asin,price,title,rating,currency,is_prime,best_seller,price_upper,is_sponsored,manufacturer,sales_volume,pricing_count,reviews_count,is_amazons_choice,price_strikethrough,shipping_information,pos,rel_pos,url_image,source,category_id,keyword,page,position,min_revenue,discount,discount_rate
B09LTVXCFD,14.99,Turquoise Beaded Choker Necklace Chakra Stone Necklace Adjustable,4.6,USD,True,False,14.99,False,,,1,478,False,0.0,"FREE delivery Mon, Aug 12 on $35 of items shipped by AmazonOr fastest delivery Fri, Aug 9",13.0,,https://m.media-amazon.com/images/I/61REh-cRdSL._AC_UL320_.jpg,organic,17880332011,malachite,1,12,7165.22,0.0,0.0
B09QMR5BZM,8.49,Tumbled Malachite Stone - Healing Stone,4.2,USD,True,False,8.49,False,,,1,122,False,0.0,"FREE delivery Mon, Aug 12 on $35 of items shipped by AmazonOr fastest delivery Fri, Aug 9",14.0,,https://m.media-amazon.com/images/I/51clwu0ViaL._AC_UL320_.jpg,organic,17880332011,malachite,1,13,1035.78,0.0,0.0
B0CH9WBTLP,15.98,Apengshi Natural Crystal Raw Stone Polished Slices 0.11-0.22lb Malachite Polished Slices Irregular Edge Protection Purification Meditation Elimination Negative Energy,4.9,USD,True,False,15.98,False,,,1,7,False,16.98,"FREE delivery Wed, Aug 14 on $35 of items shipped by Amazon",15.0,,https://m.media-amazon.com/images/I/71HunkIH6kL._AC_UL320_.jpg,organic,17880332011,malachite,1,14,111.86,1.0,0.058892815076560655
B09HMNCCHF,19.99,Malachite Stone Ring 925 Sterling Silver Statement Ring For Women Handmade Rings Gemstone Christmas Promise Ring Size US 8 Gift For Her,4.5,USD,True,False,19.99,False,,,1,243,False,0.0,"FREE delivery Wed, Aug 14 on $35 of items shipped by Amazon",16.0,,https://m.media-amazon.com/images/I/41XsmIR36XL._AC_UL320_.jpg,organic,17880332011,malachite,1,15,4857.57,0.0,0.0
B0CQJPR2FC,11.59,WUYOUSHI Natural Malachite Stone Crystals 0.11-0.22lb Malachite Raw Irregular Rough Mineral Specimen and Healing Crystal Gem Reiki Healing Home Decor Gift Box,4.8,USD,True,False,11.59,False,,,1,10,False,0.0,"FREE delivery Mon, Aug 12 on $35 of items shipped by Amazon",17.0,,https://m.media-amazon.com/images/I/81WOgP35I-L._AC_UL320_.jpg,organic,17880332011,malachite,1,16,115.9,0.0,0.0
B09DYKQ91V,24.8,Orgonite Pendant Malachite Green Crystal Orgone Pendant Necklace Reiki Spiritual Healing Energy Jewelry For Women (1),4.5,USD,True,False,24.8,False,,100+ bought in past month,1,462,False,0.0,"FREE delivery Mon, Aug 12 on $35 of items shipped by AmazonOr fastest delivery Fri, Aug 9",18.0,,https://m.media-amazon.com/images/I/512jSrPvUhL._AC_UL320_.jpg,organic,17880332011,malachite,1,17,11457.6,0.0,0.0
B0C2YL439B,13.99,Apengshi Healing Crystals Natural Malachite Raw Stone 0.25lb Irregular Shape Repair Reiki Gems Protection Wicca Meditation Yoga Outdoor Indoor Home Decoration Say Fish Tank Fountain Jewelry Design,4.3,USD,True,False,13.99,False,,,1,25,False,0.0,"FREE delivery Thu, Aug 15 on $35 of items shipped by Amazon",19.0,,https://m.media-amazon.com/images/I/711Zaxkh+-L._AC_UL320_.jpg,organic,17880332011,malachite,1,18,349.75,0.0,0.0
B003TT8PWO,5.09,Malachite Tumble Stone (20-25mm) - Pack of 5,4.5,USD,False,False,5.09,False,,,1,1300,False,7.41,FREE delivery Aug 22 - Sep 6 Or fastest delivery Aug 9 - 13,20.0,,https://m.media-amazon.com/images/I/314FXfGZ51L._AC_UL320_.jpg,organic,17880332011,malachite,1,19,6617.0,2.3200000000000003,0.31309041835357626
B0CLRPCS3K,5.99,"Malachite Raw Crystals, Large 1.25-2.0"" Healing Crystals Natural Rough Stones Crystal for Tumbling, Cabbing, Fountain Rocks, Decoration, Polishing, Wire Wrapping, Wicca & Reiki",4.3,USD,True,False,5.99,False,,,1,826,False,0.0,"FREE delivery Mon, Aug 12 on $35 of items shipped by AmazonOr fastest delivery Fri, Aug 9",21.0,,https://m.media-amazon.com/images/I/61m8g9koEeL._AC_UL320_.jpg,organic,17880332011,malachite,1,20,4947.74,0.0,0.0
B0993QCKFF,17.99,"Handmade Gem Bracelet 7.5"" Stretch Gemstone 8mm Round Beads Crystals Quartz Unisex",4.5,USD,True,False,17.99,False,,50+ bought in past month,1,4165,False,0.0,"FREE delivery Tue, Aug 13 on $35 of items shipped by Amazon",22.0,,https://m.media-amazon.com/images/I/71wKcvk56pL._AC_UL320_.jpg,organic,17880332011,malachite,1,21,74928.34999999999,0.0,0.0
B0927XRJQ3,15.87,IMALY Malachite Tumbled Chips Stone Polished Crushed Healing Crystal Quartz Pieces Irregular Shaped Stones for Home Decorative Stones Vases Plants Succulents 0.5lb,4.6,USD,True,False,15.87,False,,,1,178,False,0.0,"FREE delivery Thu, Aug 15 on $35 of items shipped by Amazon",23.0,,https://m.media-amazon.com/images/I/61GF7XldD-L._AC_UL320_.jpg,organic,17880332011,malachite,1,22,2824.8599999999997,0.0,0.0
B015XOVAWO,6.49,Crystal Necklaces for Women Crystal Pendant Gemstone Necklace for Spiritual Energy Healing Hexagonal Pendant Divination for Men (18 Inches Stainless Chain),4.3,USD,True,False,6.49,False,,,1,7908,False,0.0,"FREE delivery Tue, Aug 13 on $35 of items shipped by Amazon",24.0,,https://m.media-amazon.com/images/I/61DeEjC-tTL._AC_UL320_.jpg,organic,17880332011,malachite,1,23,51322.92,0.0,0.0
B08Q488FF8,13.99,New Gemstone Healing Chakra Bracelet Anxiety Crystal Natural Stone Men Women Stress Relief Reiki Yoga Diffuser Semi Precious,4.3,USD,True,False,13.99,False,,,1,1486,False,0.0,"FREE delivery Mon, Aug 12 on $35 of items shipped by AmazonOr fastest delivery Fri, Aug 9",25.0,,https://m.media-amazon.com/images/I/71Xkcikus+L._AC_UL320_.jpg,organic,17880332011,malachite,1,24,20789.14,0.0,0.0
B0CY7VK5FH,7.99,Lameybrt Evil Eye Beads Green Aventurine - Stone of Wealth - Handmade Yoga Stretch Elastic Bracelet Natural Stone Crystal Healing Power Energy Gifts for Unisex Adult 6mm (H08 Malachite),3.9,USD,True,False,7.99,False,,,1,15,False,0.0,"FREE delivery Mon, Aug 12 on $35 of items shipped by Amazon",26.0,,https://m.media-amazon.com/images/I/71daSZZQl9L._AC_UL320_.jpg,organic,17880332011,malachite,1,25,119.85000000000001,0.0,0.0
B0B8Y263T7,21.95,"Wire Wrapped Crystal Stone Pendants for Chakra/Reiki Healing, Positive Energy, Boho Statement Necklace, Handmade & Ethically Sourced. Silver-plated, includes 20"" Black Satin Cord and Gift Box",4.4,USD,True,False,21.95,False,,,1,186,False,0.0,"FREE delivery Wed, Aug 14 on $35 of items shipped by Amazon",27.0,,https://m.media-amazon.com/images/I/81daiwjuHxL._AC_UL320_.jpg,organic,17880332011,malachite,1,26,4082.7,0.0,0.0
B081N4H9LJ,169.0,"Skullis 2.0"" Malachite Crystal Skull, Hand Carved Gemstone Fine Art Sculpture, Reiki Healing Stone Statue.1478",5.0,USD,True,False,169.0,False,,,1,12,False,0.0,"FREE delivery Tue, Aug 13",28.0,,https://m.media-amazon.com/images/I/71gSZDd7JmL._AC_UL320_.jpg,organic,17880332011,malachite,1,27,2028.0,0.0,0.0
B0C727N9VJ,9.99,Natural Double Pointed Crystal Necklace Handmade Woven Pendant Polished Gemstone Reiki Energy Stone Men and Women Necklace Gift,4.1,USD,True,False,9.99,False,,,1,35,False,0.0,"FREE delivery Tue, Aug 13 on $35 of items shipped by Amazon",29.0,,https://m.media-amazon.com/images/I/513OW3nihZL._AC_UL320_.jpg,organic,17880332011,malachite,1,28,349.65000000000003,0.0,0.0
B0BXBTZFJN,12.99,"Von Keib Real Malachite Natural Crystal Gemstone Bracelet Stretch Bracelet for Meditation Yoga Semi Precious Handmade Round Malachite Beads 5 mm (0.20"") Unisex for Women Men Large",4.5,USD,True,False,12.99,False,,,1,12,False,0.0,"FREE delivery Tue, Aug 13 on $35 of items shipped by Amazon",30.0,,https://m.media-amazon.com/images/I/61QNnawu3KL._AC_UL320_.jpg,organic,17880332011,malachite,1,29,155.88,0.0,0.0
B0BYNH86YM,19.8,Orgonite Necklace With Malachite And Flower Of Life - Healing Crystals For Energy Protection And Meditation - Spiritual Pendant With Adjustable Cord,4.6,USD,True,False,19.8,False,,50+ bought in past month,1,55,False,0.0,"FREE delivery Wed, Aug 14 on $35 of items shipped by Amazon",31.0,,https://m.media-amazon.com/images/I/61dxyX1qwoL._AC_UL320_.jpg,organic,17880332011,malachite,1,30,1089.0,0.0,0.0
B0B2L8Z5QJ,11.99,Tiger Eye Beaded Necklace Green Malachite Beads Choker Necklace Gold Star Zircon Pendant Necklace Women Chakra Healing Gemstone Jewelry Amulet Gifts,4.5,USD,True,False,11.99,False,,,1,169,False,0.0,"FREE delivery Wed, Aug 14 on $35 of items shipped by Amazon",32.0,,https://m.media-amazon.com/images/I/71NN11LJUeL._AC_UL320_.jpg,organic,17880332011,malachite,1,31,2026.31,0.0,0.0
B09L4CQ3G6,28.0,925 Sterling Silver Chain Healing Crystal Necklace for Women,4.6,USD,True,False,28.0,False,,,1,485,False,0.0,"FREE delivery Mon, Aug 12 on $35 of items shipped by AmazonOr fastest delivery Fri, Aug 9",33.0,,https://m.media-amazon.com/images/I/51+mIsc3ohL._AC_UL320_.jpg,organic,17880332011,malachite,1,32,13580.0,0.0,0.0
B09P4VLZCV,9.99,Healing Stone Beaded Bracelets for Women Semi-Precious Gemstones Bracelets Pearl Beaded Bracelet Adjustable Strand Bracelets 6MM,4.5,USD,True,False,9.99,False,,,1,185,False,0.0,"FREE delivery Mon, Aug 12 on $35 of items shipped by AmazonOr fastest delivery Fri, Aug 9",34.0,,https://m.media-amazon.com/images/I/61l8wSEy5EL._AC_UL320_.jpg,organic,17880332011,malachite,1,33,1848.15,0.0,0.0
B07LD778FM,10.99,Justinstones Synthetic Malachite Carved Elephant Crystal Animal Totem Spirit Stone Figurine 2 inch,4.7,USD,True,False,10.99,False,,,1,2658,False,0.0,"FREE delivery Mon, Aug 12 on $35 of items shipped by AmazonOr fastest delivery Fri, Aug 9",35.0,,https://m.media-amazon.com/images/I/613rE4A1UBL._AC_UL320_.jpg,organic,17880332011,malachite,1,34,29211.420000000002,0.0,0.0
B0CZ3ZF5BP,16.98,MAIBAOTA 60 mm Malachite Crystals Large Heart Stone Healing Crystals Heart Reiki Crystal Gemstone Polished Heart Shaped Rocks Meditation Mothers Day Crystal Gifts for Mom Her,4.6,USD,True,False,16.98,False,,,1,123,False,0.0,"FREE delivery Thu, Aug 15 on $35 of items shipped by Amazon",36.0,,https://m.media-amazon.com/images/I/71ZOMBuyYEL._AC_UL320_.jpg,organic,17880332011,malachite,1,35,2088.54,0.0,0.0
B09D3XB75T,13.95,"NUOTE 1.6 Inches Large Heart Shaped Worry Stone Green Crystal Green Malachite Stone Shiny Carved Natural Crystal Quartz Stone Polished Oval Pocket Palm Stone for Reiki Healing, Meditation, Gift, Decor",4.4,USD,True,False,13.95,False,,,1,64,False,0.0,"FREE delivery Mon, Aug 12 on $35 of items shipped by Amazon",37.0,,https://m.media-amazon.com/images/I/719lbL3fQZL._AC_UL320_.jpg,organic,17880332011,malachite,1,36,892.8,0.0,0.0
B09H2XTKM3,19.99,Simple Malachite/Turquoise/Moonstone/Zirconia Earrings 925 Sterling Silver Malachite Stud Earrings 6mm Round Mallache Earrings Peacock Stone Jewelry Gifts for Women Wife,4.2,USD,True,False,19.99,False,,,1,54,False,0.0,"FREE delivery Wed, Aug 14 on $35 of items shipped by Amazon",38.0,,https://m.media-amazon.com/images/I/51tVFTNb4+L._AC_UL320_.jpg,organic,17880332011,malachite,1,37,1079.4599999999998,0.0,0.0
B0D5M78F28,17.99,Dainty Green Malachite Crystal Pendant 925 Sterling Silver Chain Necklace and Healing Chakra Crystal Stone Handmade Choker Necklace Jewelry Gift for Women Young Lady 1 Bead,4.1,USD,True,False,17.99,False,,,1,234,False,0.0,"FREE delivery Mon, Aug 12 on $35 of items shipped by AmazonOr fastest delivery Fri, Aug 9",39.0,,https://m.media-amazon.com/images/I/31-IWB9hBkL._AC_UL320_.jpg,organic,17880332011,malachite,1,38,4209.66,0.0,0.0
B09VXG9TZW,30.43,Bernat Blanket Malachite Yarn - 2 Pack of 300g/10.5oz - Polyester - 6 Super Bulky - 220 Yards - Knitting/Crochet,4.7,USD,True,False,30.43,False,,,1,13467,False,0.0,"FREE delivery Mon, Aug 12 on $35 of items shipped by AmazonOr fastest delivery Fri, Aug 9",40.0,,https://m.media-amazon.com/images/I/61Z-sArHIxL._AC_UL320_.jpg,organic,17880332011,malachite,1,39,409800.81,0.0,0.0
B097521Q8Y,13.95,"NUOTE Green Malachite Stone Palm Stone Crystal - Natural Chakra Reiki Polished Healing Thumbed Oval Pocket Worry Stone Crystals for Anxiety Stress Relief Therapy, Reiki Healing",4.1,USD,True,False,13.95,False,,,1,129,False,0.0,"FREE delivery Wed, Aug 14 on $35 of items shipped by Amazon",41.0,,https://m.media-amazon.com/images/I/61qM7oLfYAL._AC_UL320_.jpg,organic,17880332011,malachite,1,40,1799.55,0.0,0.0
B0BD4MJV27,22.0,Stainless Steel Clasp Mens Stone Beaded Bracelet,4.6,USD,False,False,22.0,False,,,1,399,False,0.0,FREE delivery on $35 shipped by Amazon.,42.0,,https://m.media-amazon.com/images/I/61kyp2AHvbL._AC_UL320_.jpg,organic,17880332011,malachite,1,41,8778.0,0.0,0.0
B0C9Q6F7KX,9.99,"QINJIEJIE 100PCS Malachite Beads 8mm Natural Stone Beads Round Loose Gemstone Bead for Bracelet Beading Crystal Jewelry Making DIY Necklace Earrings 0.32""",4.5,USD,True,False,9.99,False,,,1,132,False,0.0,"FREE delivery Thu, Aug 15 on $35 of items shipped by Amazon",43.0,,https://m.media-amazon.com/images/I/81eloVXl8JL._AC_UL320_.jpg,organic,17880332011,malachite,1,42,1318.68,0.0,0.0
B07MNH466Z,53.0,Malachite Necklace - 14K Gold Plated over 925 Sterling Silver - Handmade 12mm Green Natural Stone Necklaces for Women - Perfect Gift for Women,4.4,USD,True,False,53.0,False,,,1,902,False,0.0,"FREE delivery Mon, Aug 12",44.0,,https://m.media-amazon.com/images/I/61kx7bpa6HL._AC_UL320_.jpg,organic,17880332011,malachite,1,43,47806.0,0.0,0.0
B09S5TXWSX,8.99,6/8/10/12/14mm Round Natural Malachite Beaded Bracelet Dainty Gemstone Bangle Malachite Stone Stretch Bracelets Yoga Healing Crystals Quartz Chakra Bracelet for Women Men Girls Gifts,4.0,USD,True,False,8.99,False,,,1,52,False,0.0,"FREE delivery Mon, Aug 12 on $35 of items shipped by AmazonOr fastest delivery Fri, Aug 9",45.0,,https://m.media-amazon.com/images/I/51u55ChPP3L._AC_UL320_.jpg,organic,17880332011,malachite,1,44,467.48,0.0,0.0
B0BL2ZZ1N4,14.99,1 oz Malachite Crystal Tumbled Stones Polished Rocks - Natural Gem Stones for Healing - DIY Crystals for Protection,4.5,USD,True,False,14.99,False,,,1,192,False,0.0,"FREE delivery Tue, Aug 13 on $35 of items shipped by Amazon",46.0,,https://m.media-amazon.com/images/I/71bsf8s+WjL._AC_UL320_.jpg,organic,17880332011,malachite,1,45,2878.08,0.0,0.0
B08GLWJ2Z6,9.99,"Bacatgem Synthetic Malachite Water Drop Chakra Thumb Worry Stone,Stress Relax Healing Reiki Crystal Pocket Palm Stones",4.5,USD,True,False,9.99,False,,,1,548,False,0.0,"FREE delivery Tue, Aug 13 on $35 of items shipped by Amazon",47.0,,https://m.media-amazon.com/images/I/71UcFzd9CNL._AC_UL320_.jpg,organic,17880332011,malachite,1,46,5474.52,0.0,0.0
B08ZKR8NF1,9.99,"Nvzi Malachite Crystal, Crystals for Witchcraft, Crystals and Healing Stones, Chakra Stones(25-45mm)",4.5,USD,True,False,9.99,False,,,1,191,False,0.0,FREE delivery on $35 shipped by Amazon.,48.0,,https://m.media-amazon.com/images/I/51d05RL8VqL._AC_UL320_.jpg,organic,17880332011,malachite,1,47,1908.0900000000001,0.0,0.0
B08ZDWYX3Z,15.77,"Smooth Tumbled Stones AAA+ Jewelry Grade Reiki Crystal Piedras Caidas for Wicca/Healing; Many Types, Colors",4.7,USD,True,False,15.77,False,,50+ bought in past month,1,1402,True,0.0,"FREE delivery Mon, Aug 12 on $35 of items shipped by AmazonOr fastest delivery Fri, Aug 9",3.0,,https://m.media-amazon.com/images/I/81ZXhDN0UBL._AC_UL320_.jpg,amazons_choices,17880332011,malachite,1,1,22109.54,0.0,0.0
B0CLHS96G8,138.98,"Rocks2Rings Genuine Moldavite Crystal - Large Herkimer Diamond Necklace Pendant - VERY high vibration Czech Republic Tektite Healing Stone Reiki Valentines Gift S61a (Silver, 1.8 Gram Moldavite, S)",4.9,USD,,False,138.98,True,,,1,271,False,0.0,,,1.0,https://aax-us-iad.amazon.com/e/loi/imp?b=JFhQfJ8KCEy_h38UA6Oro9wAAAGRLYC7ZAEAAAH2AQBvbm9fdHhuX2JpZDIgICBvbm9fdHhuX2ltcDEgICDpyFxw,paid,17880332011,moldavite,1,1,37663.579999999994,0.0,0.0
B0CLHS96G8,138.98,"Rocks2Rings Genuine Moldavite Crystal - Large Herkimer Diamond Necklace Pendant - VERY high vibration Czech Republic Tektite Healing Stone Reiki Valentines Gift S61a (Silver, 1.8 Gram Moldavite, S)",4.9,USD,,False,138.98,True,,,1,271,False,0.0,,,2.0,https://aax-us-iad.amazon.com/e/loi/imp?b=JPT4GaKWyc5qdImN1OhmgLoAAAGRLYC7ZwEAAAH2AQBvbm9fdHhuX2JpZDIgICBvbm9fdHhuX2ltcDEgICABUxYF,paid,17880332011,moldavite,1,2,37663.579999999994,0.0,0.0
B0C5THRRYP,34.99,Natural Moldavite Rough Ring 925 Sterling Silver Handmade Jewelry With Certified Gemstone From Czech Republic By HARSHITA JEWELLERY (9),3.8,USD,True,False,34.99,False,,,1,5,False,0.0,"FREE delivery Mon, Aug 12 on $35 of items shipped by AmazonOr fastest delivery Fri, Aug 9",2.0,,https://m.media-amazon.com/images/I/31Bz2FCYrbL._AC_UL320_.jpg,organic,17880332011,moldavite,1,1,174.95000000000002,0.0,0.0
B0CLJ386V5,92.99,Rocks2Rings Genuine Moldavite Crystal Bracelet - High Vibration Manifestation and Transformation Authentic Czech Republic Crystals Tektite Healing Stone BRmA (1.33 gram),5.0,USD,True,False,92.99,False,,50+ bought in past month,1,42,False,0.0,"FREE delivery Mon, Aug 12 Or fastest delivery Fri, Aug 9",3.0,,https://m.media-amazon.com/images/I/71s+CYDYo9L._AC_UL320_.jpg,organic,17880332011,moldavite,1,2,3905.58,0.0,0.0
B0CBL9VQ3X,126.99,"Rocks2Rings Genuine Moldavite Crystal - Large Herkimer Diamond Necklace Pendant - VERY high vibration Czech Republic Tektite Healing Stone Reiki S61 (Sterling Silver, 1.3 gram moldavite, S)",4.9,USD,True,False,126.99,False,,,1,271,False,0.0,"FREE delivery Mon, Aug 12 Or fastest delivery Tomorrow, Aug 8",4.0,,https://m.media-amazon.com/images/I/61boh-PCcmL._AC_UL320_.jpg,organic,17880332011,moldavite,1,3,34414.29,0.0,0.0
B08Z7JK3X3,9.99,1Pcs Moldavite Irregular Natural Stone Gemstone Crystal Meteorite Pendant Necklace Handmade Handwoven Rope Chain Citrine Necklaec for Women Men Energy Jewelry Gift,3.8,USD,True,False,9.99,False,,,1,44,False,0.0,"FREE delivery Mon, Aug 12 on $35 of items shipped by AmazonOr fastest delivery Fri, Aug 9",5.0,,https://m.media-amazon.com/images/I/61V+P080BkL._AC_UL320_.jpg,organic,17880332011,moldavite,1,4,439.56,0.0,0.0
B09LYQQNLB,4.99,Natural Moldavite Green aerolites Czech Crystal Stone Raw Stone Grinding 8mm Bead Meteorite Bracelet Czech Meteorite Bracelet (Size : 1pcs),3.3,USD,False,False,4.99,False,,50+ bought in past month,1,14,False,5.49,FREE delivery Aug 28 - Sep 18,6.0,,https://m.media-amazon.com/images/I/41EKttJswmL._AC_UL320_.jpg,organic,17880332011,moldavite,1,5,69.86,0.5,0.09107468123861566
B0927WPHNY,44.99,Crystal Vibe Moldavite Necklace Real for Women Men Healing Crystal with Silver Chain Green Natural Energy Gemstone Pendant for Protection and Healing,3.8,USD,True,False,44.99,False,,,1,146,False,49.99,"FREE delivery Mon, Aug 12 Or fastest delivery Tomorrow, Aug 8",7.0,,https://m.media-amazon.com/images/I/51Qhav29SEL._AC_UL320_.jpg,organic,17880332011,moldavite,1,6,6568.54,5.0,0.10002000400080016
B08YK58KHM,13.99,"Moldavite Crystal Necklace for Men Women, Handmade Irregular Stone Pendant Crystal Energy Stone",3.5,USD,True,False,13.99,False,,,1,120,False,0.0,"FREE delivery Mon, Aug 12 on $35 of items shipped by AmazonOr fastest delivery Fri, Aug 9",8.0,,https://m.media-amazon.com/images/I/61KCUR9uLFL._AC_UL320_.jpg,organic,17880332011,moldavite,1,7,1678.8,0.0,0.0
B0BSV6YHXH,45.99,"Moldavite Ring, Black Tourmaline, Herkimer Diamond Ring Czech Republic Natural Gemstone 925 Solid Sterling Silver Handmade Jewelry",4.2,USD,True,False,45.99,False,,,1,44,False,0.0,"FREE delivery Mon, Aug 12 Or fastest delivery Fri, Aug 9",9.0,,https://m.media-amazon.com/images/I/61qpZNMjdSL._AC_UL320_.jpg,organic,17880332011,moldavite,1,8,2023.5600000000002,0.0,0.0
B077YW1JVT,89.85,Natural Rare Gemstone Loose - Medium,4.4,USD,True,False,89.85,False,,,1,804,False,0.0,"FREE delivery Mon, Aug 12 Or fastest delivery Fri, Aug 9",10.0,,https://m.media-amazon.com/images/I/61Vm6xlKicL._AC_UL320_.jpg,organic,17880332011,moldavite,1,9,72239.4,0.0,0.0
B0BHQ2FWQN,33.0,Moldavite/Moldavite Pendant/Moldavite Necklace/Moldavite Jewelry/Moldavite Crystal/Authentic Certified Genuine Moldavite (18 inches),4.9,USD,False,False,33.0,False,,,1,13,False,0.0,FREE delivery Aug 13 - 15,11.0,,https://m.media-amazon.com/images/I/51k2YFueZuL._AC_UL320_.jpg,organic,17880332011,moldavite,1,10,429.0,0.0,0.0
B08XDCY2V5,9.95,Moldavite Incense Sticks And Incense Stick Holder Bundle Insence Insense Hem Incense Sticks,4.4,USD,True,False,9.95,False,,,1,1280,False,0.0,"FREE delivery Mon, Aug 12 on $35 of items shipped by AmazonOr fastest delivery Fri, Aug 9",12.0,,https://m.media-amazon.com/images/I/71C3cC3Ke+L._AC_UL320_.jpg,organic,17880332011,moldavite,1,11,12736.0,0.0,0.0
B0CLHYYS9Q,124.99,Genuine Moldavite Crystal with Super Seven Crystal Necklace Pendant Real Czech Republic Tektite Healing Stones Jewelry Super 7 Mothers Day Gift M7GA (Silver),4.9,USD,True,False,124.99,False,,,1,118,False,0.0,"FREE delivery Mon, Aug 12 Or fastest delivery Fri, Aug 9",13.0,,https://m.media-amazon.com/images/I/61TUYhFEqXL._AC_UL320_.jpg,organic,17880332011,moldavite,1,12,14748.82,0.0,0.0
B0C85TDSLT,38.99,Moldavite Ring 925 Sterling Silver Handmade Natural Rough Gemstone Jewelry For Her (10),4.0,USD,True,False,38.99,False,,,1,10,False,0.0,"FREE delivery Mon, Aug 12 Or fastest delivery Tomorrow, Aug 8",14.0,,https://m.media-amazon.com/images/I/41TjDZZkQoL._AC_UL320_.jpg,organic,17880332011,moldavite,1,13,389.90000000000003,0.0,0.0
B0915Y998D,11.99,Moldavite Necklace Irregular Natural Moldavite Stone Gemstone Crystal Pendant Necklace Dainty Gift for Women Men,3.7,USD,True,False,11.99,False,,,1,87,False,0.0,"FREE delivery Mon, Aug 12 on $35 of items shipped by AmazonOr fastest delivery Fri, Aug 9",15.0,,https://m.media-amazon.com/images/I/61e200GH4TL._AC_UL320_.jpg,organic,17880332011,moldavite,1,14,1043.13,0.0,0.0
B077YRFQVV,118.0,Genuine Rough Moldavite - One Large Piece,4.3,USD,True,False,118.0,False,,,1,368,False,0.0,"FREE delivery Mon, Aug 12 Or fastest delivery Sat, Aug 10",16.0,,https://m.media-amazon.com/images/I/61VxmejBOTL._AC_UL320_.jpg,organic,17880332011,moldavite,1,15,43424.0,0.0,0.0
B01D97OJ1G,98.0,Natural 7-12 cts Moldavite Pendant in Sterling Silver,4.6,USD,True,False,98.0,False,,,1,272,False,0.0,"FREE delivery Mon, Aug 12 Or fastest delivery Tomorrow, Aug 8",17.0,,https://m.media-amazon.com/images/I/81TCOsfGM6L._AC_UL320_.jpg,organic,17880332011,moldavite,1,16,26656.0,0.0,0.0
B08H1R2TPF,49.0,Real Raw Moldavite Piece Wire Wrapped Cage Bracelet- Copper-Bronze-Stainless Steel-Silver-14K Gold-14K Rose Gold-titanium on a Leather or Waxed Cord Adjustable Friendship Bracelet- Mens Womens -,4.2,USD,False,False,49.0,False,,,1,185,False,0.0,"$5.25 delivery Tue, Aug 13 Or fastest delivery Fri, Aug 9",18.0,,https://m.media-amazon.com/images/I/615dH5H5i9S._AC_UL320_.jpg,organic,17880332011,moldavite,1,17,9065.0,0.0,0.0
B0C5Y297WM,38.99,"Moldavite, Herkimer & Black Tourmaline Ring Natural Moldavite 925 Sterling silver Handmade Jewelry with Gemstone From Czech Republic (7)",4.4,USD,True,False,38.99,False,,,1,15,False,0.0,"FREE delivery Mon, Aug 12 Or fastest delivery Fri, Aug 9",19.0,,https://m.media-amazon.com/images/I/21FQnf0RzVL._AC_UL320_.jpg,organic,17880332011,moldavite,1,18,584.85,0.0,0.0
B0D3TW77MX,29.99,"CRYSTALIS 4pcs Raw Moldavite, High Grade Loose Gemstone Wholesale Bulk Rough Jewelry Making Supply, Chakra Stones, Wire Wrapping, DIY, Gem Collection",3.0,USD,True,False,29.99,False,,,1,1,False,0.0,"FREE delivery Mon, Aug 12 on $35 of items shipped by AmazonOr fastest delivery Sat, Aug 10",20.0,,https://m.media-amazon.com/images/I/815lA5iExOL._AC_UL320_.jpg,organic,17880332011,moldavite,1,19,29.99,0.0,0.0
B0CB5RMCFS,36.99,"Moldavite Crystal Necklace,Raw Czech Meteorite Stone Certified Healing Crystal Pendant,Green,Irregualr Shape",4.0,USD,True,False,36.99,False,,,1,24,False,0.0,"FREE delivery Mon, Aug 12 Or fastest delivery Fri, Aug 9",21.0,,https://m.media-amazon.com/images/I/51+B0WJhkfL._AC_UL320_.jpg,organic,17880332011,moldavite,1,20,887.76,0.0,0.0
B08X22FJYQ,8.99,Green Irregular Shape Moldavite Czech Meteorite Multifunctional Artificial Raw Rough Crystal Energy Stone for Art Jewelry Making,3.5,USD,False,False,8.99,False,,,1,179,False,0.0,FREE delivery Aug 19 - 29,22.0,,https://m.media-amazon.com/images/I/61nSbN+FWTL._AC_UL320_.jpg,organic,17880332011,moldavite,1,21,1609.21,0.0,0.0
B08G9ZN8PV,57.99,Shop LC Moldavite Zircon Eternity Ring 925 Sterling Silver Wedding Band for Women Birthday Gifts,4.5,USD,True,False,57.99,False,,,1,122,False,0.0,"FREE delivery Mon, Aug 12 Or fastest delivery Fri, Aug 9",23.0,,https://m.media-amazon.com/images/I/51Ya3Kqze4L._AC_UL320_.jpg,organic,17880332011,moldavite,1,22,7074.780000000001,0.0,0.0
B0CFJ1R3JB,88.99,"Genuine Moldavite Healing Crystal Necklace Pendant | Real Moldavite Jewelry Crystal Stones | Certificate of Authencity | Transformation | Manifestation Mothers Day Gift M66A (Silver, Moldavite, S)",4.7,USD,True,False,88.99,False,,,1,46,False,0.0,"FREE delivery Mon, Aug 12 Or fastest delivery Sat, Aug 10",24.0,,https://m.media-amazon.com/images/I/61UcK8mq-NL._AC_UL320_.jpg,organic,17880332011,moldavite,1,23,4093.54,0.0,0.0
B0C9QQ5MVY,10.99,"Moldavite Pendant Necklace Irregular Energy Stone Aerolites Czech Crystal,Green,4x2cm",3.8,USD,False,False,10.99,False,,,1,5,False,0.0,FREE delivery Aug 19 - 29,25.0,,https://m.media-amazon.com/images/I/6173B1uxV9S._AC_UL320_.jpg,organic,17880332011,moldavite,1,24,54.95,0.0,0.0
B0B6PXPS86,8.0,"Raw Moldavite Quartz Pendant, Gold Electroplated Jewelry, Raw Crystal, Woman Necklace, Gift Ideas, Gifts for her, Hippie Raw Crystal Necklace, Gift By CHARMSANDSPELLS",4.1,USD,False,False,8.0,False,,,1,27,False,0.0,$6.98 delivery Aug 28 - Sep 6 Or fastest delivery Aug 13 - 15,26.0,,https://m.media-amazon.com/images/I/41-Khksn8JL._AC_UL320_.jpg,organic,17880332011,moldavite,1,25,216.0,0.0,0.0
B0BPXCHFR3,35.99,100% Natural Moldavite Rough Ring 925 Sterling Silver Handmade Jewelry Gemstone From Czech Republic By CrownJewelry,3.8,USD,True,False,35.99,False,,,1,10,False,0.0,"FREE delivery Mon, Aug 12 Or fastest delivery Fri, Aug 9",27.0,,https://m.media-amazon.com/images/I/41224997fwL._AC_UL320_.jpg,organic,17880332011,moldavite,1,26,359.90000000000003,0.0,0.0
