asin,price,title,rating,currency,is_prime,best_seller,price_upper,is_sponsored,manufacturer,sales_volume,pricing_count,reviews_count,is_amazons_choice,price_strikethrough,shipping_information,pos,rel_pos,url_image,source,category_id,keyword,page,position,min_revenue,discount,discount_rate
B089GXTH3D,12.99,XIANNVXI Tree of Life Wire Wrapped Crystal Point Pendant Necklace Reiki Healing Crystal Stone Black Agate Necklaces Natural Hexagonal Gemstone Quartz Jewelry for Women,4.5,USD,True,False,12.99,False,,,1,2138,False,0.0,"FREE delivery Tue, Aug 13 on $35 of items shipped by Amazon",31.0,,https://m.media-amazon.com/images/I/61boBQUM1YL._AC_UL320_.jpg,organic,17880332011,black agate,1,30,27772.62,0.0,0.0
B0CJ5PBPKV,4.49,"Stone Beads 8mm 100pcs Black Agate Beads Round Loose Gemstones Beads for Bracelet Necklace Jewelry Making (8mm, 60821 Black Agate)",4.7,USD,True,False,4.49,False,,,1,32,False,8.99,"FREE delivery Mon, Aug 12 on $35 of items shipped by AmazonOr fastest delivery Fri, Aug 9",32.0,,https://m.media-amazon.com/images/I/61DtAVWJOEL._AC_UL320_.jpg,organic,17880332011,black agate,1,31,143.68,4.5,0.5005561735261401
B0893FSZ3Y,8.49,"NCB 100pcs Original Natural Stone Beads Gemstone Round Loose Beads 6mm 8mm 10mm (Black Onyx Agate, 6mm 100Beads)",4.6,USD,True,False,8.49,False,,50+ bought in past month,1,7298,False,0.0,"FREE delivery Mon, Aug 12 on $35 of items shipped by AmazonOr fastest delivery Fri, Aug 9",33.0,,https://m.media-amazon.com/images/I/61Zf6hdoyxL._AC_UL320_.jpg,organic,17880332011,black agate,1,32,61960.020000000004,0.0,0.0
B07PX416CR,11.95,"Small, Medium, Large Sizes - Gemstone Beaded Bracelets For Women and Men - 8mm Round Beads",4.5,USD,True,False,11.95,False,,,1,3448,False,0.0,"FREE delivery Mon, Aug 12 on $35 of items shipped by AmazonOr fastest delivery Fri, Aug 9",34.0,,https://m.media-amazon.com/images/I/71Gdz0Xm8oL._AC_UL320_.jpg,organic,17880332011,black agate,1,33,41203.6,0.0,0.0
B07L89PFP4,25.99,"mookaitedecor Polished Agate Light Table Slices,Geode Agate Slab Cards Pack of 12",4.5,USD,True,False,25.99,False,,,1,1757,False,0.0,"FREE delivery Mon, Aug 12 on $35 of items shipped by AmazonOr fastest delivery Fri, Aug 9",35.0,,https://m.media-amazon.com/images/I/71lDzVhUC-L._AC_UL320_.jpg,organic,17880332011,black agate,1,34,45664.43,0.0,0.0
B07LGQSP95,6.99,Howlite Bracelet Black Matte Agate Bracelet Couples Bracelet Distance Bracelet Energy Beads Bracelet for Valentine's Day Present,4.4,USD,True,False,6.99,False,,200+ bought in past month,1,6714,False,0.0,"FREE delivery Mon, Aug 12 on $35 of items shipped by Amazon",36.0,,https://m.media-amazon.com/images/I/61d3nm9faeL._AC_UL320_.jpg,organic,17880332011,black agate,1,35,46930.86,0.0,0.0
B093XK6MHX,5.59,"CHEAVIAN 60PCS 6mm Black Smooth Polish Onyx Agate Gemstone Round Loose Beads for Jewelry Making 1 Strand 15""",4.5,USD,True,False,5.59,False,,50+ bought in past month,1,4028,False,0.0,"FREE delivery Mon, Aug 12 on $35 of items shipped by AmazonOr fastest delivery Fri, Aug 9",37.0,,https://m.media-amazon.com/images/I/81wdP7Tb8aS._AC_UL320_.jpg,organic,17880332011,black agate,1,36,22516.52,0.0,0.0
B07C4P9RYR,10.99,Healing Crystal Necklace for Women Tree of Family Pendant Family Tree Wire Wrapped Jewelry Energy Healing Teardrop pendant (24 Inches Stainless Steel Chain),4.6,USD,True,False,10.99,False,,,1,1169,False,0.0,"FREE delivery Mon, Aug 12 on $35 of items shipped by AmazonOr fastest delivery Fri, Aug 9",38.0,,https://m.media-amazon.com/images/I/7152hr1lPfL._AC_UL320_.jpg,organic,17880332011,black agate,1,37,12847.31,0.0,0.0
B0D2DNNKQV,5.75,"Black Agate Raw Crystals and Healing Stones, Natural Rocks for Tumbling and DIY Raw Stones and Crystals (1 Piece)",4.2,USD,True,False,5.75,False,,,1,111,False,0.0,"FREE delivery Tue, Aug 13 on $35 of items shipped by Amazon",39.0,,https://m.media-amazon.com/images/I/714H4SanrmL._AC_UL320_.jpg,organic,17880332011,black agate,1,38,638.25,0.0,0.0
B09D3L45QJ,39.21,Agate Coaster Geode Coaster for Drinks Gemstone Natural Stone Coaster Agate Slices Coaster Cup Mat for Home Decor by Yougoals (Black - 4PK) Agate Coaster Set of 4 for Coffee Table,4.2,USD,True,False,39.21,False,,,1,292,False,0.0,"FREE delivery Mon, Aug 12",40.0,,https://m.media-amazon.com/images/I/719WJltWFxL._AC_UL320_.jpg,organic,17880332011,black agate,1,39,11449.32,0.0,0.0
B09T2Q3G7M,11.99,300 Pcs Black Agate Beads Round Imitation Onyx Gemstone Beads Black Smooth Polished Spacer Beads for Jewelry Making Bracelet Necklace Earrings DIY Crafts (8 mm),4.7,USD,True,False,11.99,False,,,1,185,False,12.99,"FREE delivery Tue, Aug 13 on $35 of items shipped by Amazon",41.0,,https://m.media-amazon.com/images/I/71c2swgQ0jL._AC_UL320_.jpg,organic,17880332011,black agate,1,40,2218.15,1.0,0.07698229407236336
B0B4P9N2Z9,19.99,"Black Agate Pyramid Crystal Healing Stones - 2"" Great Pyramid Figurine of Natural Stone Pyramid for Meditation, Reiki, Chakra Balancing and Crystal Pyramids Grid",4.3,USD,True,False,19.99,False,,,1,160,False,0.0,"FREE delivery Mon, Aug 12 on $35 of items shipped by AmazonOr fastest delivery Fri, Aug 9",42.0,,https://m.media-amazon.com/images/I/612mGPkx04L._AC_UL320_.jpg,organic,17880332011,black agate,1,41,3198.3999999999996,0.0,0.0
B0B77LYTJV,9.49,Black Hakik Banded Bracelet for Women Men's Gifts - Protection Healing Crystal Bracelet - 8mm Gemstone Beaded Adjustable Bracelet Pulseras Para Hombres Mujer Stocking Stuffers,4.4,USD,True,True,9.49,False,,,1,873,False,0.0,"FREE delivery Tue, Aug 13 on $35 of items shipped by Amazon",43.0,,https://m.media-amazon.com/images/I/61tQxpMQs3L._AC_UL320_.jpg,organic,17880332011,black agate,1,42,8284.77,0.0,0.0
B0BFWKK7V1,9.99,Healing Crystal Necklace Tree of Life Wire Wrapped Natural Stone Point Pendant Necklace Hexagonal Reiki Spiritual Quartz Gemstone Jewelry for Women Men,4.1,USD,True,False,9.99,False,,,1,1244,False,0.0,"FREE delivery Mon, Aug 12 on $35 of items shipped by AmazonOr fastest delivery Fri, Aug 9",44.0,,https://m.media-amazon.com/images/I/512owdaHi3L._AC_UL320_.jpg,organic,17880332011,black agate,1,43,12427.56,0.0,0.0
B0C4NZK2CY,14.99,"Archangel Stones Set of 4 - Michael, Gabriel, Raphael, Uriel Signature Symbol for Talisman Protection - Black Agate Healing Crystals and Healing Stones",4.9,USD,True,False,14.99,False,,,1,13,False,0.0,"FREE delivery Mon, Aug 12 on $35 of items shipped by AmazonOr fastest delivery Fri, Aug 9",45.0,,https://m.media-amazon.com/images/I/71biYeKILoL._AC_UL320_.jpg,organic,17880332011,black agate,1,44,194.87,0.0,0.0
B00ZWV1S7G,6.83,"6-8mm Natural Black Agate Chips Beads for Jewelry Making Freeform 34"" JOE FOREMAN",4.5,USD,True,False,6.83,False,,,1,2573,False,0.0,"FREE delivery Mon, Aug 12 on $35 of items shipped by Amazon",46.0,,https://m.media-amazon.com/images/I/61vXOxvsASL._AC_UL320_.jpg,organic,17880332011,black agate,1,45,17573.59,0.0,0.0
B07Q2F9V5M,18.6,"925 Sterling Silver Natural Crytral for Womens Pendant Necklace, Gemstone Birthstone with 17.8"" Silver Chain Ladies",4.5,USD,True,False,18.6,False,,,1,972,False,0.0,"FREE delivery Tue, Aug 13 on $35 of items shipped by Amazon",47.0,,https://m.media-amazon.com/images/I/41DypMfWJGL._AC_UL320_.jpg,organic,17880332011,black agate,1,46,18079.2,0.0,0.0
B07CTH9M1R,7.69,"Hexagonal Pointed Reiki Chakra Pendant Stainless Steel Chain Necklace 20"" Iron Gift Box",3.8,USD,True,False,7.69,False,,,1,27,False,0.0,"FREE delivery Mon, Aug 12 on $35 of items shipped by Amazon",48.0,,https://m.media-amazon.com/images/I/41KFuv+fTjL._AC_UL320_.jpg,organic,17880332011,black agate,1,47,207.63000000000002,0.0,0.0
B004ENPHK2,5.0,BLACK AGATE STONE EVIL EYE BRACELET OF PROTECTION BRACELET HELPS RELEASING NEGATIVITY,4.0,USD,True,False,5.0,False,,,1,95,True,0.0,"FREE delivery Mon, Aug 12 on $35 of items shipped by AmazonOr fastest delivery Fri, Aug 9",1.0,,https://m.media-amazon.com/images/I/71S0NAbJlCL._AC_UL320_.jpg,amazons_choices,17880332011,black agate,1,1,475.0,0.0,0.0
B0BYM3KM6Q,25.95,"Tourmaline Orgone Pyramid Charged for Wealth, Happiness, Good Fortune, Genuine Crystals and Healing Stones, Malachite, Lapis Lazuli, Amethyst, orgonite Chakra Pyramid Crystal, Energy Generator",4.3,USD,,False,25.95,True,,50+ bought in past month,1,65,False,29.95,,,1.0,https://aax-us-iad.amazon.com/e/loi/imp?b=JJPKq7Mo2-iWtcu3_orfj7YAAAGRLYBKBQEAAAH2AQBvbm9fdHhuX2JpZDcgICBvbm9fdHhuX2ltcDEgICCkNdHC,paid,17880332011,black jasper,1,1,1686.75,4.0,0.1335559265442404
B0002PEKBS,37.99,"NOVICA Black Onyx Natural Gemstone Energy Channeling Pyramid, Black Night of Peace'",4.5,USD,,False,37.99,True,,,1,75,False,0.0,,,2.0,https://aax-us-iad.amazon.com/e/loi/imp?b=JPnJUXYRxrH5IGpXka0-jYcAAAGRLYBKBwEAAAH2AQBvbm9fdHhuX2JpZDUgICBvbm9fdHhuX2ltcDEgICC81ZrG,paid,17880332011,black jasper,1,2,2849.25,0.0,0.0
B01HFPJM4M,6.49,"Zentron Crystal Collection: Natural Rough Black Jasper Stones with Velvet Bag - Large 1"" Natural Bulk Rocks for Tumbling, Wire Wrapping, Polishing, Wicca and Reiki (1/2 Pound)",3.6,USD,True,False,6.49,False,,,1,15,False,0.0,"FREE delivery Mon, Aug 12 on $35 of items shipped by Amazon",2.0,,https://m.media-amazon.com/images/I/81ztAS-tyRL._AC_UL320_.jpg,organic,17880332011,black jasper,1,1,97.35000000000001,0.0,0.0
B00L2KVH90,14.99,Jet Black Jasper 5 Element Flat Tumbled Plam Stone Set Handcrafted (Earth Air Fire Water Spirit) Polished Palm Stones for Gemstone Reiki Crystals Healing,4.7,USD,True,False,14.99,False,,,1,123,False,0.0,"FREE delivery Tue, Aug 13 on $35 of items shipped by Amazon",3.0,,https://m.media-amazon.com/images/I/51-JnxTBhxL._AC_UL320_.jpg,organic,17880332011,black jasper,1,2,1843.77,0.0,0.0
B08R97KZ5M,11.5,Sea Sediment Jasper Beads | Smooth Black Sea Sediment Jasper Round Beads | 6mm 8mm 10mm | Single or Bulk Lots Available - 8mm - 1 Strand,4.5,USD,False,False,11.5,False,,,1,126,False,0.0,FREE delivery Aug 16 - 22 Or fastest delivery Aug 12 - 14,4.0,,https://m.media-amazon.com/images/I/91ZNihrmQeL._AC_UL320_.jpg,organic,17880332011,black jasper,1,3,1449.0,0.0,0.0
B08R8BPP7L,10.99,Carved Natural Black Network Jasper Gemstone Elephant Healing Guardian Statue Figurine Crafts 2 inch,4.7,USD,True,False,10.99,False,,,1,2658,False,0.0,"FREE delivery Mon, Aug 12 on $35 of items shipped by Amazon",5.0,,https://m.media-amazon.com/images/I/71p25W3Hv+L._AC_UL320_.jpg,organic,17880332011,black jasper,1,4,29211.420000000002,0.0,0.0
B0BCGTXMCD,24.99,GEMSCITE Lot of 5 Pieces BLACK JASPER Gemstone Pendulums Fashion Powerful Meditation Psychic Success Gift FengShui Health Wealth Reiki Dowsing Energy Wellness Crystal Healing Metaphysical from INDIA,4.0,USD,True,False,24.99,False,,,1,1,False,0.0,"FREE delivery Mon, Aug 12 on $35 of items shipped by AmazonOr fastest delivery Fri, Aug 9",6.0,,https://m.media-amazon.com/images/I/51jPmXF2a8L._AC_UL320_.jpg,organic,17880332011,black jasper,1,5,24.99,0.0,0.0
B0BDR887PT,8.99,60PCS 6MM Red Black Jasper Stone Beads Energy Healing Beads for DIY Jewelry Bracelet Necklace Making for Jewelry Making 15Inch,4.6,USD,True,False,8.99,False,,,1,142,False,0.0,"FREE delivery Wed, Aug 14 on $35 of items shipped by Amazon",7.0,,https://m.media-amazon.com/images/I/71tBzh6So7L._AC_UL320_.jpg,organic,17880332011,black jasper,1,6,1276.58,0.0,0.0
B07H4GQ47G,6.99,"CHEAVIAN 45PCS 8mm Natural Black White Zebra Jasper Gemstone Round Loose Beads Crystal Energy Stone for DIY Jewelry Making 1 Strand 15""",4.6,USD,True,False,6.99,False,,,1,5617,False,0.0,"FREE delivery Mon, Aug 12 on $35 of items shipped by AmazonOr fastest delivery Fri, Aug 9",8.0,,https://m.media-amazon.com/images/I/71nN0GfvkVL._AC_UL320_.jpg,organic,17880332011,black jasper,1,7,39262.83,0.0,0.0
B09Z84GK7H,19.99,"Crystals for Health Manifestation, Set of 6 Red Jasper, Black Obsidian, Black Tourmaline, Bloodstone, Hematite and Unakite Healing Crystals and Stones",4.6,USD,True,False,19.99,False,,,1,332,False,0.0,"FREE delivery Mon, Aug 12 on $35 of items shipped by Amazon",9.0,,https://m.media-amazon.com/images/I/81tZxXWatqL._AC_UL320_.jpg,organic,17880332011,black jasper,1,8,6636.679999999999,0.0,0.0
B0BCDNPWNS,9.99,"150PCs Natural Black Imperial Jasper Spacer Beads, Loose Semi Precious Flat Round Gemstone Heishi Disc Stone Beads for Beading Jewelry Making 4mm*2mm 38cm",4.4,USD,True,False,9.99,False,,,1,323,False,0.0,"FREE delivery Mon, Aug 12 on $35 of items shipped by Amazon",10.0,,https://m.media-amazon.com/images/I/817Qo3KZ8jL._AC_UL320_.jpg,organic,17880332011,black jasper,1,9,3226.77,0.0,0.0
B0B17P988M,13.29,"CHEAVIAN 45PCS 8mm Natural Black Silver Leaf Jasper Gemstone Round Loose Beads for Jewelry Making 1 Strand 15""",4.5,USD,True,False,13.29,False,,,1,4028,False,0.0,"FREE delivery Mon, Aug 12 on $35 of items shipped by Amazon",11.0,,https://m.media-amazon.com/images/I/81ejlgEr0XL._AC_UL320_.jpg,organic,17880332011,black jasper,1,10,53532.119999999995,0.0,0.0
B0CG7Z5VLP,8.83,JOE FOREMAN 12Pcs 14mm Natural Black Jasper Stone Plant Rose Flower Double Side Hand Carved Gemstone Semi Precious Beads for Jewelry Making,5.0,USD,False,False,8.83,False,,,1,1,False,0.0,$3.48 delivery Aug 20 - Sep 3,12.0,,https://m.media-amazon.com/images/I/71Wcmd+rWXL._AC_UL320_.jpg,organic,17880332011,black jasper,1,11,8.83,0.0,0.0
B0BY3JJSY8,9.98,"Black Round Jasper Beads, 8mm by Bead Landingâ„¢",0.0,USD,False,False,9.98,False,,,1,0,False,0.0,FREE delivery Aug 13 - 14,13.0,,https://m.media-amazon.com/images/I/71QHDsi1c9L._AC_UL320_.jpg,organic,17880332011,black jasper,1,12,0.0,0.0,0.0
B0856S8MYF,10.99,Black Imperial Jasper Pendant Earrings Leaf Drop Shape Size18x58mm Sold per Pair,5.0,USD,False,False,10.99,False,,,1,1,False,0.0,FREE delivery Aug 13 - 15 Or fastest delivery Aug 9 - 13,14.0,,https://m.media-amazon.com/images/I/81PM1fPFOVL._AC_UL320_.jpg,organic,17880332011,black jasper,1,13,10.99,0.0,0.0
B07YYY8GB9,7.99,Gem Semi Precious Gemstone 8mm Round Beads Stretch Bracelet 7 Inch Unisex,4.5,USD,True,False,7.99,False,,,1,786,False,0.0,"FREE delivery Mon, Aug 12 on $35 of items shipped by Amazon",15.0,,https://m.media-amazon.com/images/I/51OwykPv3bL._AC_UL320_.jpg,organic,17880332011,black jasper,1,14,6280.14,0.0,0.0
B08B3D44VH,13.95,"FIREBOOMOON 2lb/950g Rough Natural Black Obsidian Stones Raw Gemstone Crystal Rock for Cabbing,Tumbling,Cutting,Polishing,Lapidary,Wire Wrapping,Healing Reiki,Jewelry Making,Home Decoration(Black)",4.6,USD,True,False,13.95,False,,50+ bought in past month,1,426,False,0.0,"FREE delivery Mon, Aug 12 on $35 of items shipped by AmazonOr fastest delivery Fri, Aug 9",16.0,,https://m.media-amazon.com/images/I/71i3GzTYN1L._AC_UL320_.jpg,organic,17880332011,black jasper,1,15,5942.7,0.0,0.0
B0BL3HMJVJ,7.99,"2 pieces of Black Obsidian Raw Crystals and Healing Stones, Natural Rocks for Tumbling and DIY Raw Stones and Crystals",4.1,USD,True,True,7.99,False,,100+ bought in past month,1,1155,False,0.0,"FREE delivery Mon, Aug 12 on $35 of items shipped by Amazon",17.0,,https://m.media-amazon.com/images/I/71Iwq-1UxrL._AC_UL320_.jpg,organic,17880332011,black jasper,1,16,9228.45,0.0,0.0
B0D8FWG1FB,0.0,Jasper (Black Dog Security Book 8),4.6,USD,False,False,0.0,False,,,1,5,False,0.0,,18.0,,https://m.media-amazon.com/images/I/81R8lkBQFcL._AC_UL320_.jpg,organic,17880332011,black jasper,1,17,0.0,0.0,0.0
B0D2CTLG7V,7.49,"90pcs 4mm Natural Black and White Zebra Jasper Gemstone Round Spacer Loose Stone Beads for Jewelry Making 15.5"" 1 Strand (Black and White Zebra Jasper, 4mm 90Beads)",3.7,USD,True,False,7.49,False,,,1,32,False,0.0,"FREE delivery Mon, Aug 12 on $35 of items shipped by AmazonOr fastest delivery Fri, Aug 9",19.0,,https://m.media-amazon.com/images/I/61hRyTg73EL._AC_UL320_.jpg,organic,17880332011,black jasper,1,18,239.68,0.0,0.0
B01LXJZX64,10.99,RUBYCA Natural Black White Zebra Jasper Gemstone Round Loose Beads Jewelry Making 1 Strand - 4mm,4.5,USD,True,False,10.99,False,,,1,366,False,0.0,"FREE delivery Wed, Aug 14 on $35 of items shipped by Amazon",20.0,,https://m.media-amazon.com/images/I/71euxQz3aEL._AC_UL320_.jpg,organic,17880332011,black jasper,1,19,4022.34,0.0,0.0
B0CPS6PG4L,19.0,Black Tourmaline Stone Beaded Bracelet,4.7,USD,True,False,19.0,False,,,1,24,False,0.0,"FREE delivery Mon, Aug 12 on $35 of items shipped by Amazon",21.0,,https://m.media-amazon.com/images/I/51sqWiZZxrL._AC_UL320_.jpg,organic,17880332011,black jasper,1,20,456.0,0.0,0.0
B08L4FSR6V,7.99,"Natural Stone Heishi Beads for Necklace Making, 4mm x 2mm Small Flat Round Stone Loose Heishi Disc Gemstone Beads for Jewelry Making Craft Bracelet Earrings Necklace - Black Imperial Jasper",4.4,USD,True,False,7.99,False,,,1,362,False,0.0,"FREE delivery Mon, Aug 12 on $35 of items shipped by AmazonOr fastest delivery Fri, Aug 9",22.0,,https://m.media-amazon.com/images/I/71es68lsH9S._AC_UL320_.jpg,organic,17880332011,black jasper,1,21,2892.38,0.0,0.0
B0BKJWDVKZ,11.51,"GEM-Inside 10mm Heart Charms Natural Black Obsidian Jasper Gemstone Stone Beads for Jewelry Making Full 15"" Strand Power Energy Healing Chakra Stone Beads",4.7,USD,True,False,11.51,False,,,1,15,False,0.0,"FREE delivery Mon, Aug 12 on $35 of items shipped by Amazon",23.0,,https://m.media-amazon.com/images/I/61riK5gu1IL._AC_UL320_.jpg,organic,17880332011,black jasper,1,22,172.65,0.0,0.0
B07PH25KP3,22.4,"Emtek Jasper Pull, 8"" Center-to-Center, Flat Black",4.4,USD,True,False,22.4,False,,,1,6,False,0.0,"FREE delivery Mon, Aug 12 on $35 of items shipped by Amazon",24.0,,https://m.media-amazon.com/images/I/51YyKTxHluL._AC_UL320_.jpg,organic,17880332011,black jasper,1,23,134.39999999999998,0.0,0.0
B01NCE2D7E,6.99,"EPILEPSY RELIEF - Professionally Selected Tumbled Crystal Healing Set with Pouch & Description Card - Amethyst, Dumortierite, Jasper, and Black Tourmaline Genuine Gemstones",4.4,USD,False,False,6.99,False,,,1,30,False,0.0,"$5 delivery Thu, Aug 15 Or fastest delivery Aug 12 - 14",25.0,,https://m.media-amazon.com/images/I/71VoiSTL67L._AC_UL320_.jpg,organic,17880332011,black jasper,1,24,209.70000000000002,0.0,0.0
B09Z665YKZ,19.99,Anti Bullying Manifestation Bracelets - Black Obsidian Tiger Eye Red Jasper Bracelet Set for Men Women Healing Calming Anxiety Stress Relief Gifts Pulseras Para Hombres Mujer (Adjustable),4.3,USD,True,False,19.99,False,,,1,1187,False,0.0,"FREE delivery Mon, Aug 12 on $35 of items shipped by Amazon",26.0,,https://m.media-amazon.com/images/I/61Yn9l8cR8L._AC_UL320_.jpg,organic,17880332011,black jasper,1,25,23728.129999999997,0.0,0.0
B07GBW9PGF,19.0,Hamsa Hand Charm Black Tourmaline Stone Bracelet,4.6,USD,True,False,19.0,False,,,1,225,False,0.0,"FREE delivery Mon, Aug 12 on $35 of items shipped by Amazon",27.0,,https://m.media-amazon.com/images/I/61R+4lLot4L._AC_UL320_.jpg,organic,17880332011,black jasper,1,26,4275.0,0.0,0.0
B07VQ2N3GC,19.2,"Emtek Jasper Pull Available in 7 Sizes in 6 Finishes - 86689US19 - (Center to Center 6"", Flat Black - US19)",4.3,USD,True,False,19.2,False,,,1,2,False,0.0,"FREE delivery Mon, Aug 12 on $35 of items shipped by Amazon",28.0,,https://m.media-amazon.com/images/I/41SSTInLuEL._AC_UL320_.jpg,organic,17880332011,black jasper,1,27,38.4,0.0,0.0
B0CZNXPJ9Z,25.0,6mm Leaf Pendant 108 Mala Beaded Necklace,4.8,USD,True,False,25.0,False,,,1,35,False,0.0,"FREE delivery Tue, Aug 13 on $35 of items shipped by Amazon",29.0,,https://m.media-amazon.com/images/I/61YpgDZKt7L._AC_UL320_.jpg,organic,17880332011,black jasper,1,28,875.0,0.0,0.0
B0BL6GW6WY,9.99,"8mm Natural Lava Rock Stone Bracelets for Men, Healing Crystal Essential Oil Diffuser Beads Bracelet Chakra Yoga Energy Anxiety Gemstone Bracelet - 3 Layer",4.5,USD,True,False,9.99,False,,,1,728,False,0.0,"FREE delivery Mon, Aug 12 on $35 of items shipped by Amazon",30.0,,https://m.media-amazon.com/images/I/81zrtDm2OAL._AC_UL320_.jpg,organic,17880332011,black jasper,1,29,7272.72,0.0,0.0
B08X4S9D32,8.99,Gem Semi Precious Gemstones 10mm Round Beads Stone Crystal Stretch Bracelets Unisex,4.6,USD,False,False,8.99,False,,,1,233,False,0.0,FREE delivery on $35 shipped by Amazon.,31.0,,https://m.media-amazon.com/images/I/71wnvE8G2qL._AC_UL320_.jpg,organic,17880332011,black jasper,1,30,2094.67,0.0,0.0
B099W72633,14.99,"Filluck Natural Stone Beads 8mm Green Red Imperial Jasper Polished Round Smooth Gemstone Beads for Jewelry Making Adults 15 Inch(Green Red Imperial Jasper,8mm)",4.6,USD,True,False,14.99,False,,50+ bought in past month,1,1208,False,0.0,"FREE delivery Mon, Aug 12 on $35 of items shipped by AmazonOr fastest delivery Fri, Aug 9",32.0,,https://m.media-amazon.com/images/I/71cUdBccLVL._AC_UL320_.jpg,organic,17880332011,black jasper,1,31,18107.920000000002,0.0,0.0
B09YQQZYR9,10.4,"Natural AAA Genuine Red Jasper And Black Onyx Bracelet, Natural Sun Red jasper, Crystal Healing, Fertility Bracelet, Abundance Wea Red And Black",5.0,USD,True,False,10.4,False,,,1,1,False,0.0,"FREE delivery Tue, Aug 13 on $35 of items shipped by Amazon",33.0,,https://m.media-amazon.com/images/I/41l6ZvhnJhL._AC_UL320_.jpg,organic,17880332011,black jasper,1,32,10.4,0.0,0.0
B08W311PFX,9.59,Semi Precious Gemstones 30mm Circle Coin Peace Donut Beads Adjustable Braided Rope Pendant Necklace,4.5,USD,True,False,9.59,False,,,1,636,False,0.0,FREE delivery on $35 shipped by Amazon.,34.0,,https://m.media-amazon.com/images/I/71GeigaDZfL._AC_UL320_.jpg,organic,17880332011,black jasper,1,33,6099.24,0.0,0.0
B0CPCPSDW3,9.99,"Black White Jasper Teardrop Stone Earrings for Women, Golden Edged Flat Drop Dangle Earrings",5.0,USD,True,False,9.99,False,,,1,4,False,0.0,"FREE delivery Mon, Aug 12 on $35 of items shipped by AmazonOr fastest delivery Fri, Aug 9",35.0,,https://m.media-amazon.com/images/I/71U9Y35HPpL._AC_UL320_.jpg,organic,17880332011,black jasper,1,34,39.96,0.0,0.0
B0C86QH4XG,9.99,Ear gauges Black Imperial jasper organic stone plugs SoScene,4.7,USD,True,False,9.99,False,,,1,25,False,0.0,"FREE delivery Tue, Aug 13 on $35 of items shipped by Amazon",36.0,,https://m.media-amazon.com/images/I/51HBZs7RzFL._AC_UL320_.jpg,organic,17880332011,black jasper,1,35,249.75,0.0,0.0
B07VSXBL45,18.4,"Emtek Jasper Pull Available in 7 Sizes in 6 Finishes - 86688US19 - (Center to Center 5"", Flat Black - US19)",4.7,USD,True,False,18.4,False,,,1,4,False,0.0,"FREE delivery Mon, Aug 12 on $35 of items shipped by Amazon",37.0,,https://m.media-amazon.com/images/I/41Gr1tnUQCL._AC_UL320_.jpg,organic,17880332011,black jasper,1,36,73.6,0.0,0.0
B004JFUOSK,0.0,The Black Bear of Jasper,0.0,USD,False,False,0.0,False,,,1,0,False,0.0,,38.0,,https://m.media-amazon.com/images/I/51gfQQp+n+L._AC_UL320_.jpg,organic,17880332011,black jasper,1,37,0.0,0.0,0.0
B0D6X3W3TX,314.02,"BUNBUNCHAKO Jasper Ebony Black 29"" W Round Coffee Table",0.0,USD,False,False,314.02,False,,,1,4,False,0.0,FREE delivery Aug 22 - Sep 6,39.0,,https://m.media-amazon.com/images/I/61UbzXidq9L._AC_UL320_.jpg,organic,17880332011,black jasper,1,38,1256.08,0.0,0.0
B003P7J3XA,0.0,The Black Jaspers,0.0,USD,False,False,0.0,False,,,1,0,False,0.0,,40.0,,https://m.media-amazon.com/images/I/71bfxUSyMTL._AC_UL320_.jpg,organic,17880332011,black jasper,1,39,0.0,0.0,0.0
B075MR98M8,25.5,8MM 60 Inch Matte-Finish Genuine Semi-Precious Stone Endless Infinity Opera Length Hand Beaded Mala Chakra Long OR Multi-strand Multi-wrap Necklace for Women or Men.,4.7,USD,True,False,25.5,False,,,1,97,False,0.0,"FREE delivery Mon, Aug 12 on $35 of items shipped by Amazon",41.0,,https://m.media-amazon.com/images/I/813VevdZ7cL._AC_UL320_.jpg,organic,17880332011,black jasper,1,40,2473.5,0.0,0.0
B0C9T8DDZR,19.99,"Natural Red Jasper Pear Cabochon Necklace, Gemstone Healing Crystals, Gift for Her, Birthstone Jewelry, 18 inch Black Plated Adjustable Chain",5.0,USD,True,False,19.99,False,,,1,2,False,0.0,"FREE delivery Mon, Aug 12 on $35 of items shipped by Amazon",42.0,,https://m.media-amazon.com/images/I/61mDkTx8-yL._AC_UL320_.jpg,organic,17880332011,black jasper,1,41,39.98,0.0,0.0
B011KZJYH8,59.95,Boy's Jasper Driver Jr Loafer,4.5,USD,True,False,59.95,False,,,1,265,False,65.95,"FREE delivery Tue, Aug 13",43.0,,https://m.media-amazon.com/images/I/717aHSR0plL._AC_UL320_.jpg,organic,17880332011,black jasper,1,42,15886.75,6.0,0.09097801364670205
B0CKSRQ77M,14.99,"Dalmatian Jasper Necklace Crystal Jewelry for Men Women : Stylish Natural Gemstone Men Jewelry, Unique Women Men's Necklace with Crystal Stone Holder Necklace Pyramid (Black Macrame)",4.7,USD,True,False,14.99,False,,,1,4,False,0.0,"FREE delivery Tue, Aug 13 on $35 of items shipped by Amazon",44.0,,https://m.media-amazon.com/images/I/71tdPIp4g-L._AC_UL320_.jpg,organic,17880332011,black jasper,1,43,59.96,0.0,0.0
B0B24KFHLL,29.99,"Beaded Necklace for Women,8MM Jasper Stone Necklace, Handmade Fashion Jewelry Gifts,Bead Choker Necklace",4.4,USD,True,False,29.99,False,,,1,131,False,0.0,"FREE delivery Tue, Aug 13 on $35 of items shipped by Amazon",45.0,,https://m.media-amazon.com/images/I/716DYy1ab9L._AC_UL320_.jpg,organic,17880332011,black jasper,1,44,3928.6899999999996,0.0,0.0
B09YQWJB4Y,22.4,"Natural AAA Genuine Red Jasper Bracelet, Natural Sun Red jasper, Crystal Healing, Fertility Bracelet, Abundance Wealth, Blance Peace Harmony, 8 mm, red jasper and black onyx",4.1,USD,True,False,22.4,False,,,1,8,False,0.0,"FREE delivery Tue, Aug 13 on $35 of items shipped by Amazon",46.0,,https://m.media-amazon.com/images/I/41TdfW+dc7L._AC_UL320_.jpg,organic,17880332011,black jasper,1,45,179.2,0.0,0.0
B0BLT5DGR7,35.9,"ElisaJewelryArt - Natural Red Jasper Crystal Pendant Black Onyx Stone Beaded Necklace Genuine Gemstone Endurance Stone Clasp Closure Necklace Unisex Necklace (22.00, Red Jasper)",4.7,USD,True,False,35.9,False,,,1,6,False,0.0,"FREE delivery Tue, Aug 13",47.0,,https://m.media-amazon.com/images/I/61twNNP632L._AC_UL320_.jpg,organic,17880332011,black jasper,1,46,215.39999999999998,0.0,0.0
B08LF1QWV8,189.89,"Emtek Jasper Appliance Pull of The Industrial Modern Cabinet Hardware Collection 12 inch (CTC) Thru Bolted Mounting for Your Contemporary Home, Color: Flat Black Coated (US19), Model: 86693",5.0,USD,True,False,189.89,False,,,1,3,False,0.0,"FREE delivery Mon, Aug 12",48.0,,https://m.media-amazon.com/images/I/21R5J53OVAL._AC_UL320_.jpg,organic,17880332011,black jasper,1,47,569.67,0.0,0.0
