asin,price,title,rating,currency,is_prime,best_seller,price_upper,is_sponsored,manufacturer,sales_volume,pricing_count,reviews_count,is_amazons_choice,price_strikethrough,shipping_information,pos,rel_pos,url_image,source,category_id,keyword,page,position,min_revenue,discount,discount_rate
B092QVM8G9,28.99,Gemstone For Necklace 9.10-118.50 Carat | Topaz | Citrine | Amethyst | Aquamarine Loose Gemstones Jewelry Making For Women And Mens,3.7,USD,True,False,28.99,True,,,1,94,False,0.0,"FREE delivery Mon, Aug 12 on $35 of items shipped by AmazonOr fastest delivery Sun, Aug 11",27.0,,https://m.media-amazon.com/images/I/6102E4RKkjL._AC_UL320_.jpg,paid,17880332011,peridot,1,9,2725.06,0.0,0.0
B089W7TKYY,39.99,Heart Birthstone Necklace for Women Sterling Silver Genuine or Created Gemstone Forever Love Pendant Necklace Fine Jewelry Anniversary Birthday Gifts for Women Mom Wife Her,4.6,USD,True,False,39.99,True,,50+ bought in past month,1,1377,False,69.99,"FREE delivery Mon, Aug 12 Or fastest delivery Fri, Aug 9",28.0,,https://m.media-amazon.com/images/I/51-X5eFvIJL._AC_UL320_.jpg,paid,17880332011,peridot,1,10,55066.23,29.999999999999993,0.42863266180882975
B09MMYNJ6T,12.99,"Peridot Healing Crystal Necklace - Success, Wealth & Joy. Harmony Stone Pendant for Positive Energy",4.1,USD,True,False,12.99,True,,,1,25,False,0.0,"FREE delivery Mon, Aug 12 on $35 of items shipped by AmazonOr fastest delivery Fri, Aug 9",33.0,,https://m.media-amazon.com/images/I/717lRCRXBBL._AC_UL320_.jpg,paid,17880332011,peridot,1,11,324.75,0.0,0.0
B00UYGOF9M,48.0,925 Sterling Silver 6mm Cushion Cut Birthstone Solitaire Pendant Necklace for Women with 18 inch Box Chain,4.4,USD,True,False,48.0,True,,,1,893,False,0.0,"FREE delivery Mon, Aug 12 Or fastest delivery Fri, Aug 9",34.0,,https://m.media-amazon.com/images/I/51RKGy1AQfL._AC_UL320_.jpg,paid,17880332011,peridot,1,12,42864.0,0.0,0.0
B0948TWNMZ,24.99,25carats AA Raw Peridot Crystal Gemstone Rough Stones Chaka Healing Crystals Handcraft DIY - Jewelry Making Loose Wholesale Lot Wire Wrapping August Birthstone,3.6,USD,True,False,24.99,True,,,1,10,False,28.99,"FREE delivery Mon, Aug 12 on $35 of items shipped by AmazonOr fastest delivery Fri, Aug 9",35.0,,https://m.media-amazon.com/images/I/611iecI4g1L._AC_UL320_.jpg,paid,17880332011,peridot,1,13,249.89999999999998,4.0,0.1379786133149362
B0CZKKT6P3,69.99,"Birthstone Necklace for Women Teardrop Necklace S925 Sterling Silver Infinity Love Birthday Gifts for Mom Women, 16""+2"" Inches",4.7,USD,,False,69.99,True,,50+ bought in past month,1,19,False,0.0,,,2.0,https://aax-us-iad.amazon.com/e/loi/imp?b=JHNaZHOjbUVOKD8kEBrSCvAAAAGRLX_eUgEAAAH2AQBvbm9fdHhuX2JpZDQgICBvbm9fdHhuX2ltcDEgICCBmked,paid,17880332011,peridot,1,14,1329.81,0.0,0.0
B0CFHF9FWK,9.99,"Natural Peridot Chips Braided Bracelet, Healing Crystals, Birthday, Gift for Her, Resizable Hand Braid Rope Thread Protection Bracelet for Men, Women, Gemstone Jewelry 7 inch Christmas Gifts (Peridot)",3.7,USD,True,False,9.99,False,,,1,31,False,0.0,"FREE delivery Mon, Aug 12 on $35 of items shipped by AmazonOr fastest delivery Tomorrow, Aug 8",2.0,,https://m.media-amazon.com/images/I/71eu8+NJhEL._AC_UL320_.jpg,organic,17880332011,peridot,1,1,309.69,0.0,0.0
B0CZKKT6P3,69.99,"Birthstone Necklace for Women Teardrop Necklace S925 Sterling Silver Infinity Love Birthday Gifts for Mom Women, 16""+2"" Inches",4.7,USD,True,False,69.99,False,,50+ bought in past month,1,19,False,0.0,"FREE delivery Mon, Aug 12 Or fastest delivery Tomorrow, Aug 8",4.0,,https://m.media-amazon.com/images/I/61CNHw-FwFL._AC_UL320_.jpg,organic,17880332011,peridot,1,2,1329.81,0.0,0.0
B0C8S9WX2R,18.95,"GemFire Organic Scented Crystal Candle - Peridot Gemstone, August Birthstone Gift - Leo or Virgo Zodiac Sign - Natural Soy Wax & Beeswax - Long-Burn for Aromatherapy, Meditation, Relaxation",3.9,USD,True,False,18.95,False,,,1,17,False,0.0,"FREE delivery Mon, Aug 12 on $35 of items shipped by AmazonOr fastest delivery Fri, Aug 9",5.0,,https://m.media-amazon.com/images/I/81nwmg-Y4CL._AC_UL320_.jpg,organic,17880332011,peridot,1,3,322.15,0.0,0.0
B09XHHMPVF,19.99,Handmade Tree of Life Orgonite Pyramid Peridot with Obsidian Crystal Stone Positive Reiki Energy Generator Healing Orgone Collection,4.4,USD,True,False,19.99,False,,,1,265,False,0.0,"FREE delivery Mon, Aug 12 on $35 of items shipped by AmazonOr fastest delivery Fri, Aug 9",6.0,,https://m.media-amazon.com/images/I/71vlu8hXZxL._AC_UL320_.jpg,organic,17880332011,peridot,1,4,5297.349999999999,0.0,0.0
B09M9RP8LC,17.59,"InfinityGemsArt 30 carats Natural Raw Peridot Crystal Gemstone, Chakra Crystal, Rough Crystals Gemstone, August Birthstone Crystal for Jewelry Making Supplies, DIY Crafts, Loose Gemstones",4.8,USD,True,False,17.59,False,,50+ bought in past month,1,12,False,0.0,"FREE delivery Mon, Aug 12 on $35 of items shipped by AmazonOr fastest delivery Fri, Aug 9",7.0,,https://m.media-amazon.com/images/I/61GUUXVnpPL._AC_UL320_.jpg,organic,17880332011,peridot,1,5,211.07999999999998,0.0,0.0
B0CZ4H1V5Z,5.99,14K Gold Plated 925 Sterling Silver Post Rose Flower Stud Earrings for Women Birthstone Cubic Zirconia Studs Earrings Hypoallergenic & Nickel Free Jewelry,4.4,USD,True,False,5.99,False,,50+ bought in past month,1,50,False,9.99,"FREE delivery Mon, Aug 12 on $35 of items shipped by AmazonOr fastest delivery Fri, Aug 9",8.0,,https://m.media-amazon.com/images/I/51kBd5xsoNL._AC_UL320_.jpg,organic,17880332011,peridot,1,6,299.5,4.0,0.40040040040040037
B0CWRBFYNZ,9.99,"Sterling Silver Choker Necklace for Women,Dainty Blue Green Crystals Gemstones Pearl Necklace Jewelry,June August September Birthstone Necklace for Teen Girls",5.0,USD,True,False,9.99,False,,50+ bought in past month,1,4,False,0.0,"FREE delivery Mon, Aug 12 on $35 of items shipped by AmazonOr fastest delivery Tomorrow, Aug 8",9.0,,https://m.media-amazon.com/images/I/61WOJU0eV2L._AC_UL320_.jpg,organic,17880332011,peridot,1,7,39.96,0.0,0.0
B07FKKV5CT,65.0,"Elisa Pendant Necklace for Women, Fashion Jewelry, 14k Gold-Plated",4.6,USD,True,True,65.0,False,,100+ bought in past month,1,16222,False,0.0,"FREE delivery Mon, Aug 12 Or fastest delivery Fri, Aug 9",10.0,,https://m.media-amazon.com/images/I/41-V9pJZSWL._AC_UL320_.jpg,organic,17880332011,peridot,1,8,1054430.0,0.0,0.0
B07QQ46JFD,13.95,14K Gold Plated Crystal Birthstone Bar Necklace | Dainty Necklace | Gold Necklaces for Women |,4.5,USD,True,False,13.95,False,,100+ bought in past month,1,2221,False,0.0,"FREE delivery Mon, Aug 12 on $35 of items shipped by AmazonOr fastest delivery Tomorrow, Aug 8",11.0,,https://m.media-amazon.com/images/I/51w2pTqV9LL._AC_UL320_.jpg,organic,17880332011,peridot,1,9,30982.949999999997,0.0,0.0
B003AYEX7Y,19.0,"womens Sterling Silver Genuine Peridot Frog Pendant Necklace, 18""",4.5,USD,True,False,19.0,False,,50+ bought in past month,1,799,False,22.4,"FREE delivery Mon, Aug 12 on $35 of items shipped by AmazonOr fastest delivery Sun, Aug 11",12.0,,https://m.media-amazon.com/images/I/716OMNDBiPL._AC_UL320_.jpg,organic,17880332011,peridot,1,10,15181.0,3.3999999999999986,0.15178571428571422
B0CBJJD4CD,10.99,A Promise of Peridot (The Sacred Stones Book 2),4.4,USD,False,False,10.99,False,,,1,647,False,0.0,,13.0,,https://m.media-amazon.com/images/I/91HqbHsx1yL._AC_UL320_.jpg,organic,17880332011,peridot,1,11,7110.53,0.0,0.0
B01E703QE0,4.99,Genuine Natural Olivine Peridot Gemstone Stretch Round Crystal Bead Bracelet 6mm,4.1,USD,False,False,4.99,False,,100+ bought in past month,1,34,False,0.0,FREE delivery Aug 22 - Sep 6,14.0,,https://m.media-amazon.com/images/I/710LjqJKGOL._AC_UL320_.jpg,organic,17880332011,peridot,1,12,169.66,0.0,0.0
B0CSFM2LQ7,13.99,Birthstone Bracelets for Women Gold Dainty Link Bracelet Birthstone Jewelry Birthday Gifts for Her Mom Wife Girlfriend Anniversary Jewelry,4.6,USD,True,False,13.99,False,,100+ bought in past month,1,24,False,0.0,"FREE delivery Mon, Aug 12 on $35 of items shipped by AmazonOr fastest delivery Sun, Aug 11",15.0,,https://m.media-amazon.com/images/I/51DzDKZ6+aL._AC_UL320_.jpg,organic,17880332011,peridot,1,13,335.76,0.0,0.0
B086ZJX54F,39.99,"Birthstone Necklaces for Women Fine Jewelry Sterling Silver Dainty Infinity Pendant Anniversary Birthday Christmas Gifts for Her Wife Mom Lady Daughter, Chain 16""+2"" Extendâ€¦",4.6,USD,True,False,39.99,False,,50+ bought in past month,1,1662,False,0.0,"FREE delivery Mon, Aug 12 Or fastest delivery Tomorrow, Aug 8",16.0,,https://m.media-amazon.com/images/I/51681hZILAL._AC_UL320_.jpg,organic,17880332011,peridot,1,14,66463.38,0.0,0.0
B0BS35GXBW,19.99,"Tree of Life Green Chakra Healing Orgone Pendant Necklace with Green Peridot&Tiger Eye, Heart 4th Chakra Reiki Healing Crystals Stones Jewelry Men Women",4.7,USD,True,False,19.99,False,,,1,4,False,0.0,"FREE delivery Mon, Aug 12 on $35 of items shipped by AmazonOr fastest delivery Fri, Aug 9",21.0,,https://m.media-amazon.com/images/I/81NLz2hlZnL._AC_UL320_.jpg,organic,17880332011,peridot,1,15,79.96,0.0,0.0
B01HD7X6WG,21.8,Sterling Silver Round Birthstone Stud Earrings (previously Amazon Collection),4.6,USD,True,False,21.8,False,,100+ bought in past month,1,10782,False,0.0,"FREE delivery Tue, Aug 13 on $35 of items shipped by Amazon",22.0,,https://m.media-amazon.com/images/I/61nligXDhbL._AC_UL320_.jpg,organic,17880332011,peridot,1,16,235047.6,0.0,0.0
B07KN4X2DN,22.99,Shop LC Multi Gemstone Bracelet in 925 Sterling Silver Bracelet 7.25 Inches Bolo Link Chain Bracelets Infinity Jewelry Birthday Gifts for Women,4.3,USD,True,False,22.99,False,,50+ bought in past month,1,198,False,0.0,"FREE delivery Mon, Aug 12 on $35 of items shipped by Amazon",23.0,,https://m.media-amazon.com/images/I/51L5MbvglJL._AC_UL320_.jpg,organic,17880332011,peridot,1,17,4552.0199999999995,0.0,0.0
B075FJG3Z8,16.99,"2ct Cushion Cut Peridot Pendant Necklace for Women Sterling Silver Gemstone August Birthstone Jewelry for Women, 16-18 inch",4.4,USD,True,False,16.99,False,,50+ bought in past month,1,292,False,0.0,"FREE delivery Mon, Aug 12 on $35 of items shipped by AmazonOr fastest delivery Sun, Aug 11",24.0,,https://m.media-amazon.com/images/I/51fqQn3uwxL._AC_UL320_.jpg,organic,17880332011,peridot,1,18,4961.08,0.0,0.0
B000SMNIUO,16.0,Womens Sterling Silver Created Gemstones Four Stone Pendant Necklace (previously Amazon Collection),4.6,USD,True,False,16.0,False,,50+ bought in past month,1,2299,False,19.0,"FREE delivery Mon, Aug 12 on $35 of items shipped by AmazonOr fastest delivery Sun, Aug 11",29.0,,https://m.media-amazon.com/images/I/71XEQ3xYvcL._AC_UL320_.jpg,organic,17880332011,peridot,1,19,36784.0,3.0,0.15789473684210525
B0BCQZ612T,7.99,45pcs 8mm Peridot Beads Natural Gemstone Beads Round Loose Beads for Jewelry Making,4.6,USD,True,False,7.99,False,,,1,625,False,0.0,"FREE delivery Mon, Aug 12 on $35 of items shipped by AmazonOr fastest delivery Fri, Aug 9",30.0,,https://m.media-amazon.com/images/I/71O43vgD+jL._AC_UL320_.jpg,organic,17880332011,peridot,1,20,4993.75,0.0,0.0
B0CCVCJXD3,59.99,Tree of life Birthstone necklace Sterling Silver Pendant Birthstone Necklace Gemstone Anniversary Birthday Jewelry Christmas Gifts for Mom Her Wife,4.5,USD,True,False,59.99,False,,50+ bought in past month,1,120,False,79.99,"FREE delivery Mon, Aug 12 Or fastest delivery Fri, Aug 9",31.0,,https://m.media-amazon.com/images/I/71hEFiJvioL._AC_UL320_.jpg,organic,17880332011,peridot,1,21,7198.8,19.999999999999993,0.25003125390673825
B00851JMW8,19.99,"925 Sterling Silver Green Peridot Stud Earrings For Women (2.00 Cttw, Gemstone Birthstone, Round 6MM)",4.5,USD,True,False,19.99,False,,100+ bought in past month,1,954,False,0.0,"FREE delivery Mon, Aug 12 on $35 of items shipped by AmazonOr fastest delivery Fri, Aug 9",32.0,,https://m.media-amazon.com/images/I/51EzY82AHaL._AC_UL320_.jpg,organic,17880332011,peridot,1,22,19070.46,0.0,0.0
B0BD3PH342,15.99,"Layered Birthstone Necklace for Women Girls, Gold Silver Rose Gold Plated Layered Paperclip Chain Choker Necklace with Rectangle Birthstone Pendant Birthday Gifts for Women Girls Jewelry",4.2,USD,True,False,15.99,False,,50+ bought in past month,1,517,False,0.0,"FREE delivery Mon, Aug 12 on $35 of items shipped by AmazonOr fastest delivery Tomorrow, Aug 8",36.0,,https://m.media-amazon.com/images/I/61gPkme-8vL._AC_UL320_.jpg,organic,17880332011,peridot,1,23,8266.83,0.0,0.0
B07FKDNMM3,65.0,"Elaina Adjustable Chain Bracelet for Women, Fashion Jewelry, Gold-Plated",4.7,USD,True,False,65.0,False,,,1,2023,False,0.0,"FREE delivery Mon, Aug 12",37.0,,https://m.media-amazon.com/images/I/41WN9ikGNQL._AC_UL320_.jpg,organic,17880332011,peridot,1,24,131495.0,0.0,0.0
B07LGBFGLP,229.0,3.90 ct. t.w. Peridot Drop Earrings in 14kt Yellow Gold,4.8,USD,True,False,229.0,False,,,1,19,False,0.0,"FREE delivery Tomorrow, Aug 8",38.0,,https://m.media-amazon.com/images/I/71S1SDLod3L._AC_UL320_.jpg,organic,17880332011,peridot,1,25,4351.0,0.0,0.0
B07QWXQ8N7,39.99,"Necklaces for Women, Infinity Love Heart Pendant with Birthstone Crystals, Jewelry Gifts for Wife, Silver Plated 18 + 2 inch Chain, Birthday or Chrismas Holiday Gift for Her, Mom, & Sister",4.6,USD,True,False,39.99,False,,200+ bought in past month,1,25117,False,0.0,"FREE delivery Mon, Aug 12 Or fastest delivery Fri, Aug 9",39.0,,https://m.media-amazon.com/images/I/71v9lR6P3wL._AC_UL320_.jpg,organic,17880332011,peridot,1,26,1004428.8300000001,0.0,0.0
B0BM9VQSC6,10.99,Paris Jewelry 18K White Gold 6 Cttw Created Peridot Round Adjustable Tennis Plated Bracelet,4.0,USD,True,False,10.99,False,,,1,20,False,12.99,"FREE delivery Mon, Aug 12 on $35 of items shipped by AmazonOr fastest delivery Sun, Aug 11",40.0,,https://m.media-amazon.com/images/I/41A5fyXg4mL._AC_UL320_.jpg,organic,17880332011,peridot,1,27,219.8,2.0,0.15396458814472672
B07Z5N6C63,20.99,"mookaitedecor Set of 3 Peridot Healing Crystal Wands 2 Inch, Polished Tumbled Stone Points 6 Faceted Reiki Chakra Meditation Therapy Decor",4.4,USD,True,False,20.99,False,,,1,137,False,0.0,"FREE delivery Mon, Aug 12 on $35 of items shipped by AmazonOr fastest delivery Tomorrow, Aug 8",41.0,,https://m.media-amazon.com/images/I/616jT1SgY2L._AC_UL320_.jpg,organic,17880332011,peridot,1,28,2875.6299999999997,0.0,0.0
B095BVZBWZ,21.0,"30 carats Natural Raw Peridot Crystal Gemstone, Chakra Healing Crystal, Rough Crystals and Gemstone, Birthstone Crystal for Jewelry Making Supplies, DIY Crafts, Loose Gemstones Birthday Gift",4.0,USD,True,False,21.0,False,,,1,56,False,0.0,"FREE delivery Mon, Aug 12 on $35 of items shipped by AmazonOr fastest delivery Fri, Aug 9",42.0,,https://m.media-amazon.com/images/I/71ypbZ+PKGS._AC_UL320_.jpg,organic,17880332011,peridot,1,29,1176.0,0.0,0.0
B0B9RY8HDL,19.99,"Gempires Natural Raw Green Peridot Prong Setting Stud Earrings, August Birthstone Jewelry, 8-10 mm Crystals Earring, Handmade Jewelry, Gift for Her (Peridot)",4.4,USD,True,False,19.99,False,,50+ bought in past month,1,107,False,0.0,"FREE delivery Mon, Aug 12 on $35 of items shipped by AmazonOr fastest delivery Fri, Aug 9",43.0,,https://m.media-amazon.com/images/I/51wsfq8JcbL._AC_UL320_.jpg,organic,17880332011,peridot,1,30,2138.93,0.0,0.0
B0C3ZWHXVS,14.99,"TGH Natural Peridot Chips Bar Bracelet, Healing Crystal, Gold Plated Raw Beads Bracelet, 7+1 inch Adjustable Chain, Gift For Her (Peridot)",4.0,USD,True,False,14.99,False,,,1,5,False,0.0,"FREE delivery Mon, Aug 12 on $35 of items shipped by AmazonOr fastest delivery Tomorrow, Aug 8",44.0,,https://m.media-amazon.com/images/I/614jZCfrRoL._AC_UL320_.jpg,organic,17880332011,peridot,1,31,74.95,0.0,0.0
B00MCK31IY,22.0,Sterling Silver Sky Flower Stud Earrings (previously Amazon Collection),4.4,USD,True,False,22.0,False,,,1,6860,False,26.9,"FREE delivery Mon, Aug 12 on $35 of items shipped by AmazonOr fastest delivery Sun, Aug 11",45.0,,https://m.media-amazon.com/images/I/71pPJzNW2vL._AC_UL320_.jpg,organic,17880332011,peridot,1,32,150920.0,4.899999999999999,0.18215613382899623
B07CBJ18T7,99.0,5.00 ct. t.w. Peridot Bolo Bracelet in Sterling Silver,4.6,USD,True,False,99.0,False,,,1,28,False,0.0,"FREE delivery Tomorrow, Aug 8",46.0,,https://m.media-amazon.com/images/I/71M0Ful7bTL._AC_UL320_.jpg,organic,17880332011,peridot,1,33,2772.0,0.0,0.0
B00MCK349K,14.0,"Genuine or Created Gemstone Birthstone Flower Pendant Necklace with Chain in Sterling Silver, 18"" (previously Amazon Collection)",4.5,USD,True,False,14.0,False,,100+ bought in past month,1,3944,False,17.0,"FREE delivery Tue, Aug 13 on $35 of items shipped by Amazon",47.0,,https://m.media-amazon.com/images/I/81Bix9F+5tL._AC_UL320_.jpg,organic,17880332011,peridot,1,34,55216.0,3.0,0.17647058823529413
B08KZRDLST,29.99,"Gempires Peridot Beads Necklace for Women, Peridot Crystal Necklace, August Birthstone Jewelry, 18 inches Silver Plated Chain, Gift for Her, Peridot Jewelry",3.9,USD,True,False,29.99,False,,,1,354,False,0.0,"FREE delivery Mon, Aug 12 on $35 of items shipped by AmazonOr fastest delivery Tomorrow, Aug 8",48.0,,https://m.media-amazon.com/images/I/61y8NOOV9HL._AC_UL320_.jpg,organic,17880332011,peridot,1,35,10616.46,0.0,0.0
B07KTHGNQS,11.99,Charged Premium Natural Crystal Chip Bead Bracelet + Moroccan Selenite Charging Crystal [Included],4.3,USD,True,False,11.99,False,,,1,1282,False,0.0,"FREE delivery Mon, Aug 12 on $35 of items shipped by AmazonOr fastest delivery Sun, Aug 11",49.0,,https://m.media-amazon.com/images/I/71fUKjS5KVL._AC_UL320_.jpg,organic,17880332011,peridot,1,36,15371.18,0.0,0.0
B09DK5K7Q6,16.49,"Sparkling 925 Sterling Silver Birthstone Stud Earrings for Women, Heart/Round/Teardrop/Square Crystal Solitaire Diamond Studs Halo Earrings, Great Birthday/Christmas Gifts",4.5,USD,True,False,16.49,False,,,1,1204,False,0.0,"FREE delivery Mon, Aug 12 on $35 of items shipped by AmazonOr fastest delivery Tomorrow, Aug 8",50.0,,https://m.media-amazon.com/images/I/71iOW2FUixL._AC_UL320_.jpg,organic,17880332011,peridot,1,37,19853.96,0.0,0.0
B09KCG9K7R,34.99,"GemInspire Peridot Pendant Necklace, Rough Green Crystal Pendant, Raw Gemstone Necklace, August Birthstone Jewelry, Casual Wear, 925 Silver 16+2 inch Adjustable Chain",4.0,USD,True,False,34.99,False,,,1,127,False,0.0,"FREE delivery Mon, Aug 12 on $35 of items shipped by AmazonOr fastest delivery Sun, Aug 11",51.0,,https://m.media-amazon.com/images/I/51wSTILJwVL._AC_UL320_.jpg,organic,17880332011,peridot,1,38,4443.7300000000005,0.0,0.0
B01M5D9RJF,29.24,Pear Shape Birthstone Gemstone Antique Finishing 925 Sterling Silver Leaf Vintage Inspired Pendant with 18 Inch Chain Necklace Jewelry for Women,4.6,USD,True,False,29.24,False,,,1,796,False,0.0,"FREE delivery Mon, Aug 12 on $35 of items shipped by AmazonOr fastest delivery Fri, Aug 9",52.0,,https://m.media-amazon.com/images/I/514z-HUABhL._AC_UL320_.jpg,organic,17880332011,peridot,1,39,23275.039999999997,0.0,0.0
B07W71QBK7,36.19,"ZZYBIA LARGE 4"" Olivine Peridot Crystals Flower Of Life Coaster Water Charging Plate Energy Dome",4.4,USD,True,False,36.19,False,,,1,11,False,0.0,"FREE delivery Mon, Aug 12 Or fastest delivery Fri, Aug 9",53.0,,https://m.media-amazon.com/images/I/71z5fXkxaIL._AC_UL320_.jpg,organic,17880332011,peridot,1,40,398.09,0.0,0.0
B07H4CDXCB,12.99,4MM Petite Round Shape Cabochon Gemstones White Gold Plated or Yellow Gold Plated 925 Sterling Silver Stud Post Birthstone Earrings Jewelry for Women or Teens Second or third Hole Piercing,4.5,USD,True,False,12.99,False,,,1,2336,False,0.0,"FREE delivery Mon, Aug 12 on $35 of items shipped by AmazonOr fastest delivery Fri, Aug 9",54.0,,https://m.media-amazon.com/images/I/51W6KjwBxCL._AC_UL320_.jpg,organic,17880332011,peridot,1,41,30344.64,0.0,0.0
B08V5BXJBC,15.99,"Healing Tree of Life Orgonite Crystal Stone Pendant Necklace for Unisex 26.38"" Adjustable Energy Sacred Geometry Tiger's Eye Necklace",4.6,USD,True,False,15.99,False,,,1,119,False,0.0,"FREE delivery Mon, Aug 12 on $35 of items shipped by AmazonOr fastest delivery Sun, Aug 11",55.0,,https://m.media-amazon.com/images/I/61xa8k8XOiL._AC_UL320_.jpg,organic,17880332011,peridot,1,42,1902.81,0.0,0.0
B0C894TPJY,6.49,60pcs 6mm Natural Peridot Beads Gemstone Beads Round Loose Beads for Jewelry Making,4.5,USD,True,False,6.49,False,,50+ bought in past month,1,270,False,0.0,"FREE delivery Mon, Aug 12 on $35 of items shipped by AmazonOr fastest delivery Tomorrow, Aug 8",56.0,,https://m.media-amazon.com/images/I/81FuIE7RizL._AC_UL320_.jpg,organic,17880332011,peridot,1,43,1752.3,0.0,0.0
B09LM3Q8Y5,29.99,"Birthstone Necklace for Women, S925 Sterling Silver 2CT Round Birthstone Necklace Birthday Gifts 12 Months Birthstone Necklaces for Women Jewelry Gifts",4.3,USD,True,False,29.99,False,,,1,459,False,0.0,"FREE delivery Mon, Aug 12 on $35 of items shipped by AmazonOr fastest delivery Tomorrow, Aug 8",57.0,,https://m.media-amazon.com/images/I/61Fkjr+yjBL._AC_UL320_.jpg,organic,17880332011,peridot,1,44,13765.41,0.0,0.0
B00EDS6EMS,100.99,"Solid 14K White Gold Peridot Pendant for Women, Genuine Gemstone Birthstone Classic Solitaire, Cushion Cut, 6mm, 1 Carat total",4.3,USD,False,False,100.99,False,,,1,83,False,0.0,"FREE delivery Aug 13 - 15 Or fastest delivery Fri, Aug 9",58.0,,https://m.media-amazon.com/images/I/61bS0497JjL._AC_UL320_.jpg,organic,17880332011,peridot,1,45,8382.17,0.0,0.0
B00MCK2VXK,104.0,"18k Yellow Gold Plated Sterling Silver Gemstone and Diamond Accent Filigree Mandala Pendant Necklace, 18"" (previously Amazon Collection)",4.5,USD,True,False,104.0,False,,,1,923,False,123.5,"FREE delivery Mon, Aug 12 Or fastest delivery Sun, Aug 11",59.0,,https://m.media-amazon.com/images/I/81W5X-2G19L._AC_UL320_.jpg,organic,17880332011,peridot,1,46,95992.0,19.5,0.15789473684210525
B003TTA77U,6.12,Peridot Healing Crystal,3.8,USD,False,False,6.12,False,,,1,1392,False,16.22,FREE delivery Aug 22 - Sep 6 Or fastest delivery Aug 9 - 13,60.0,,https://m.media-amazon.com/images/I/617QG69U-XL._AC_UL320_.jpg,organic,17880332011,peridot,1,47,8519.04,10.099999999999998,0.6226880394574599
B08N69PTZR,8.99,Peridot Orgone Pyramid - 30mm Small Orgonite Pyramids with Crystals and Healing Stones - Authentic Organite Gifts,4.3,USD,True,False,8.99,False,,,1,150,True,0.0,"FREE delivery Mon, Aug 12 on $35 of items shipped by AmazonOr fastest delivery Tomorrow, Aug 8",3.0,,https://m.media-amazon.com/images/I/711xUT0wKuL._AC_UL320_.jpg,amazons_choices,17880332011,peridot,1,1,1348.5,0.0,0.0
B09PSMZ4VV,20.49,Crystal Vibe Green Jade Bracelet for Women - Bring Good Luck Wealth Prosperity - Stress Relief Healing Crystal Bracelet - 8mm Beaded Bracelets for men - Adjustable Size - Mother's Day Gift,4.4,USD,,False,20.49,True,,200+ bought in past month,1,1179,False,0.0,,,1.0,https://aax-us-iad.amazon.com/e/loi/imp?b=JAbOVin4qT8JPrw0jr38jBEAAAGRLX_njgEAAAH2AQBvbm9fdHhuX2JpZDIgICBvbm9fdHhuX2ltcDEgICBlaL1V,paid,17880332011,jade,1,1,24157.71,0.0,0.0
B09SBMFXJM,6.49,Pachamama Essentials Green Jade Tumbled - Healing Stone - Crystal Healing 20-25mm (1),3.9,USD,True,False,6.49,False,,50+ bought in past month,1,65,False,0.0,"FREE delivery Mon, Aug 12 on $35 of items shipped by AmazonOr fastest delivery Fri, Aug 9",2.0,,https://m.media-amazon.com/images/I/41ZF-B-Un2L._AC_UL320_.jpg,organic,17880332011,jade,1,1,421.85,0.0,0.0
B0BY1MX7MM,12.99,2.3in Natural Guizhou cui green stone jade bracelet for women with box (59-60mm),3.9,USD,True,False,12.99,False,,100+ bought in past month,1,75,False,0.0,"FREE delivery Mon, Aug 12 on $35 of items shipped by AmazonOr fastest delivery Fri, Aug 9",3.0,,https://m.media-amazon.com/images/I/41J7r2OH9kL._AC_UL320_.jpg,organic,17880332011,jade,1,2,974.25,0.0,0.0
B0BMLDFNS5,18.88,Dainty Real Green Jade 925 Sterling Silver Choker Collar Necklace and Spiritual Healing Feng Shui Crystal Stone Pendant Handmade Necklace Chain Jewelry Gift for Women Young Lady,4.0,USD,True,False,18.88,False,,,1,953,False,0.0,"FREE delivery Mon, Aug 12 on $35 of items shipped by AmazonOr fastest delivery Fri, Aug 9",4.0,,https://m.media-amazon.com/images/I/510+USu7OQL._AC_UL320_.jpg,organic,17880332011,jade,1,3,17992.64,0.0,0.0
B08RD6S5HF,9.99,"IcyMe Gua Sha & Jade Roller Facial Tools Face Roller and Gua Sha Set for Puffiness and Redness Reducing Skin Care Routine, Self Care Gift for Men Women - Green",4.5,USD,True,True,9.99,False,,10K+ bought in past month,1,36521,False,15.99,"FREE delivery Mon, Aug 12 on $35 of items shipped by AmazonOr fastest delivery Fri, Aug 9",5.0,,https://m.media-amazon.com/images/I/71yoOvyYDBL._AC_UL320_.jpg,organic,17880332011,jade,1,4,364844.79,6.0,0.37523452157598497
B0C4DCQN1H,15.99,Four Leaf Clover Necklace for Women Gold Necklace Rotatable Lucky Clover Necklace Pendant Necklace Jade Necklaces for Women,4.4,USD,True,False,15.99,False,,50+ bought in past month,1,57,False,18.99,"FREE delivery Mon, Aug 12 on $35 of items shipped by AmazonOr fastest delivery Fri, Aug 9",6.0,,https://m.media-amazon.com/images/I/610R2wi4cmL._AC_UL320_.jpg,organic,17880332011,jade,1,5,911.4300000000001,2.9999999999999982,0.15797788309636643
B095P4C3W8,16.99,Acxico 1 pcs Jade Green Feng Shui Wealth Lucky Elephant Statues Figurine Home Decor Gift,4.5,USD,True,False,16.99,False,,100+ bought in past month,1,135,False,0.0,"FREE delivery Mon, Aug 12 on $35 of items shipped by AmazonOr fastest delivery Sat, Aug 10",7.0,,https://m.media-amazon.com/images/I/51GrwoHNOaS._AC_UL320_.jpg,organic,17880332011,jade,1,6,2293.6499999999996,0.0,0.0
B08NXNW3J3,22.99,"Natural Jade Bracelet for Women Gradient Green Jade Bead Elastic Bracelet, Suitable for Christmas, Thanksgiving",4.3,USD,True,False,22.99,False,,100+ bought in past month,1,616,False,0.0,"FREE delivery Mon, Aug 12 on $35 of items shipped by Amazon",8.0,,https://m.media-amazon.com/images/I/61LBnwM5ERL._AC_UL320_.jpg,organic,17880332011,jade,1,7,14161.839999999998,0.0,0.0
B07BMCBQ2D,139.0,Jade Good Fortune Bracelet in 18kt Gold Over Sterling,4.3,USD,True,False,139.0,False,,100+ bought in past month,1,2256,False,0.0,"FREE delivery Tomorrow, Aug 8",9.0,,https://m.media-amazon.com/images/I/61rJXGnHFtL._AC_UL320_.jpg,organic,17880332011,jade,1,8,313584.0,0.0,0.0
