asin,price,title,rating,currency,is_prime,best_seller,price_upper,is_sponsored,manufacturer,sales_volume,pricing_count,reviews_count,is_amazons_choice,price_strikethrough,shipping_information,pos,rel_pos,url_image,source,category_id,keyword,page,position,min_revenue,discount,discount_rate
B09V36LPLK,7.99,"Triple Protection Bracelet, Tigers Eye - Black Obsidian and Hematite Beaded Bracelets for Men Women, Tourmaline Spiritual Natural Crystal Stone Luck Bracelet, Birthday Mother's Day Gift",4.5,USD,True,False,7.99,True,,,1,298,False,0.0,"FREE delivery Mon, Aug 12 on $35 of items shipped by AmazonOr fastest delivery Fri, Aug 9",1,,https://m.media-amazon.com/images/I/613XyHphYKL._AC_UL320_.jpg,paid,7454898011,tiger's eye,1,1,2381.02,0.0,0.0
B0BMTHT8HZ,12.97,Tiger Eye Mens Bracelet Gifts Anniversary Birthday Father's Day Christmas Gifts for Boyfriend Dad Son Husband 8mm Adjustable Protection Bead Bracelet for Him,4.6,USD,True,False,12.97,True,,,1,641,False,0.0,"FREE delivery Mon, Aug 12 on $35 of items shipped by Amazon",2,,https://m.media-amazon.com/images/I/81YprnAojYL._AC_UL320_.jpg,paid,7454898011,tiger's eye,1,2,8313.77,0.0,0.0
B0D5CP1VZL,7.99,Cross Bracelet for Women Men 8mm Natural Gemstone Crystal Bracelet Religious Christian Bracelet Stretch Beaded Bracelet for Men Women,0.0,USD,True,False,7.99,True,,,1,20,False,0.0,"FREE delivery Mon, Aug 12 on $35 of items shipped by AmazonOr fastest delivery Fri, Aug 9",11,,https://m.media-amazon.com/images/I/61bp82OeoZL._AC_UL320_.jpg,paid,7454898011,tiger's eye,1,3,159.8,0.0,0.0
B0CN7F4WL9,9.99,"Men's Bead Bracelet - 8mm Tiger Eye Beads, Black Obsidian, Hematite",4.1,USD,True,False,9.99,True,,,1,18,False,0.0,"FREE delivery Mon, Aug 12 on $35 of items shipped by AmazonOr fastest delivery Fri, Aug 9",12,,https://m.media-amazon.com/images/I/61cMcOKH+jL._AC_UL320_.jpg,paid,7454898011,tiger's eye,1,4,179.82,0.0,0.0
B0D1VN9LSZ,38.99,"Tiger Eye Leather Bracelet for Men,3 Layer Multi-Layer Braided Leather Bracelet With Natural Tiger Eyes Gemstone 361L Stainless Steel Clasp Men Leather Cuff Bracelet Jewelry Gift for Men",5.0,USD,True,False,38.99,True,,,1,3,False,0.0,"FREE delivery Thu, Aug 15",13,,https://m.media-amazon.com/images/I/61ojtzxz+OL._AC_UL320_.jpg,paid,7454898011,tiger's eye,1,5,116.97,0.0,0.0
B0D39B43FL,8.99,Natural Stone Beaded Healing Bracelets for Men Women Adjustable 6mm Tiger Eye Obsidian Matte Agate Hematite Beads Crystal Bracelet Set for Mens BF Husband Him Birthday Gifts,4.0,USD,True,False,8.99,True,,,1,1,False,0.0,"FREE delivery Wed, Aug 14 on $35 of items shipped by Amazon",14,,https://m.media-amazon.com/images/I/61xsZDRjd9L._AC_UL320_.jpg,paid,7454898011,tiger's eye,1,6,8.99,0.0,0.0
B0D3D3SVF6,12.99,Mens Beaded Bracelets Set 8MM Tiger Eye Lava Stone Stretch Natural Stone Men's Bead Bracelet Mens Bracelet,4.3,USD,True,False,12.99,True,,100+ bought in past month,1,9,False,0.0,"FREE delivery Tue, Aug 13 on $35 of items shipped by Amazon",19,,https://m.media-amazon.com/images/I/71Tebjd02FL._AC_UL320_.jpg,paid,7454898011,tiger's eye,1,7,116.91,0.0,0.0
B0D3XK8LLN,11.99,"8MM-Tiger Eye Beaded Bracelets for Men Natural Stone Elastic Bracelet Set Lava Rock Beaded Bracelets for Men,Birthday Gifts for Son Boyfriend Brother for Him",4.8,USD,True,False,11.99,True,,50+ bought in past month,1,7,False,0.0,"FREE delivery Mon, Aug 12 on $35 of items shipped by AmazonOr fastest delivery Fri, Aug 9",20,,https://m.media-amazon.com/images/I/71buaDDWjiL._AC_UL320_.jpg,paid,7454898011,tiger's eye,1,8,83.93,0.0,0.0
B0C5R51ZYY,15.97,𝐔𝐧𝐢𝐪𝐮𝐞 𝐆𝐢𝐟𝐭𝐬 for Men 𝐋𝐞𝐚𝐭𝐡𝐞𝐫 𝐁𝐫𝐚𝐜𝐞𝐥𝐞𝐭 𝐟𝐨𝐫 𝐌𝐞𝐧 Dad Boyfriend Son Grandson Brother Love You Forever Tiger Eye Stone Father's Day Birthday Anniversary Christmas Black Jewelry 7.5/8.5/9 Inches,4.6,USD,True,False,15.97,True,,,1,317,False,0.0,"FREE delivery Mon, Aug 12 on $35 of items shipped by AmazonOr fastest delivery Fri, Aug 9",21,,https://m.media-amazon.com/images/I/81nPWg45yoL._AC_UL320_.jpg,paid,7454898011,tiger's eye,1,9,5062.49,0.0,0.0
B01N2Y8UOB,64.99,925K Stamped Sterling Silver Men Natural Tiger Eye Ring I1B,4.5,USD,True,False,64.99,True,,,1,508,False,0.0,"FREE delivery Thu, Aug 15",22,,https://m.media-amazon.com/images/I/71CW1j2RyfL._AC_UL320_.jpg,paid,7454898011,tiger's eye,1,10,33014.92,0.0,0.0
B0BYSGVZ87,17.99,"Layered Leather Beads Bracelets for Men,Braided Leather Tiger Eye Lava Rock Stone Bracelets for Men with Stainless Steel Magnetic Clasp Mens Leather Beaded Bracelets Jewelry Anxiety Stress Relief Gift",4.7,USD,True,False,17.99,True,,,1,76,False,0.0,"FREE delivery Mon, Aug 12 on $35 of items shipped by Amazon",27,,https://m.media-amazon.com/images/I/71F5CizOiEL._AC_UL320_.jpg,paid,7454898011,tiger's eye,1,11,1367.2399999999998,0.0,0.0
B0CYPZM13S,12.99,Tiger Eye Beaded Bracelets for Men - Elastic 8MM Natural Stone Bracelet Set Lava Rock Bracelets Gifts for Son Grandson Bonus Son Boyfriend Brother,4.2,USD,True,False,12.99,True,,100+ bought in past month,1,14,False,0.0,"FREE delivery Mon, Aug 12 on $35 of items shipped by AmazonOr fastest delivery Fri, Aug 9",28,,https://m.media-amazon.com/images/I/61QHsUFNOhL._AC_UL320_.jpg,paid,7454898011,tiger's eye,1,12,181.86,0.0,0.0
B0CBNZX9R3,7.99,"4pcs Beaded Bracelets for Women,Natural Healing Crystal Gemstones Bracelet,Anxiety Stress Relief Bracelet Handmade purple Jewelry Gifts for Women",4.6,USD,True,False,7.99,False,,300+ bought in past month,1,123,False,0.0,"FREE delivery Mon, Aug 12 on $35 of items shipped by AmazonOr fastest delivery Fri, Aug 9",4,,https://m.media-amazon.com/images/I/71-GgPH6xqL._AC_UL320_.jpg,organic,7454898011,tiger's eye,1,1,982.77,0.0,0.0
B095MCMVP6,7.99,"Handmade Gem Bracelet 7.5"" Stretch Gemstone 8mm Round Beads Crystals Quartz Unisex",4.5,USD,True,False,7.99,False,,200+ bought in past month,1,4165,False,0.0,"FREE delivery Mon, Aug 12 on $35 of items shipped by AmazonOr fastest delivery Fri, Aug 9",5,,https://m.media-amazon.com/images/I/71E4xItkYyL._AC_UL320_.jpg,organic,7454898011,tiger's eye,1,2,33278.35,0.0,0.0
B09G6KYRMF,9.99,"Tiger Eye Bracelet,Relax Anxiety Crystal Beaded Triple Protection Jewelry Bead Stone Chakra Gemstones Bracelets for women men",4.5,USD,True,False,9.99,False,,200+ bought in past month,1,720,False,0.0,"FREE delivery Mon, Aug 12 on $35 of items shipped by AmazonOr fastest delivery Fri, Aug 9",6,,https://m.media-amazon.com/images/I/61XbVmSicNL._AC_UL320_.jpg,organic,7454898011,tiger's eye,1,3,7192.8,0.0,0.0
B0BGJ4159R,9.99,"Natural 8mm 7 Chakra Stone Crystal Bracelet Reiki Healing Crystal Gemstone Beads Men Women Stretch Bracelet for Meditation, Protection",4.5,USD,True,False,9.99,False,,,1,47,False,0.0,"FREE delivery Mon, Aug 12 on $35 of items shipped by AmazonOr fastest delivery Fri, Aug 9",7,,https://m.media-amazon.com/images/I/71bzViLR8eL._AC_UL320_.jpg,organic,7454898011,tiger's eye,1,4,469.53000000000003,0.0,0.0
B0C8CFM4X8,6.99,"Tiger Eye Bracelet,10MM Relax Anxiety Triple Protection Bracelet Spiritual Crystal Gemstones Beaded Bracelets for women men Bring Luck And Prosperity",4.4,USD,True,False,6.99,False,,100+ bought in past month,1,89,False,0.0,"FREE delivery Mon, Aug 12 on $35 of items shipped by AmazonOr fastest delivery Fri, Aug 9",8,,https://m.media-amazon.com/images/I/518aJ2NMYzL._AC_UL320_.jpg,organic,7454898011,tiger's eye,1,5,622.11,0.0,0.0
B07Q1K5WNJ,13.95,"Small, Medium, Large Sizes - Gemstone Beaded Bracelets For Women and Men - 8mm Round Beads",4.5,USD,True,False,13.95,False,,200+ bought in past month,1,3448,False,0.0,"FREE delivery Mon, Aug 12 on $35 of items shipped by AmazonOr fastest delivery Fri, Aug 9",9,,https://m.media-amazon.com/images/I/71An+p8eUvL._AC_UL320_.jpg,organic,7454898011,tiger's eye,1,6,48099.6,0.0,0.0
B09BDDP351,9.99,"Small, Medium, Large Sizes - Gemstone Beaded Bracelets For Women and Men - 4mm Round Beads",4.4,USD,True,False,9.99,False,,,1,1056,False,11.95,"FREE delivery Mon, Aug 12 on $35 of items shipped by AmazonOr fastest delivery Fri, Aug 9",10,,https://m.media-amazon.com/images/I/61bRhv5VmrL._AC_UL320_.jpg,organic,7454898011,tiger's eye,1,7,10549.44,1.959999999999999,0.16401673640167358
B0713T9ZK2,14.99,Natural Moonstone Labradorite Pearl Bangle For Women 6X9Mm Pear Shape Gemstone Silver Overlay Handmade Cuff Bangle Jewelry Women's Day Gift For Mom Wife Her,4.3,USD,True,False,14.99,False,,,1,1830,False,0.0,"FREE delivery Mon, Aug 12 on $35 of items shipped by AmazonOr fastest delivery Fri, Aug 9",15,,https://m.media-amazon.com/images/I/61YnrDWGZwL._AC_UL320_.jpg,organic,7454898011,tiger's eye,1,8,27431.7,0.0,0.0
B09BK79P2K,6.79,Natural Stone Beaded Bracelet Aventurine Jade Tiger Eye Agate Beads Stretch Bracelet for Women Men Jewelry,4.0,USD,True,False,6.79,False,,,1,80,False,0.0,"FREE delivery Mon, Aug 12 on $35 of items shipped by AmazonOr fastest delivery Fri, Aug 9",16,,https://m.media-amazon.com/images/I/614b9a1XYPL._AC_UL320_.jpg,organic,7454898011,tiger's eye,1,9,543.2,0.0,0.0
B07RL57SZW,16.99,Healing Stone Bracelet 8mm Beads Chakra Crystal Energy Heart Charm Bracelet Handmade Jewelry for Women,4.5,USD,True,False,16.99,False,,50+ bought in past month,1,6133,False,0.0,"FREE delivery Mon, Aug 12 on $35 of items shipped by AmazonOr fastest delivery Fri, Aug 9",17,,https://m.media-amazon.com/images/I/61-xQGlMNTL._AC_UL320_.jpg,organic,7454898011,tiger's eye,1,10,104199.66999999998,0.0,0.0
B09T2L46KC,9.99,Cultured Freshwater Single Pearl Bracelet Handmade Genuine Leather Wrap Bracelet Agate Malachite Tiger Eyes with Charm Jewelry Synthetic Pearl Beaded Gold Bracelet,4.4,USD,True,False,9.99,False,,,1,288,False,0.0,"FREE delivery Mon, Aug 12 on $35 of items shipped by Amazon",18,,https://m.media-amazon.com/images/I/716cAJOoCHL._AC_UL320_.jpg,organic,7454898011,tiger's eye,1,11,2877.12,0.0,0.0
B0CN2Q3H7W,8.09,Natural Healing Power Gemstone Crystal Beads Unisex Adjustable Macrame Bracelets,4.5,USD,True,False,8.09,False,,,1,7870,False,8.99,"FREE delivery Mon, Aug 12 on $35 of items shipped by AmazonOr fastest delivery Fri, Aug 9",23,,https://m.media-amazon.com/images/I/619zfIIShOL._AC_UL320_.jpg,organic,7454898011,tiger's eye,1,12,63668.299999999996,0.9000000000000004,0.10011123470522806
B07C1J9R3B,9.99,10mm Natural Tiger Eye Bracelet Elastic Yoga Gemstones Healing Energy Men Women Stretch Bracelet,4.6,USD,True,False,9.99,False,,,1,2451,False,0.0,"FREE delivery Thu, Aug 15 on $35 of items shipped by Amazon",24,,https://m.media-amazon.com/images/I/61HYYE0pCQL._AC_UL320_.jpg,organic,7454898011,tiger's eye,1,13,24485.49,0.0,0.0
B0CRKDZNWG,5.99,Christian Gifts for Women Men Cross Healing Crystal Bracelet Faith Easter Catholic Religious Bracelet Natural Stone Stretch Bracelets Stress Relief Anxiety Yoga Bracelet For Teens,4.5,USD,True,False,5.99,False,,,1,18,False,0.0,FREE delivery on $35 shipped by Amazon.,25,,https://m.media-amazon.com/images/I/7178mQoMuTL._AC_UL320_.jpg,organic,7454898011,tiger's eye,1,14,107.82000000000001,0.0,0.0
B0B23WZY3Q,7.99,"Triple Protection Bracelet,Genuine Tigers Eye Black Obsidian and Hematite Beads Bracelet for Men Women,Handmade Crystal Healing Bracelets Bring Luck and Prosperity and Happiness",4.4,USD,True,False,7.99,False,,50+ bought in past month,1,169,False,9.99,"FREE delivery Mon, Aug 12 on $35 of items shipped by AmazonOr fastest delivery Fri, Aug 9",26,,https://m.media-amazon.com/images/I/71G+wMpP-+L._AC_UL320_.jpg,organic,7454898011,tiger's eye,1,15,1350.31,2.0,0.20020020020020018
B0BFLB3XKF,14.89,"Tiger Eye Triple Protection Bracelet for Women Men, Yellow Blue Tiger Eye Hematite Bead Crystal Stone Handmade Jewelry Bracelet, Bring Luck And Prosperity Courage Bracelet",4.5,USD,True,False,14.89,False,,,1,104,False,0.0,"FREE delivery Fri, Aug 16 on $35 of items shipped by Amazon",29,,https://m.media-amazon.com/images/I/71xw0cptUDL._AC_UL320_.jpg,organic,7454898011,tiger's eye,1,16,1548.56,0.0,0.0
B072FRMC7Q,14.99,"8.85 Cts South Western Native American Style Round Shape Natural & Synthetic Gemstones Bracelet For Women, Handmade Birthstone Bracelet For Women Jewelry Gifts For Her Wife Women Sister Girfriend",4.4,USD,True,False,14.99,False,,,1,1649,False,15.99,"FREE delivery Mon, Aug 12 on $35 of items shipped by AmazonOr fastest delivery Fri, Aug 9",30,,https://m.media-amazon.com/images/I/61HljojEdmL._AC_UL320_.jpg,organic,7454898011,tiger's eye,1,17,24718.510000000002,1.0,0.06253908692933083
B09ZRNR4P6,12.89,"Tiger Eye Bracelet men women,anti-anxiety, courage and determination bracelet & Red Bead Triple Protection Bracelet Jewelry Genuine Crystal Chakra Stone Bracelets",4.3,USD,True,False,12.89,False,,,1,110,False,13.89,"FREE delivery Tue, Aug 13 on $35 of items shipped by Amazon",31,,https://m.media-amazon.com/images/I/61t01YcnCUL._AC_UL320_.jpg,organic,7454898011,tiger's eye,1,18,1417.9,1.0,0.07199424046076314
B0CZ3KFQXD,6.98,Crystal Healing Stones Bracelets Healing Spiritual Crystal Bracelets for Women Men Amethyst Anxiety Bracelets Empath Protection Bracelet Natural Gemstones Bracelets Jewelry Gifts,4.3,USD,True,False,6.98,False,,100+ bought in past month,1,24,False,0.0,"FREE delivery Mon, Aug 12 on $35 of items shipped by AmazonOr fastest delivery Fri, Aug 9",32,,https://m.media-amazon.com/images/I/81PIPpLKuwL._AC_UL320_.jpg,organic,7454898011,tiger's eye,1,19,167.52,0.0,0.0
B0C2HBTNXG,6.99,Healing Bracelet For Women Anxiety Beaded Bracelets Jewelry Healing Stone Crystal Bracelet Stress Relief Yoga Beads Chakra Bracelets Gifts For Women pink,4.6,USD,True,False,6.99,False,,,1,664,False,0.0,"FREE delivery Mon, Aug 12 on $35 of items shipped by AmazonOr fastest delivery Fri, Aug 9",33,,https://m.media-amazon.com/images/I/61irEEXd02L._AC_UL320_.jpg,organic,7454898011,tiger's eye,1,20,4641.360000000001,0.0,0.0
B08H84BHHY,9.1,"chengmu 8mm Golden Tiger Eye Stretch Bracelet for Women Natural Handmade Round Beads Semi Precious Gemstone for Crystal Elastic Beaded Bracelet 7.5""",4.5,USD,True,False,9.1,False,,,1,687,False,0.0,"FREE delivery Mon, Aug 12 on $35 of items shipped by Amazon",34,,https://m.media-amazon.com/images/I/71yJCnEgcfL._AC_UL320_.jpg,organic,7454898011,tiger's eye,1,21,6251.7,0.0,0.0
B0CYH6CYDP,9.99,Crystal Bracelets for Women 2pcs Natural Healing Gemstone Beaded Bracelet Butterfly Charms Stone Layered Bracelet Gifts Women,5.0,USD,False,False,9.99,False,,,1,2,False,0.0,FREE delivery on $35 shipped by Amazon.,35,,https://m.media-amazon.com/images/I/61plVVpoftL._AC_UL320_.jpg,organic,7454898011,tiger's eye,1,22,19.98,0.0,0.0
B0CNCYR3FP,21.99,"Natural obsidian crystal bracelet,Tigers eye black obsidian 10/12/13mm beads bracelet for men and women, Jewelry Healing elasticized Bracelets Bring Luck and happyness Prosperity.Mom/Dad/Wife/Employee gift",4.6,USD,True,False,21.99,False,,100+ bought in past month,1,17,False,0.0,"FREE delivery Mon, Aug 12 on $35 of items shipped by AmazonOr fastest delivery Fri, Aug 9",36,,https://m.media-amazon.com/images/I/61GL00z6gRL._AC_UL320_.jpg,organic,7454898011,tiger's eye,1,23,373.83,0.0,0.0
B075VD4KWS,8.99,Natural Gemstone Round Beads Stretch Bracelet Healing Reiki 8mm,4.5,USD,True,False,8.99,False,,,1,2150,False,0.0,"FREE delivery Tue, Aug 13 on $35 of items shipped by Amazon",37,,https://m.media-amazon.com/images/I/61TP3Hh9-vL._AC_UL320_.jpg,organic,7454898011,tiger's eye,1,24,19328.5,0.0,0.0
B0D6P5K4K2,13.99,"Small, Medium, Large Sizes - Gemstone Beaded Bracelets For Women and Men - 6mm Round Beads",4.4,USD,True,False,13.99,False,,,1,2792,False,0.0,"FREE delivery Wed, Aug 14 on $35 of items shipped by Amazon",38,,https://m.media-amazon.com/images/I/51ExDnJ7+zL._AC_UL320_.jpg,organic,7454898011,tiger's eye,1,25,39060.08,0.0,0.0
B0BD4MWNZ3,18.99,Stainless Steel Clasp Mens Stone Beaded Bracelet,4.6,USD,True,False,18.99,False,,,1,399,False,0.0,"FREE delivery Mon, Aug 12 on $35 of items shipped by Amazon",39,,https://m.media-amazon.com/images/I/61zEd-9obuL._AC_UL320_.jpg,organic,7454898011,tiger's eye,1,26,7577.009999999999,0.0,0.0
B0BMJQR883,9.99,Snowflake Obsidian Motivational Gemstone Bracelet – XS Regular and XL Inspirational Bracelet – Made of Elegant and Eye-Catching Volcanic Glass – Ideal for Men or Women,4.5,USD,True,False,9.99,False,,,1,207,False,12.99,"FREE delivery Mon, Aug 12 on $35 of items shipped by AmazonOr fastest delivery Fri, Aug 9",40,,https://m.media-amazon.com/images/I/61ATAP284YL._AC_UL320_.jpg,organic,7454898011,tiger's eye,1,27,2067.93,3.0,0.23094688221709006
B0785NJSFB,10.99,"Natural Bead Bracelet Semi Precious Gemstone Beaded Bracelet for Women Healing Crystal Stone Stretch Bracelet Men Couple Bracelets (2pcs,6-8mm/8-10mm)",4.4,USD,True,False,10.99,False,,,1,1972,False,0.0,"FREE delivery Mon, Aug 12 on $35 of items shipped by AmazonOr fastest delivery Fri, Aug 9",41,,https://m.media-amazon.com/images/I/71xXJ0pMSoL._AC_UL320_.jpg,organic,7454898011,tiger's eye,1,28,21672.28,0.0,0.0
B0CY2NJBFH,8.99,Amethyst Bracelet Healing Crystal Stone Bracelet for Women Girls 8mm Crystal Beads Butterfly Charms Stretch Bracelet Handmade Energy Gemstone Bracelet Jewelry,4.4,USD,True,False,8.99,False,,,1,12,False,0.0,"FREE delivery Mon, Aug 12 on $35 of items shipped by AmazonOr fastest delivery Fri, Aug 9",42,,https://m.media-amazon.com/images/I/61q8rCDvwZL._AC_UL320_.jpg,organic,7454898011,tiger's eye,1,29,107.88,0.0,0.0
B0D1G4FVRS,7.98,Initial Crystal Bracelet Mens Beaded Bracelets for Women 8mm - Rose Quartz Bracelet Amethyst Bracelet Obsidian Bracelet Tiger Eye Bracelet Men - Stone Bracelets Healing Bracelets for Women,4.8,USD,True,False,7.98,False,,,1,25,False,9.99,"FREE delivery Wed, Aug 14 on $35 of items shipped by Amazon",43,,https://m.media-amazon.com/images/I/8174-XRQNmL._AC_UL320_.jpg,organic,7454898011,tiger's eye,1,30,199.5,2.01,0.20120120120120116
B0BHTTPX9P,9.99,"Natural Gemstones Healing Beaded Bracelets - Blue Tiger Eye Bracelet 8MM - Protection, Anxiety Relief, Insight and Focus for Men Women",4.2,USD,True,False,9.99,False,,,1,118,False,0.0,"FREE delivery Mon, Aug 12 on $35 of items shipped by AmazonOr fastest delivery Fri, Aug 9",44,,https://m.media-amazon.com/images/I/61R+zuh-PlL._AC_UL320_.jpg,organic,7454898011,tiger's eye,1,31,1178.82,0.0,0.0
B0CRP1C3ND,12.99,Crystal Cat Bracelet for Women Men 8mm Crystal Stone Bead Bracelets Protection Healing Crystals Gemstones Stretch Bracelet Good Luck Bracelet Jewelry Cat Gifts for Mom Women,5.0,USD,True,False,12.99,False,,,1,9,False,0.0,"FREE delivery Mon, Aug 12 on $35 of items shipped by AmazonOr fastest delivery Fri, Aug 9",45,,https://m.media-amazon.com/images/I/51B316ozM9L._AC_UL320_.jpg,organic,7454898011,tiger's eye,1,32,116.91,0.0,0.0
B07D4FLDTK,19.99,Natural Tiger Eye Bracelet for Men and Women Elastic Gemstone Natural Stone Beads 12mm Stretch Unisex,4.5,USD,True,False,19.99,False,,,1,384,False,0.0,"FREE delivery Mon, Aug 12 on $35 of items shipped by AmazonOr fastest delivery Fri, Aug 9",46,,https://m.media-amazon.com/images/I/61W-Jzuzx+L._AC_UL320_.jpg,organic,7454898011,tiger's eye,1,33,7676.16,0.0,0.0
B074N3SJBT,14.99,8.80 Cts Natural Moonstone Turquoise Labradorite Malachite Cuff Bangle 12x16mm Oval Shape Gemstone Silver Overlay Handmade Cuff Bangle Jewelry Women's Day Gifts For Mom Wife,4.0,USD,True,False,14.99,False,,,1,535,False,0.0,"FREE delivery Mon, Aug 12 on $35 of items shipped by AmazonOr fastest delivery Fri, Aug 9",47,,https://m.media-amazon.com/images/I/71HuVnik5UL._AC_UL320_.jpg,organic,7454898011,tiger's eye,1,34,8019.650000000001,0.0,0.0
B0D1VLD2HR,18.75,Tiger Eye Gemstone Beaded Stretch Bracelet For Men 8MM Natural Stone Beads Bracelet Set Adjustable Bracelet Best for Men Women Gifts,4.5,USD,True,False,18.75,False,,,1,23,False,0.0,"FREE delivery Wed, Aug 14 on $35 of items shipped by Amazon",48,,https://m.media-amazon.com/images/I/71dhPCOHPEL._AC_UL320_.jpg,organic,7454898011,tiger's eye,1,35,431.25,0.0,0.0
B0CKM45LF4,10.98,"Triple Protection Crystal Bracelet - Tigers Eye, Black Obsidian, Hematite Beads - Crystal Jewelry for Men and Women - Brings Luck, Prosperity, and Happiness",5.0,USD,True,False,10.98,False,,,1,3,False,11.98,"FREE delivery Mon, Aug 12 on $35 of items shipped by AmazonOr fastest delivery Fri, Aug 9",49,,https://m.media-amazon.com/images/I/51-FunZehQL._AC_UL320_.jpg,organic,7454898011,tiger's eye,1,36,32.94,1.0,0.08347245409015025
B071G5KDQM,12.99,5.60 Cts Natural Amethyst Moonstone Turquoise Lapis Cuff Bangle 10x14mm Oval Shape Gemstone Silver Overlay Handmade Cuff Bangle Jewelry Women's Day Gifts For Mom Wife,4.2,USD,True,False,12.99,False,,,1,430,False,0.0,"FREE delivery Wed, Aug 14 on $35 of items shipped by Amazon",50,,https://m.media-amazon.com/images/I/71UA9E15vkL._AC_UL320_.jpg,organic,7454898011,tiger's eye,1,37,5585.7,0.0,0.0
B0CHRP7X3S,13.99,"Beaded Bracelet for Women and Girl, Colorful Beach Boho Gems Bracelet 14K Gold Plated Stackable Handmade Bohemian Multicolor Natural Stone Bracelet",5.0,USD,True,False,13.99,False,,,1,1,False,0.0,"FREE delivery Mon, Aug 12 on $35 of items shipped by AmazonOr fastest delivery Fri, Aug 9",51,,https://m.media-amazon.com/images/I/61Mc0L+8zML._AC_UL320_.jpg,organic,7454898011,tiger's eye,1,38,13.99,0.0,0.0
B07GBKMQ7C,16.99,"6mm Stone Beads Bracelet for Women and Men, 108 Mala Prayer Beads Necklace for Unisex Elastic",4.3,USD,True,False,16.99,False,,,1,381,False,0.0,"FREE delivery Tue, Aug 13 on $35 of items shipped by Amazon",52,,https://m.media-amazon.com/images/I/61IoiXeXZ2L._AC_UL320_.jpg,organic,7454898011,tiger's eye,1,39,6473.19,0.0,0.0
B07574V584,13.95,"Gemstone Beaded Stretch Bracelet 8mm Round Beads 7""",4.5,USD,True,False,13.95,False,,,1,2561,False,0.0,"FREE delivery Mon, Aug 12 on $35 of items shipped by AmazonOr fastest delivery Fri, Aug 9",53,,https://m.media-amazon.com/images/I/81H2Z14JUkL._AC_UL320_.jpg,organic,7454898011,tiger's eye,1,40,35725.95,0.0,0.0
B07NL2G36R,14.49,"8mm Round Stone Adjustable Bracelet for Unisex, Double Layers Beads Macrame Friendship Bracelets, 7""-10"" Strand",4.5,USD,True,False,14.49,False,,,1,264,False,0.0,"FREE delivery Wed, Aug 14 on $35 of items shipped by Amazon",54,,https://m.media-amazon.com/images/I/61dxtqUIn0L._AC_UL320_.jpg,organic,7454898011,tiger's eye,1,41,3825.36,0.0,0.0
B07PTFDJ23,15.95,"4mm Smooth Round Tiger's Eye Stretch Bracelets in Various Lengths (6.5, 7, 7.5, 8 Inches)",4.8,USD,True,False,15.95,False,,,1,87,False,0.0,"FREE delivery Tue, Aug 13 on $35 of items shipped by Amazon",55,,https://m.media-amazon.com/images/I/61TIj0-fX5L._AC_UL320_.jpg,organic,7454898011,tiger's eye,1,42,1387.6499999999999,0.0,0.0
B07LG8H9J7,119.0,Tiger Eye Square-Link Bracelet in 18kt Gold Over Sterling. 7.5 inches,4.3,USD,True,False,119.0,False,,,1,6,False,149.25,"FREE delivery Tomorrow, Aug 8",56,,https://m.media-amazon.com/images/I/71P4e0ZyCvL._AC_UL320_.jpg,organic,7454898011,tiger's eye,1,43,714.0,30.25,0.20268006700167504
B099DJXLP1,10.95,Natural Healing Crystal Beads Bracelet Gemstone Couple Adjustable Gift Bracelet,4.4,USD,True,False,10.95,False,,,1,318,False,0.0,"FREE delivery Wed, Aug 14 on $35 of items shipped by Amazon",57,,https://m.media-amazon.com/images/I/71jc1wEYt-L._AC_UL320_.jpg,organic,7454898011,tiger's eye,1,44,3482.1,0.0,0.0
B08RZ7MB4J,13.99,New Gemstone Healing Chakra Bracelet Anxiety Crystal Natural Stone Men Women Stress Relief Reiki Yoga Diffuser Semi Precious,4.3,USD,True,False,13.99,False,,,1,1486,False,0.0,"FREE delivery Mon, Aug 12 on $35 of items shipped by AmazonOr fastest delivery Fri, Aug 9",58,,https://m.media-amazon.com/images/I/71gbNInDAUL._AC_UL320_.jpg,organic,7454898011,tiger's eye,1,45,20789.14,0.0,0.0
B0BH85NCCJ,6.99,Natural Gemstone Bracelet 7.5 inch Gems Stones 8mm Round Beads Healing Crystal Bracelet for Women Men,4.0,USD,True,False,6.99,False,,,1,15,False,0.0,"FREE delivery Mon, Aug 12 on $35 of items shipped by AmazonOr fastest delivery Fri, Aug 9",59,,https://m.media-amazon.com/images/I/51YXzIimZqL._AC_UL320_.jpg,organic,7454898011,tiger's eye,1,46,104.85000000000001,0.0,0.0
B0CVXKF5DQ,7.99,"Lucky Evil Eye Beads Bracelet for Men Women, Natural Stone Turquoise Tiger Eye Evil Eye Charm, Fashion Healing Energy Jewelry",4.8,USD,True,False,7.99,False,,,1,7,False,9.95,"FREE delivery Mon, Aug 12 on $35 of items shipped by AmazonOr fastest delivery Fri, Aug 9",60,,https://m.media-amazon.com/images/I/713WCpjs7eL._AC_UL320_.jpg,organic,7454898011,tiger's eye,1,47,55.93,1.959999999999999,0.1969849246231155
B07MDBH9B4,6.99,"Handmade Gem Semi Precious Gemstone 6mm Round Beads Stretch Bracelet 7"" Unisex",4.5,USD,True,False,6.99,False,,100+ bought in past month,1,5171,True,7.99,"FREE delivery Mon, Aug 12 on $35 of items shipped by AmazonOr fastest delivery Fri, Aug 9",3,,https://m.media-amazon.com/images/I/51KzwPX-kVL._AC_UL320_.jpg,amazons_choices,7454898011,tiger's eye,1,1,36145.29,1.0,0.1251564455569462
