asin,price,title,rating,currency,is_prime,best_seller,price_upper,is_sponsored,manufacturer,sales_volume,pricing_count,reviews_count,is_amazons_choice,price_strikethrough,shipping_information,pos,rel_pos,url_image,source,category_id,keyword,page,position,min_revenue,discount,discount_rate
B09YXXWFNK,7.66,5-6Pcs Imitation Pearl Stretch Bracelet Set for Women Gold Beaded Flat Strand Stackable Crystal Rhinestone Layered Bracelet for Women Jewelry,3.9,USD,True,False,7.66,False,,,1,40,False,0.0,"FREE delivery Mon, Aug 12 on $35 of items shipped by AmazonOr fastest delivery Sat, Aug 10",59.0,,https://m.media-amazon.com/images/I/41W9JlOVYdL._AC_UL320_.jpg,organic,7454898011,pearl,5,237,306.4,0.0,0.0
B0CYC2GY3M,9.99,Arm Cuff Upper Arm Jewelry Bangle Cuff Bracelets for Women Turquoise Pearl Beaded Armband Vintage Summer Jewelry Party Halloween Costumes Women 2024,3.9,USD,True,False,9.99,False,,,1,2,False,0.0,"FREE delivery Mon, Aug 12 on $35 of items shipped by AmazonOr fastest delivery Sat, Aug 10",60.0,,https://m.media-amazon.com/images/I/618p4y6H1BL._AC_UL320_.jpg,organic,7454898011,pearl,5,238,19.98,0.0,0.0
B0CLJNC4VV,4.99,1920s Flapper Style Faux Pearl Stretch Bracelet  1/3/4 Rows White Pearl Bracelet - Elegant Bridal Wedding Jewelry- Party Prom Jewelry,5.0,USD,True,False,4.99,False,,,1,1,False,0.0,"FREE delivery Thu, Aug 15 on $35 of items shipped by Amazon",1.0,,https://m.media-amazon.com/images/I/41Sa+U9HgaL._AC_UL320_.jpg,organic,7454898011,pearl,6,239,4.99,0.0,0.0
B09YXXWFNK,7.66,5-6Pcs Imitation Pearl Stretch Bracelet Set for Women Gold Beaded Flat Strand Stackable Crystal Rhinestone Layered Bracelet for Women Jewelry,3.9,USD,True,False,7.66,False,,,1,40,False,0.0,"FREE delivery Tue, Aug 13 on $35 of items shipped by Amazon",2.0,,https://m.media-amazon.com/images/I/41W9JlOVYdL._AC_UL320_.jpg,organic,7454898011,pearl,6,240,306.4,0.0,0.0
B0CYC2GY3M,9.99,Arm Cuff Upper Arm Jewelry Bangle Cuff Bracelets for Women Turquoise Pearl Beaded Armband Vintage Summer Jewelry Party Halloween Costumes Women 2024,3.9,USD,True,False,9.99,False,,,1,2,False,0.0,"FREE delivery Mon, Aug 12 on $35 of items shipped by Amazon",3.0,,https://m.media-amazon.com/images/I/618p4y6H1BL._AC_UL320_.jpg,organic,7454898011,pearl,6,241,19.98,0.0,0.0
B08YYP8HM8,7.99,6Pcs Stackable Venetian Pearl Flat Brass Bead Ball Bracelet Set Simple Delecate Gold Beaded Stretch Bracelets Friendship Bangle Boho Stretchable Elastic Bracelet for Women Girl,4.2,USD,True,False,7.99,False,,,1,73,False,0.0,"FREE delivery Mon, Aug 12 on $35 of items shipped by Amazon",4.0,,https://m.media-amazon.com/images/I/51cGxTN05NL._AC_UL320_.jpg,organic,7454898011,pearl,6,242,583.27,0.0,0.0
B0BJ32MBGM,9.99,"Cute Beaded Freshwater Cultured 10mm Big Shell Pearl Bracelets for Women,Dainty Handmade Bead Ball Pearl Stretch Bracelet Simple Jewelry for Woman",4.0,USD,True,False,9.99,False,,,1,9,False,0.0,"FREE delivery Mon, Aug 12 on $35 of items shipped by Amazon",5.0,,https://m.media-amazon.com/images/I/41fofpcBd-L._AC_UL320_.jpg,organic,7454898011,pearl,6,243,89.91,0.0,0.0
B0CN6R31HV,9.99,14K Gold Plated Beaded Bracelets Letter Stretch Dainty Stackable Bracelet for Women,3.9,USD,True,False,9.99,False,,,1,444,False,0.0,"FREE delivery Mon, Aug 12 on $35 of items shipped by Amazon",6.0,,https://m.media-amazon.com/images/I/615xzchdQuL._AC_UL320_.jpg,organic,7454898011,pearl,6,244,4435.56,0.0,0.0
B0CJDG1L61,3.79,8pcs Rhinestone Stretch Bracelets Sparkly Clear Crystal Wedding Bridal Bridesmaid Stretch Bracelet Jewelry Stackable Elastic Pearl Multilayer Strand Link Tennis Bracelets Set,0.0,USD,True,False,3.79,False,,,1,0,False,0.0,"FREE delivery Thu, Aug 15 on $35 of items shipped by Amazon",7.0,,https://m.media-amazon.com/images/I/61XV8Jjk+7L._AC_UL320_.jpg,organic,7454898011,pearl,6,245,0.0,0.0,0.0
B0CQYQM69T,13.99,Pearl Bracelets For Women Gold Plated Chain Link Bracelets Bow Heart Charm Bracelets,4.7,USD,True,False,13.99,False,,,1,14,False,0.0,"FREE delivery Mon, Aug 12 on $35 of items shipped by Amazon",8.0,,https://m.media-amazon.com/images/I/51uopLUWJPL._AC_UL320_.jpg,organic,7454898011,pearl,6,246,195.86,0.0,0.0
B0CPHV3J5T,4.99,Silicone Beaded Bracelet Keychain with Bling Pearl Zircon & Tassel for Women Girls (Pearl White),0.0,USD,True,False,4.99,False,,,1,0,False,0.0,"FREE delivery Mon, Aug 12 on $35 of items shipped by Amazon",9.0,,https://m.media-amazon.com/images/I/410BmQRZM2L._AC_UL320_.jpg,organic,7454898011,pearl,6,247,0.0,0.0,0.0
B0CJ2ZJJ6Y,6.99,Silicone Pearl Bracelet Freshwater Pearl Bracelets Charm Dainty Bangle Stretch Bracelet Mood Rubber Bands for Women Men 7'' Adjustable,3.6,USD,True,False,6.99,False,,,1,10,False,8.99,"FREE delivery Mon, Aug 12 on $35 of items shipped by Amazon",10.0,,https://m.media-amazon.com/images/I/31AiifvrXSL._AC_UL320_.jpg,organic,7454898011,pearl,6,248,69.9,2.0,0.22246941045606228
B0CKNKDJND,7.99,Gold Stackable Bracelets Gold Beaded Pearl Bracelets Chunky Layered Link Bracelet Fashion Chain Punk Bracelets Jewelry Gifts for Women Girls,0.0,USD,True,False,7.99,False,,,1,0,False,0.0,"FREE delivery Mon, Aug 12 on $35 of items shipped by Amazon",11.0,,https://m.media-amazon.com/images/I/51BAY3CNZFL._AC_UL320_.jpg,organic,7454898011,pearl,6,249,0.0,0.0,0.0
B0BZ5522HQ,9.99,Gold Bangle Bracelet For Women Boho Cuff Bracelet Silver Bangle Bracelet Back To School Bracelet Open Cuff Bracelet Jewelry,4.2,USD,True,False,9.99,False,,,1,149,False,16.99,"FREE delivery Mon, Aug 12 on $35 of items shipped by Amazon",12.0,,https://m.media-amazon.com/images/I/61yZVwICafL._AC_UL320_.jpg,organic,7454898011,pearl,6,250,1488.51,6.999999999999998,0.4120070629782224
B0BKSK5TJL,9.98,Wedding Silver Multi Row Pearl Rhinestone Layered Adjustable Stretch Wrap Cuff Bridals Crystal Stunning Bracelet Strand Bracelet Gift for Women Brides,4.7,USD,True,False,9.98,False,,,1,3,False,0.0,"FREE delivery Tue, Aug 13 on $35 of items shipped by Amazon",13.0,,https://m.media-amazon.com/images/I/71Tf2VDk3YL._AC_UL320_.jpg,organic,7454898011,pearl,6,251,29.94,0.0,0.0
B0CNY6ZFCP,129.0,3.00 Carat Amethyst and 4-5mm Cultured Pearl Stretch Bracelet With 14kt Yellow Gold. 7 inches,0.0,USD,True,False,129.0,False,,,1,0,False,0.0,"FREE delivery Tomorrow, Aug 8",14.0,,https://m.media-amazon.com/images/I/61Jb09yW-RL._AC_UL320_.jpg,organic,7454898011,pearl,6,252,0.0,0.0,0.0
B07KKJBKJ8,89.25,9-10mm Cultured Pearl Stretch Bracelet With 14kt Yellow Gold,4.3,USD,True,False,89.25,False,,,1,62,False,0.0,"FREE delivery Tomorrow, Aug 8",15.0,,https://m.media-amazon.com/images/I/51Fg9p9uZxL._AC_UL320_.jpg,organic,7454898011,pearl,6,253,5533.5,0.0,0.0
B09635J1V3,13.98,"Pearl Bracelet for Women, Gold Adjustable Slider Bracelet Dainty Chain Bracelet for Women Girls Bride Bridesmaid Gift",4.2,USD,True,False,13.98,False,,,1,207,False,0.0,"FREE delivery Fri, Aug 16 on $35 of items shipped by Amazon",16.0,,https://m.media-amazon.com/images/I/511IpTzQRhS._AC_UL320_.jpg,organic,7454898011,pearl,6,254,2893.86,0.0,0.0
B0C1RN8XLD,13.99,"Ring Bracelet Hand Chain, Gold Plated Butterfly Ring and Chain Bracelet, Shiny Link Bracelet Dainty Hand Harness Chain Statement Jewelry Gift for Women Her",4.2,USD,True,False,13.99,False,,,1,190,False,0.0,"FREE delivery Mon, Aug 12 on $35 of items shipped by Amazon",17.0,,https://m.media-amazon.com/images/I/51u+iUasKdL._AC_UL320_.jpg,organic,7454898011,pearl,6,255,2658.1,0.0,0.0
B07HCFLC3C,96.75,4-9mm Cultured Pearl Wrap Bracelet in Sterling Silver. 7 inches,4.2,USD,True,False,96.75,False,,,1,48,False,0.0,"FREE delivery Tomorrow, Aug 8",18.0,,https://m.media-amazon.com/images/I/61wB+4Xoa7L._AC_UL320_.jpg,organic,7454898011,pearl,6,256,4644.0,0.0,0.0
B0CXSY58R7,11.99,"Gold Gemstone Beaded Bracelets for Women, Boho Handmade Stackable Crystal Natural Stone Bracelet Summer Beach Bohemian Jewelry Gift",5.0,USD,True,False,11.99,False,,,1,1,False,0.0,"FREE delivery Mon, Aug 12 on $35 of items shipped by Amazon",19.0,,https://m.media-amazon.com/images/I/61Alb3CbK9L._AC_UL320_.jpg,organic,7454898011,pearl,6,257,11.99,0.0,0.0
B0C7R2XTSP,6.99,Gold Pearl Bracelet for Women Dainty Paperclip Chain Pearl Bracelet for Women Girls Pearl Bracelet Jewelry Gifts,5.0,USD,True,False,6.99,False,,,1,1,False,0.0,"FREE delivery Mon, Aug 12 on $35 of items shipped by Amazon",20.0,,https://m.media-amazon.com/images/I/61dHYaSJykL._AC_UL320_.jpg,organic,7454898011,pearl,6,258,6.99,0.0,0.0
B09XM1JXJC,15.99,Beaded Bangle Bracelets for Women Silver Wrap Bangles Bracelet Womens Costume Jewelry Fashion Gift,4.5,USD,True,False,15.99,False,,,1,186,False,0.0,"FREE delivery Tue, Aug 13 on $35 of items shipped by Amazon",21.0,,https://m.media-amazon.com/images/I/61stHcnG19L._AC_UL320_.jpg,organic,7454898011,pearl,6,259,2974.14,0.0,0.0
B097SWNFDN,13.9,Pearl Bracelet Baroque Cultured Link 14K Gold Plated Adjustable Love Extension Chain Valentine's Day Gift Retro Charm Jewelry for Women,4.4,USD,True,False,13.9,False,,,1,167,False,15.9,"FREE delivery Thu, Aug 15 on $35 of items shipped by Amazon",22.0,,https://m.media-amazon.com/images/I/71nmW4VyASS._AC_UL320_.jpg,organic,7454898011,pearl,6,260,2321.3,2.0,0.12578616352201258
B0CHJLD5Y1,13.99,Gold Beaded Bracelets For Women White Black Beads Bracelets Gold Filled Bead Ball Stretch Elastic Stackable Layered Sets Trendy Dainty Jewelry,4.1,USD,True,False,13.99,False,,,1,29,False,0.0,"FREE delivery Tue, Aug 13 on $35 of items shipped by Amazon",23.0,,https://m.media-amazon.com/images/I/61QFcQdj2aL._AC_UL320_.jpg,organic,7454898011,pearl,6,261,405.71,0.0,0.0
B09XVB9KH4,8.99,4PCS 3-Row Faux Pearl Bracelet 3-Row Pearl Stretch Bracelet Multilayer Pearl Elastic Bangle for Wedding Jewelry 1920s Costume,4.8,USD,True,False,8.99,False,,,1,18,False,0.0,"FREE delivery Mon, Aug 12 on $35 of items shipped by Amazon",24.0,,https://m.media-amazon.com/images/I/61+U43yKSuL._AC_UL320_.jpg,organic,7454898011,pearl,6,262,161.82,0.0,0.0
B08HPL78JX,9.99,Simple Hand Chain Pearl Finger Ring Bracelets Wedding Beaded Bracelet for Women and Girls,3.9,USD,True,False,9.99,False,,,1,46,False,10.99,"FREE delivery Tue, Aug 13 on $35 of items shipped by Amazon",25.0,,https://m.media-amazon.com/images/I/61caj09likL._AC_UL320_.jpg,organic,7454898011,pearl,6,263,459.54,1.0,0.09099181073703366
B0BJL28ZKV,11.99,"Dainty Gold Freshwater Pearls Chain Bracelet for Women, Statement Paperclip Rosary Purple Pearl Beaded Bangle Cuff Jewelry Gifts",3.8,USD,True,False,11.99,False,,,1,29,False,0.0,"FREE delivery Mon, Aug 12 on $35 of items shipped by Amazon",26.0,,https://m.media-amazon.com/images/I/714U0mPKXKL._AC_UL320_.jpg,organic,7454898011,pearl,6,264,347.71,0.0,0.0
B07XW9RYS9,69.0,7-8mm Cultured Pearl Bracelet With Sterling Silver Magnetic Clasp,3.9,USD,True,False,69.0,False,,,1,21,False,0.0,"FREE delivery Tomorrow, Aug 8",27.0,,https://m.media-amazon.com/images/I/61jP332zgZL._AC_UL320_.jpg,organic,7454898011,pearl,6,265,1449.0,0.0,0.0
B0CRQS83JC,18.99,925 Sterling Silver Seamless Navajo Style Pearls Loose Beads (Pack of 20),0.0,USD,False,False,18.99,False,,,1,0,False,0.0,FREE delivery Aug 13 - 15 Or fastest delivery Aug 9 - 13,28.0,,https://m.media-amazon.com/images/I/41aSl3V7ayL._AC_UL320_.jpg,organic,7454898011,pearl,6,266,0.0,0.0,0.0
B08FCTVL82,8.99,Womens Faux Pearl Link Bracelet Silver Tone Rhinestone Imitation Pearl Bracelets,4.6,USD,True,False,8.99,False,,,1,9,False,0.0,"FREE delivery Mon, Aug 12 on $35 of items shipped by Amazon",29.0,,https://m.media-amazon.com/images/I/415EN3vbVtL._AC_UL320_.jpg,organic,7454898011,pearl,6,267,80.91,0.0,0.0
B0BHTTFC73,13.99,Pearl Bracelet For Women - Natural Handpicked Pearl Adjustable 18k Gold Plated Chain Bracelets Delicate Vintage Jewelry Gifts for Mom Women Girls,4.4,USD,True,False,13.99,False,,,1,12,False,0.0,"FREE delivery Mon, Aug 12 on $35 of items shipped by Amazon",30.0,,https://m.media-amazon.com/images/I/41ao2VGPEJL._AC_UL320_.jpg,organic,7454898011,pearl,6,268,167.88,0.0,0.0
B0D2KY1RWY,9.98,Gold Pearl Bracelets for Women Irregular Pearl Elegant Gold Bracelets Adjustable Gold Bracelets Prom Jewelry Gift,5.0,USD,True,False,9.98,False,,,1,3,False,0.0,"FREE delivery Mon, Aug 12 on $35 of items shipped by Amazon",31.0,,https://m.media-amazon.com/images/I/51QJSkUis5L._AC_UL320_.jpg,organic,7454898011,pearl,6,269,29.94,0.0,0.0
B08H22BK3X,7.66,Crystal Finger Bracelets Ring Hand Chain Beach Slave Bracelet Jewelry for Women,3.3,USD,True,False,7.66,False,,,1,51,False,0.0,"FREE delivery Mon, Aug 12 on $35 of items shipped by Amazon",32.0,,https://m.media-amazon.com/images/I/51tr-81V0hL._AC_UL320_.jpg,organic,7454898011,pearl,6,270,390.66,0.0,0.0
B08YP148CF,59.99,"Freshwater Cultured Pearls White, Pink, Peach or Gray 7'' Classic Stretch Strand Pearls Bracelet Jewelry for Women and Girls (Choice of Size and Colors)",4.6,USD,True,False,59.99,False,,,1,21,False,0.0,"FREE delivery Mon, Aug 12",33.0,,https://m.media-amazon.com/images/I/61O6l6QkOLL._AC_UL320_.jpg,organic,7454898011,pearl,6,271,1259.79,0.0,0.0
B00MX7PWSI,179.0,Sterling Silver AAAA Quality Round White Double Freshwater Cultured Pearl Bracelet for Women,4.5,USD,True,False,179.0,False,,,1,105,False,0.0,"FREE delivery Mon, Aug 12",34.0,,https://m.media-amazon.com/images/I/51azOfsIPBL._AC_UL320_.jpg,organic,7454898011,pearl,6,272,18795.0,0.0,0.0
B0CRVF3K86,9.99,"Faux Pearl Bracelet Set for Women Beaded Stretch Strand Bracelets for Gifts For Bestfriends, Couple, Family Members, Siblings, Sister, Lover",4.1,USD,True,False,9.99,False,,,1,4,False,0.0,"FREE delivery Wed, Aug 14 on $35 of items shipped by Amazon",35.0,,https://m.media-amazon.com/images/I/61p2N6A3OhL._AC_UL320_.jpg,organic,7454898011,pearl,6,273,39.96,0.0,0.0
B0CYBP82NM,6.99,Dainty Silver Bracelet for Women Adjustable Freshwater Pearl Bracelet Baroque Pearl Bead Bracelet Hypoallergenic Silver Bracelet Jewelry Gift,3.0,USD,True,False,6.99,False,,,1,1,False,0.0,"FREE delivery Mon, Aug 12 on $35 of items shipped by Amazon",36.0,,https://m.media-amazon.com/images/I/41Ep8tu0MeL._AC_UL320_.jpg,organic,7454898011,pearl,6,274,6.99,0.0,0.0
B07FVWBWK2,13.99,"Bead Crystal Wrap Bangle Bracelet - Fashion Jewelry Beaded Bracelet with Silver Metal, Gifts for Women",4.6,USD,True,False,13.99,False,,,1,981,False,0.0,"FREE delivery Tue, Aug 13 on $35 of items shipped by Amazon",37.0,,https://m.media-amazon.com/images/I/61xRpEHzbpS._AC_UL320_.jpg,organic,7454898011,pearl,6,275,13724.19,0.0,0.0
B0CR88D4LP,11.99,Thin Gold Bangle Bracelet for Women Adjustable Minimalist Cuff Bracelet for Valentine's Day Birthday Mom Girlfriend,0.0,USD,True,False,11.99,False,,,1,0,False,0.0,"FREE delivery Mon, Aug 12 on $35 of items shipped by Amazon",38.0,,https://m.media-amazon.com/images/I/51ZnVvYvLlL._AC_UL320_.jpg,organic,7454898011,pearl,6,276,0.0,0.0,0.0
B0C4PGVHXV,7.99,Round Imitation Pearl Bracelets Wedding Pearl Bracelets White Pearl Bracelets for Women Brides Bridesmaid Jewelry Gifts6/8/10mm,4.2,USD,True,False,7.99,False,,,1,3,False,9.99,"FREE delivery Mon, Aug 12 on $35 of items shipped by Amazon",39.0,,https://m.media-amazon.com/images/I/41ZS0qi2ZvL._AC_UL320_.jpg,organic,7454898011,pearl,6,277,23.97,2.0,0.20020020020020018
B09YCTBGJY,6.99,"Pearl Stretch Bracelet, 8mm Round Multicolor Shell Pearl Bracelet Jewelry for Women",3.9,USD,True,False,6.99,False,,,1,21,False,0.0,"FREE delivery Mon, Aug 12 on $35 of items shipped by Amazon",40.0,,https://m.media-amazon.com/images/I/51rx+Vd4XSL._AC_UL320_.jpg,organic,7454898011,pearl,6,278,146.79,0.0,0.0
B0B5TTQXWJ,6.89,Multi Row Imitition Pearl Stretch Bracelet Stackable Crystal Strand Multi-Layered Elastic Bangle for Women Girl 1920s Costume Vintage Bridal Wedding Jewelry,4.3,USD,True,False,6.89,False,,,1,31,False,0.0,"FREE delivery Mon, Aug 12 on $35 of items shipped by Amazon",41.0,,https://m.media-amazon.com/images/I/51OsSAHukxL._AC_UL320_.jpg,organic,7454898011,pearl,6,279,213.59,0.0,0.0
B0B2JVDNHV,6.59,5 Piecs Pearl Bracelets for women Wedding Accessories Stretch Bracelet Faux Pearl Bracelet Bridal Party Prom Beaded Bracelet Jewelry,4.7,USD,True,False,6.59,False,,,1,3,False,0.0,"FREE delivery Thu, Aug 15 on $35 of items shipped by Amazon",42.0,,https://m.media-amazon.com/images/I/412y+ZOUkLL._AC_UL320_.jpg,organic,7454898011,pearl,6,280,19.77,0.0,0.0
B0D5GHWFQN,6.99,Charms for Bogg Bag Accessories Colorful Flowers and Pearls for Bogg Bag Rubber Beach Totes Accessories Inserts,4.5,USD,True,False,6.99,False,,,1,2,False,0.0,"FREE delivery Mon, Aug 12 on $35 of items shipped by Amazon",43.0,,https://m.media-amazon.com/images/I/71Lv8P+PoTL._AC_UL320_.jpg,organic,7454898011,pearl,6,281,13.98,0.0,0.0
B00LLJ742Q,29.0,7-8mm Genuine White Keshi Cultured Pearl Bracelet for Women,4.1,USD,True,False,29.0,False,,,1,23,False,0.0,"FREE delivery Thu, Aug 15 on $35 of items shipped by Amazon",44.0,,https://m.media-amazon.com/images/I/61FH5RlnYtL._AC_UL320_.jpg,organic,7454898011,pearl,6,282,667.0,0.0,0.0
B0CDFH5F6N,7.99,Y2k Star Pearl Beaded Chain Adjustable Aesthetic Bracelets Punk Gothic Link Dainty Bracelets Grunge Gifts For Women Christmas Jewelry,4.5,USD,True,False,7.99,False,,,1,3,False,0.0,"FREE delivery Tue, Aug 13 on $35 of items shipped by Amazon",45.0,,https://m.media-amazon.com/images/I/41R+y6JfhuL._AC_UL320_.jpg,organic,7454898011,pearl,6,283,23.97,0.0,0.0
B0128SHYS2,279.0,14K Gold 6.5-7mm Round White Japanese Akoya Saltwater Cultured Pearl Bracelet for Women,4.4,USD,True,False,279.0,False,,,1,43,False,0.0,"FREE delivery Mon, Aug 12",46.0,,https://m.media-amazon.com/images/I/51IN9dbTaML._AC_UL320_.jpg,organic,7454898011,pearl,6,284,11997.0,0.0,0.0
B0CL9L8KFL,6.99,4Pcs Faux Pearl Bracelet Set for Women Multi Layered Pearl Stretch Bracelets for Women Dainty Pearl Bracelets for Women White Pearl Stackable Bracelets Layered Bracelets Pearl Jewelry for Women,0.0,USD,True,False,6.99,False,,,1,0,False,0.0,"FREE delivery Mon, Aug 12 on $35 of items shipped by Amazon",47.0,,https://m.media-amazon.com/images/I/61-v9io2tSL._AC_UL320_.jpg,organic,7454898011,pearl,6,285,0.0,0.0,0.0
B0B1WDTDCM,7.99,Pearl Satellite Chain Bracelet Gold Pearl Finger Chain Pearl Beaded Station Slave Hand Chain Pearl Hand Harness Boho Pearl Bracelets Jewelry Gifts for Women Girls,2.8,USD,True,False,7.99,False,,,1,4,False,0.0,"FREE delivery Mon, Aug 12 on $35 of items shipped by Amazon",48.0,,https://m.media-amazon.com/images/I/71lz37c6aqL._AC_UL320_.jpg,organic,7454898011,pearl,6,286,31.96,0.0,0.0
B09ZHRTHLK,13.99,"MUYAN Pearl Choker Necklace for Women Boho Imitation Pearl Necklace Jewelry Gift for Women,White",4.3,USD,,False,13.99,True,,50+ bought in past month,1,158,False,0.0,,,1.0,https://aax-us-iad.amazon.com/e/loi/imp?b=JJyzkwez0s7PPIrcl5ab4BsAAAGRLRiW7wEAAAH2AQBvbm9fdHhuX2JpZDUgICBvbm9fdHhuX2ltcDEgICD_EZCS,paid,7454898011,pearl,7,17,2210.42,0.0,0.0
B0128SHYS2,279.0,14K Gold 6.5-7mm Round White Japanese Akoya Saltwater Cultured Pearl Bracelet for Women,4.4,USD,True,False,279.0,False,,,1,43,False,0.0,"FREE delivery Mon, Aug 12 Or fastest delivery Fri, Aug 9",1.0,,https://m.media-amazon.com/images/I/51IN9dbTaML._AC_UL320_.jpg,organic,7454898011,pearl,7,287,11997.0,0.0,0.0
B0B5D196HX,9.99,BABAYOND 1920s Flapper Bracelet Ring Set Roaring 20s The Great Gatsby Austrian Crystals Imitation Pearl Bracelet Accessory,3.8,USD,True,False,9.99,False,,,1,53,False,0.0,"FREE delivery Mon, Aug 12 on $35 of items shipped by Amazon",2.0,,https://m.media-amazon.com/images/I/61E7Rp6fB5L._AC_UL320_.jpg,organic,7454898011,pearl,7,288,529.47,0.0,0.0
B09NXSY8SL,12.98,Multi Row Layered Glitter Bracelets Faux Pearl Bracelet Stretch Tennis Chain Rhinestone Adjustable Band Cuff Elastic Bangle 1920s Bridal Body Jewelry Accessories for Women and Girls Wedding,4.4,USD,True,False,12.98,False,,,1,100,False,0.0,"FREE delivery Mon, Aug 12 on $35 of items shipped by AmazonOr fastest delivery Tomorrow, Aug 8",3.0,,https://m.media-amazon.com/images/I/81slcc7JYJL._AC_UL320_.jpg,organic,7454898011,pearl,7,289,1298.0,0.0,0.0
B0B76KZMFK,7.29,Boho Multilayer Crystal Beaded Stackable Stretch Bracelets Strand Elestic Simulated Pearl Bohemian for Women Boho Handmade Jewelry,4.2,USD,True,False,7.29,False,,,1,75,False,0.0,"FREE delivery Mon, Aug 12 on $35 of items shipped by AmazonOr fastest delivery Tomorrow, Aug 8",4.0,,https://m.media-amazon.com/images/I/51DDlKC4NhL._AC_UL320_.jpg,organic,7454898011,pearl,7,290,546.75,0.0,0.0
B004W95488,9.83,Burton & Burton Floral Avery Corsage Bracelet,3.8,USD,True,False,9.83,False,,,1,86,False,0.0,"FREE delivery Mon, Aug 12 on $35 of items shipped by AmazonOr fastest delivery Tomorrow, Aug 8",5.0,,https://m.media-amazon.com/images/I/51EslbwxM8L._AC_UL320_.jpg,organic,7454898011,pearl,7,291,845.38,0.0,0.0
B0B1WDTDCM,7.99,Pearl Satellite Chain Bracelet Gold Pearl Finger Chain Pearl Beaded Station Slave Hand Chain Pearl Hand Harness Boho Pearl Bracelets Jewelry Gifts for Women Girls,2.8,USD,True,False,7.99,False,,,1,4,False,0.0,"FREE delivery Mon, Aug 12 on $35 of items shipped by AmazonOr fastest delivery Fri, Aug 9",6.0,,https://m.media-amazon.com/images/I/71lz37c6aqL._AC_UL320_.jpg,organic,7454898011,pearl,7,292,31.96,0.0,0.0
B0CB5YTCVM,6.99,"Dainty Gold Bracelets for Women, 14K Gold Filled Adjustable Layered Bracelet Cute Evil Eye Oval Chain Pearl Bar Turtle Gold Bracelets for Women Jewelry",3.7,USD,True,False,6.99,False,,,1,6,False,7.69,"FREE delivery Mon, Aug 12 on $35 of items shipped by AmazonOr fastest delivery Sun, Aug 11",7.0,,https://m.media-amazon.com/images/I/51RuLx3P2mL._AC_UL320_.jpg,organic,7454898011,pearl,7,293,41.94,0.7000000000000002,0.09102730819245776
B0C9KYV211,10.99,New Trend Freshwater Baroque Pink Pearl Adjustable Bracelet A Rose Gold Adjustable Charm Fits Most Sizes Come With Custom Packaging A Wonderful Gift For Her,3.3,USD,True,False,10.99,False,,,1,2,False,0.0,"FREE delivery Mon, Aug 12 on $35 of items shipped by AmazonOr fastest delivery Sun, Aug 11",8.0,,https://m.media-amazon.com/images/I/41lNImJRPsL._AC_UL320_.jpg,organic,7454898011,pearl,7,294,21.98,0.0,0.0
B0CL46GZK4,5.99,"7"" Silicone Freshwater Pearl Bracelets Colored Dainty Personalized Stretch Mood Rubber Bands Bracelets for Women",0.0,USD,True,False,5.99,False,,,1,0,False,0.0,"FREE delivery Tue, Aug 13 on $35 of items shipped by AmazonOr fastest delivery Fri, Aug 9",9.0,,https://m.media-amazon.com/images/I/41voTlWFgAL._AC_UL320_.jpg,organic,7454898011,pearl,7,295,0.0,0.0,0.0
B07JF35LF5,11.88,Women Pearls Bracelets Handmade Friendship Charm Bracelet Boho Thin Strand Bracelets,4.3,USD,True,False,11.88,False,,,1,180,False,0.0,FREE delivery on $35 shipped by Amazon.,10.0,,https://m.media-amazon.com/images/I/51nS-FQ3t3L._AC_UL320_.jpg,organic,7454898011,pearl,7,296,2138.4,0.0,0.0
B09VXNDN5H,9.98,"Baroque Natural Pearls Beaded Bracelets Boho Leather Wrap Bracelets for Women Gold Tube Charm Bohemian Bracelet Multilayer Cuff Bangle with Clasp Jewelry Gift for Teen Girls, Sisters and mother",4.3,USD,True,False,9.98,False,,,1,74,False,0.0,FREE delivery on $35 shipped by Amazon.,11.0,,https://m.media-amazon.com/images/I/71jXCrtBFmL._AC_UL320_.jpg,organic,7454898011,pearl,7,297,738.52,0.0,0.0
B0CYH71G3K,21.99,Pink Pearls Bracelet 14K Gold Plated Freshwater Baroque Pearls O/T & Slider Chain Adjustable Bracelet for Women Girls,4.5,USD,True,False,21.99,False,,,1,3,False,0.0,"FREE delivery Mon, Aug 12 on $35 of items shipped by AmazonOr fastest delivery Tomorrow, Aug 8",12.0,,https://m.media-amazon.com/images/I/51BMeJao53L._AC_UL320_.jpg,organic,7454898011,pearl,7,298,65.97,0.0,0.0
B078YCKBLX,59.87,"Elton Cuff Bracelet for Women, Fashion Jewelry",4.6,USD,True,False,59.87,False,,,1,677,False,63.97,"FREE delivery Mon, Aug 12 Or fastest delivery Fri, Aug 9",13.0,,https://m.media-amazon.com/images/I/61fBuHj39tL._AC_UL320_.jpg,organic,7454898011,pearl,7,299,40531.99,4.100000000000001,0.06409254337970927
B07DMZYV7N,279.0,13-14mm Cultured Baroque Pearl Stretch Bracelet With 14kt Yellow Gold. 8 inches,0.0,USD,True,False,279.0,False,,,1,0,False,0.0,"FREE delivery Tomorrow, Aug 8",14.0,,https://m.media-amazon.com/images/I/51jwCH6x6oL._AC_UL320_.jpg,organic,7454898011,pearl,7,300,0.0,0.0,0.0
B083S7XXGY,8.99,Faux Pearl Bracelet 3-Row Pearl Stretch Bracelet Multilayer Halloween Cosplay 1920s Elastic 1920s Costume,4.5,USD,True,False,8.99,False,,,1,469,False,0.0,"FREE delivery Mon, Aug 12 on $35 of items shipped by AmazonOr fastest delivery Fri, Aug 9",15.0,,https://m.media-amazon.com/images/I/71INRLVLduL._AC_UL320_.jpg,organic,7454898011,pearl,7,301,4216.31,0.0,0.0
B0CX8TXFFQ,7.99,5 Pcs Pearl Bracelet Dainty Pearl Bracelet for Girls Silver Pearl Layered Bracelet Bridesmaid Jewelry Gifts for Women,5.0,USD,True,False,7.99,False,,,1,2,False,0.0,"FREE delivery Mon, Aug 12 on $35 of items shipped by AmazonOr fastest delivery Sun, Aug 11",16.0,,https://m.media-amazon.com/images/I/51VRf9qr4mL._AC_UL320_.jpg,organic,7454898011,pearl,7,302,15.98,0.0,0.0
B0CL9L8KFL,6.99,4Pcs Faux Pearl Bracelet Set for Women Multi Layered Pearl Stretch Bracelets for Women Dainty Pearl Bracelets for Women White Pearl Stackable Bracelets Layered Bracelets Pearl Jewelry for Women,0.0,USD,True,False,6.99,False,,,1,0,False,0.0,"FREE delivery Mon, Aug 12 on $35 of items shipped by AmazonOr fastest delivery Fri, Aug 9",17.0,,https://m.media-amazon.com/images/I/61-v9io2tSL._AC_UL320_.jpg,organic,7454898011,pearl,7,303,0.0,0.0,0.0
B0CKVJ7SG4,11.99,"Saint Benedict Rosary Cross Bracelet, Adjustable Stainless Steel Religious Catholic Link Chain Wristband for Men Womens",5.0,USD,True,False,11.99,False,,,1,2,False,0.0,"FREE delivery Mon, Aug 12 on $35 of items shipped by AmazonOr fastest delivery Tomorrow, Aug 8",18.0,,https://m.media-amazon.com/images/I/51wTUXjYQ1L._AC_UL320_.jpg,organic,7454898011,pearl,7,304,23.98,0.0,0.0
