asin,price,title,rating,currency,is_prime,best_seller,price_upper,is_sponsored,manufacturer,sales_volume,pricing_count,reviews_count,is_amazons_choice,price_strikethrough,shipping_information,pos,rel_pos,url,url_image,source,category_id,keyword,page,position,min_revenue,discount,discount_rate
B0D6QKVNXN,59.99,"Moissanite Halo Earrings 0.2ct-4ct Moissanite Stud Earrings for Women, 18k White Gold Plated 925 Sterling Silver Men's Diamond Stud Earrings D Color VVS1 Brilliant Cut Simulated Diamond Studs with Push Back Bling Jewelry Gifts",4.9,USD,,False,59.99,True,,,1,18,False,0.0,,,1.0,#,https://aax-us-iad.amazon.com/e/loi/imp?b=JG_aH3eqJnGE85yQDp1xhIAAAAGQh5566gEAAAH2AQBvbm9fdHhuX2JpZDQgICBvbm9fdHhuX2ltcDEgICAzp66I,paid,7454927011,moissanite,1,1,1079.82,0.0,0.0
B0CM6F89QZ,69.99,"Moissanite Stud Earrings, Round Cut D Color VVS1 Clarity Lab Created Diamond Earrings Studs 18K White Gold Plated 925 Sterling Silver Jewelry for Women Men",4.8,USD,,False,69.99,True,,100+ bought in past month,1,95,False,0.0,,,2.0,#,https://aax-us-iad.amazon.com/e/loi/imp?b=JLDqjWpq1u2R8q5ctxT5DGsAAAGQh557CAEAAAH2AQBvbm9fdHhuX2JpZDIgICBvbm9fdHhuX2ltcDEgICDbdSCT,paid,7454927011,moissanite,1,2,6649.049999999999,0.0,0.0
B08T16TPLR,23.9,Moissanite Pendant Necklace 1-5CT 18K White Gold Plated silver D Color Ideal Cut Diamond Necklace for Women with Certificate of Authenticity,4.6,USD,True,False,23.9,False,,200+ bought in past month,1,908,False,39.9,"FREE delivery Thu, Jul 11 on $35 of items shipped by Amazon",1.0,,/SecreTalk-Moissanite-Necklace-Certificate-Authenticity/dp/B08T16TPLR/ref=sr_1_1?dib=eyJ2IjoiMSJ9.pbDONWtRJBYEiWayROAmiee9sVRmd2wOV2JosxLBBg_G_q-hOLKKnqxM_jr79Rl0Br2LqxdGtv8jvoM7CznTCHPCuxmCkGrf27tQDJslCnG3dfXOOoP34gPdv7ZuGLghLlz1aCLvZcEAkjyHRgou9SKETORdfn3GoAioc3S8vMxkGiUmsdwJU2cBy7Wru_EQsW1AGJ7izrlWa7Zy_3gv-xSr2VPv_LpuDAN50J2sPRBXR95QDGAM6pqgslhoB-erXTRMgEa_ZnP5rHXb_NZd8TIpB7keb2kvcICSXcNRabg.-o7Qzd7RiOpdrqQABa3qTvJxCob-VMapMw0hbTCif3E&dib_tag=se&keywords=moissanite&qid=1720262228&s=apparel&sr=1-1,https://m.media-amazon.com/images/I/51waZNepXVS._AC_UL320_.jpg,organic,7454927011,moissanite,1,1,21701.199999999997,16.0,0.4010025062656642
B0CYGR54RK,72.84,"Color-D VVS1 Clarity 1.10/3.30 Carat Moissanite Cross Necklace for Women Men, Pure 925 Sterling Silver Chain Pendant, 16""/18""/20"" Adjustable, Wedding Anniversary Jewelry",4.8,USD,True,False,72.84,False,,50+ bought in past month,1,29,False,0.0,"FREE delivery Thu, Jul 11 Or fastest delivery Wed, Jul 10",2.0,,/Moissanite-Pendant-Necklace-Anniversary-Sterling/dp/B0CYGR54RK/ref=sr_1_2?dib=eyJ2IjoiMSJ9.pbDONWtRJBYEiWayROAmiee9sVRmd2wOV2JosxLBBg_G_q-hOLKKnqxM_jr79Rl0Br2LqxdGtv8jvoM7CznTCHPCuxmCkGrf27tQDJslCnG3dfXOOoP34gPdv7ZuGLghLlz1aCLvZcEAkjyHRgou9SKETORdfn3GoAioc3S8vMxkGiUmsdwJU2cBy7Wru_EQsW1AGJ7izrlWa7Zy_3gv-xSr2VPv_LpuDAN50J2sPRBXR95QDGAM6pqgslhoB-erXTRMgEa_ZnP5rHXb_NZd8TIpB7keb2kvcICSXcNRabg.-o7Qzd7RiOpdrqQABa3qTvJxCob-VMapMw0hbTCif3E&dib_tag=se&keywords=moissanite&qid=1720262228&s=apparel&sr=1-2,https://m.media-amazon.com/images/I/51FQbOGRabL._AC_UL320_.jpg,organic,7454927011,moissanite,1,2,2112.36,0.0,0.0
B0BQQHTKJH,126.62,"Heart Pendant Necklace Gifts for Wife, Engraved 'I LOVE YOU' Gift for Wife Girlfriend, 1-3 carat Moissanite D Color (VVS1) , Anniversary Eternity Jewelry Present for Wife, Birthday Gifts for Women Wife Girlfriend Girls Her",4.7,USD,True,False,126.62,False,,50+ bought in past month,1,460,False,0.0,"FREE delivery Thu, Jul 11 Or fastest delivery Tomorrow, Jul 7",4.0,,/Necklace-Engraved-Girlfriend-Moissanite-Anniversary/dp/B0BQQHTKJH/ref=sr_1_4?dib=eyJ2IjoiMSJ9.pbDONWtRJBYEiWayROAmiee9sVRmd2wOV2JosxLBBg_G_q-hOLKKnqxM_jr79Rl0Br2LqxdGtv8jvoM7CznTCHPCuxmCkGrf27tQDJslCnG3dfXOOoP34gPdv7ZuGLghLlz1aCLvZcEAkjyHRgou9SKETORdfn3GoAioc3S8vMxkGiUmsdwJU2cBy7Wru_EQsW1AGJ7izrlWa7Zy_3gv-xSr2VPv_LpuDAN50J2sPRBXR95QDGAM6pqgslhoB-erXTRMgEa_ZnP5rHXb_NZd8TIpB7keb2kvcICSXcNRabg.-o7Qzd7RiOpdrqQABa3qTvJxCob-VMapMw0hbTCif3E&dib_tag=se&keywords=moissanite&qid=1720262228&s=apparel&sr=1-4,https://m.media-amazon.com/images/I/71XAvVEAzgL._AC_UL320_.jpg,organic,7454927011,moissanite,1,3,58245.200000000004,0.0,0.0
B0CSDT263V,24.99,"Moissanite Diamond Necklaces for Women, 1CT 14K White Gold plated Sterling Silver Hypoallergenic Necklaces Pendant Jewelry Gifts for Women",4.6,USD,True,False,24.99,False,,,1,11,False,0.0,"FREE delivery Thu, Jul 11 on $35 of items shipped by AmazonOr fastest delivery Wed, Jul 10",5.0,,/JEWSACE-Moissanite-Necklaces-Sterling-Hypoallergenic/dp/B0CSDT263V/ref=sr_1_5?dib=eyJ2IjoiMSJ9.pbDONWtRJBYEiWayROAmiee9sVRmd2wOV2JosxLBBg_G_q-hOLKKnqxM_jr79Rl0Br2LqxdGtv8jvoM7CznTCHPCuxmCkGrf27tQDJslCnG3dfXOOoP34gPdv7ZuGLghLlz1aCLvZcEAkjyHRgou9SKETORdfn3GoAioc3S8vMxkGiUmsdwJU2cBy7Wru_EQsW1AGJ7izrlWa7Zy_3gv-xSr2VPv_LpuDAN50J2sPRBXR95QDGAM6pqgslhoB-erXTRMgEa_ZnP5rHXb_NZd8TIpB7keb2kvcICSXcNRabg.-o7Qzd7RiOpdrqQABa3qTvJxCob-VMapMw0hbTCif3E&dib_tag=se&keywords=moissanite&qid=1720262228&s=apparel&sr=1-5,https://m.media-amazon.com/images/I/715UeTpLznL._AC_UL320_.jpg,organic,7454927011,moissanite,1,4,274.89,0.0,0.0
B0BM96FVL1,49.99,"Infinity Moissanite Necklaces for Women, 925 Sterling Silver Moissanite Diamond Pendant Necklace 2ct D Color VVS1 Clarity, White Gold Plated Dainty Necklace for Women Jewelry Gifts",4.7,USD,True,False,49.99,False,,,1,42,False,0.0,"FREE delivery Thu, Jul 11 Or fastest delivery Tomorrow, Jul 7",6.0,,/AINUOSHI-Infinity-Moissanite-Necklaces-Sterling/dp/B0BM96FVL1/ref=sr_1_6?dib=eyJ2IjoiMSJ9.pbDONWtRJBYEiWayROAmiee9sVRmd2wOV2JosxLBBg_G_q-hOLKKnqxM_jr79Rl0Br2LqxdGtv8jvoM7CznTCHPCuxmCkGrf27tQDJslCnG3dfXOOoP34gPdv7ZuGLghLlz1aCLvZcEAkjyHRgou9SKETORdfn3GoAioc3S8vMxkGiUmsdwJU2cBy7Wru_EQsW1AGJ7izrlWa7Zy_3gv-xSr2VPv_LpuDAN50J2sPRBXR95QDGAM6pqgslhoB-erXTRMgEa_ZnP5rHXb_NZd8TIpB7keb2kvcICSXcNRabg.-o7Qzd7RiOpdrqQABa3qTvJxCob-VMapMw0hbTCif3E&dib_tag=se&keywords=moissanite&qid=1720262228&s=apparel&sr=1-6,https://m.media-amazon.com/images/I/61S1rQ57lpL._AC_UL320_.jpg,organic,7454927011,moissanite,1,5,2099.58,0.0,0.0
B09KTWRVWR,58.99,"Moissanite Necklace for Women,0.1CT-12.0CT Lab Created Diamond Pendant 18K White/Yellow Gold Plated Sterling Silver Necklace Round Moissanite Pendant Diamond Solitaire Necklace Gift for Mom/Wife Moissanite Diamond Jewelry with GRA Certificate of Authenticity",4.5,USD,True,False,58.99,False,,,1,559,False,0.0,"FREE delivery Thu, Jul 11",7.0,,/Moissanite-Necklace-Sterling-Solitaire-Girlfriend/dp/B09KTWRVWR/ref=sr_1_7?dib=eyJ2IjoiMSJ9.pbDONWtRJBYEiWayROAmiee9sVRmd2wOV2JosxLBBg_G_q-hOLKKnqxM_jr79Rl0Br2LqxdGtv8jvoM7CznTCHPCuxmCkGrf27tQDJslCnG3dfXOOoP34gPdv7ZuGLghLlz1aCLvZcEAkjyHRgou9SKETORdfn3GoAioc3S8vMxkGiUmsdwJU2cBy7Wru_EQsW1AGJ7izrlWa7Zy_3gv-xSr2VPv_LpuDAN50J2sPRBXR95QDGAM6pqgslhoB-erXTRMgEa_ZnP5rHXb_NZd8TIpB7keb2kvcICSXcNRabg.-o7Qzd7RiOpdrqQABa3qTvJxCob-VMapMw0hbTCif3E&dib_tag=se&keywords=moissanite&qid=1720262228&s=apparel&sr=1-7,https://m.media-amazon.com/images/I/61K33VSEGFL._AC_UL320_.jpg,organic,7454927011,moissanite,1,6,32975.41,0.0,0.0
B0C4PWCHPL,37.99,"Moissanite Necklace, Dance Necklace for Women Gifts for Wife Girlfriend Mom Moissanite Diamond D Color (VVS1) Halo Pendant Necklaces for Birthday Valentine Wedding Anniversary",4.9,USD,True,False,37.99,False,,,1,18,False,0.0,"FREE delivery Thu, Jul 11 Or fastest delivery Wed, Jul 10",8.0,,/YICILOVE-Moissanite-Girlfriend-Necklaces-Anniversary/dp/B0C4PWCHPL/ref=sr_1_8?dib=eyJ2IjoiMSJ9.pbDONWtRJBYEiWayROAmiee9sVRmd2wOV2JosxLBBg_G_q-hOLKKnqxM_jr79Rl0Br2LqxdGtv8jvoM7CznTCHPCuxmCkGrf27tQDJslCnG3dfXOOoP34gPdv7ZuGLghLlz1aCLvZcEAkjyHRgou9SKETORdfn3GoAioc3S8vMxkGiUmsdwJU2cBy7Wru_EQsW1AGJ7izrlWa7Zy_3gv-xSr2VPv_LpuDAN50J2sPRBXR95QDGAM6pqgslhoB-erXTRMgEa_ZnP5rHXb_NZd8TIpB7keb2kvcICSXcNRabg.-o7Qzd7RiOpdrqQABa3qTvJxCob-VMapMw0hbTCif3E&dib_tag=se&keywords=moissanite&qid=1720262228&s=apparel&sr=1-8,https://m.media-amazon.com/images/I/61dXetozj+L._AC_UL320_.jpg,organic,7454927011,moissanite,1,7,683.82,0.0,0.0
B0C33BC5Y2,113.59,"Heart Necklace Gift for Women, Sparkling Gift for Her, 1Carat Moissanite Heart Pendent for Girls, 925 Sterling Silver Dance Necklace for Anniversary Mother's Day Valentines Gift",4.5,USD,True,False,113.59,False,,,1,295,False,157.77,"FREE delivery Thu, Jul 11",9.0,,/MomentWish-Valentines-Moissanite-Necklaces-Anniversary/dp/B0C33BC5Y2/ref=sr_1_9?dib=eyJ2IjoiMSJ9.pbDONWtRJBYEiWayROAmiee9sVRmd2wOV2JosxLBBg_G_q-hOLKKnqxM_jr79Rl0Br2LqxdGtv8jvoM7CznTCHPCuxmCkGrf27tQDJslCnG3dfXOOoP34gPdv7ZuGLghLlz1aCLvZcEAkjyHRgou9SKETORdfn3GoAioc3S8vMxkGiUmsdwJU2cBy7Wru_EQsW1AGJ7izrlWa7Zy_3gv-xSr2VPv_LpuDAN50J2sPRBXR95QDGAM6pqgslhoB-erXTRMgEa_ZnP5rHXb_NZd8TIpB7keb2kvcICSXcNRabg.-o7Qzd7RiOpdrqQABa3qTvJxCob-VMapMw0hbTCif3E&dib_tag=se&keywords=moissanite&qid=1720262228&s=apparel&sr=1-9,https://m.media-amazon.com/images/I/61Fq-fGQj4L._AC_UL320_.jpg,organic,7454927011,moissanite,1,8,33509.05,44.18000000000001,0.2800278886987387
B0CJDWDKQJ,49.99,"Moissanite Necklaces for Women, D-E Color VVS1 Clarity Moissanite Diamond Pendant, 925 Sterling Silver Necklace, 18 + 2 inch",4.7,USD,True,False,49.99,False,,,1,19,False,0.0,"FREE delivery Thu, Jul 11 Or fastest delivery Wed, Jul 10",10.0,,/WOAINI-Moissanite-Necklaces-Sterling-Necklace/dp/B0CJDWDKQJ/ref=sr_1_10?dib=eyJ2IjoiMSJ9.pbDONWtRJBYEiWayROAmiee9sVRmd2wOV2JosxLBBg_G_q-hOLKKnqxM_jr79Rl0Br2LqxdGtv8jvoM7CznTCHPCuxmCkGrf27tQDJslCnG3dfXOOoP34gPdv7ZuGLghLlz1aCLvZcEAkjyHRgou9SKETORdfn3GoAioc3S8vMxkGiUmsdwJU2cBy7Wru_EQsW1AGJ7izrlWa7Zy_3gv-xSr2VPv_LpuDAN50J2sPRBXR95QDGAM6pqgslhoB-erXTRMgEa_ZnP5rHXb_NZd8TIpB7keb2kvcICSXcNRabg.-o7Qzd7RiOpdrqQABa3qTvJxCob-VMapMw0hbTCif3E&dib_tag=se&keywords=moissanite&qid=1720262228&s=apparel&sr=1-10,https://m.media-amazon.com/images/I/51T8esUIs0L._AC_UL320_.jpg,organic,7454927011,moissanite,1,9,949.8100000000001,0.0,0.0
B0CXT7MSDQ,29.99,"Three Stone Moissanite Pendant Necklace, D Color Lab Created Diamond Sterling Silver Platinum Plated Bezel Pendant for Women Mother's Day Valentines Day Birthday Jewelry Gift",4.7,USD,True,False,29.99,False,,,1,4,False,0.0,"FREE delivery Thu, Jul 11 on $35 of items shipped by AmazonOr fastest delivery Wed, Jul 10",11.0,,/PROSTORY-Moissanite-Necklace-Sterling-Valentines/dp/B0CXT7MSDQ/ref=sr_1_11?dib=eyJ2IjoiMSJ9.pbDONWtRJBYEiWayROAmiee9sVRmd2wOV2JosxLBBg_G_q-hOLKKnqxM_jr79Rl0Br2LqxdGtv8jvoM7CznTCHPCuxmCkGrf27tQDJslCnG3dfXOOoP34gPdv7ZuGLghLlz1aCLvZcEAkjyHRgou9SKETORdfn3GoAioc3S8vMxkGiUmsdwJU2cBy7Wru_EQsW1AGJ7izrlWa7Zy_3gv-xSr2VPv_LpuDAN50J2sPRBXR95QDGAM6pqgslhoB-erXTRMgEa_ZnP5rHXb_NZd8TIpB7keb2kvcICSXcNRabg.-o7Qzd7RiOpdrqQABa3qTvJxCob-VMapMw0hbTCif3E&dib_tag=se&keywords=moissanite&qid=1720262228&s=apparel&sr=1-11,https://m.media-amazon.com/images/I/61qkLbG6w7L._AC_UL320_.jpg,organic,7454927011,moissanite,1,10,119.96,0.0,0.0
B0B12QKZQ8,35.99,"Moissanite Necklace for Women Sterling Silver, Station Tennis Choker Layering Bezel Set Chain, 2.5MM to 4MM Lab Created Diamond Dainty Simple Adjustable 16 Inch to 18 Inch",4.3,USD,True,False,35.99,False,,,1,57,False,0.0,"FREE delivery Thu, Jul 11 Or fastest delivery Mon, Jul 8",12.0,,/Necklace-Sterling-Moissanite-Graduation-DYUNQ/dp/B0B12QKZQ8/ref=sr_1_12?dib=eyJ2IjoiMSJ9.pbDONWtRJBYEiWayROAmiee9sVRmd2wOV2JosxLBBg_G_q-hOLKKnqxM_jr79Rl0Br2LqxdGtv8jvoM7CznTCHPCuxmCkGrf27tQDJslCnG3dfXOOoP34gPdv7ZuGLghLlz1aCLvZcEAkjyHRgou9SKETORdfn3GoAioc3S8vMxkGiUmsdwJU2cBy7Wru_EQsW1AGJ7izrlWa7Zy_3gv-xSr2VPv_LpuDAN50J2sPRBXR95QDGAM6pqgslhoB-erXTRMgEa_ZnP5rHXb_NZd8TIpB7keb2kvcICSXcNRabg.-o7Qzd7RiOpdrqQABa3qTvJxCob-VMapMw0hbTCif3E&dib_tag=se&keywords=moissanite&qid=1720262228&s=apparel&sr=1-12,https://m.media-amazon.com/images/I/51k8YRMDOTL._AC_UL320_.jpg,organic,7454927011,moissanite,1,11,2051.4300000000003,0.0,0.0
B08ZL2RLLD,58.9,"1-4CT Moissanite Pendant Necklace for Women, Halo Round 18K White Gold Plated Silver Diamond Necklace Gift for Wife Mother Her",4.3,USD,True,False,58.9,False,,,1,48,False,0.0,"FREE delivery Thu, Jul 11",13.0,,/SecreTalk-Moissanite-Necklace-Certificate-Authenticity/dp/B08ZL2RLLD/ref=sr_1_13?dib=eyJ2IjoiMSJ9.pbDONWtRJBYEiWayROAmiee9sVRmd2wOV2JosxLBBg_G_q-hOLKKnqxM_jr79Rl0Br2LqxdGtv8jvoM7CznTCHPCuxmCkGrf27tQDJslCnG3dfXOOoP34gPdv7ZuGLghLlz1aCLvZcEAkjyHRgou9SKETORdfn3GoAioc3S8vMxkGiUmsdwJU2cBy7Wru_EQsW1AGJ7izrlWa7Zy_3gv-xSr2VPv_LpuDAN50J2sPRBXR95QDGAM6pqgslhoB-erXTRMgEa_ZnP5rHXb_NZd8TIpB7keb2kvcICSXcNRabg.-o7Qzd7RiOpdrqQABa3qTvJxCob-VMapMw0hbTCif3E&dib_tag=se&keywords=moissanite&qid=1720262228&s=apparel&sr=1-13,https://m.media-amazon.com/images/I/612+mRnRyQL._AC_UL320_.jpg,organic,7454927011,moissanite,1,12,2827.2,0.0,0.0
B08HYFG8V4,35.99,"Moissanite Necklace for Women, 0.5-3 CT Solitaire Moissanite Diamond Pendant，18K White Gold Plated 925 Sterling Silver Necklace, Gifts for Women Her Wife Girlfriend Mom Jewelry, GRA Certified, 18 inch",4.7,USD,True,False,35.99,False,,,1,107,False,0.0,"FREE delivery Thu, Jul 11 Or fastest delivery Wed, Jul 10",14.0,,/WOAINI-Sterling-Brilliant-Moissanite-Solitaire/dp/B08HYFG8V4/ref=sr_1_14?dib=eyJ2IjoiMSJ9.pbDONWtRJBYEiWayROAmiee9sVRmd2wOV2JosxLBBg_G_q-hOLKKnqxM_jr79Rl0Br2LqxdGtv8jvoM7CznTCHPCuxmCkGrf27tQDJslCnG3dfXOOoP34gPdv7ZuGLghLlz1aCLvZcEAkjyHRgou9SKETORdfn3GoAioc3S8vMxkGiUmsdwJU2cBy7Wru_EQsW1AGJ7izrlWa7Zy_3gv-xSr2VPv_LpuDAN50J2sPRBXR95QDGAM6pqgslhoB-erXTRMgEa_ZnP5rHXb_NZd8TIpB7keb2kvcICSXcNRabg.-o7Qzd7RiOpdrqQABa3qTvJxCob-VMapMw0hbTCif3E&dib_tag=se&keywords=moissanite&qid=1720262228&s=apparel&sr=1-14,https://m.media-amazon.com/images/I/51gBNBHnhRL._AC_UL320_.jpg,organic,7454927011,moissanite,1,13,3850.9300000000003,0.0,0.0
B0BT8BC3JX,15.99,Moissanite Cross Necklace | 0.17 Cttw | 17X12MM | Jesus Christian Reiligous Crucifix Jewelry Pendant Necklace for Women | with 18 Inch Chain,3.7,USD,True,False,15.99,False,,,1,7,False,0.0,"FREE delivery Thu, Jul 11 on $35 of items shipped by AmazonOr fastest delivery Wed, Jul 10",15.0,,/Gem-Stone-King-Moissanite-Necklace/dp/B0BT8BC3JX/ref=sr_1_15?dib=eyJ2IjoiMSJ9.pbDONWtRJBYEiWayROAmiee9sVRmd2wOV2JosxLBBg_G_q-hOLKKnqxM_jr79Rl0Br2LqxdGtv8jvoM7CznTCHPCuxmCkGrf27tQDJslCnG3dfXOOoP34gPdv7ZuGLghLlz1aCLvZcEAkjyHRgou9SKETORdfn3GoAioc3S8vMxkGiUmsdwJU2cBy7Wru_EQsW1AGJ7izrlWa7Zy_3gv-xSr2VPv_LpuDAN50J2sPRBXR95QDGAM6pqgslhoB-erXTRMgEa_ZnP5rHXb_NZd8TIpB7keb2kvcICSXcNRabg.-o7Qzd7RiOpdrqQABa3qTvJxCob-VMapMw0hbTCif3E&dib_tag=se&keywords=moissanite&qid=1720262228&s=apparel&sr=1-15,https://m.media-amazon.com/images/I/61hws964sLL._AC_UL320_.jpg,organic,7454927011,moissanite,1,14,111.93,0.0,0.0
B09Q5MFDZF,45.9,"1-4CT Moissanite 4P Pendant Necklace for Women, 1-4CT D-F Color Ideal Cut 925 Sterling Silver Solitaire Diamond Necklace with Certificate of Authenticity",4.3,USD,True,False,45.9,False,,,1,54,False,0.0,"FREE delivery Thu, Jul 11 Or fastest delivery Tomorrow, Jul 7",16.0,,/Moissanite-Necklace-Solitaire-Certificate-Authenticity/dp/B09Q5MFDZF/ref=sr_1_16?dib=eyJ2IjoiMSJ9.pbDONWtRJBYEiWayROAmiee9sVRmd2wOV2JosxLBBg_G_q-hOLKKnqxM_jr79Rl0Br2LqxdGtv8jvoM7CznTCHPCuxmCkGrf27tQDJslCnG3dfXOOoP34gPdv7ZuGLghLlz1aCLvZcEAkjyHRgou9SKETORdfn3GoAioc3S8vMxkGiUmsdwJU2cBy7Wru_EQsW1AGJ7izrlWa7Zy_3gv-xSr2VPv_LpuDAN50J2sPRBXR95QDGAM6pqgslhoB-erXTRMgEa_ZnP5rHXb_NZd8TIpB7keb2kvcICSXcNRabg.-o7Qzd7RiOpdrqQABa3qTvJxCob-VMapMw0hbTCif3E&dib_tag=se&keywords=moissanite&qid=1720262228&s=apparel&sr=1-16,https://m.media-amazon.com/images/I/61THUcFsb1L._AC_UL320_.jpg,organic,7454927011,moissanite,1,15,2478.6,0.0,0.0
B0CXLF88WF,52.99,"2ct Oval Moissanite Pendant Necklace, D Color VVS1 Lab Created Diamond, Sterling Silver Platinum Plated Dainty Pendant for Women Wife Girlfriend Mothers Day Jewelry Gifts",5.0,USD,True,False,52.99,False,,,1,2,False,0.0,"FREE delivery Thu, Jul 11 Or fastest delivery Tomorrow, Jul 7",17.0,,/EONFUN-Moissanite-Necklace-Sterling-Girlfriend/dp/B0CXLF88WF/ref=sr_1_17?dib=eyJ2IjoiMSJ9.pbDONWtRJBYEiWayROAmiee9sVRmd2wOV2JosxLBBg_G_q-hOLKKnqxM_jr79Rl0Br2LqxdGtv8jvoM7CznTCHPCuxmCkGrf27tQDJslCnG3dfXOOoP34gPdv7ZuGLghLlz1aCLvZcEAkjyHRgou9SKETORdfn3GoAioc3S8vMxkGiUmsdwJU2cBy7Wru_EQsW1AGJ7izrlWa7Zy_3gv-xSr2VPv_LpuDAN50J2sPRBXR95QDGAM6pqgslhoB-erXTRMgEa_ZnP5rHXb_NZd8TIpB7keb2kvcICSXcNRabg.-o7Qzd7RiOpdrqQABa3qTvJxCob-VMapMw0hbTCif3E&dib_tag=se&keywords=moissanite&qid=1720262228&s=apparel&sr=1-17,https://m.media-amazon.com/images/I/61vSAVtUhQL._AC_UL320_.jpg,organic,7454927011,moissanite,1,16,105.98,0.0,0.0
B0CT5HCJWS,29.99,"Moissanite Pendant Necklace for Women, D Color Lab Created Diamond 18K Gold Plated Sterling Silver 3 Stone Pendant for Mon Girlfriend Birthday Valentines Day Gift",3.8,USD,True,False,29.99,False,,,1,5,False,0.0,"FREE delivery Thu, Jul 11 on $35 of items shipped by AmazonOr fastest delivery Tomorrow, Jul 7",18.0,,/PROSTORY-Moissanite-Necklace-Girlfriend-Valentines/dp/B0CT5HCJWS/ref=sr_1_18?dib=eyJ2IjoiMSJ9.pbDONWtRJBYEiWayROAmiee9sVRmd2wOV2JosxLBBg_G_q-hOLKKnqxM_jr79Rl0Br2LqxdGtv8jvoM7CznTCHPCuxmCkGrf27tQDJslCnG3dfXOOoP34gPdv7ZuGLghLlz1aCLvZcEAkjyHRgou9SKETORdfn3GoAioc3S8vMxkGiUmsdwJU2cBy7Wru_EQsW1AGJ7izrlWa7Zy_3gv-xSr2VPv_LpuDAN50J2sPRBXR95QDGAM6pqgslhoB-erXTRMgEa_ZnP5rHXb_NZd8TIpB7keb2kvcICSXcNRabg.-o7Qzd7RiOpdrqQABa3qTvJxCob-VMapMw0hbTCif3E&dib_tag=se&keywords=moissanite&qid=1720262228&s=apparel&sr=1-18,https://m.media-amazon.com/images/I/61BAfRbIktL._AC_UL320_.jpg,organic,7454927011,moissanite,1,17,149.95,0.0,0.0
B0C61GDBV2,45.9,"1-5CT Moissanite Pendant Necklace for Women, 4-Prong 18K White Gold Plated Silver D Color Ideal Cut Diamond Necklace with Certificate of Authenticity",4.4,USD,True,False,45.9,False,,,1,19,False,0.0,"FREE delivery Thu, Jul 11 Or fastest delivery Tomorrow, Jul 7",19.0,,/SecreTalk-Moissanite-Necklace-Certificate-Authenticity/dp/B0C61GDBV2/ref=sr_1_19?dib=eyJ2IjoiMSJ9.pbDONWtRJBYEiWayROAmiee9sVRmd2wOV2JosxLBBg_G_q-hOLKKnqxM_jr79Rl0Br2LqxdGtv8jvoM7CznTCHPCuxmCkGrf27tQDJslCnG3dfXOOoP34gPdv7ZuGLghLlz1aCLvZcEAkjyHRgou9SKETORdfn3GoAioc3S8vMxkGiUmsdwJU2cBy7Wru_EQsW1AGJ7izrlWa7Zy_3gv-xSr2VPv_LpuDAN50J2sPRBXR95QDGAM6pqgslhoB-erXTRMgEa_ZnP5rHXb_NZd8TIpB7keb2kvcICSXcNRabg.-o7Qzd7RiOpdrqQABa3qTvJxCob-VMapMw0hbTCif3E&dib_tag=se&keywords=moissanite&qid=1720262228&s=apparel&sr=1-19,https://m.media-amazon.com/images/I/61y1n2XhOtL._AC_UL320_.jpg,organic,7454927011,moissanite,1,18,872.1,0.0,0.0
B097G5ZTN7,39.9,"Moissanite Necklace for Women Men, 1ct-5ct Lab Created Moissanite Diamond Pendant Necklace，925 Sterling Silver necklace, Safety Friction Back",4.2,USD,True,False,39.9,False,,,1,95,False,0.0,"FREE delivery Thu, Jul 11 Or fastest delivery Wed, Jul 10",20.0,,/Moissanite-Necklace-1ct-2ct-DEF-Color-Lab-Necklace，925/dp/B097G5ZTN7/ref=sr_1_20?dib=eyJ2IjoiMSJ9.pbDONWtRJBYEiWayROAmiee9sVRmd2wOV2JosxLBBg_G_q-hOLKKnqxM_jr79Rl0Br2LqxdGtv8jvoM7CznTCHPCuxmCkGrf27tQDJslCnG3dfXOOoP34gPdv7ZuGLghLlz1aCLvZcEAkjyHRgou9SKETORdfn3GoAioc3S8vMxkGiUmsdwJU2cBy7Wru_EQsW1AGJ7izrlWa7Zy_3gv-xSr2VPv_LpuDAN50J2sPRBXR95QDGAM6pqgslhoB-erXTRMgEa_ZnP5rHXb_NZd8TIpB7keb2kvcICSXcNRabg.-o7Qzd7RiOpdrqQABa3qTvJxCob-VMapMw0hbTCif3E&dib_tag=se&keywords=moissanite&qid=1720262228&s=apparel&sr=1-20,https://m.media-amazon.com/images/I/61NRV-a8bTL._AC_UL320_.jpg,organic,7454927011,moissanite,1,19,3790.5,0.0,0.0
B0BVMHB3D3,39.99,"Moissanite Necklace for Women, 1-3 CT Solitaire Pendant 925 Sterling Silver Diamond Necklaces Round D-E Color VVS1 Clarity White Gold Plated Necklaces Mother's Day Wedding Gifts for Her",4.4,USD,True,False,39.99,False,,,1,65,False,0.0,"FREE delivery Thu, Jul 11 Or fastest delivery Wed, Jul 10",21.0,,/Moissanite-Necklace-Solitaire-Sterling-Necklaces/dp/B0BVMHB3D3/ref=sr_1_21?dib=eyJ2IjoiMSJ9.pbDONWtRJBYEiWayROAmiee9sVRmd2wOV2JosxLBBg_G_q-hOLKKnqxM_jr79Rl0Br2LqxdGtv8jvoM7CznTCHPCuxmCkGrf27tQDJslCnG3dfXOOoP34gPdv7ZuGLghLlz1aCLvZcEAkjyHRgou9SKETORdfn3GoAioc3S8vMxkGiUmsdwJU2cBy7Wru_EQsW1AGJ7izrlWa7Zy_3gv-xSr2VPv_LpuDAN50J2sPRBXR95QDGAM6pqgslhoB-erXTRMgEa_ZnP5rHXb_NZd8TIpB7keb2kvcICSXcNRabg.-o7Qzd7RiOpdrqQABa3qTvJxCob-VMapMw0hbTCif3E&dib_tag=se&keywords=moissanite&qid=1720262228&s=apparel&sr=1-21,https://m.media-amazon.com/images/I/51IfxzKYtqL._AC_UL320_.jpg,organic,7454927011,moissanite,1,20,2599.35,0.0,0.0
B0BKSX7JQB,69.49,Moissanite Necklace Halo Diamond Pendant for Women 0.5CT-4.0CT 18K White/Yellow Gold Plated Sterling Silver Necklace Dainty Pendant Anniversary Day Gifts for Her Wife Mother 18+2 inches Lab Created Dimaond Jewelry with GRA Certificate of Authenticity,4.4,USD,True,False,69.49,False,,,1,107,False,0.0,"FREE delivery Thu, Jul 11 Or fastest delivery Tomorrow, Jul 7",22.0,,/Moissanite-0-5CT-4-0CT-Anniversary-Certificate-Authenticity/dp/B0BKSX7JQB/ref=sr_1_22?dib=eyJ2IjoiMSJ9.pbDONWtRJBYEiWayROAmiee9sVRmd2wOV2JosxLBBg_G_q-hOLKKnqxM_jr79Rl0Br2LqxdGtv8jvoM7CznTCHPCuxmCkGrf27tQDJslCnG3dfXOOoP34gPdv7ZuGLghLlz1aCLvZcEAkjyHRgou9SKETORdfn3GoAioc3S8vMxkGiUmsdwJU2cBy7Wru_EQsW1AGJ7izrlWa7Zy_3gv-xSr2VPv_LpuDAN50J2sPRBXR95QDGAM6pqgslhoB-erXTRMgEa_ZnP5rHXb_NZd8TIpB7keb2kvcICSXcNRabg.-o7Qzd7RiOpdrqQABa3qTvJxCob-VMapMw0hbTCif3E&dib_tag=se&keywords=moissanite&qid=1720262228&s=apparel&sr=1-22,https://m.media-amazon.com/images/I/61bJj+w-HBL._AC_UL320_.jpg,organic,7454927011,moissanite,1,21,7435.429999999999,0.0,0.0
B0CQCS9FYM,27.26,"Moissanite Necklace for Women,0.5-2ct Sterling Silver Necklace Diamond Jewelry for Women Birthday Gifts for Her Girlfriend",4.9,USD,True,False,27.26,False,,,1,39,False,37.99,"FREE delivery Thu, Jul 11 on $35 of items shipped by AmazonOr fastest delivery Wed, Jul 10",23.0,,/HOMIGIFTY-Moissanite-Girlfriend-Graduation-Appreciation/dp/B0CQCS9FYM/ref=sr_1_23?dib=eyJ2IjoiMSJ9.pbDONWtRJBYEiWayROAmiee9sVRmd2wOV2JosxLBBg_G_q-hOLKKnqxM_jr79Rl0Br2LqxdGtv8jvoM7CznTCHPCuxmCkGrf27tQDJslCnG3dfXOOoP34gPdv7ZuGLghLlz1aCLvZcEAkjyHRgou9SKETORdfn3GoAioc3S8vMxkGiUmsdwJU2cBy7Wru_EQsW1AGJ7izrlWa7Zy_3gv-xSr2VPv_LpuDAN50J2sPRBXR95QDGAM6pqgslhoB-erXTRMgEa_ZnP5rHXb_NZd8TIpB7keb2kvcICSXcNRabg.-o7Qzd7RiOpdrqQABa3qTvJxCob-VMapMw0hbTCif3E&dib_tag=se&keywords=moissanite&qid=1720262228&s=apparel&sr=1-23,https://m.media-amazon.com/images/I/71uN-26xfVL._AC_UL320_.jpg,organic,7454927011,moissanite,1,22,1063.14,10.73,0.282442748091603
B09V2DDFSC,39.95,Sterling Silver Moissanite Pendant Necklace:1 Carat Round Cut Moissanite Solitaire Diamond Necklace with White Gold Plated Chain - Trendy Infinity Knot Gem Jewelry for Women,4.5,USD,True,False,39.95,False,,,1,55,False,0.0,"FREE delivery Thu, Jul 11 Or fastest delivery Wed, Jul 10",24.0,,/Sterling-Silver-Moissanite-Pendant-Necklace/dp/B09V2DDFSC/ref=sr_1_24?dib=eyJ2IjoiMSJ9.pbDONWtRJBYEiWayROAmiee9sVRmd2wOV2JosxLBBg_G_q-hOLKKnqxM_jr79Rl0Br2LqxdGtv8jvoM7CznTCHPCuxmCkGrf27tQDJslCnG3dfXOOoP34gPdv7ZuGLghLlz1aCLvZcEAkjyHRgou9SKETORdfn3GoAioc3S8vMxkGiUmsdwJU2cBy7Wru_EQsW1AGJ7izrlWa7Zy_3gv-xSr2VPv_LpuDAN50J2sPRBXR95QDGAM6pqgslhoB-erXTRMgEa_ZnP5rHXb_NZd8TIpB7keb2kvcICSXcNRabg.-o7Qzd7RiOpdrqQABa3qTvJxCob-VMapMw0hbTCif3E&dib_tag=se&keywords=moissanite&qid=1720262228&s=apparel&sr=1-24,https://m.media-amazon.com/images/I/51FRkMO-oDL._AC_UL320_.jpg,organic,7454927011,moissanite,1,23,2197.25,0.0,0.0
B0CTK8286D,156.88,"Moissanite Pendant Necklace for Women | 925 Sterling Silver 1-5CT Moissanite Diamond Heart Necklace Gift for Wife D-Color-VVS1 | Anniversary Romantic Gift for Her,Birthday Gifts for Mom Daughter Women",4.8,USD,True,False,156.88,False,,,1,35,False,0.0,"FREE delivery Thu, Jul 11",25.0,,/N9NEMUSES-Moissanite-Anniversary-Valentine-Girlfriend/dp/B0CTK8286D/ref=sr_1_25?dib=eyJ2IjoiMSJ9.pbDONWtRJBYEiWayROAmiee9sVRmd2wOV2JosxLBBg_G_q-hOLKKnqxM_jr79Rl0Br2LqxdGtv8jvoM7CznTCHPCuxmCkGrf27tQDJslCnG3dfXOOoP34gPdv7ZuGLghLlz1aCLvZcEAkjyHRgou9SKETORdfn3GoAioc3S8vMxkGiUmsdwJU2cBy7Wru_EQsW1AGJ7izrlWa7Zy_3gv-xSr2VPv_LpuDAN50J2sPRBXR95QDGAM6pqgslhoB-erXTRMgEa_ZnP5rHXb_NZd8TIpB7keb2kvcICSXcNRabg.-o7Qzd7RiOpdrqQABa3qTvJxCob-VMapMw0hbTCif3E&dib_tag=se&keywords=moissanite&qid=1720262228&s=apparel&sr=1-25,https://m.media-amazon.com/images/I/71LilWIp0rL._AC_UL320_.jpg,organic,7454927011,moissanite,1,24,5490.8,0.0,0.0
B0BC3TS84Y,28.99,Moissanite necklaces for women Lab Created Diamond Round Moissanite Pendant Solitaire Necklace Chain Adjustable 18K WhiteGold Plated Sterling Silver Necklace Gift for Mother Mom Wife Girlfriend,4.4,USD,True,False,28.99,False,,,1,61,False,39.99,"FREE delivery Thu, Jul 11 on $35 of items shipped by AmazonOr fastest delivery Wed, Jul 10",26.0,,/ZYI-Moissanite-Pendant-necklace-1-0ct/dp/B0BC3TS84Y/ref=sr_1_26?dib=eyJ2IjoiMSJ9.pbDONWtRJBYEiWayROAmiee9sVRmd2wOV2JosxLBBg_G_q-hOLKKnqxM_jr79Rl0Br2LqxdGtv8jvoM7CznTCHPCuxmCkGrf27tQDJslCnG3dfXOOoP34gPdv7ZuGLghLlz1aCLvZcEAkjyHRgou9SKETORdfn3GoAioc3S8vMxkGiUmsdwJU2cBy7Wru_EQsW1AGJ7izrlWa7Zy_3gv-xSr2VPv_LpuDAN50J2sPRBXR95QDGAM6pqgslhoB-erXTRMgEa_ZnP5rHXb_NZd8TIpB7keb2kvcICSXcNRabg.-o7Qzd7RiOpdrqQABa3qTvJxCob-VMapMw0hbTCif3E&dib_tag=se&keywords=moissanite&qid=1720262228&s=apparel&sr=1-26,https://m.media-amazon.com/images/I/51DJwguunML._AC_UL320_.jpg,organic,7454927011,moissanite,1,25,1768.3899999999999,11.000000000000004,0.275068767191798
B0B2PG25H4,35.99,"Moissanite Pendant Necklace, 925 Sterling Silver Lab Created Diamond Necklaces for Women White Gold Plated 3 Stone Pendant, 18 to 20 Inch, Jewelry Gifts",4.4,USD,True,False,35.99,False,,,1,79,False,0.0,"FREE delivery Thu, Jul 11 Or fastest delivery Wed, Jul 10",27.0,,/DYUNQ-Moissanite-Necklaces-Anniversary-Girlfriend/dp/B0B2PG25H4/ref=sr_1_27?dib=eyJ2IjoiMSJ9.pbDONWtRJBYEiWayROAmiee9sVRmd2wOV2JosxLBBg_G_q-hOLKKnqxM_jr79Rl0Br2LqxdGtv8jvoM7CznTCHPCuxmCkGrf27tQDJslCnG3dfXOOoP34gPdv7ZuGLghLlz1aCLvZcEAkjyHRgou9SKETORdfn3GoAioc3S8vMxkGiUmsdwJU2cBy7Wru_EQsW1AGJ7izrlWa7Zy_3gv-xSr2VPv_LpuDAN50J2sPRBXR95QDGAM6pqgslhoB-erXTRMgEa_ZnP5rHXb_NZd8TIpB7keb2kvcICSXcNRabg.-o7Qzd7RiOpdrqQABa3qTvJxCob-VMapMw0hbTCif3E&dib_tag=se&keywords=moissanite&qid=1720262228&s=apparel&sr=1-27,https://m.media-amazon.com/images/I/519eu-NBoRL._AC_UL320_.jpg,organic,7454927011,moissanite,1,26,2843.21,0.0,0.0
