asin,price,title,rating,currency,is_prime,best_seller,price_upper,is_sponsored,manufacturer,sales_volume,pricing_count,reviews_count,is_amazons_choice,price_strikethrough,shipping_information,pos,rel_pos,url_image,source,category_id,keyword,page,position,min_revenue,discount,discount_rate
B0BZVBG87W,9.99,Dainty Gold Bracelet for Women 14K Gold Plated Lightweight Chain Bracelet Herringbone Pearl Circle Bracelet Charm Minimalist Handmade Jewelry Gift,4.3,USD,True,False,9.99,False,,100+ bought in past month,1,101,False,12.99,"FREE delivery Mon, Aug 12 on $35 of items shipped by AmazonOr fastest delivery Tomorrow, Aug 8",12.0,,https://m.media-amazon.com/images/I/61u9lRU4vnL._AC_UL320_.jpg,organic,7454898011,pearl,2,58,1008.99,3.0,0.23094688221709006
B0129XIU9S,9.99,Ladies 3 Rows Faux Pearls Accent Off White Stretch Wrist Bracelet Jewelry,4.6,USD,True,False,9.99,False,,100+ bought in past month,1,748,False,0.0,"FREE delivery Mon, Aug 12 on $35 of items shipped by AmazonOr fastest delivery Tomorrow, Aug 8",13.0,,https://m.media-amazon.com/images/I/611ZC9g2ijL._AC_UL320_.jpg,organic,7454898011,pearl,2,59,7472.52,0.0,0.0
B0CYC64G6Z,9.99,"Initial Pearl Bracelets for Women Trendy,18k Gold Plated Dainty Heart Charm Bracelets for Women Beaded Bracelet Jewelry Gifts Wedding Gifts",5.0,USD,True,False,9.99,False,,,1,7,False,12.99,"FREE delivery Mon, Aug 12 on $35 of items shipped by AmazonOr fastest delivery Tomorrow, Aug 8",14.0,,https://m.media-amazon.com/images/I/41IUn4UPdUL._AC_UL320_.jpg,organic,7454898011,pearl,2,60,69.93,3.0,0.23094688221709006
B0B5G8LTK3,14.99,Dainty Gold Bar Bracelet for Women Simple Delicate Thin Cuff Bangle Hook Bracelet 18K Gold Plated Handmade Minimalist Jewelry,4.3,USD,True,False,14.99,False,,,1,4152,False,0.0,"FREE delivery Mon, Aug 12 on $35 of items shipped by AmazonOr fastest delivery Tomorrow, Aug 8",15.0,,https://m.media-amazon.com/images/I/61rgOSywuIL._AC_UL320_.jpg,organic,7454898011,pearl,2,61,62238.48,0.0,0.0
B0CRHCRHCJ,13.99,Dainty Gold Bracelet for Women 14K Gold Plated Lightweight Chain Bracelet Herringbone Twisted Rope Box Mesh Bracelet Charm Minimalist Handmade Jewelry Gift,4.4,USD,True,False,13.99,False,,50+ bought in past month,1,550,False,0.0,"FREE delivery Mon, Aug 12 on $35 of items shipped by AmazonOr fastest delivery Tomorrow, Aug 8",16.0,,https://m.media-amazon.com/images/I/51n2JX92J2L._AC_UL320_.jpg,organic,7454898011,pearl,2,62,7694.5,0.0,0.0
B0BV9Q62BL,7.99,10 Pcs Faux Pearl Bracelets for Women Pearl Bracelets for Bridesmaid Stretch Beaded Bracelets for Wedding Bridal Party,4.4,USD,True,False,7.99,False,,50+ bought in past month,1,57,False,0.0,"FREE delivery Mon, Aug 12 on $35 of items shipped by AmazonOr fastest delivery Tomorrow, Aug 8",17.0,,https://m.media-amazon.com/images/I/612+RnbBFSL._AC_UL320_.jpg,organic,7454898011,pearl,2,63,455.43,0.0,0.0
B0B7KZM87K,14.99,Bracelet for Women 14K Gold Plated Dainty Chain Simple Jewelry Cute Handmade Minimalist for Her,4.5,USD,True,False,14.99,False,,100+ bought in past month,1,10818,False,0.0,"FREE delivery Mon, Aug 12 on $35 of items shipped by AmazonOr fastest delivery Tomorrow, Aug 8",18.0,,https://m.media-amazon.com/images/I/61VXkYhhH8L._AC_UL320_.jpg,organic,7454898011,pearl,2,64,162161.82,0.0,0.0
B09YTSKD8C,10.39,Dainty Bracelet for Women 14K Gold Plated Cross Pearl CZ Leaf Bracelets Set Gold Layering Bracelets Everyday Jewelry,4.5,USD,True,False,10.39,False,,,1,465,False,12.99,"FREE delivery Mon, Aug 12 on $35 of items shipped by AmazonOr fastest delivery Tomorrow, Aug 8",19.0,,https://m.media-amazon.com/images/I/61Ji1qsBb5L._AC_UL320_.jpg,organic,7454898011,pearl,2,65,4831.35,2.5999999999999996,0.2001539645881447
B0CHR6SVW3,4.99,Cross Bracelet for Women 18K Gold Plated Cuban Chain Link Bracelet Gold Bracelet for Women Confirmation Gifts for Girls,4.1,USD,True,False,4.99,False,,,1,19,False,9.99,"FREE delivery Mon, Aug 12 on $35 of items shipped by AmazonOr fastest delivery Tomorrow, Aug 8",20.0,,https://m.media-amazon.com/images/I/61TAihCebjL._AC_UL320_.jpg,organic,7454898011,pearl,2,66,94.81,5.0,0.5005005005005005
B0CW8HZ26Y,8.19,2-8Pcs 1920s Flapper Imitation Pearl Bracelet 3-Rows Stretch Bracelet Multi-Layered Elastic Bangle Bridal Wedding Jewelry Roaring 20s Accessories Jewelry,5.0,USD,True,False,8.19,False,,50+ bought in past month,1,2,False,9.99,"FREE delivery Tue, Aug 13 on $35 of items shipped by AmazonOr fastest delivery Fri, Aug 9",21.0,,https://m.media-amazon.com/images/I/61LePtCdMUL._AC_UL320_.jpg,organic,7454898011,pearl,2,67,16.38,1.8000000000000007,0.18018018018018025
B0CF1NPS69,15.99,Gold Beaded Bracelets for Women Baroque Pearl Stackable14K Gold Plated Stretch Bead Ball Bracelet Jewelry Gifts,4.4,USD,True,False,15.99,False,,,1,132,False,0.0,"FREE delivery Mon, Aug 12 on $35 of items shipped by AmazonOr fastest delivery Tomorrow, Aug 8",22.0,,https://m.media-amazon.com/images/I/61sB90NxBoL._AC_UL320_.jpg,organic,7454898011,pearl,2,68,2110.68,0.0,0.0
B09TC1B524,10.99,Women's Simulated Pearl Stretch Bracelet 5 PCS Set,4.5,USD,True,False,10.99,False,,50+ bought in past month,1,347,False,0.0,"FREE delivery Mon, Aug 12 on $35 of items shipped by AmazonOr fastest delivery Tomorrow, Aug 8",23.0,,https://m.media-amazon.com/images/I/61kg-7f8Y0L._AC_UL320_.jpg,organic,7454898011,pearl,2,69,3813.53,0.0,0.0
B0C1ZXMJ1Q,23.99,"8-9MM Cultured Freshwater Baroque Pearl Stretch Bracelet 7 Inches. Available In a Range of Beautiful Colors, For Women Comes with Gift Box",4.7,USD,True,False,23.99,False,,50+ bought in past month,1,57,False,0.0,"FREE delivery Mon, Aug 12 on $35 of items shipped by AmazonOr fastest delivery Tomorrow, Aug 8",24.0,,https://m.media-amazon.com/images/I/41phA6zos-L._AC_UL320_.jpg,organic,7454898011,pearl,2,70,1367.4299999999998,0.0,0.0
B0BHQJH72L,9.98,Dainty Rhinestone 1920s Silver Gold Fake Pearl Open Bangle Bracelet Wedding Sparkly Layered Wrap Cuff Bangle Bracelet Adjustable Pearl Bracelets for Women Brides Girls,4.4,USD,True,False,9.98,False,,50+ bought in past month,1,22,False,0.0,"FREE delivery Mon, Aug 12 on $35 of items shipped by AmazonOr fastest delivery Tomorrow, Aug 8",25.0,,https://m.media-amazon.com/images/I/61mFjkE-PoL._AC_UL320_.jpg,organic,7454898011,pearl,2,71,219.56,0.0,0.0
B0CZQSXVXW,10.99,Healing Stone Beaded Bracelets for Women Semi-Precious Gemstones Bracelets Pearl Beaded Bracelet Adjustable Strand Bracelets 6MM,4.5,USD,True,False,10.99,False,,,1,185,False,0.0,"FREE delivery Tue, Aug 13 on $35 of items shipped by AmazonOr fastest delivery Fri, Aug 9",26.0,,https://m.media-amazon.com/images/I/51UQMd-P5SL._AC_UL320_.jpg,organic,7454898011,pearl,2,72,2033.15,0.0,0.0
B0BD4VG87Q,4.99,Leather Bracelets for Women Trendy Teen Girls Simulated Pearl Bracelet Beaded Boho Jewelry Sister Daughter Mother Gifts,4.7,USD,True,False,4.99,False,,,1,9,False,0.0,"FREE delivery Mon, Aug 12 on $35 of items shipped by AmazonOr fastest delivery Tomorrow, Aug 8",27.0,,https://m.media-amazon.com/images/I/71kNAa33TiL._AC_UL320_.jpg,organic,7454898011,pearl,2,73,44.910000000000004,0.0,0.0
B01NBE5HHM,56.37,"Elaina Adjustable Chain Bracelet for Women, Fashion Jewelry, Gold-Plated",4.3,USD,True,False,56.37,False,,100+ bought in past month,1,83,False,65.0,"FREE delivery Tue, Aug 13 Or fastest delivery Fri, Aug 9",28.0,,https://m.media-amazon.com/images/I/61dbPtMo+9L._AC_UL320_.jpg,organic,7454898011,pearl,2,74,4678.71,8.630000000000003,0.1327692307692308
B09J2B8K29,9.99,1920s Flapper Imitation Pearl Bracelet Great Gatsby Pearl Bracelet Roaring 20s Accessories Jewelry Set,4.6,USD,True,False,9.99,False,,100+ bought in past month,1,167,False,0.0,"FREE delivery Mon, Aug 12 on $35 of items shipped by AmazonOr fastest delivery Tomorrow, Aug 8",29.0,,https://m.media-amazon.com/images/I/51Y9waHf37L._AC_UL320_.jpg,organic,7454898011,pearl,2,75,1668.33,0.0,0.0
B0C857GDBQ,11.04,"Gold Bracelets for Women,Dainty Bracelets Set for Women Trendy, Gold Bracelets Stack With Beaded, Cuban, Paperclip, Heart, Snake, Rope, Pearl, Cross, Hand Chain, Silver Jewelry Gifts for Women Mom",4.3,USD,True,False,11.04,False,,50+ bought in past month,1,694,False,12.99,"FREE delivery Tue, Aug 13 on $35 of items shipped by AmazonOr fastest delivery Fri, Aug 9",30.0,,https://m.media-amazon.com/images/I/61PqIE5xtsL._AC_UL320_.jpg,organic,7454898011,pearl,2,76,7661.759999999999,1.950000000000001,0.15011547344110862
B0BJQ28TJF,12.98,Wedding Silver Gold Pearl Rhinestone Multi Layered Stretch Wrap Bracelet 1920s Vintage Strand Layered Bracelet Gift for Women Brides,4.5,USD,True,False,12.98,False,,100+ bought in past month,1,99,False,0.0,"FREE delivery Mon, Aug 12 on $35 of items shipped by AmazonOr fastest delivery Tomorrow, Aug 8",31.0,,https://m.media-amazon.com/images/I/718NRtYFCpL._AC_UL320_.jpg,organic,7454898011,pearl,2,77,1285.02,0.0,0.0
B0C21RXQPT,23.99,8MM Cultured Freshwater Natural White Pearl Crystal Bead Stretch Bracelet 7 inches for Women Comes with Gift Box,4.6,USD,True,False,23.99,False,,50+ bought in past month,1,56,False,0.0,"FREE delivery Mon, Aug 12 on $35 of items shipped by AmazonOr fastest delivery Tomorrow, Aug 8",32.0,,https://m.media-amazon.com/images/I/41P9VQ1EbfL._AC_UL320_.jpg,organic,7454898011,pearl,2,78,1343.4399999999998,0.0,0.0
B0CNP2WKQG,9.99,Pearl Bracelet Gold Bracelets for Women Pearl Beaded Bracelet Adjustable Pearl Cuff Bangle Bracelet Daisy Flower Bracelet Link Bracelet Dainty Bracelets for Women Bridal Bracelet Wedding Jewelry,4.2,USD,True,False,9.99,False,,,1,4,False,0.0,"FREE delivery Mon, Aug 12 on $35 of items shipped by AmazonOr fastest delivery Tomorrow, Aug 8",33.0,,https://m.media-amazon.com/images/I/51T7SkgvBrL._AC_UL320_.jpg,organic,7454898011,pearl,2,79,39.96,0.0,0.0
B0CHMB8HNH,9.99,"6 pcs Pearl Bracelet Set, Dainty Pearl Bracelets for Women Stackable, Stretch Beaded Bracelets Elastic, Trendy Jewelry Gift for Women Wedding, Party, Valentine's Day",4.6,USD,True,False,9.99,False,,,1,11,False,0.0,"FREE delivery Mon, Aug 12 on $35 of items shipped by AmazonOr fastest delivery Tomorrow, Aug 8",34.0,,https://m.media-amazon.com/images/I/71Hr2OThleL._AC_UL320_.jpg,organic,7454898011,pearl,2,80,109.89,0.0,0.0
B0C1RM765W,7.99,"9-11mm Silicone Edison Freshwater Pearl Bracelets,Womens Charm Bangle Jewelry,Colored Dainty Personalized Stretch Mood Rubber Bands for Men and Women 6.5'' 7'' 7.5''",4.5,USD,True,False,7.99,False,,,1,140,False,8.99,"FREE delivery Mon, Aug 12 on $35 of items shipped by AmazonOr fastest delivery Tomorrow, Aug 8",35.0,,https://m.media-amazon.com/images/I/41RWQcDrqDL._AC_UL320_.jpg,organic,7454898011,pearl,2,81,1118.6000000000001,1.0,0.11123470522803114
B09XQ1J97Z,6.99,Imitition Pearl Stretch Bracelet Multilayer Crystals Pearl Elastic Bangle for Women Wedding Jewelry 1920s Costume,4.3,USD,True,False,6.99,False,,50+ bought in past month,1,148,False,0.0,"FREE delivery Tue, Aug 13 on $35 of items shipped by AmazonOr fastest delivery Fri, Aug 9",36.0,,https://m.media-amazon.com/images/I/71QIgvVOJVL._AC_UL320_.jpg,organic,7454898011,pearl,2,82,1034.52,0.0,0.0
B08CS9NGPR,15.99,"Dainty Gold Bracelets for Women, 14K Gold Filled Adjustable Layered Bracelet Cute Evil Eye Oval Chain Pearl Bar Turtle Gold Bracelets for Women Jewelry",4.4,USD,True,False,15.99,False,,,1,7335,False,0.0,"FREE delivery Mon, Aug 12 on $35 of items shipped by AmazonOr fastest delivery Tomorrow, Aug 8",37.0,,https://m.media-amazon.com/images/I/61+zYJXvd-L._AC_UL320_.jpg,organic,7454898011,pearl,2,83,117286.65000000001,0.0,0.0
B07F287145,5.59,Womens 4mm Faux Pearl Wave Link Bracelet Silver Tone Rhinestone Bracelets Ladies,4.2,USD,True,False,5.59,False,,50+ bought in past month,1,216,False,8.99,"FREE delivery Mon, Aug 12 on $35 of items shipped by AmazonOr fastest delivery Tomorrow, Aug 8",38.0,,https://m.media-amazon.com/images/I/51QKrC0QSXL._AC_UL320_.jpg,organic,7454898011,pearl,2,84,1207.44,3.4000000000000004,0.37819799777530594
B0D83GWDYS,7.99,"6Pcs Pearl Bracelet Set for Women, Bridesmaid Bracelet, Stretch Bracelets Stack, Dainty Heart Gold Beaded Bracelets, Bridesmaids Bridal jewelry Gift for Wedding",5.0,USD,True,False,7.99,False,,,1,2,False,0.0,"FREE delivery Tue, Aug 13 on $35 of items shipped by AmazonOr fastest delivery Fri, Aug 9",39.0,,https://m.media-amazon.com/images/I/714PS6JU+yL._AC_UL320_.jpg,organic,7454898011,pearl,2,85,15.98,0.0,0.0
B0CSD4ZM99,6.99,Pearl Bracelet for Women Gold Adjustable Slider Bracelet Dainty Chain Bracelet Bride Bridesmaid Birthday Jewelry Gift for Women,2.5,USD,True,False,6.99,False,,,1,2,False,0.0,"FREE delivery Mon, Aug 12 on $35 of items shipped by AmazonOr fastest delivery Tomorrow, Aug 8",40.0,,https://m.media-amazon.com/images/I/51GRew8BYqL._AC_UL320_.jpg,organic,7454898011,pearl,2,86,13.98,0.0,0.0
B0B7MJ1BTT,13.59,Gold Bracelet for Women 18K Gold Plated Dainty Paperclip Cubic Zirconia Disc Coin Star Cable Satellite Bead Pearl Simple Boho Minimalist Stacking Layered Link Jewelry Gift,4.3,USD,True,False,13.59,False,,,1,786,False,0.0,"FREE delivery Mon, Aug 12 on $35 of items shipped by AmazonOr fastest delivery Tomorrow, Aug 8",41.0,,https://m.media-amazon.com/images/I/416NgBhn4pL._AC_UL320_.jpg,organic,7454898011,pearl,2,87,10681.74,0.0,0.0
B0CYKQQGS7,14.99,Gold Bracelets for Women 14K Real Gold Plated Dainty Bracelets Stack Trendy Cuban Link Snake Rope Pearl Paperclip Chain Bracelet Pack Adjustable Women Jewelry,4.6,USD,True,False,14.99,False,,,1,15,False,0.0,"FREE delivery Mon, Aug 12 on $35 of items shipped by AmazonOr fastest delivery Tomorrow, Aug 8",42.0,,https://m.media-amazon.com/images/I/61Xmrz7GspL._AC_UL320_.jpg,organic,7454898011,pearl,2,88,224.85,0.0,0.0
B08KCWFJ75,9.59,"Leopard Bracelet for Women, Boho Leather Wrap Multi-Layer Pearl Crystal Bracelet Bangle Jewelry",4.4,USD,True,False,9.59,False,,,1,4534,False,12.99,"FREE delivery Mon, Aug 12 on $35 of items shipped by AmazonOr fastest delivery Fri, Aug 9",43.0,,https://m.media-amazon.com/images/I/514kYOV50lL._AC_UL320_.jpg,organic,7454898011,pearl,2,89,43481.06,3.4000000000000004,0.26173979984603546
B08MZ78TNC,34.0,Kate Spade Pearls of Wisdom Open Hinged Bangle Bracelet,4.6,USD,False,False,34.0,False,,100+ bought in past month,1,27,False,57.49,"$4.55 delivery Fri, Aug 9",44.0,,https://m.media-amazon.com/images/I/51DEODif0rL._AC_UL320_.jpg,organic,7454898011,pearl,2,90,918.0,23.490000000000002,0.4085927987476083
B0B82MLRGS,9.99,Pearl Bracelets for Women Pearl Jewelry Crystal Rhinestone Bangle Bracelets for Women Beaded Stretch Strand Stackable Bracelets Wedding Jewelry for Brides,4.2,USD,True,False,9.99,False,,,1,66,False,0.0,"FREE delivery Mon, Aug 12 on $35 of items shipped by AmazonOr fastest delivery Tomorrow, Aug 8",45.0,,https://m.media-amazon.com/images/I/61Vm5Gr+V-L._AC_UL320_.jpg,organic,7454898011,pearl,2,91,659.34,0.0,0.0
B0D41J3YHS,5.99,Imitition Pearl Stretch Bracelet Layers Stackable Bangle Bracelet Crystals Pearl Elastic Wristband for Women Wedding Jewelry,0.0,USD,True,False,5.99,False,,,1,0,False,0.0,"FREE delivery Mon, Aug 12 on $35 of items shipped by AmazonOr fastest delivery Tomorrow, Aug 8",46.0,,https://m.media-amazon.com/images/I/51NEdexTMtL._AC_UL320_.jpg,organic,7454898011,pearl,2,92,0.0,0.0,0.0
B0CW1T8FWY,8.99,Initial Pearl Bracelets for Women Girls Gifts - Personalized Pearl Bracelet Dainty Gold Initial Bracelets for Women Teen Girls Bridesmaid Gifts Wedding Gifts Valentine's Gift,4.5,USD,True,False,8.99,False,,,1,17,False,0.0,"FREE delivery Mon, Aug 12 on $35 of items shipped by AmazonOr fastest delivery Tomorrow, Aug 8",47.0,,https://m.media-amazon.com/images/I/51PIsEMeVgL._AC_UL320_.jpg,organic,7454898011,pearl,2,93,152.83,0.0,0.0
B0BCG9DR9G,14.99,30 Pieces 6mm/8mm Faux White Pearl Bracelets for Women Stackable Stretch Beaded Bracelets Simulated Pearl Bracelet Set for Bridesmaid Bridal Wedding Party Jewelry,4.7,USD,True,False,14.99,False,,,1,45,False,0.0,"FREE delivery Mon, Aug 12 on $35 of items shipped by AmazonOr fastest delivery Tomorrow, Aug 8",48.0,,https://m.media-amazon.com/images/I/71d67kaCAnL._AC_UL320_.jpg,organic,7454898011,pearl,2,94,674.55,0.0,0.0
B0CQWZKMGV,6.98,Chunky Simulated Pearl Stackable Stretch Bracelet Set Beaded Ball Adjustable Multilayered Elastic Bangles for Women Wedding Jewelry,4.3,USD,True,False,6.98,False,,100+ bought in past month,1,26,True,0.0,"FREE delivery Mon, Aug 12 on $35 of items shipped by AmazonOr fastest delivery Fri, Aug 9",1.0,,https://m.media-amazon.com/images/I/51f1X+Ys5qL._AC_UL320_.jpg,amazons_choices,7454898011,pearl,2,2,181.48000000000002,0.0,0.0
B09839YKV8,33.7,Natural Pearl Bracelets for Women 925 Sterling Silver Bracelets for Women Handmade Jewelry for Women AAAA Quality Real White Freshwater Pearl from The Pearls Source,4.6,USD,,False,33.7,True,,50+ bought in past month,1,247,False,0.0,,,1.0,https://aax-us-iad.amazon.com/e/loi/imp?b=JB7ND0kicNDBJRsr0PzLmS0AAAGRLRhkRAEAAAH2AQBvbm9fdHhuX2JpZDcgICBvbm9fdHhuX2ltcDEgICD3rFYc,paid,7454898011,pearl,3,3,8323.900000000001,0.0,0.0
B0C9LCQPG9,10.36,18K Gold Pearl Beaded Chain Bracelets for Women Adjustable Stainless Steel Dainty Thin Gold Box Cuban Twisted Link Chain Bracelet Bridesmaid Jewelry Gifts,4.3,USD,True,False,10.36,False,,,1,378,False,12.95,"FREE delivery Mon, Aug 12 on $35 of items shipped by AmazonOr fastest delivery Sat, Aug 10",1.0,,https://m.media-amazon.com/images/I/51fdUg4ZaQL._AC_UL320_.jpg,organic,7454898011,pearl,3,95,3916.08,2.59,0.2
B07F287145,5.59,Womens 4mm Faux Pearl Wave Link Bracelet Silver Tone Rhinestone Bracelets Ladies,4.2,USD,True,False,5.59,False,,50+ bought in past month,1,216,False,8.99,"FREE delivery Mon, Aug 12 on $35 of items shipped by AmazonOr fastest delivery Sat, Aug 10",2.0,,https://m.media-amazon.com/images/I/51QKrC0QSXL._AC_UL320_.jpg,organic,7454898011,pearl,3,96,1207.44,3.4000000000000004,0.37819799777530594
B0B82MLRGS,9.99,Pearl Bracelets for Women Pearl Jewelry Crystal Rhinestone Bangle Bracelets for Women Beaded Stretch Strand Stackable Bracelets Wedding Jewelry for Brides,4.2,USD,True,False,9.99,False,,,1,66,False,0.0,"FREE delivery Mon, Aug 12 on $35 of items shipped by AmazonOr fastest delivery Fri, Aug 9",3.0,,https://m.media-amazon.com/images/I/61Vm5Gr+V-L._AC_UL320_.jpg,organic,7454898011,pearl,3,97,659.34,0.0,0.0
B09NCYBK2L,11.99,Cultured Freshwater Single Pearl Bracelet Handmade Genuine Leather Wrap Bracelet Agate Malachite Tiger Eyes with Charm Jewelry Synthetic Pearl Beaded Gold Bracelet,4.4,USD,True,False,11.99,False,,,1,288,False,0.0,"FREE delivery Mon, Aug 12 on $35 of items shipped by AmazonOr fastest delivery Fri, Aug 9",4.0,,https://m.media-amazon.com/images/I/61P48FUWvqL._AC_UL320_.jpg,organic,7454898011,pearl,3,98,3453.12,0.0,0.0
B07N78D6FM,49.0,8-8.5mm Cultured Pearl Stretch Bracelet. 7 inches,4.3,USD,True,False,49.0,False,,,1,59,False,0.0,"FREE delivery Tomorrow, Aug 8",5.0,,https://m.media-amazon.com/images/I/61SYI3t2RIL._AC_UL320_.jpg,organic,7454898011,pearl,3,99,2891.0,0.0,0.0
B0BCG9DR9G,14.99,30 Pieces 6mm/8mm Faux White Pearl Bracelets for Women Stackable Stretch Beaded Bracelets Simulated Pearl Bracelet Set for Bridesmaid Bridal Wedding Party Jewelry,4.7,USD,True,False,14.99,False,,,1,45,False,0.0,"FREE delivery Mon, Aug 12 on $35 of items shipped by AmazonOr fastest delivery Fri, Aug 9",6.0,,https://m.media-amazon.com/images/I/71d67kaCAnL._AC_UL320_.jpg,organic,7454898011,pearl,3,100,674.55,0.0,0.0
B01IEUYY18,14.99,Gem Semi Precious Gemstone 8mm Round Beads Stretch Bracelet 7 Inch Unisex,4.6,USD,True,False,14.99,False,,,1,1389,False,0.0,"FREE delivery Mon, Aug 12 on $35 of items shipped by AmazonOr fastest delivery Sat, Aug 10",7.0,,https://m.media-amazon.com/images/I/41GexfWtrQL._AC_UL320_.jpg,organic,7454898011,pearl,3,101,20821.11,0.0,0.0
B0CYKQQGS7,14.99,Gold Bracelets for Women 14K Real Gold Plated Dainty Bracelets Stack Trendy Cuban Link Snake Rope Pearl Paperclip Chain Bracelet Pack Adjustable Women Jewelry,4.6,USD,True,False,14.99,False,,,1,15,False,0.0,"FREE delivery Mon, Aug 12 on $35 of items shipped by AmazonOr fastest delivery Sat, Aug 10",8.0,,https://m.media-amazon.com/images/I/61Xmrz7GspL._AC_UL320_.jpg,organic,7454898011,pearl,3,102,224.85,0.0,0.0
B0D5Y1SJKT,11.99,"1920s Pearl Bracelet, Pearl Bracelets for Women, Vintage Bracelet, 1920s Accessories, Costume Jewelry, Christmas Jewelry Gift for Women",5.0,USD,True,False,11.99,False,,,1,5,False,0.0,"FREE delivery Mon, Aug 12 on $35 of items shipped by Amazon",9.0,,https://m.media-amazon.com/images/I/71pmXemQsJL._AC_UL320_.jpg,organic,7454898011,pearl,3,103,59.95,0.0,0.0
B0D5H541KK,4.99,"Pearl Bracelets for Women, Faux Elastic Pearl Bracelets Set with Card, Stretch Beaded Bracelets for Mother, Wife, Girlfriend, Daughters, Sisters, Friends, Bridal Bridesmaid",0.0,USD,False,False,4.99,False,,,1,0,False,0.0,FREE delivery on $35 shipped by Amazon.,10.0,,https://m.media-amazon.com/images/I/41AzFtbjh5L._AC_UL320_.jpg,organic,7454898011,pearl,3,104,0.0,0.0,0.0
B0D1K47DG2,12.99,"Gold/Silver Bracelets for Women,14K Gold Plated Bracelets for Women Evil Eye Diamond Cuban Link Heart Pearl Bracelets Everyday Jewelry Gift",4.2,USD,True,False,12.99,False,,,1,46,False,0.0,"FREE delivery Mon, Aug 12 on $35 of items shipped by AmazonOr fastest delivery Sat, Aug 10",11.0,,https://m.media-amazon.com/images/I/512rAdrcG9L._AC_UL320_.jpg,organic,7454898011,pearl,3,105,597.54,0.0,0.0
B0D8T5KC7L,12.99,2 PCS Fresh Water Pearl Bracelets for Women Dainty 18k Gold Link Bracelet Small Heart Bracelet,4.5,USD,True,False,12.99,False,,,1,2,False,0.0,"FREE delivery Mon, Aug 12 on $35 of items shipped by AmazonOr fastest delivery Sat, Aug 10",12.0,,https://m.media-amazon.com/images/I/41Gp7YftwmL._AC_UL320_.jpg,organic,7454898011,pearl,3,106,25.98,0.0,0.0
B0CG9CT6V9,9.98,Elegant Multi Row Crystal Pearl Cuff Rhinestone Bridals Crystal Stunning Bangle Bracelet Layered Cuff Bracelet Gift for Women Brides,4.5,USD,True,False,9.98,False,,,1,26,False,0.0,"FREE delivery Mon, Aug 12 on $35 of items shipped by AmazonOr fastest delivery Sat, Aug 10",13.0,,https://m.media-amazon.com/images/I/515VXudCPkL._AC_UL320_.jpg,organic,7454898011,pearl,3,107,259.48,0.0,0.0
B0CH9JPDHH,5.79,Dainty Rhinestone Silver Gold Pearl Open Bangle Bracelet Fashion Chunky Gold Bracelets Wedding Sparkly Layered Bracelet Adjustable Pearl Bracelets for Women Brides Girls,5.0,USD,True,False,5.79,False,,,1,2,False,0.0,"FREE delivery Mon, Aug 12 on $35 of items shipped by AmazonOr fastest delivery Fri, Aug 9",14.0,,https://m.media-amazon.com/images/I/51nnnAazc5L._AC_UL320_.jpg,organic,7454898011,pearl,3,108,11.58,0.0,0.0
B0BSGK7X85,17.99,50 Pcs Elastic Pearl Bracelets for Women Wedding Stretch Faux Pearl Wrist Bands White Beaded Stackable Bracelets Corsage for Bridal Bridesmaid Party Prom,4.5,USD,True,False,17.99,False,,50+ bought in past month,1,12,False,18.99,"FREE delivery Mon, Aug 12 on $35 of items shipped by AmazonOr fastest delivery Fri, Aug 9",15.0,,https://m.media-amazon.com/images/I/71A3MEIMEXL._AC_UL320_.jpg,organic,7454898011,pearl,3,109,215.88,1.0,0.05265929436545551
B0CG8YYYBT,16.33,Beaded Pearl Stretch Bracelet Silver Stackable Crystal Beads Bracelets Trendy Costume Jewelry Mothers Day Gifts for Women,4.7,USD,True,False,16.33,False,,,1,172,False,0.0,"FREE delivery Mon, Aug 12 on $35 of items shipped by AmazonOr fastest delivery Sat, Aug 10",16.0,,https://m.media-amazon.com/images/I/71MMrOXMusL._AC_UL320_.jpg,organic,7454898011,pearl,3,110,2808.7599999999998,0.0,0.0
B0C1444QXN,9.99,Gold Chain Link Bracelet Set for Women 14K Gold Plated Snake Pearl CZ Lock Portrait Dainty Classic Adjustable Layered Paperclip Bracelets for women Jewelry,3.5,USD,True,False,9.99,False,,,1,51,False,0.0,"FREE delivery Mon, Aug 12 on $35 of items shipped by AmazonOr fastest delivery Fri, Aug 9",17.0,,https://m.media-amazon.com/images/I/51eTjCgKAJL._AC_UL320_.jpg,organic,7454898011,pearl,3,111,509.49,0.0,0.0
B0BYN63MVK,12.99,Dainty Gold Pearl Crystal Beaded Bracelets Set for Women 14K Real Gold Plated Bead Pearl Crystal Beads Bracelet Stake Paperclip Link Chain Bracelets Gold Bracelets for Women Trendy Jewelry,4.4,USD,True,False,12.99,False,,,1,412,False,0.0,"FREE delivery Mon, Aug 12 on $35 of items shipped by AmazonOr fastest delivery Fri, Aug 9",18.0,,https://m.media-amazon.com/images/I/61DXhFaKp6L._AC_UL320_.jpg,organic,7454898011,pearl,3,112,5351.88,0.0,0.0
B0D5QNNHJM,5.79,4/5Pcs Faux Pearl Love Heart Stretch Bracelet Set Bohemian Handmade Stackable Beaded Bracelet Multilayered Round Pearl Crystal Beaded Strand Bracelets for Women Girls Jewelry Gifts,0.0,USD,True,False,5.79,False,,,1,0,False,0.0,"FREE delivery Mon, Aug 12 on $35 of items shipped by AmazonOr fastest delivery Sat, Aug 10",19.0,,https://m.media-amazon.com/images/I/61wyvR2E7tL._AC_UL320_.jpg,organic,7454898011,pearl,3,113,0.0,0.0,0.0
B06XW87TR3,7.99,Gem Semi Precious Gemstone 6mm Round Beads Stretch Bracelet 6.5 Inch,4.5,USD,True,False,7.99,False,,,1,795,False,0.0,"FREE delivery Mon, Aug 12 on $35 of items shipped by AmazonOr fastest delivery Sat, Aug 10",20.0,,https://m.media-amazon.com/images/I/51w4GEeglIL._AC_UL320_.jpg,organic,7454898011,pearl,3,114,6352.05,0.0,0.0
B0CJN8R2DF,13.99,Gold Bracelets for Women-14K Gold Plated Pearl Bracelets for Women Daisy Pearl Flower Gold Beaded Station Pearl Bracelets,4.0,USD,True,False,13.99,False,,,1,21,False,0.0,"FREE delivery Mon, Aug 12 on $35 of items shipped by Amazon",21.0,,https://m.media-amazon.com/images/I/61R1OJd4YnL._AC_UL320_.jpg,organic,7454898011,pearl,3,115,293.79,0.0,0.0
B09HTTGSM2,9.99,Pearl Bracelets for Women Freshwater Cultured Pearl Zircon Beads Gold Chain Slider Bracelet Bride Wedding Gifts,4.3,USD,True,False,9.99,False,,,1,43,False,0.0,"FREE delivery Mon, Aug 12 on $35 of items shipped by Amazon",22.0,,https://m.media-amazon.com/images/I/41MD-Uc3ozL._AC_UL320_.jpg,organic,7454898011,pearl,3,116,429.57,0.0,0.0
