asin,price,title,rating,currency,is_prime,best_seller,price_upper,is_sponsored,manufacturer,sales_volume,pricing_count,reviews_count,is_amazons_choice,price_strikethrough,shipping_information,pos,rel_pos,url_image,source,category_id,keyword,page,position,min_revenue,discount,discount_rate
B09D2QR4NN,9.99,Open Layered Simulated Pearl Wide Crystal Bracelet Multilayer Glaring Rhinestone Cuff Bangles Jewelry for Women Girls,4.7,USD,True,False,9.99,False,,,1,8,False,0.0,"FREE delivery Mon, Aug 12 on $35 of items shipped by AmazonOr fastest delivery Fri, Aug 9",23.0,,https://m.media-amazon.com/images/I/61YaOyV2swL._AC_UL320_.jpg,organic,7454898011,pearl,3,117,79.92,0.0,0.0
B0CGJ3F92D,9.98,"Pearl Bracelet for Women,Gold Cuff Pearl Bracelet Chunky Bangle Bracelets Simple Gold Plated Cuff Bangle Irregular Pearl Bracelet Trendy Personality Pearl Statement Jewelry",4.1,USD,True,False,9.98,False,,,1,9,False,0.0,"FREE delivery Mon, Aug 12 on $35 of items shipped by AmazonOr fastest delivery Sat, Aug 10",24.0,,https://m.media-amazon.com/images/I/61zb5K04E9L._AC_UL320_.jpg,organic,7454898011,pearl,3,118,89.82000000000001,0.0,0.0
B0CKZ2XFNT,6.99,Pearl Bracelets for Women Pearl Beads for Bracelets Stretch Bracelets Wedding Bracelets for Brides Trendy Jewelry Gift,5.0,USD,True,False,6.99,False,,,1,2,False,0.0,"FREE delivery Mon, Aug 12 on $35 of items shipped by AmazonOr fastest delivery Fri, Aug 9",25.0,,https://m.media-amazon.com/images/I/51XU2ufFX5L._AC_UL320_.jpg,organic,7454898011,pearl,3,119,13.98,0.0,0.0
B0CM9297CM,14.99,Dainty Pearl Chain Bracelets 14K Gold Bracelet for Women Adjustable Baroque Culture Jewelry Gifts for Mother Wife,4.2,USD,True,False,14.99,False,,,1,78,False,0.0,"FREE delivery Mon, Aug 12 on $35 of items shipped by AmazonOr fastest delivery Sat, Aug 10",26.0,,https://m.media-amazon.com/images/I/61X2k1Sq3KL._AC_UL320_.jpg,organic,7454898011,pearl,3,120,1169.22,0.0,0.0
B0BGNYYD3L,7.98,Chunky Imitation Pearl Bracelet for Women Multi Row Layered Crystal Rhinestone Stackable Wrap Open Cuff Bangle Bridal Wedding Jewelry,4.5,USD,True,False,7.98,False,,,1,13,False,0.0,"FREE delivery Mon, Aug 12 on $35 of items shipped by AmazonOr fastest delivery Sat, Aug 10",27.0,,https://m.media-amazon.com/images/I/61j08b7Xo7L._AC_UL320_.jpg,organic,7454898011,pearl,3,121,103.74000000000001,0.0,0.0
B0CYBTNKMQ,9.99,Pearl Bracelet Pearl Bracelets for Women Dainty Gold Charm Bracelet Pearl Hand Chain Bracelet Wedding Jewelry for Brides Bridesmaid Gifts,4.1,USD,True,False,9.99,False,,,1,21,False,0.0,"FREE delivery Mon, Aug 12 on $35 of items shipped by AmazonOr fastest delivery Sat, Aug 10",28.0,,https://m.media-amazon.com/images/I/51to3GQDV6L._AC_UL320_.jpg,organic,7454898011,pearl,3,122,209.79,0.0,0.0
B07FF1NRWG,26.99,"Set of 3 White Cultured Freshwater Pearl Bracelets for Women | Women's Stretch Bracelet with Adjustable Fit of 7.25""",4.4,USD,True,False,26.99,False,,,1,386,False,0.0,"FREE delivery Mon, Aug 12 on $35 of items shipped by AmazonOr fastest delivery Sun, Aug 11",29.0,,https://m.media-amazon.com/images/I/61531NmcsDL._AC_UL320_.jpg,organic,7454898011,pearl,3,123,10418.14,0.0,0.0
B0D22FJNX5,14.99,Bracelets for Women Trendy Bangle Bracelets Non Tarnish Adjustable Dainty Bracelets for Women Bracelets Fashion Bracelets,4.6,USD,True,False,14.99,False,,,1,13,False,0.0,"FREE delivery Mon, Aug 12 on $35 of items shipped by Amazon",30.0,,https://m.media-amazon.com/images/I/511IpTzQRhS._AC_UL320_.jpg,organic,7454898011,pearl,3,124,194.87,0.0,0.0
B0D89TJS4W,6.19,"Flower Bracelet for Women, Titanium Steel Pearl Daisy Bracelet Dainty Gold Adjustable Link Chain Pearl Simple Bracelet Jewelry Gift for Women as Prom Accessories Anniversary",0.0,USD,True,False,6.19,False,,,1,0,False,0.0,"FREE delivery Mon, Aug 12 on $35 of items shipped by AmazonOr fastest delivery Fri, Aug 9",31.0,,https://m.media-amazon.com/images/I/51kXFGvHPsL._AC_UL320_.jpg,organic,7454898011,pearl,3,125,0.0,0.0,0.0
B0D41J3YHS,5.99,Imitition Pearl Stretch Bracelet Layers Stackable Bangle Bracelet Crystals Pearl Elastic Wristband for Women Wedding Jewelry,0.0,USD,True,False,5.99,False,,,1,0,False,0.0,"FREE delivery Mon, Aug 12 on $35 of items shipped by AmazonOr fastest delivery Sat, Aug 10",32.0,,https://m.media-amazon.com/images/I/51NEdexTMtL._AC_UL320_.jpg,organic,7454898011,pearl,3,126,0.0,0.0,0.0
B0D12N2GB4,13.99,"Charms for Beach Bag, Accessories Compatible with Bogg Bags, Flower Charms for Simply Southern Beach Tote Bags",0.0,USD,False,False,13.99,False,,,1,0,False,0.0,FREE delivery Aug 20 - 28,33.0,,https://m.media-amazon.com/images/I/61bxWZfsZ1L._AC_UL320_.jpg,organic,7454898011,pearl,3,127,0.0,0.0,0.0
B0BLZ2XSR2,7.19,9-12Pcs Bohemian Indian Chunky Stackable Textured Bangle Bracelet Set Multilayer Boho Cable Rhinestone Bead Bracelet for Women Friend Vintage African Wedding Jewelry Birthday Gift,4.3,USD,True,False,7.19,False,,,1,138,False,0.0,"FREE delivery Mon, Aug 12 on $35 of items shipped by AmazonOr fastest delivery Sat, Aug 10",34.0,,https://m.media-amazon.com/images/I/61BZLDYIjjL._AC_UL320_.jpg,organic,7454898011,pearl,3,128,992.22,0.0,0.0
B0CXJ6NHJ4,9.49,"Freshwater Pearl Seed Bead for Women, Dainty Handmade Bohemian Stone Beaded Stretch Friend Bracelet Summer Beach Jewelry Gift",5.0,USD,False,False,9.49,False,,,1,4,False,0.0,FREE delivery on $35 shipped by Amazon.,35.0,,https://m.media-amazon.com/images/I/618Ys5C8JCL._AC_UL320_.jpg,organic,7454898011,pearl,3,129,37.96,0.0,0.0
B06XCJJN3K,33.99,"Genuine Freshwater Pearl 3-Strand Bridal Wedding Bracelet with CZ Safety Clasp, Birthday Gift",4.2,USD,True,False,33.99,False,,,1,242,False,0.0,"FREE delivery Mon, Aug 12 on $35 of items shipped by AmazonOr fastest delivery Fri, Aug 9",36.0,,https://m.media-amazon.com/images/I/517ELuB4ZKL._AC_UL320_.jpg,organic,7454898011,pearl,3,130,8225.58,0.0,0.0
B0CG8DNC1K,9.98,Wedding Silver 3 Row Pearl Rhinestone Stunning Bracelet Layered Stretch Wrap Cuff Bridals Crystal Strand Bracelet Gift for Women Brides (Silver 4),4.4,USD,True,False,9.98,False,,,1,3,False,0.0,"FREE delivery Mon, Aug 12 on $35 of items shipped by AmazonOr fastest delivery Fri, Aug 9",37.0,,https://m.media-amazon.com/images/I/411yWLCMQ7L._AC_UL320_.jpg,organic,7454898011,pearl,3,131,29.94,0.0,0.0
B0D7LP39N2,12.99,"Gold Pearl Bracelets for Women, 14K Gold Plated Initial Bracelets for Women Heart Charm Bracelets Dainty Pearl Bracelets Jewelry for Women Trendy",5.0,USD,True,False,12.99,False,,,1,3,False,0.0,"FREE delivery Mon, Aug 12 on $35 of items shipped by Amazon",38.0,,https://m.media-amazon.com/images/I/51RKDNFr14L._AC_UL320_.jpg,organic,7454898011,pearl,3,132,38.97,0.0,0.0
B0CFTH1QQ3,9.99,Pearl Bracelet for Women Dainty Pearl Bracelets Wedding Bridal Bracelets Bridesmaid Dresses Gifts Wedding Guest Dresses for Women Wedding Jewelry Gifts for Brides Bridesmaid,4.3,USD,True,False,9.99,False,,,1,32,False,0.0,"FREE delivery Mon, Aug 12 on $35 of items shipped by AmazonOr fastest delivery Fri, Aug 9",39.0,,https://m.media-amazon.com/images/I/61W3xJSDGUL._AC_UL320_.jpg,organic,7454898011,pearl,3,133,319.68,0.0,0.0
B09F98HQJN,4.64,"11mm Real Pearl Bridesmaid Mood Stackable Silicone Rubber Stretch Freshwater Cultured Pearl Jewelry Bracelets for women 7""",4.2,USD,False,False,4.64,False,,,1,53,False,7.64,$3.48 delivery Aug 20 - Sep 3,40.0,,https://m.media-amazon.com/images/I/41D3khlvE0L._AC_UL320_.jpg,organic,7454898011,pearl,3,134,245.92,3.0,0.39267015706806285
B0CGDSZZTY,11.59,Dainty Gold Pearl Beaded Bracelets for Women 14K Real Gold Plated Bead Pearl Beads Bracelets Stackable Paperclip Link Stretch Bracelets Set Gold Bracelets for Women,4.2,USD,True,False,11.59,False,,,1,33,False,0.0,"FREE delivery Mon, Aug 12 on $35 of items shipped by AmazonOr fastest delivery Sat, Aug 10",41.0,,https://m.media-amazon.com/images/I/71gsUhIwAvL._AC_UL320_.jpg,organic,7454898011,pearl,3,135,382.46999999999997,0.0,0.0
B01N5LZRFP,13.99,4pcs /Set Imitation Pearl Bracelets Crystal Women Multi Layer (BR1113),4.6,USD,True,False,13.99,False,,,1,280,False,0.0,"FREE delivery Mon, Aug 12 on $35 of items shipped by AmazonOr fastest delivery Fri, Aug 9",42.0,,https://m.media-amazon.com/images/I/71F9e9e5iWL._AC_UL320_.jpg,organic,7454898011,pearl,3,136,3917.2000000000003,0.0,0.0
B09W9RF8WG,19.99,Cultured Freshwater Pearl Stretch Bracelets For Women Multicolored Strand Bracelet Jewelry Gift,4.2,USD,True,False,19.99,False,,50+ bought in past month,1,67,False,0.0,"FREE delivery Wed, Aug 14 on $35 of items shipped by Amazon",43.0,,https://m.media-amazon.com/images/I/61ckkvDriHL._AC_UL320_.jpg,organic,7454898011,pearl,3,137,1339.33,0.0,0.0
B0D6K2VTK7,19.88,8-9mm Cultured Freshwater Pearl Bracelet for Women Gift Wife Mother Birthday Gift,4.5,USD,True,False,19.88,False,,,1,73,False,0.0,"FREE delivery Mon, Aug 12 on $35 of items shipped by Amazon",44.0,,https://m.media-amazon.com/images/I/51ppUN67EDL._AC_UL320_.jpg,organic,7454898011,pearl,3,138,1451.24,0.0,0.0
B0D3DZXNPZ,9.99,Hand Chain Ring Bracelet Hand Chain for Women Beaded Finger Chain Bracelets Delicate Slave Bracelet for Women and Girls,3.7,USD,True,False,9.99,False,,,1,17,False,0.0,"FREE delivery Mon, Aug 12 on $35 of items shipped by Amazon",45.0,,https://m.media-amazon.com/images/I/61y2JhPsnrL._AC_UL320_.jpg,organic,7454898011,pearl,3,139,169.83,0.0,0.0
B0CLNQF29J,15.99,Natural Pearl Bracelets for Women 925 Sterling Silver Bracelets for Women Handmade Jewelry for Women Wife Girls Mom AAA 5-6mm Quality Real Freshwater Pearl,4.8,USD,True,False,15.99,False,,,1,5,False,0.0,"FREE delivery Mon, Aug 12 on $35 of items shipped by Amazon",46.0,,https://m.media-amazon.com/images/I/41i+RJaXc0L._AC_UL320_.jpg,organic,7454898011,pearl,3,140,79.95,0.0,0.0
B0D7LY124R,9.97,Gold Beaded Bracelets for Women Baroque Pearl Stackable 14K Gold Plated Stretch Bead Ball Bracelet Set Gold Jewelry for Women Gifts,0.0,USD,True,False,9.97,False,,,1,20,False,0.0,"FREE delivery Mon, Aug 12 on $35 of items shipped by Amazon",47.0,,https://m.media-amazon.com/images/I/51M6Y7xyT1L._AC_UL320_.jpg,organic,7454898011,pearl,3,141,199.4,0.0,0.0
B09HSDBP8Q,7.98,Asphire Vintage Pearl Bracelet 2pcs 3-Row Pearl Stretch Bracelet Multi-Layered Elastic Bangle Bridal Wedding Jewelry 1920s Flapper Costume Accessories for Women,4.3,USD,True,False,7.98,False,,,1,52,False,0.0,"FREE delivery Mon, Aug 12 on $35 of items shipped by Amazon",48.0,,https://m.media-amazon.com/images/I/51lESqqG6nL._AC_UL320_.jpg,organic,7454898011,pearl,3,142,414.96000000000004,0.0,0.0
B08QMQVLVD,8.99,1PCS Simple Stylish Fresh Water Pearl Bracelet Stretch Pearl Bracelet Valentine's Day Thanksgiving Christmas Birthday Gift - with a Drawstring Bag,4.3,USD,True,False,8.99,False,,,1,46,False,9.99,"FREE delivery Mon, Aug 12 on $35 of items shipped by AmazonOr fastest delivery Fri, Aug 9",1.0,,https://m.media-amazon.com/images/I/51MFkC2ERyL._AC_UL320_.jpg,organic,7454898011,pearl,4,143,413.54,1.0,0.10010010010010009
B0CTCD5748,7.99,Boho Pearl Finger Ring Bracelet Pearl Hand Chain Bracelet Gold Pearl Slave Bracelet Slave Finger Bracelet Adjustable Pearl Bracelet Pearl Chain Hand Harness Bracelet Jewelry for Women,0.0,USD,True,False,7.99,False,,,1,5,False,0.0,"FREE delivery Mon, Aug 12 on $35 of items shipped by AmazonOr fastest delivery Fri, Aug 9",2.0,,https://m.media-amazon.com/images/I/61aK+05ZhGL._AC_UL320_.jpg,organic,7454898011,pearl,4,144,39.95,0.0,0.0
B07F32ZXM7,15.69,"Beaded Pearl Bangle Wrap Bracelet - Fashion Bohemian Jewelry Multilayer Charm Bracelet with Thick Silver Metal Beads, Gift For Women",4.5,USD,True,False,15.69,False,,50+ bought in past month,1,3031,False,0.0,"FREE delivery Mon, Aug 12 on $35 of items shipped by AmazonOr fastest delivery Fri, Aug 9",3.0,,https://m.media-amazon.com/images/I/61jZkv+YIjS._AC_UL320_.jpg,organic,7454898011,pearl,4,145,47556.39,0.0,0.0
B0BGNYYD3L,7.98,Chunky Imitation Pearl Bracelet for Women Multi Row Layered Crystal Rhinestone Stackable Wrap Open Cuff Bangle Bridal Wedding Jewelry,4.5,USD,True,False,7.98,False,,,1,13,False,0.0,"FREE delivery Mon, Aug 12 on $35 of items shipped by AmazonOr fastest delivery Fri, Aug 9",4.0,,https://m.media-amazon.com/images/I/61j08b7Xo7L._AC_UL320_.jpg,organic,7454898011,pearl,4,146,103.74000000000001,0.0,0.0
B0CGDSZZTY,11.59,Dainty Gold Pearl Beaded Bracelets for Women 14K Real Gold Plated Bead Pearl Beads Bracelets Stackable Paperclip Link Stretch Bracelets Set Gold Bracelets for Women,4.2,USD,True,False,11.59,False,,,1,33,False,0.0,"FREE delivery Mon, Aug 12 on $35 of items shipped by AmazonOr fastest delivery Fri, Aug 9",5.0,,https://m.media-amazon.com/images/I/71gsUhIwAvL._AC_UL320_.jpg,organic,7454898011,pearl,4,147,382.46999999999997,0.0,0.0
B0BYN63MVK,12.99,Dainty Gold Pearl Crystal Beaded Bracelets Set for Women 14K Real Gold Plated Bead Pearl Crystal Beads Bracelet Stake Paperclip Link Chain Bracelets Gold Bracelets for Women Trendy Jewelry,4.4,USD,True,False,12.99,False,,,1,412,False,0.0,"FREE delivery Thu, Aug 15 on $35 of items shipped by Amazon",6.0,,https://m.media-amazon.com/images/I/61DXhFaKp6L._AC_UL320_.jpg,organic,7454898011,pearl,4,148,5351.88,0.0,0.0
B0BYRNW9FK,17.34,Beaded Pearl Stretch Bracelet Silver Stackable Crystal Beads Bracelets Trendy Costume Jewelry Mothers Day Gifts for Women,4.7,USD,True,False,17.34,False,,50+ bought in past month,1,172,False,0.0,"FREE delivery Mon, Aug 12 on $35 of items shipped by AmazonOr fastest delivery Fri, Aug 9",7.0,,https://m.media-amazon.com/images/I/61snkhBek-L._AC_UL320_.jpg,organic,7454898011,pearl,4,149,2982.48,0.0,0.0
B0CW9JMBRS,5.59,4 Pcs Pearl Gold Bracelet Stack Gold Plated Dainty Gold Pearl Bracelet Stackable Stretch Bead Ball Bracelet Set Bohemian Gold Beaded Bracelets Jewelry Gifts for Women,4.6,USD,False,False,5.59,False,,,1,5,False,8.99,FREE delivery on $35 shipped by Amazon.,8.0,,https://m.media-amazon.com/images/I/71U0jlzDhmL._AC_UL320_.jpg,organic,7454898011,pearl,4,150,27.95,3.4000000000000004,0.37819799777530594
B0D7LP39N2,12.99,"Gold Pearl Bracelets for Women, 14K Gold Plated Initial Bracelets for Women Heart Charm Bracelets Dainty Pearl Bracelets Jewelry for Women Trendy",5.0,USD,True,False,12.99,False,,,1,3,False,0.0,"FREE delivery Wed, Aug 14 on $35 of items shipped by Amazon",9.0,,https://m.media-amazon.com/images/I/51RKDNFr14L._AC_UL320_.jpg,organic,7454898011,pearl,4,151,38.97,0.0,0.0
B09D2QR4NN,9.99,Open Layered Simulated Pearl Wide Crystal Bracelet Multilayer Glaring Rhinestone Cuff Bangles Jewelry for Women Girls,4.7,USD,True,False,9.99,False,,,1,8,False,0.0,"FREE delivery Mon, Aug 12 on $35 of items shipped by AmazonOr fastest delivery Fri, Aug 9",10.0,,https://m.media-amazon.com/images/I/61YaOyV2swL._AC_UL320_.jpg,organic,7454898011,pearl,4,152,79.92,0.0,0.0
B01N5LZRFP,13.99,4pcs /Set Imitation Pearl Bracelets Crystal Women Multi Layer (BR1113),4.6,USD,True,False,13.99,False,,,1,280,False,0.0,"FREE delivery Mon, Aug 12 on $35 of items shipped by AmazonOr fastest delivery Fri, Aug 9",11.0,,https://m.media-amazon.com/images/I/71F9e9e5iWL._AC_UL320_.jpg,organic,7454898011,pearl,4,153,3917.2000000000003,0.0,0.0
B0D6K2VTK7,19.88,8-9mm Cultured Freshwater Pearl Bracelet for Women Gift Wife Mother Birthday Gift,4.5,USD,True,False,19.88,False,,,1,73,False,0.0,"FREE delivery Wed, Aug 14 on $35 of items shipped by Amazon",12.0,,https://m.media-amazon.com/images/I/51ppUN67EDL._AC_UL320_.jpg,organic,7454898011,pearl,4,154,1451.24,0.0,0.0
B0D4KSK4FB,10.99,Pearl Bracelets for Women Pearl Beaded Stretch Strand Stackable Bracelets freshwater pearl bracelet Party Gifts,4.7,USD,False,False,10.99,False,,,1,4,False,0.0,FREE delivery on $35 shipped by Amazon.,13.0,,https://m.media-amazon.com/images/I/61FTl8KFfcL._AC_UL320_.jpg,organic,7454898011,pearl,4,155,43.96,0.0,0.0
B0CKZ2XFNT,6.99,Pearl Bracelets for Women Pearl Beads for Bracelets Stretch Bracelets Wedding Bracelets for Brides Trendy Jewelry Gift,5.0,USD,True,False,6.99,False,,,1,2,False,0.0,"FREE delivery Wed, Aug 14 on $35 of items shipped by Amazon",14.0,,https://m.media-amazon.com/images/I/51XU2ufFX5L._AC_UL320_.jpg,organic,7454898011,pearl,4,156,13.98,0.0,0.0
B0D3DZXNPZ,9.99,Hand Chain Ring Bracelet Hand Chain for Women Beaded Finger Chain Bracelets Delicate Slave Bracelet for Women and Girls,3.7,USD,True,False,9.99,False,,,1,17,False,0.0,"FREE delivery Mon, Aug 12 on $35 of items shipped by AmazonOr fastest delivery Fri, Aug 9",15.0,,https://m.media-amazon.com/images/I/61y2JhPsnrL._AC_UL320_.jpg,organic,7454898011,pearl,4,157,169.83,0.0,0.0
B0B2VQ3TZR,5.99,Layers Bohemica Stackable Bracelets Set Indian Wedding Multi Textured Pearl Beads Gold Bangle Bracelet Fashion Simple Handcuffs Wrist Bangle for women Jewelry,4.0,USD,True,False,5.99,False,,,1,105,False,0.0,"FREE delivery Mon, Aug 12 on $35 of items shipped by AmazonOr fastest delivery Fri, Aug 9",16.0,,https://m.media-amazon.com/images/I/51E6fKDnJaL._AC_UL320_.jpg,organic,7454898011,pearl,4,158,628.95,0.0,0.0
B0CLNQF29J,15.99,Natural Pearl Bracelets for Women 925 Sterling Silver Bracelets for Women Handmade Jewelry for Women Wife Girls Mom AAA 5-6mm Quality Real Freshwater Pearl,4.8,USD,True,False,15.99,False,,,1,5,False,0.0,"FREE delivery Wed, Aug 14 on $35 of items shipped by Amazon",17.0,,https://m.media-amazon.com/images/I/41i+RJaXc0L._AC_UL320_.jpg,organic,7454898011,pearl,4,159,79.95,0.0,0.0
B01IEN0GX0,70.0,"Elton Cuff Bracelet for Women, Fashion Jewelry",4.6,USD,True,False,70.0,False,,200+ bought in past month,1,677,False,0.0,"FREE delivery Mon, Aug 12 Or fastest delivery Fri, Aug 9",18.0,,https://m.media-amazon.com/images/I/61Xob5Q43aL._AC_UL320_.jpg,organic,7454898011,pearl,4,160,47390.0,0.0,0.0
B0D7LY124R,9.97,Gold Beaded Bracelets for Women Baroque Pearl Stackable 14K Gold Plated Stretch Bead Ball Bracelet Set Gold Jewelry for Women Gifts,0.0,USD,True,False,9.97,False,,,1,20,False,0.0,"FREE delivery Wed, Aug 14 on $35 of items shipped by Amazon",19.0,,https://m.media-amazon.com/images/I/51M6Y7xyT1L._AC_UL320_.jpg,organic,7454898011,pearl,4,161,199.4,0.0,0.0
B07KDZZ8PP,9.99,18K Gold Chain Bracelet Tiny Pearl Lucky Evil Eye Turquoise Link Bracelet Sets Minimalist Layering Stacking Jewelry for Women,4.4,USD,True,False,9.99,False,,,1,1911,False,0.0,"FREE delivery Wed, Aug 14 on $35 of items shipped by Amazon",20.0,,https://m.media-amazon.com/images/I/71hq368UVAL._AC_UL320_.jpg,organic,7454898011,pearl,4,162,19090.89,0.0,0.0
B01NCEFZKB,5.99,"5 Pc Stretch Vintage Ivory Faux Pearl Bracelet, Wedding, Bridal Party, Bridal jewelry, pearl wedding/party favor",4.4,USD,False,False,5.99,False,,,1,193,False,0.0,"FREE delivery Mon, Aug 12 Or fastest delivery Fri, Aug 9",21.0,,https://m.media-amazon.com/images/I/51cgST95ZuL._AC_UL320_.jpg,organic,7454898011,pearl,4,163,1156.07,0.0,0.0
B0CW1Q9HPN,8.99,Initial Pearl Bracelets for Women Girls Gifts - Personalized Pearl Bracelet Dainty Gold Initial Bracelets for Women Teen Girls Bridesmaid Gifts Wedding Gifts Valentine's Gift,4.5,USD,True,False,8.99,False,,50+ bought in past month,1,17,False,0.0,"FREE delivery Mon, Aug 12 on $35 of items shipped by AmazonOr fastest delivery Fri, Aug 9",22.0,,https://m.media-amazon.com/images/I/51ZJlg9NpQL._AC_UL320_.jpg,organic,7454898011,pearl,4,164,152.83,0.0,0.0
B0CG8DNC1K,9.98,Wedding Silver 3 Row Pearl Rhinestone Stunning Bracelet Layered Stretch Wrap Cuff Bridals Crystal Strand Bracelet Gift for Women Brides (Silver 4),4.4,USD,True,False,9.98,False,,,1,3,False,0.0,"FREE delivery Mon, Aug 12 on $35 of items shipped by AmazonOr fastest delivery Fri, Aug 9",23.0,,https://m.media-amazon.com/images/I/411yWLCMQ7L._AC_UL320_.jpg,organic,7454898011,pearl,4,165,29.94,0.0,0.0
B09HSDBP8Q,7.98,Asphire Vintage Pearl Bracelet 2pcs 3-Row Pearl Stretch Bracelet Multi-Layered Elastic Bangle Bridal Wedding Jewelry 1920s Flapper Costume Accessories for Women,4.3,USD,True,False,7.98,False,,,1,52,False,0.0,"FREE delivery Tue, Aug 13 on $35 of items shipped by Amazon",24.0,,https://m.media-amazon.com/images/I/51lESqqG6nL._AC_UL320_.jpg,organic,7454898011,pearl,4,166,414.96000000000004,0.0,0.0
B09V2BH5F2,8.5,Boho Pearl Bracelet Silver Three Pearl Chain Bracelet Freshwater Pearl Bracelet Everyday Bracelet Minimalist Hand Chain Jewelry for Women and Girls Bridesmaid Gifts,4.0,USD,True,False,8.5,False,,,1,48,False,0.0,"FREE delivery Mon, Aug 12 on $35 of items shipped by AmazonOr fastest delivery Fri, Aug 9",25.0,,https://m.media-amazon.com/images/I/61M3vOghe2L._AC_UL320_.jpg,organic,7454898011,pearl,4,167,408.0,0.0,0.0
B0C8ND2KG8,59.99,AAA+ Quality Natural Freshwater Pearl Bracelet for Women | 6.5-7mm Round White Pearls with 925 Sterling Silver Lobster Buckle,4.0,USD,True,False,59.99,False,,,1,33,False,0.0,"FREE delivery Mon, Aug 12 Or fastest delivery Fri, Aug 9",26.0,,https://m.media-amazon.com/images/I/41dwWm5Q+gL._AC_UL320_.jpg,organic,7454898011,pearl,4,168,1979.67,0.0,0.0
B0BX2MS6X7,8.99,"Natural Healing Crystal Stone Mother of Pearl White 5 mm (0.20"") Bracelet Stretch Real Crystal Gemstone Bracelet for Women Men Beaded Shell",4.6,USD,True,False,8.99,False,,,1,16,False,0.0,"FREE delivery Mon, Aug 12 on $35 of items shipped by Amazon",27.0,,https://m.media-amazon.com/images/I/513hyAdHxfL._AC_UL320_.jpg,organic,7454898011,pearl,4,169,143.84,0.0,0.0
B0B31B6R8P,16.99,Dainty Gold Bracelets for Women Cute Tiny Sideways Cross Bracelets Layered Pearls Herringbone Chain Toggle Clasp Bracelet Minimalist Handmade Jewelry Gift,4.3,USD,True,False,16.99,False,,,1,1153,False,0.0,"FREE delivery Mon, Aug 12 on $35 of items shipped by AmazonOr fastest delivery Fri, Aug 9",28.0,,https://m.media-amazon.com/images/I/51tHCyBUFEL._AC_UL320_.jpg,organic,7454898011,pearl,4,170,19589.469999999998,0.0,0.0
B0D5WK54K7,110.0,"Daily Glory' Sterling Silver Freshwater Pearl Link Bracelet, 7""",0.0,USD,False,False,110.0,False,,,1,0,False,0.0,FREE delivery Aug 13 - 15,29.0,,https://m.media-amazon.com/images/I/61Nkqv8lg7L._AC_UL320_.jpg,organic,7454898011,pearl,4,171,0.0,0.0,0.0
B007KA9ZJA,139.0,"White Freshwater Pearl Bracelet for Women - Cultured Pearl Bracelet with 14k Gold Plated Clasp with Genuine Cultured Pearls, 7.0-7.5mm",4.6,USD,True,False,139.0,False,,,1,837,False,0.0,"FREE delivery Wed, Aug 14",30.0,,https://m.media-amazon.com/images/I/51ReA2ARfcL._AC_UL320_.jpg,organic,7454898011,pearl,4,172,116343.0,0.0,0.0
B07HCK8W8Y,259.0,6-7mm Cultured Pearl Bracelet With 14kt Yellow Gold,4.1,USD,True,False,259.0,False,,,1,58,False,0.0,"FREE delivery Tomorrow, Aug 8",31.0,,https://m.media-amazon.com/images/I/51gTO4FSQUL._AC_UL320_.jpg,organic,7454898011,pearl,4,173,15022.0,0.0,0.0
B0C9DNRC8V,6.29,"Silicone dainty Freshwater Pearl Bracelets,Womens Charm Bangle Jewelry,Colored Dainty Personalized Stretch Mood Rubber Bands Bangles for Men and Women Birthday Gifts 7.2'' Adjustable",3.6,USD,True,False,6.29,False,,,1,12,False,0.0,"FREE delivery Mon, Aug 12 on $35 of items shipped by AmazonOr fastest delivery Fri, Aug 9",32.0,,https://m.media-amazon.com/images/I/41Z7eqDW6XL._AC_UL320_.jpg,organic,7454898011,pearl,4,174,75.48,0.0,0.0
B0BYJDFMRR,14.98,"Gold Double Layered Pearl Bracelets for Girls and Women, 14K Real Yellow Gold Plated Hypoallergenic Dainty Charm Chain with Extension Link",4.0,USD,True,False,14.98,False,,,1,29,False,0.0,"FREE delivery Wed, Aug 14 on $35 of items shipped by Amazon",33.0,,https://m.media-amazon.com/images/I/61lJ5EOL5SL._AC_UL320_.jpg,organic,7454898011,pearl,4,175,434.42,0.0,0.0
B0CCNWL2RV,13.99,"Gold Bracelets for Women, 14K Gold Evil Eye Bracelets Pearl Bracelet Sparkle Bracelet Twisted Bead Bracelets Dainty Gold Adjustable Bracelets Layered Lips Chain Bracelets Jewelry for Women",4.2,USD,True,False,13.99,False,,,1,146,False,0.0,"FREE delivery Mon, Aug 12 on $35 of items shipped by AmazonOr fastest delivery Fri, Aug 9",34.0,,https://m.media-amazon.com/images/I/41MCH-OLAdL._AC_UL320_.jpg,organic,7454898011,pearl,4,176,2042.54,0.0,0.0
B0B88LV6J2,199.0,4mm Cultured Pearl Tennis Bracelet in 18kt Gold Over Sterling,4.7,USD,True,False,199.0,False,,,1,3,False,0.0,"FREE delivery Tomorrow, Aug 8",35.0,,https://m.media-amazon.com/images/I/61VfzewJaBS._AC_UL320_.jpg,organic,7454898011,pearl,4,177,597.0,0.0,0.0
B0BCGFBYH9,14.99,30 Pieces 6mm/8mm Faux White Pearl Bracelets for Women Stackable Stretch Beaded Bracelets Simulated Pearl Bracelet Set for Bridesmaid Bridal Wedding Party Jewelry,4.7,USD,True,False,14.99,False,,,1,45,False,0.0,"FREE delivery Mon, Aug 12 on $35 of items shipped by AmazonOr fastest delivery Fri, Aug 9",36.0,,https://m.media-amazon.com/images/I/71P0lAGG2SL._AC_UL320_.jpg,organic,7454898011,pearl,4,178,674.55,0.0,0.0
B09VBHN8SC,36.99,Natural Pearl Bracelets for Women 925 Sterling Silver Handmade AAA+ Quality Handpicked Real White Cultured Freshwater Pearl Strand Birthstone June Charm Fine Jewelry For Women Gifts 7mm,4.5,USD,True,False,36.99,False,,,1,38,False,0.0,"FREE delivery Tue, Aug 13 Or fastest delivery Mon, Aug 12",37.0,,https://m.media-amazon.com/images/I/51TDfsiZJ+L._AC_UL320_.jpg,organic,7454898011,pearl,4,179,1405.6200000000001,0.0,0.0
B0C6Z2HWKY,28.8,Gorgeous CZ Crystal Genuine Freshwater Pearls Floral Necklace Earrings Set,4.1,USD,False,False,28.8,False,,,1,536,False,0.0,"FREE delivery Thu, Aug 15 Or fastest delivery Tomorrow, Aug 8",38.0,,https://m.media-amazon.com/images/I/61pNXtTJCsL._AC_UL320_.jpg,organic,7454898011,pearl,4,180,15436.800000000001,0.0,0.0
B0CCV7WBC6,13.99,"Pearl Bracelet, Pearl Bracelets Daisy Flower Bead Station Strand Dainty Pearl Bracelet for Women 6.5+2 Inch",4.6,USD,True,False,13.99,False,,,1,34,False,0.0,"FREE delivery Mon, Aug 12 on $35 of items shipped by AmazonOr fastest delivery Fri, Aug 9",39.0,,https://m.media-amazon.com/images/I/515YIMBNYuL._AC_UL320_.jpg,organic,7454898011,pearl,4,181,475.66,0.0,0.0
B07BKTVFWH,199.0,4-9.5mm Cultured Pearl Bolo Bracelet in 14kt Yellow Gold,4.2,USD,True,False,199.0,False,,,1,108,False,0.0,"FREE delivery Tomorrow, Aug 8",40.0,,https://m.media-amazon.com/images/I/61JvliptGnL._AC_UL320_.jpg,organic,7454898011,pearl,4,182,21492.0,0.0,0.0
