asin,price,title,rating,currency,is_prime,best_seller,price_upper,is_sponsored,manufacturer,sales_volume,pricing_count,reviews_count,is_amazons_choice,price_strikethrough,shipping_information,pos,rel_pos,url_image,source,category_id,keyword,page,position,min_revenue,discount,discount_rate
B0C88KGRCV,7.55,"Crystal Bead Bracelet, Wholesale Genuine Stretch Gemstone Bracelet, Healing Crystal Bracelet, Gift for Men & Women",4.3,USD,True,False,7.55,False,,,1,33,False,0.0,"FREE delivery Mon, Aug 12 on $35 of items shipped by AmazonOr fastest delivery Fri, Aug 9",11.0,,https://m.media-amazon.com/images/I/61-SQpkG47L._AC_UL320_.jpg,organic,7454898011,agate,5,201,249.15,0.0,0.0
B0BKK6DCW5,25.95,"10mm Shiny Round Red Agate (Carnelian) Stretch Bracelet in Various Lengths (7, 7.5, 8 Inches)",5.0,USD,False,False,25.95,False,,,1,2,False,0.0,"FREE delivery Aug 15 - 16 Or fastest delivery Fri, Aug 9",12.0,,https://m.media-amazon.com/images/I/51pKfPPoWBL._AC_UL320_.jpg,organic,7454898011,agate,5,202,51.9,0.0,0.0
B0B636WFSD,11.99,"Natural Stretch Gemstone Healing Chakra Bracelet for Women Teen Girls, Anxiety Crystal Jade Bracelet Good Luck Green Jade Bracelet Anxiety Relief Jewelry",3.5,USD,True,False,11.99,False,,,1,21,False,0.0,"FREE delivery Mon, Aug 12 on $35 of items shipped by AmazonOr fastest delivery Fri, Aug 9",13.0,,https://m.media-amazon.com/images/I/51O2txStHcL._AC_UL320_.jpg,organic,7454898011,agate,5,203,251.79,0.0,0.0
B0CRRH9GXG,7.99,2pcs Couple Bracelets Healing Crystal Black Agate White Turquoise Bracelets for Couples Matching Heart Bracelet for Lover Him & Her Boyfriend Girlfriend Valentine's Day Gifts,4.0,USD,True,False,7.99,False,,,1,679,False,0.0,"FREE delivery Mon, Aug 12 on $35 of items shipped by AmazonOr fastest delivery Fri, Aug 9",14.0,,https://m.media-amazon.com/images/I/718KOQL9fvL._AC_UL320_.jpg,organic,7454898011,agate,5,204,5425.21,0.0,0.0
B091GK1RNX,8.99,Gem Semi Precious Gemstones 4mm Natural Stone Round Beads Crystal Jasper Stretch Bracelet 7.2 Inch Unisex,4.6,USD,True,False,8.99,False,,,1,147,False,0.0,"FREE delivery Wed, Aug 14 on $35 of items shipped by Amazon",15.0,,https://m.media-amazon.com/images/I/71IWB8y3B-L._AC_UL320_.jpg,organic,7454898011,agate,5,205,1321.53,0.0,0.0
B07SGDFHGW,16.99,"8MM Stretch Bracelets for Unisex, Healing Stone Bracelet with Dangle Heart Charm 7""",4.4,USD,True,False,16.99,False,,,1,329,False,0.0,"FREE delivery Mon, Aug 12 on $35 of items shipped by AmazonOr fastest delivery Fri, Aug 9",16.0,,https://m.media-amazon.com/images/I/61jQFj8a3pL._AC_UL320_.jpg,organic,7454898011,agate,5,206,5589.709999999999,0.0,0.0
B07DZTZQVK,23.99,Womens Prayer Tree of Life Black Tourmaline Bracelet,4.6,USD,True,False,23.99,False,,,1,162,False,0.0,"FREE delivery Wed, Aug 14 on $35 of items shipped by Amazon",17.0,,https://m.media-amazon.com/images/I/71d5IU4pywL._AC_UL320_.jpg,organic,7454898011,agate,5,207,3886.3799999999997,0.0,0.0
B01AL6T3SC,20.49,"108 Stone Wrist Mala Bracelet,Necklace,Tibetan Buddhist Prayer Beads",4.4,USD,True,False,20.49,False,,,1,383,False,0.0,"FREE delivery Wed, Aug 14 on $35 of items shipped by Amazon",18.0,,https://m.media-amazon.com/images/I/614tD1la6iL._AC_UL320_.jpg,organic,7454898011,agate,5,208,7847.669999999999,0.0,0.0
B0733NZDPN,5.85,Gemstone Bracelets Natural Genuine Gemstones Birthstone Handmade Healing Power Crystal Beads Elastic Stretch 8mm 7.5 Inch Unisex,5.0,USD,False,False,5.85,False,,,1,3,False,0.0,"FREE delivery Aug 14 - 20 Or fastest delivery Fri, Aug 9",19.0,,https://m.media-amazon.com/images/I/81FYtd-c2HL._AC_UL320_.jpg,organic,7454898011,agate,5,209,17.549999999999997,0.0,0.0
B0CSCQQ9TR,42.99,Bracelet 925 Sterling Silver Adjustable Bracelets for Women Jewelry Gifts for Girls Friends,3.5,USD,True,False,42.99,False,,,1,2,False,0.0,"FREE delivery Mon, Aug 12 Or fastest delivery Fri, Aug 9",20.0,,https://m.media-amazon.com/images/I/61hz63E5gnL._AC_UL320_.jpg,organic,7454898011,agate,5,210,85.98,0.0,0.0
B0CTJDH1WN,11.98,Adjustable Handmade Bracelets for Women 4mm Spiritual Crystals Beaded Bracelets Worry Stone Energy Jewelry,0.0,USD,True,False,11.98,False,,,1,0,False,0.0,"FREE delivery Mon, Aug 12 on $35 of items shipped by AmazonOr fastest delivery Fri, Aug 9",21.0,,https://m.media-amazon.com/images/I/61RxA9ezoDL._AC_UL320_.jpg,organic,7454898011,agate,5,211,0.0,0.0,0.0
B00CD7B3C2,10.0,12mm Brown Botswana Agate Gemstone Bracelet - Good for Healing and Energy - 91166,4.5,USD,False,False,10.0,False,,,1,3,False,0.0,"FREE delivery Thu, Aug 15 Or fastest delivery Fri, Aug 9",22.0,,https://m.media-amazon.com/images/I/71H9Z3+PT9L._AC_UL320_.jpg,organic,7454898011,agate,5,212,30.0,0.0,0.0
B07RMXC1WQ,7.99,"Featured Men Women 8mm Beads Bracelet Elastic Natural Stone Yoga Bracelet Bangle 6.7""",4.5,USD,False,False,7.99,False,,,1,44,False,0.0,FREE delivery Aug 28 - Sep 19,23.0,,https://m.media-amazon.com/images/I/51wrKTTPvuL._AC_UL320_.jpg,organic,7454898011,agate,5,213,351.56,0.0,0.0
B0895SBJC2,52.99,Natural Purple Agate Women's Round Chalcedony Bracelet Bangle,0.0,USD,False,False,52.99,False,,,1,0,False,0.0,FREE delivery Aug 28 - Sep 19,24.0,,https://m.media-amazon.com/images/I/418gbV-61sL._AC_UL320_.jpg,organic,7454898011,agate,5,214,0.0,0.0,0.0
B094DX8C89,16.95,"4mm Smooth Round Red Agate (Carnelian) Stretch Bracelet with Celtic Knot Centerpiece, 6.5"" for Men, Women,and Teens",5.0,USD,True,False,16.95,False,,,1,1,False,0.0,"FREE delivery Mon, Aug 12 on $35 of items shipped by AmazonOr fastest delivery Fri, Aug 9",25.0,,https://m.media-amazon.com/images/I/615KS3--1AS._AC_UL320_.jpg,organic,7454898011,agate,5,215,16.95,0.0,0.0
B07QS3NFF8,31.9,Natural Green Color Agate Jade Bangle Bracelet for Womens (Small Size(58-59)),4.3,USD,True,False,31.9,False,,,1,25,False,0.0,"FREE delivery Mon, Aug 12 on $35 of items shipped by AmazonOr fastest delivery Fri, Aug 9",26.0,,https://m.media-amazon.com/images/I/51B0zh7GwjL._AC_UL320_.jpg,organic,7454898011,agate,5,216,797.5,0.0,0.0
B0C28TVZHG,29.0,Women's Stone Wrap Bracelet & Necklace - Ocean Agate - Stone of Plenitude,5.0,USD,False,False,29.0,False,,,1,1,False,0.0,"FREE delivery Wed, Aug 14 Or fastest delivery Fri, Aug 9",27.0,,https://m.media-amazon.com/images/I/61lnfTGJ6hL._AC_UL320_.jpg,organic,7454898011,agate,5,217,29.0,0.0,0.0
B07DJ2LGT2,6.99,1Pcs Lava Stone Aromatherapy Essential Oil Diffuser Bracelet Colorful Agate Beads Bracelet 8mm,0.0,USD,False,False,6.99,False,,,1,3,False,0.0,FREE delivery Aug 12 - 13,28.0,,https://m.media-amazon.com/images/I/61eStPa7luL._AC_UL320_.jpg,organic,7454898011,agate,5,218,20.97,0.0,0.0
B0CH4XD4D3,8.99,Zodiac Signs Spirit Bracelet Multilayer 12 Constellation Bracelet for Women Men Handmade Woven Zodiac Leather Bracelets Adjustable Glow in the Dark Zodiac Cuff Bangles for Constellation Lover,2.8,USD,True,False,8.99,False,,,1,56,False,0.0,"FREE delivery Wed, Aug 14 on $35 of items shipped by Amazon",29.0,,https://m.media-amazon.com/images/I/614TXOoDqYL._AC_UL320_.jpg,organic,7454898011,agate,5,219,503.44,0.0,0.0
B0C5SDYPX1,12.99,8MM Natural Crystal Agate Beads Bracelet Three Pieces Stretch Bracelet Handmade Beads Bracelet for Women (bra000028-S),4.6,USD,True,False,12.99,False,,,1,20,False,0.0,"FREE delivery Mon, Aug 12 on $35 of items shipped by AmazonOr fastest delivery Fri, Aug 9",30.0,,https://m.media-amazon.com/images/I/61dATSICTkL._AC_UL320_.jpg,organic,7454898011,agate,5,220,259.8,0.0,0.0
B088WFBVX4,17.8,"Beaded Multi Strand Multi Color Gem Stone and Crystal Memory Wire Bracelet, Multi Strand Wrap Bracelet or Stacked Cuff Bracelet",3.9,USD,True,False,17.8,False,,,1,16,False,0.0,"FREE delivery Mon, Aug 12 on $35 of items shipped by AmazonOr fastest delivery Fri, Aug 9",31.0,,https://m.media-amazon.com/images/I/81j6NBL6ZPL._AC_UL320_.jpg,organic,7454898011,agate,5,221,284.8,0.0,0.0
B07LDGB3C5,9.99,Gorgeous 10MM Round Agate Stretchy Bracelet for Women Fits up to 8.5 inch wrist,3.0,USD,False,False,9.99,False,,,1,5,False,0.0,FREE delivery Aug 12 - 14,32.0,,https://m.media-amazon.com/images/I/61N-oXQciXL._AC_UL320_.jpg,organic,7454898011,agate,5,222,49.95,0.0,0.0
B09QSTX5KT,32.99,Natural Jade Bangle Bracelet for Women Colorful Chinese Elegant Agate Jewelry for Mother Gift,5.0,USD,False,False,32.99,False,,,1,2,False,0.0,FREE delivery Aug 19 - 29,33.0,,https://m.media-amazon.com/images/I/51krMtaFQgL._AC_UL320_.jpg,organic,7454898011,agate,5,223,65.98,0.0,0.0
B09JW1V6XG,9.49,"Experience the Healing Power of Natural Agate Crystal Bracelet for Women - Mindfulness, Harmony, and Protection",0.0,USD,True,False,9.49,False,,,1,0,False,0.0,"FREE delivery Mon, Aug 12 on $35 of items shipped by AmazonOr fastest delivery Fri, Aug 9",34.0,,https://m.media-amazon.com/images/I/61Qp2QOJMIL._AC_UL320_.jpg,organic,7454898011,agate,5,224,0.0,0.0,0.0
B0CDLG7Z9P,36.99,Agate Beads Bracelet for Women 14/12mm Gobi Agate stone 15-16 Round Beads Bracelet Birthday Christmas Jewelry Gifts,0.0,USD,True,False,36.99,False,,,1,0,False,0.0,"FREE delivery Mon, Aug 12 Or fastest delivery Fri, Aug 9",35.0,,https://m.media-amazon.com/images/I/61EKuH9SH8L._AC_UL320_.jpg,organic,7454898011,agate,5,225,0.0,0.0,0.0
B0CZMPNT3G,56.99,Moss Agate Butterfly Adjustable Bracelet for Women Sterling Silver Butterfly Jewelry Gifts for Christmas Birthday Mother Day for Mom Girl,5.0,USD,True,False,56.99,False,,,1,2,False,0.0,"FREE delivery Mon, Aug 12 Or fastest delivery Fri, Aug 9",36.0,,https://m.media-amazon.com/images/I/61b2184anPL._AC_UL320_.jpg,organic,7454898011,agate,5,226,113.98,0.0,0.0
B07N2T639F,14.99,4mm Faceted Stone Beads Bracelet for Women Adjustable Oblong Shape Druzy Healing Crystal Bracelet,4.1,USD,True,False,14.99,False,,,1,69,False,0.0,"FREE delivery Wed, Aug 14 on $35 of items shipped by Amazon",37.0,,https://m.media-amazon.com/images/I/61TZFZeQKmL._AC_UL320_.jpg,organic,7454898011,agate,5,227,1034.31,0.0,0.0
B0CM6H8Y7D,13.98,Natural Gem Semi Precious Gemstones Beaded Bracelets Stretch 8mm Round Beads Spiritual Bracelet for Women and Men Energy Protection Gifts Unisex,3.9,USD,True,False,13.98,False,,,1,3,False,0.0,"FREE delivery Mon, Aug 12 on $35 of items shipped by AmazonOr fastest delivery Fri, Aug 9",38.0,,https://m.media-amazon.com/images/I/61SlIeq-7bL._AC_UL320_.jpg,organic,7454898011,agate,5,228,41.94,0.0,0.0
B0CJP5L8PG,9.9,Feng Shui Bracelets Good Luck Beaded Bracelets Tibetan Agate Prayer Bracelets for Women Men Thoughtful Gifts for Mum Girlfriends Sisters,4.3,USD,True,False,9.9,False,,,1,68,False,0.0,"FREE delivery Wed, Aug 14 on $35 of items shipped by Amazon",39.0,,https://m.media-amazon.com/images/I/51fmXi1d7rL._AC_UL320_.jpg,organic,7454898011,agate,5,229,673.2,0.0,0.0
B0CGZLGQ1Y,13.98,"Unisex Handmade Braided Healing Stone Gem Semi-Precious Gemstone Crystal 8mm Beaded Bracelets with Heart Charm for Women Men,Adjustable",4.6,USD,True,False,13.98,False,,,1,2,False,0.0,"FREE delivery Mon, Aug 12 on $35 of items shipped by AmazonOr fastest delivery Fri, Aug 9",40.0,,https://m.media-amazon.com/images/I/51nMGkyfblL._AC_UL320_.jpg,organic,7454898011,agate,5,230,27.96,0.0,0.0
B0CJ6VD2BZ,4.99,"Get Well Soon Gifts -Natural Stone Healing Relaxation Bracelets,8mm Anti-Anxiety Crystal Yoga Beads, Stress Relief Stretch Bracelets for Women Men Teen Girls",4.6,USD,True,False,4.99,False,,,1,67,False,9.99,"FREE delivery Mon, Aug 12 on $35 of items shipped by AmazonOr fastest delivery Fri, Aug 9",41.0,,https://m.media-amazon.com/images/I/81fDaTIjaoL._AC_UL320_.jpg,organic,7454898011,agate,5,231,334.33000000000004,5.0,0.5005005005005005
B07FT31TR4,15.49,"21 Crystal Stone Mala Bracelet for Unisex, 7"" Meditation Tibetan Buddhist Handmade Prayer Beads",3.7,USD,True,False,15.49,False,,,1,13,False,0.0,"FREE delivery Mon, Aug 12 on $35 of items shipped by AmazonOr fastest delivery Fri, Aug 9",42.0,,https://m.media-amazon.com/images/I/61GMx3T5CBL._AC_UL320_.jpg,organic,7454898011,agate,5,232,201.37,0.0,0.0
B0B8DBVNNK,48.4,Red Jade Bangle for Women Natural Agate Retro Chinese Style Jade Bracelets Gift for Girls,0.0,USD,False,False,48.4,False,,,1,0,False,0.0,FREE delivery Aug 19 - 29,43.0,,https://m.media-amazon.com/images/I/51jgpha1qlL._AC_UL320_.jpg,organic,7454898011,agate,5,233,0.0,0.0,0.0
B0C9PG3D1R,12.99,Chip Reiki Raw Amethyst Rose Quartz Crystal Bracelet for Women Chakra Tumbled Healing Crystals and Gemstones Yoga Meditation Stone Bracelets Adjustable,4.3,USD,True,False,12.99,False,,,1,21,False,0.0,"FREE delivery Mon, Aug 12 on $35 of items shipped by Amazon",44.0,,https://m.media-amazon.com/images/I/61PYEjfKz6L._AC_UL320_.jpg,organic,7454898011,agate,5,234,272.79,0.0,0.0
B00B85IVF2,10.0,"Botswana Agate Gemstone Bracelet for Women, Men | Macramé Style Adjustable Bracelet for Meditation, Yoga (Magenta Pink)",3.8,USD,False,False,10.0,False,,,1,35,False,0.0,"FREE delivery Thu, Aug 15 Or fastest delivery Fri, Aug 9",45.0,,https://m.media-amazon.com/images/I/71tCoiIlF-L._AC_UL320_.jpg,organic,7454898011,agate,5,235,350.0,0.0,0.0
B01A6RR0EU,20.0,Turquoise Heart Beaded Genuine Leather 3 Wrap Bracelet Handmade Fashion Women Jewelry,4.2,USD,True,False,20.0,False,,,1,80,False,0.0,"FREE delivery Wed, Aug 14 on $35 of items shipped by Amazon",46.0,,https://m.media-amazon.com/images/I/71JkuUcObpL._AC_UL320_.jpg,organic,7454898011,agate,5,236,1600.0,0.0,0.0
B0CHLB6PRH,10.6,Green Aventurine Indian Agat 4 mm Polished Aamazonite Stone Beads Bracelets Men Stretch Jewelry Women Mineral Pulsera,0.0,USD,False,False,10.6,False,,,1,0,False,0.0,FREE delivery Aug 22 - Sep 4,47.0,,https://m.media-amazon.com/images/I/31XgJWli9pL._AC_UL320_.jpg,organic,7454898011,agate,5,237,0.0,0.0,0.0
B00E00Y7DC,17.99,Genuine Brown Leather Wrap Around Bracelet with Natural Agate Stone Beads - Assorted Colors,0.0,USD,False,False,17.99,False,,,1,0,False,0.0,FREE delivery Aug 13 - 14,48.0,,https://m.media-amazon.com/images/I/81WMvt4D3OL._AC_UL320_.jpg,organic,7454898011,agate,5,238,0.0,0.0,0.0
B0DBD6LTGN,9.98,"12 Colors Cream Texture Lipstick Waterproof, Superstay Smudge-Proof Non-Sticky Lip Gloss, Long-Lasting Moisturizing Lipstick Lip Stain - Keep Shiny All Day (4#Puppylove, one size)",5.0,USD,,False,9.98,True,,,1,1,False,0.0,,,1.0,https://aax-us-iad.amazon.com/e/loi/imp?b=JImlRnQ28Nx2JZw2GOyAAQgAAAGRLRz_FAEAAAH2AQBvbm9fdHhuX2JpZDIgICBvbm9fdHhuX2ltcDEgICC-cq8P,paid,7454898011,agate,6,7,9.98,0.0,0.0
B01N2KJ3ER,4.64,SHG 6mm Round Smooth Blue Crazy Lace Agate Gemstone Stretchy Round Rope Hand Knitted Men Women Bracelets 7 Inches,0.0,USD,False,False,4.64,False,,,1,0,False,0.0,$3.48 delivery Aug 21 - Sep 4,1.0,,https://m.media-amazon.com/images/I/61QnFwmqBAL._AC_UL320_.jpg,organic,7454898011,agate,6,239,0.0,0.0,0.0
B01HR6TXQ6,0.0,Natural Gemstone 6mm Round Beads Stretch Bracelet 7 Inch,4.4,USD,False,False,0.0,False,,,1,832,False,0.0,,2.0,,https://m.media-amazon.com/images/I/61EbLefv37L._AC_UL320_.jpg,organic,7454898011,agate,6,240,0.0,0.0,0.0
B08W44L6M2,7.99,Fashion Crystal Man Women Stretch Bracelet 10mm Round Beads Rock Jasper 7 Inch Unisex,4.5,USD,True,False,7.99,False,,,1,79,False,0.0,"FREE delivery Mon, Aug 12 on $35 of items shipped by Amazon",3.0,,https://m.media-amazon.com/images/I/61QLmBMiMsL._AC_UL320_.jpg,organic,7454898011,agate,6,241,631.21,0.0,0.0
B0D65JT3XC,30.39,Flower Agate Bracelet Classic Feng Shui Wealth Love Amulet Crystal Bracelet Cherry Blossom Carnelian Chakra Pink Quartz Bracelet Gourd Longevity Calabash Wu Lou Bracelet Prosperity Luck Mo/2096,0.0,USD,False,False,30.39,False,,,1,0,False,0.0,$6.99 delivery Aug 28 - Sep 19,4.0,,https://m.media-amazon.com/images/I/61qJDZcEPKL._AC_UL320_.jpg,organic,7454898011,agate,6,242,0.0,0.0,0.0
B07FT31TR4,15.49,"21 Crystal Stone Mala Bracelet for Unisex, 7"" Meditation Tibetan Buddhist Handmade Prayer Beads",3.7,USD,True,False,15.49,False,,,1,13,False,0.0,"FREE delivery Mon, Aug 12 on $35 of items shipped by Amazon",5.0,,https://m.media-amazon.com/images/I/61GMx3T5CBL._AC_UL320_.jpg,organic,7454898011,agate,6,243,201.37,0.0,0.0
B09P3GKDD1,8.99,Natural Fashion Seven Chakra Beaded Bracelet Alloy Peach Heart Chain Agate Crystal Strand,4.4,USD,True,False,8.99,False,,,1,30,False,0.0,"FREE delivery Wed, Aug 14 on $35 of items shipped by Amazon",6.0,,https://m.media-amazon.com/images/I/61zQ8h7EQFL._AC_UL320_.jpg,organic,7454898011,agate,6,244,269.7,0.0,0.0
B00E00Y7DC,17.99,Genuine Brown Leather Wrap Around Bracelet with Natural Agate Stone Beads - Assorted Colors,0.0,USD,False,False,17.99,False,,,1,0,False,0.0,FREE delivery Aug 14 - 19 Or fastest delivery Aug 13 - 16,7.0,,https://m.media-amazon.com/images/I/81WMvt4D3OL._AC_UL320_.jpg,organic,7454898011,agate,6,245,0.0,0.0,0.0
B08V4L9RLC,15.7,Natural Black Botswana Agate Bracelet Crystal Stone 8 mm Round Bead Thread Bracelet for Unisex (Color : Multi),5.0,USD,False,False,15.7,False,,,1,1,False,0.0,FREE delivery Sep 6 - 19,8.0,,https://m.media-amazon.com/images/I/61EODAx8XDL._AC_UL320_.jpg,organic,7454898011,agate,6,246,15.7,0.0,0.0
B0B5ZR5HJ2,16.99,Natural Red Agate Stretch Bracelet Healing Crystals Carnelian For Women Jewelry Beauty Happiness Auspiciousness Wealth(8 mm),5.0,USD,True,False,16.99,False,,,1,2,False,0.0,"FREE delivery Wed, Aug 14 on $35 of items shipped by Amazon",9.0,,https://m.media-amazon.com/images/I/51mVgcdAmKL._AC_UL320_.jpg,organic,7454898011,agate,6,247,33.98,0.0,0.0
B014FLLI4Q,13.99,6mm Agate 7-7.5 Inch Stretchy Adjustable Stackable Bracelet For Women with Charms Set of 4,5.0,USD,False,False,13.99,False,,,1,4,False,0.0,FREE delivery Aug 12 - 14,10.0,,https://m.media-amazon.com/images/I/61NZnkjjrML._AC_UL320_.jpg,organic,7454898011,agate,6,248,55.96,0.0,0.0
B0CM5Z82ZK,0.0,Natural Pink Marble Alashan Agate 10mm rondelle smooth 7inch Semi-Precious Gemstones Beaded Bracelets for Men Women Healing Crystal Stretch Beaded Bracelet Unisex,0.0,USD,False,False,0.0,False,,,1,0,False,0.0,,11.0,,https://m.media-amazon.com/images/I/51Is0w-z+9L._AC_UL320_.jpg,organic,7454898011,agate,6,249,0.0,0.0,0.0
B0C5SDYPX1,12.99,8MM Natural Crystal Agate Beads Bracelet Three Pieces Stretch Bracelet Handmade Beads Bracelet for Women (bra000028-S),4.6,USD,True,False,12.99,False,,,1,20,False,0.0,"FREE delivery Mon, Aug 12 on $35 of items shipped by Amazon",12.0,,https://m.media-amazon.com/images/I/61dATSICTkL._AC_UL320_.jpg,organic,7454898011,agate,6,250,259.8,0.0,0.0
B0CRDNYBPP,16.99,Custom Bead Wrap Bracelet for Women Engraved Name Photo Handmade Natural Agate Beads Layered Bracelet Bohemian Style 3 Wraps Adjustable Bracelets Jewelry Gifts,4.4,USD,False,False,16.99,False,,,1,1330,False,0.0,FREE delivery Aug 19 - 29,13.0,,https://m.media-amazon.com/images/I/71LjvteP+QL._AC_UL320_.jpg,organic,7454898011,agate,6,251,22596.699999999997,0.0,0.0
B01D6G2804,0.0,Natural Gemstone 8mm Round Beads Stretch Bracelet 7 Inch,4.5,USD,False,False,0.0,False,,,1,309,False,0.0,,14.0,,https://m.media-amazon.com/images/I/51bI2roJrlL._AC_UL320_.jpg,organic,7454898011,agate,6,252,0.0,0.0,0.0
B0BJNZYFQS,15.99,"Lava Rock Pink Zebra Jasper Bracelet, Stress Relief Yoga Relaxation Bracelets, Natural Crystal Stone Healing Spiritual Bracelet,Adjustable Beaded Bracelet, Anti Anxiety Happy Mood Bracelet for Women, Bring Good Luck Gift",4.4,USD,True,False,15.99,False,,,1,68,False,0.0,"FREE delivery Wed, Aug 14 on $35 of items shipped by Amazon",15.0,,https://m.media-amazon.com/images/I/7156IA2D5mL._AC_UL320_.jpg,organic,7454898011,agate,6,253,1087.32,0.0,0.0
B083K5MH94,34.36,58mm-62mm Natural Brazilian Red Agate Bracelet Women's Jade Round Bar Bangle,0.0,USD,False,False,34.36,False,,,1,18,False,0.0,FREE delivery Aug 19 - 29,16.0,,https://m.media-amazon.com/images/I/41NuumA4bpL._AC_UL320_.jpg,organic,7454898011,agate,6,254,618.48,0.0,0.0
B08RB3MXSH,25.99,Artisan Handmade Rose Quartz Agate Beaded Pendant Bracelet from Thailand Brass Gemstone Birthstone [7.75 in min L x 7.75 in max L 5 mm W Pendant(s) 0.6 in L x 0.8 in W] ' Magical Day',5.0,USD,True,False,25.99,False,,,1,2,False,0.0,"FREE delivery Wed, Aug 14 on $35 of items shipped by Amazon",17.0,,https://m.media-amazon.com/images/I/61xQVtAJHiL._AC_UL320_.jpg,organic,7454898011,agate,6,255,51.98,0.0,0.0
B09R9JNHYT,19.99,Boho Natural Gemstone Blue Turquoise Black Brown Tiger Eye Red Lime Orange Jasper Green Jade Malachite Stones Chakra Stacking Bolo Bracelet Gold Plated Stainless Steel Rondel Tube Beads Cord 7-9”,3.6,USD,True,False,19.99,False,,,1,8,False,0.0,"FREE delivery Wed, Aug 14 on $35 of items shipped by Amazon",18.0,,https://m.media-amazon.com/images/I/51lQBDTwoKL._AC_UL320_.jpg,organic,7454898011,agate,6,256,159.92,0.0,0.0
B0D2H32Z2Y,46.99,"925 Sterling Silver Bangles for Women, Agate Bracelets for Teens, Handmade Cuff Bracelet - Party Bridal Jewelry",0.0,USD,False,False,46.99,False,,,1,0,False,0.0,$4.99 delivery Aug 28 - Sep 19,19.0,,https://m.media-amazon.com/images/I/411IsZutn8L._AC_UL320_.jpg,organic,7454898011,agate,6,257,0.0,0.0,0.0
B085XT8VPS,12.0,Created Turquoise Beaded Bracelet Handmade Braided Stretch Bracelets Cuff Fashion Jewelry,4.1,USD,False,False,12.0,False,,,1,144,False,0.0,FREE delivery on $35 shipped by Amazon.,20.0,,https://m.media-amazon.com/images/I/61udtdefvML._AC_UL320_.jpg,organic,7454898011,agate,6,258,1728.0,0.0,0.0
B0CN2N2FDZ,0.0,Natural Orca Agate 8mm rondelle smooth 7inch Semi-Precious Gemstones Beaded Bracelets for Men Women Healing Crystal Stretch Beaded Bracelet Unisex,0.0,USD,False,False,0.0,False,,,1,0,False,0.0,,21.0,,https://m.media-amazon.com/images/I/41I2wL6TUBL._AC_UL320_.jpg,organic,7454898011,agate,6,259,0.0,0.0,0.0
B07MMTV9ZV,24.95,"""Chihuahuan Desert"" Natural Crazy Lace Agate Stone Bracelet, 7.0 Inches Adjustable",0.0,USD,False,False,24.95,False,,,1,0,False,0.0,"FREE delivery Aug 14 - 20 Or fastest delivery Mon, Aug 12",22.0,,https://m.media-amazon.com/images/I/81X31GRSLLL._AC_UL320_.jpg,organic,7454898011,agate,6,260,0.0,0.0,0.0
B081C6DDFB,12.99,"Black Onyx Agate Bracelet, Matte finish Root Chakra Gemstone, 10 mm Stretch Mala Beads Bracelet, Buddha Head healing Bracelet, wrist mala - Repels negativity, Libido, Overcome fears. 7.5""",2.0,USD,True,False,12.99,False,,,1,1,False,0.0,"FREE delivery Mon, Aug 12 on $35 of items shipped by Amazon",23.0,,https://m.media-amazon.com/images/I/61YARHwV1uL._AC_UL320_.jpg,organic,7454898011,agate,6,261,12.99,0.0,0.0
B08HMPV6BY,7.39,Gemstone 6mm Natural Round Beads Gemstones Crystal Stretch Bracelet 7 Inch Unisex,4.5,USD,True,False,7.39,False,,,1,224,False,0.0,"FREE delivery Wed, Aug 14 on $35 of items shipped by Amazon",24.0,,https://m.media-amazon.com/images/I/51g0snhYgwL._AC_UL320_.jpg,organic,7454898011,agate,6,262,1655.36,0.0,0.0
B094DT4YB7,21.95,"4mm Smooth Round Red Agate (Carnelian) Stretch Bracelet with Corrugated Silver Beaded Centerpiece, 6.5""",2.2,USD,False,False,21.95,False,,,1,2,False,0.0,"FREE delivery Aug 14 - 15 Or fastest delivery Fri, Aug 9",25.0,,https://m.media-amazon.com/images/I/613bOUIuOZS._AC_UL320_.jpg,organic,7454898011,agate,6,263,43.9,0.0,0.0
B084LX7S5D,10.99,Mini Blue Agate Gemstone 4mm Energy Bracelet - Yoga Intention Meditation,4.1,USD,False,False,10.99,False,,,1,8,False,0.0,FREE delivery on $35 shipped by Amazon.,26.0,,https://m.media-amazon.com/images/I/71zCQFCI2DL._AC_UL320_.jpg,organic,7454898011,agate,6,264,87.92,0.0,0.0
B0CRPF73V1,32.0,"Positive Energy Bracelet for Men & Women - Natural Gemstone Women Bracelets - Unique, Beautiful & Stress Relief Gift - Stretchy Cord 4mm Genuine Gemstone Charm Bracelet",1.0,USD,False,False,32.0,False,,,1,1,False,0.0,"$9.95 delivery Thu, Aug 15 Or fastest delivery Aug 9 - 13",27.0,,https://m.media-amazon.com/images/I/31BwMfmFeqL._AC_UL320_.jpg,organic,7454898011,agate,6,265,32.0,0.0,0.0
B01DUC65H6,0.0,Natural Gemstone 8mm Round Beads Stretch Bracelet 7 Inch,4.6,USD,False,False,0.0,False,,,1,591,False,0.0,,28.0,,https://m.media-amazon.com/images/I/71HuyF5e7cL._AC_UL320_.jpg,organic,7454898011,agate,6,266,0.0,0.0,0.0
B0BY6QB6B5,29.99,Lavender Jade Bangle Bracelet for Women Girls Natural Violets Retro Agate Chalcedony Light Purple Jewelry Gift for Wife,5.0,USD,False,False,29.99,False,,,1,2,False,0.0,FREE delivery Aug 19 - 29,29.0,,https://m.media-amazon.com/images/I/51Fp1IgxiHL._AC_UL320_.jpg,organic,7454898011,agate,6,267,59.98,0.0,0.0
B0C53GMWX2,4.74,Girlfriend Gifts 100 I Love You Language Projection Bracelet Healing Crystal Pink Agate Stone Bracelets Anniversary Valentines' Day Birthday Gifts Bracelet Jewelry for Women Teen Girls Her,5.0,USD,True,False,4.74,False,,,1,3,False,0.0,"FREE delivery Tue, Aug 13 on $35 of items shipped by Amazon",30.0,,https://m.media-amazon.com/images/I/61R4ihlQFQL._AC_UL320_.jpg,organic,7454898011,agate,6,268,14.22,0.0,0.0
B01N210V88,0.0,Natural Gemstone 8mm Round Beads Stretch Bracelet 7 Inch,4.5,USD,False,False,0.0,False,,,1,334,False,0.0,,31.0,,https://m.media-amazon.com/images/I/51NiKJD7t8L._AC_UL320_.jpg,organic,7454898011,agate,6,269,0.0,0.0,0.0
B01A6VPWKA,13.99,Agate Pyrite Beaded Friendship Bracelets Wrap Bracelet Woven Braided Bracelets New,4.6,USD,True,False,13.99,False,,,1,18,False,0.0,"FREE delivery Tue, Aug 13 on $35 of items shipped by Amazon",32.0,,https://m.media-amazon.com/images/I/71j0zFm0crL._AC_UL320_.jpg,organic,7454898011,agate,6,270,251.82,0.0,0.0
B0C27HN798,20.99,Unisex blue lace agate 3.5mm round faceted beads 7 inch stacking bracelet with 925 sterling silver - silver plated clasp,0.0,USD,False,False,20.99,False,,,1,0,False,0.0,$6.99 delivery Aug 28 - Sep 19 Or fastest delivery Aug 13 - 16,33.0,,https://m.media-amazon.com/images/I/315A39TothL._AC_UL320_.jpg,organic,7454898011,agate,6,271,0.0,0.0,0.0
B0BSGZM8NQ,129.99,"24K Solid Gold Bracelets for Women, Stretchable Lucky Animals Real Gold Rabbit Bangle Charm Bracelets, Pure Gold Agate Beaded Zodiac Bunny Bracelet",4.4,USD,False,False,129.99,False,,,1,7,False,0.0,FREE delivery Aug 16 - 27,34.0,,https://m.media-amazon.com/images/I/51JWQk0XvUL._AC_UL320_.jpg,organic,7454898011,agate,6,272,909.9300000000001,0.0,0.0
