asin,price,title,rating,currency,is_prime,best_seller,price_upper,is_sponsored,manufacturer,sales_volume,pricing_count,reviews_count,is_amazons_choice,price_strikethrough,shipping_information,pos,rel_pos,url_image,source,category_id,keyword,page,position,min_revenue,discount,discount_rate
B0CP961YCC,5.39,Healing Crystal Stone Bracelets for Women Men Stress Relief Anxiety Yoga Bracelet Semi-Precious Gemstone Bracelets Healing Gifts birthday Gifts For Teen Girls jade bracelet,3.7,USD,True,False,5.39,False,,,1,34,False,0.0,"FREE delivery Mon, Aug 12 on $35 of items shipped by AmazonOr fastest delivery Fri, Aug 9",2,,https://m.media-amazon.com/images/I/61i3teCHfzL._AC_UL320_.jpg,organic,7454898011,smoky quartz,1,1,183.26,0.0,0.0
B0CZRK5JC9,5.49,"Stress Relief Anxiety Yoga Bracelets for Women Men,Healing Crystal Natural Stone Mantra Stretch Bracelet Birthday Gifts for Teen Girls Her Daughter Girlfriend Wife Mom",5.0,USD,True,False,5.49,False,,,1,1,False,0.0,"FREE delivery Mon, Aug 12 on $35 of items shipped by AmazonOr fastest delivery Fri, Aug 9",3,,https://m.media-amazon.com/images/I/61CRYNm0WzL._AC_UL320_.jpg,organic,7454898011,smoky quartz,1,2,5.49,0.0,0.0
B075VCHN4F,9.99,Natural Gemstone Round Beads Stretch Bracelet Healing Reiki 8mm,4.5,USD,True,False,9.99,False,,,1,2150,False,0.0,"FREE delivery Mon, Aug 12 on $35 of items shipped by AmazonOr fastest delivery Fri, Aug 9",4,,https://m.media-amazon.com/images/I/61rsRAlvmtL._AC_UL320_.jpg,organic,7454898011,smoky quartz,1,3,21478.5,0.0,0.0
B077Y9TCYX,9.99,"Natural Bead Bracelet Semi Precious Gemstone Beaded Bracelet for Women Healing Crystal Stone Stretch Bracelet Men Couple Bracelets (2pcs,6-8mm/8-10mm)",4.4,USD,True,False,9.99,False,,,1,1972,False,0.0,"FREE delivery Mon, Aug 12 on $35 of items shipped by AmazonOr fastest delivery Tomorrow, Aug 8",5,,https://m.media-amazon.com/images/I/71FNegYrSbL._AC_UL320_.jpg,organic,7454898011,smoky quartz,1,4,19700.28,0.0,0.0
B0C8M7212M,9.85,"Grade A++ Crystal Bead Bracelet, Wholesale Genuine Gemstone Stetch Bracelet, Healing Crystal Bracelet Bead Bracelet, Gift for Men & Women",4.4,USD,True,False,9.85,False,,,1,17,False,0.0,"FREE delivery Mon, Aug 12 on $35 of items shipped by AmazonOr fastest delivery Fri, Aug 9",6,,https://m.media-amazon.com/images/I/61wS7hMA-ML._AC_UL320_.jpg,organic,7454898011,smoky quartz,1,5,167.45,0.0,0.0
B07PP4BYWZ,16.95,"4mm Smooth Round Smoky Quartz Stretch Bracelets in Various Lengths (6, 6.5, 7, 7.5, 8 Inches) …",4.4,USD,True,False,16.95,False,,,1,42,False,0.0,"FREE delivery Mon, Aug 12 on $35 of items shipped by AmazonOr fastest delivery Tomorrow, Aug 8",7,,https://m.media-amazon.com/images/I/61BFW3X7RJL._AC_UL320_.jpg,organic,7454898011,smoky quartz,1,6,711.9,0.0,0.0
B0CN2PPYQS,8.99,Natural Healing Power Gemstone Crystal Beads Unisex Adjustable Macrame Bracelets,4.5,USD,True,False,8.99,False,,,1,7870,False,9.99,"FREE delivery Mon, Aug 12 on $35 of items shipped by AmazonOr fastest delivery Tomorrow, Aug 8",8,,https://m.media-amazon.com/images/I/61N1-E834uL._AC_UL320_.jpg,organic,7454898011,smoky quartz,1,7,70751.3,1.0,0.10010010010010009
B0BLV94YHV,10.95,Natural Healing Crystal Beads Bracelet Gemstone Couple Adjustable Gift Bracelet,4.4,USD,True,False,10.95,False,,,1,318,False,0.0,"FREE delivery Mon, Aug 12 on $35 of items shipped by AmazonOr fastest delivery Fri, Aug 9",9,,https://m.media-amazon.com/images/I/51DgSe4g39L._AC_UL320_.jpg,organic,7454898011,smoky quartz,1,8,3482.1,0.0,0.0
B07WHB8JJ8,17.99,"8mm Genuine Gemstone Stretch Bracelet for Women Men Unisex, Natural Energy Crystal Stone Beads, Classic Simple Design Cuff Birthday Gift 7.5 Inch",4.5,USD,False,False,17.99,False,,,1,562,False,0.0,FREE delivery on $35 shipped by Amazon.,10,,https://m.media-amazon.com/images/I/61n+8RHBhRL._AC_UL320_.jpg,organic,7454898011,smoky quartz,1,9,10110.38,0.0,0.0
B09N2DG5D4,29.99,SHOP LC Stainless Steel Citrine Bangle Bracelet for Women Jewelry With Adjustable Lock Women Ct 4.7 Birthday Gifts,4.2,USD,True,False,29.99,False,,,1,5,False,0.0,"FREE delivery Mon, Aug 12 on $35 of items shipped by AmazonOr fastest delivery Sun, Aug 11",11,,https://m.media-amazon.com/images/I/61-7IFXmjCL._AC_UL320_.jpg,organic,7454898011,smoky quartz,1,10,149.95,0.0,0.0
B095MBY3V4,7.99,"Handmade Gem Bracelet 7.5"" Stretch Gemstone 8mm Round Beads Crystals Quartz Unisex",4.5,USD,True,False,7.99,False,,100+ bought in past month,1,4165,False,0.0,"FREE delivery Mon, Aug 12 on $35 of items shipped by AmazonOr fastest delivery Tomorrow, Aug 8",12,,https://m.media-amazon.com/images/I/61YqKrS8b4L._AC_UL320_.jpg,organic,7454898011,smoky quartz,1,11,33278.35,0.0,0.0
B0CL2G9QWX,12.3,Natural Smo-ky Quartz Crystal Bracelet 8 Mm Designing Stone Reiki Healing Bracelet For Men & Women Luck Charm And Wealth,0.0,USD,True,False,12.3,False,,,1,0,False,0.0,"FREE delivery Mon, Aug 12 on $35 of items shipped by AmazonOr fastest delivery Fri, Aug 9",13,,https://m.media-amazon.com/images/I/41IPJ-ET3tL._AC_UL320_.jpg,organic,7454898011,smoky quartz,1,12,0.0,0.0,0.0
B074K9G2GG,9.99,"8.65 Cts Pear Shape Natural Gemstones Bracelet For Women, Handmade Birthstone Bracelet Jewelry Women's Day Gifts For Mom Wife",4.1,USD,True,False,9.99,False,,,1,74,False,14.99,"FREE delivery Mon, Aug 12 on $35 of items shipped by AmazonOr fastest delivery Fri, Aug 9",14,,https://m.media-amazon.com/images/I/6151O2LG-LL._AC_UL320_.jpg,organic,7454898011,smoky quartz,1,13,739.26,5.0,0.333555703802535
B0B4KTJV8M,22.95,"10mm Round Smoky Quartz Stretch Bracelet in Various Lengths (7, 7.5, 8 inches)",0.0,USD,False,False,22.95,False,,,1,0,False,0.0,"FREE delivery Aug 19 - 20 Or fastest delivery Fri, Aug 9",15,,https://m.media-amazon.com/images/I/61xVsxhiaDL._AC_UL320_.jpg,organic,7454898011,smoky quartz,1,14,0.0,0.0,0.0
B0CX9JJPWR,9.99,"Bracelets for Men Women, 8MM Natural Stone Beaded Bracelet Set Stretch Bracelets Adjustable Crystal Bead Bracelet Gifts for Men Women Him Her",4.9,USD,True,False,9.99,False,,,1,9,False,0.0,"FREE delivery Mon, Aug 12 on $35 of items shipped by AmazonOr fastest delivery Fri, Aug 9",16,,https://m.media-amazon.com/images/I/61Vuv5MUqdL._AC_UL320_.jpg,organic,7454898011,smoky quartz,1,15,89.91,0.0,0.0
B09TVZ8234,13.98,Genuine Natural Brown Quartz Smoky Crystal Cut Beads Bracelet 10mm AAAA,5.0,USD,False,False,13.98,False,,,1,1,False,0.0,FREE delivery Aug 21 - 30,17,,https://m.media-amazon.com/images/I/61am4sefI9L._AC_UL320_.jpg,organic,7454898011,smoky quartz,1,16,13.98,0.0,0.0
B0C778NXW2,20.7,"Crystal Bead Bracelet, Wholesale Genuine Stretch Gemstone Bracelet, Healing Crystal Bracelet, Gift for Men & Women",4.3,USD,True,False,20.7,False,,,1,33,False,0.0,"FREE delivery Mon, Aug 12 on $35 of items shipped by AmazonOr fastest delivery Tomorrow, Aug 8",18,,https://m.media-amazon.com/images/I/51EgpiYjFzL._AC_UL320_.jpg,organic,7454898011,smoky quartz,1,17,683.1,0.0,0.0
B082HCWQSC,9.16,Muko Gemstone 14mm Natural Smoky Quartz Brown Quartz Crystal Clear Round Beads Women Men Bracelet AAAA,5.0,USD,False,False,9.16,False,,,1,3,False,0.0,FREE delivery Sep 6 - 18 Or fastest delivery Aug 13 - 15,19,,https://m.media-amazon.com/images/I/61OFV-el28L._AC_UL320_.jpg,organic,7454898011,smoky quartz,1,18,27.48,0.0,0.0
B0CLGDW1XD,38.0,Baron Smoky Quartz Charm Bracelet,0.0,USD,False,False,38.0,False,,,1,0,False,0.0,"FREE delivery Thu, Aug 15 Or fastest delivery Aug 9 - 12",20,,https://m.media-amazon.com/images/I/51ECTyxH8iL._AC_UL320_.jpg,organic,7454898011,smoky quartz,1,19,0.0,0.0,0.0
B06XCY68MK,79.99,"PalmBeach Yellow Gold-plated Emerald Cut Genuine Smoky Quartz, Tennis Bracelet (5.5mm), Hidden Box Clasp, 7.25 inches",3.7,USD,True,False,79.99,False,,,1,5,False,0.0,"FREE delivery Mon, Aug 12 Or fastest delivery Fri, Aug 9",21,,https://m.media-amazon.com/images/I/71AX05a6u6L._AC_UL320_.jpg,organic,7454898011,smoky quartz,1,20,399.95,0.0,0.0
B0C3R8WPF1,160.0,1.90 ct. t.w. Citrine and .90 ct. t.w. Smoky Quartz Sunflower Bolo Bracelet in 18kt Gold Over Sterling,5.0,USD,True,False,160.0,False,,,1,2,False,0.0,"FREE delivery Tomorrow, Aug 8",22,,https://m.media-amazon.com/images/I/71F1s6UjYoL._AC_UL320_.jpg,organic,7454898011,smoky quartz,1,21,320.0,0.0,0.0
B00T889TM0,89.99,"925 Sterling Silver Brown Smoky Quartz Tennis Bracelet For Women (4.79 Cttw, Oval 7X5MM, 7 Inch + 1.5 Inch Extender)",4.0,USD,True,False,89.99,False,,,1,1,False,0.0,FREE delivery,23,,https://m.media-amazon.com/images/I/61UEVBd1u6L._AC_UL320_.jpg,organic,7454898011,smoky quartz,1,22,89.99,0.0,0.0
B09ZQQVPBF,30.99,"925 Sterling Silver Women's Bracelet Natural Smoky Quartz Gemstone, Brown, 8.5 inch (SG-16)",0.0,USD,False,False,30.99,False,,,1,0,False,0.0,FREE delivery Sep 6 - 19,24,,https://m.media-amazon.com/images/I/61bYW0hP9hL._AC_UL320_.jpg,organic,7454898011,smoky quartz,1,23,0.0,0.0,0.0
B01MY9DTPW,119.99,"PalmBeach Yellow Gold-plated Round Genuine Smoky Quartz, Tennis Bracelet (24mm), Hidden Box Clasp, 7.25 inches",4.4,USD,False,False,119.99,False,,,1,3,False,0.0,"FREE delivery Thu, Aug 15 Or fastest delivery Fri, Aug 9",25,,https://m.media-amazon.com/images/I/811jOJlFAIL._AC_UL320_.jpg,organic,7454898011,smoky quartz,1,24,359.96999999999997,0.0,0.0
B0C8TVGHQK,46.0,Crystals and Healing Stones Bracelet Citrine Smoky-Quartz Red-Agate Pyrite Gemstones for Emotional Healing Positivity Luck and Happiness,0.0,USD,True,False,46.0,False,,,1,0,False,0.0,"FREE delivery Mon, Aug 12 Or fastest delivery Fri, Aug 9",26,,https://m.media-amazon.com/images/I/71vDpgXgypL._AC_UL320_.jpg,organic,7454898011,smoky quartz,1,25,0.0,0.0,0.0
B08BT72LBR,99.99,"925 Sterling Silver Brown Smoky Quartz Tennis Bracelet For Women (6.00 Cttw, Gemstone, Oval 7X5MM, Fully Adjustable Up to 9 Inch)",5.0,USD,True,False,99.99,False,,,1,2,False,0.0,"FREE delivery Mon, Aug 12 Or fastest delivery Sun, Aug 11",27,,https://m.media-amazon.com/images/I/61CHdfHKLUL._AC_UL320_.jpg,organic,7454898011,smoky quartz,1,26,199.98,0.0,0.0
B09MDN4BJK,139.0,Genuine Smoky Lemon Quartz Bracelet in 925 Sterling Silver Vintage Inspire Design. 7 in Length,0.0,USD,True,False,139.0,False,,,1,0,False,0.0,"FREE delivery Mon, Aug 12 Or fastest delivery Fri, Aug 9",28,,https://m.media-amazon.com/images/I/71vZq2RCD6L._AC_UL320_.jpg,organic,7454898011,smoky quartz,1,27,0.0,0.0,0.0
B081M3BNZX,187.99,"18K Yellow Gold Plated Silver Brown Smoky Quartz and White Lab Grown Diamond Tennis Bracelet For Women (2.76 Cttw, Fully Adjustable Up to 9 Inch)",5.0,USD,True,False,187.99,False,,,1,2,False,0.0,"FREE delivery Mon, Aug 12 Or fastest delivery Fri, Aug 9",29,,https://m.media-amazon.com/images/I/61XG6xaSfFL._AC_UL320_.jpg,organic,7454898011,smoky quartz,1,28,375.98,0.0,0.0
B07KS1P1DR,19.0,"Smoky Quartz, Crystal and Herkimer Diamond Gemstone Bracelet Foe Women",0.0,USD,False,False,19.0,False,,,1,0,False,0.0,$5.99 delivery Aug 28 - Sep 9 Or fastest delivery Aug 13 - 16,30,,https://m.media-amazon.com/images/I/51VlytGU4-L._AC_UL320_.jpg,organic,7454898011,smoky quartz,1,29,0.0,0.0,0.0
B094QBCDTX,49.9,Natural Smoky Quartz Crystals with Red Tiger Eye Bracelets for Men Women Amulet Energy Healing Bring Wealth Prosperity Lucky Beads Jewelry Gifts Unisex,3.8,USD,True,False,49.9,False,,,1,3,False,0.0,"FREE delivery Mon, Aug 12 Or fastest delivery Fri, Aug 9",31,,https://m.media-amazon.com/images/I/61rJy1hQ16S._AC_UL320_.jpg,organic,7454898011,smoky quartz,1,30,149.7,0.0,0.0
B081M3CPBV,199.99,"18K Rose Gold Plated Silver Brown Smoky Quartz and White Lab Grown Diamond Tennis Bracelet For Women (2.76 Cttw, Fully Adjustable Up to 9 Inch)",0.0,USD,True,False,199.99,False,,,1,0,False,0.0,FREE delivery Aug 12 - 14,32,,https://m.media-amazon.com/images/I/61WFNdWTLVL._AC_UL320_.jpg,organic,7454898011,smoky quartz,1,31,0.0,0.0,0.0
B0BC6PWV1P,68.25,Smoky Quartz Bracelet Elegance Protective Gold Coil Gemstone,0.0,USD,False,False,68.25,False,,,1,0,False,0.0,FREE delivery Aug 12 - 15 Or fastest delivery Aug 9 - 14,33,,https://m.media-amazon.com/images/I/71bqc0fyRdL._AC_UL320_.jpg,organic,7454898011,smoky quartz,1,32,0.0,0.0,0.0
B08B88TMMF,9.99,3mm Natural Genuine Stone Faceted Bead Bracelet Adjustable Handmade Jewelry,4.3,USD,False,False,9.99,False,,,1,30,False,0.0,$5.99 delivery Aug 28 - Sep 18,34,,https://m.media-amazon.com/images/I/51wXTRI-DOL._AC_UL320_.jpg,organic,7454898011,smoky quartz,1,33,299.7,0.0,0.0
B08MH1HSBF,99.99,"18K Rose Gold Plated Silver Brown Smoky Quartz Tennis Bracelet For Women (6.00 Cttw, Gemstone, Oval 7X5MM, Fully Adjustable Up to 9 Inch)",0.0,USD,True,False,99.99,False,,,1,0,False,0.0,FREE delivery Aug 12 - 14,35,,https://m.media-amazon.com/images/I/61sexF6GmjL._AC_UL320_.jpg,organic,7454898011,smoky quartz,1,34,0.0,0.0,0.0
B00YZC2BSS,99.99,"18K Rose Gold Plated Silver Brown Smoky Quartz Tennis Bracelet For Women (6.42 Cttw, Oval 7X5MM, 7 Inch with 1 Inch Extender)",5.0,USD,True,False,99.99,False,,,1,2,False,0.0,FREE delivery Aug 12 - 14,36,,https://m.media-amazon.com/images/I/712emkv1RdL._AC_UL320_.jpg,organic,7454898011,smoky quartz,1,35,199.98,0.0,0.0
B01N9BR9GR,13.95,"Gemstone Beaded Stretch Bracelet 8mm Round Beads 7""",4.5,USD,True,False,13.95,False,,,1,2561,False,0.0,"FREE delivery Mon, Aug 12 on $35 of items shipped by AmazonOr fastest delivery Tomorrow, Aug 8",37,,https://m.media-amazon.com/images/I/71buyGqAioL._AC_UL320_.jpg,organic,7454898011,smoky quartz,1,36,35725.95,0.0,0.0
B0CFTCDQNY,38.0,Neims Vibrant Smoky Quartz Bracelet,0.0,USD,False,False,38.0,False,,,1,0,False,0.0,FREE delivery Aug 15 - 16 Or fastest delivery Aug 9 - 13,38,,https://m.media-amazon.com/images/I/514+dOKmqdL._AC_UL320_.jpg,organic,7454898011,smoky quartz,1,37,0.0,0.0,0.0
B0BPCZTGFC,1.55,"Crystal Stretchy Chip Bracelet,Healing Crystal Chip Bracelet,Chakra Crystal Healing Chip,Gift Crystal Bracelets.Handmade Stretch Bracelet",4.5,USD,False,False,1.55,False,,,1,2,False,0.0,$5 delivery Aug 28 - Sep 9 Or fastest delivery Aug 13 - 16,39,,https://m.media-amazon.com/images/I/41ldWvCpSuL._AC_UL320_.jpg,organic,7454898011,smoky quartz,1,38,3.1,0.0,0.0
B0CRGNPR6D,133.0,"18K Yellow Gold Plated Silver Brown Smoky Quartz and White Moissanite and White Lab Grown Diamond Bracelet For Women (2.24 Cttw, Gemstone Birthstone, Round 4MM, 6.5, 7, 7.5 Inches)",0.0,USD,True,False,133.0,False,,,1,0,False,0.0,FREE delivery Aug 12 - 14,40,,https://m.media-amazon.com/images/I/61hlhMl1sgL._AC_UL320_.jpg,organic,7454898011,smoky quartz,1,39,0.0,0.0,0.0
B0BNC6K4N4,17.99,"Avocado 1.6ct Round Cut Genuine Smoky Quartz Simulated Emerald Halo Link Bracelet for Women, 14k White Gold Plated 925 Sterling Silver Bracelet for Her, Natural Gemstone Jewelry Set",5.0,USD,False,False,17.99,False,,,1,1,False,18.99,FREE delivery on $35 shipped by Amazon.,41,,https://m.media-amazon.com/images/I/61mMVBSzVvL._AC_UL320_.jpg,organic,7454898011,smoky quartz,1,40,17.99,1.0,0.05265929436545551
B07WDDB1YT,30.0,the Blessing Bracelet - 12mm Smoky Quartz Gemstones,0.0,USD,False,False,30.0,False,,,1,0,False,0.0,FREE delivery Aug 16 - 19 Or fastest delivery Aug 13 - 16,42,,https://m.media-amazon.com/images/I/61mTxOLJLNL._AC_UL320_.jpg,organic,7454898011,smoky quartz,1,41,0.0,0.0,0.0
B0BD156JQ2,99.99,"18K Yellow Gold Plated Silver Brown Smoky Quartz and White Moissanite Tennis Bracelet For Women (2.76 Cttw, Fully Adjustable Up to 9 Inch)",0.0,USD,True,False,99.99,False,,,1,0,False,0.0,FREE delivery,43,,https://m.media-amazon.com/images/I/61vs2DJDdmL._AC_UL320_.jpg,organic,7454898011,smoky quartz,1,42,0.0,0.0,0.0
B07CQ84G57,19.99,Natural Smoky Quartz Bracelet 925 Silver Overlay Handmade Vintage Bohemian Style Jewelry For Women,5.0,USD,True,False,19.99,False,,,1,1,False,0.0,"FREE delivery Mon, Aug 12 on $35 of items shipped by AmazonOr fastest delivery Fri, Aug 9",44,,https://m.media-amazon.com/images/I/514UEFX+lWL._AC_UL320_.jpg,organic,7454898011,smoky quartz,1,43,19.99,0.0,0.0
B0D9H63639,249.0,13.00 ct. t.w. Smoky Quartz and 12.00 ct. t.w. Lemon Quartz Tennis Bracelet in Sterling Silver,0.0,USD,True,False,249.0,False,,,1,0,False,0.0,"FREE delivery Tomorrow, Aug 8",45,,https://m.media-amazon.com/images/I/714+gMFPYlL._AC_UL320_.jpg,organic,7454898011,smoky quartz,1,44,0.0,0.0,0.0
B08MHF2DPB,99.99,"18K Rose Gold Plated Silver Brown Smoky Quartz and White Lab Grown Diamond Tennis Bracelet For Women (3.75 Cttw, Gemstone Birthstone, Oval 7x5MM, Fully Adjustable Up to 9 Inch)",0.0,USD,True,False,99.99,False,,,1,0,False,0.0,FREE delivery Aug 12 - 14,46,,https://m.media-amazon.com/images/I/61i9sUTFYQL._AC_UL320_.jpg,organic,7454898011,smoky quartz,1,45,0.0,0.0,0.0
B07NK2GMRJ,21.0,"8mm Smooth Round Smoky Quartz Stretch Bracelet in Various Lengths (6, 6.5, 7, 7.5, 8 inches)",0.0,USD,False,False,21.0,False,,,1,0,False,0.0,"FREE delivery Aug 19 - 20 Or fastest delivery Fri, Aug 9",47,,https://m.media-amazon.com/images/I/61Gij4ov21L._AC_UL320_.jpg,organic,7454898011,smoky quartz,1,46,0.0,0.0,0.0
B00YZCEFA0,87.99,"18K Rose Gold Plated Silver Brown Smoky Quartz Tennis Bracelet For Women (4.79 Cttw, Oval 7X5MM, 7 Inch + 1.5 Inch Extender)",0.0,USD,True,False,87.99,False,,,1,0,False,0.0,FREE delivery Aug 12 - 14,48,,https://m.media-amazon.com/images/I/61Bx2v8WMGL._AC_UL320_.jpg,organic,7454898011,smoky quartz,1,47,0.0,0.0,0.0
B07MNR6NS9,7.99,"Handmade Gem Semi Precious Gemstone 6mm Round Beads Stretch Bracelet 7"" Unisex",4.5,USD,True,False,7.99,False,,50+ bought in past month,1,5171,True,8.49,"FREE delivery Mon, Aug 12 on $35 of items shipped by AmazonOr fastest delivery Fri, Aug 9",1,,https://m.media-amazon.com/images/I/51T9yUeu8sL._AC_UL320_.jpg,amazons_choices,7454898011,smoky quartz,1,1,41316.29,0.5,0.058892815076560655
