asin,price,title,rating,currency,is_prime,best_seller,price_upper,is_sponsored,manufacturer,sales_volume,pricing_count,reviews_count,is_amazons_choice,price_strikethrough,shipping_information,pos,rel_pos,url_image,source,category_id,keyword,page,position,min_revenue,discount,discount_rate
B081FC6P82,21.99,Shop LC 925 Sterling Silver Gemstones Ring for Women Jewelry Birthday Gifts for Women,4.0,USD,,False,21.99,True,,,1,24,False,0,,,1.0,https://aax-us-iad.amazon.com/e/loi/imp?b=JJGnJ6Esz2_vvL61zVvRPpAAAAGRLSAwfgEAAAH2AQBvbm9fdHhuX2JpZDQgICBvbm9fdHhuX2ltcDEgICDcs07-,paid,7454898011,shungite,1,1,527.76,0,0
B09FT4MJRM,23.62,"HASKARE Triple Protection Bracelet, Genuine Tigers Eye Black Obsidian and Hematite 8mm Beads Bracelet for Men Women, Crystal Jewelry Stone Bracelets Christmas Gifts for Men Bring Luck Prosperity",4.6,USD,,False,23.62,True,,500+ bought in past month,1,2354,False,0,,,2.0,https://aax-us-iad.amazon.com/e/loi/imp?b=JJkCR_XW3WeT_H0x_zMlZmgAAAGRLSAwggEAAAH2AQBvbm9fdHhuX2JpZDMgICBvbm9fdHhuX2ltcDEgICAuD2Jm,paid,7454898011,shungite,1,2,55601.48,0,0
B07DJRNQW8,16.99,Shungite Stones Bracelet Black Beads Stretchy | Authetic Shungite Crystal Jewelry | Protective Powerful Defender Stone Bracelet | Spiritual Healing Crystal Chakra Balance,4.3,USD,True,False,16.99,False,,100+ bought in past month,1,325,False,0,"FREE delivery Mon, Aug 12 on $35 of items shipped by AmazonOr fastest delivery Fri, Aug 9",1.0,,https://m.media-amazon.com/images/I/61nK-9HYMSL._AC_UL320_.jpg,organic,7454898011,shungite,1,1,5521.749999999999,0,0
B01CIPS1KU,14.99,Shungite Stone Bracelet for Men and Women | Authentic Shungite Stretchy Elastic Bracelet | Shungite Jewelry for Protection | Natural Black Stone Bracelet for Spiritual Healing,4.1,USD,True,False,14.99,False,,50+ bought in past month,1,285,False,0,"FREE delivery Mon, Aug 12 on $35 of items shipped by AmazonOr fastest delivery Tomorrow, Aug 8",3.0,,https://m.media-amazon.com/images/I/71bPND11uKL._AC_UL320_.jpg,organic,7454898011,shungite,1,2,4272.15,0,0
B0CJC172FR,22.99,Shungite Bracelets Set | Big Tumbled Bracelets Shungite Jewelry for Men and Women | Authentic Gemstone Jewelry | Crystal Healing and Protection High Positive Energy Bracelet,4.3,USD,True,False,22.99,False,,,1,25,False,0,"FREE delivery Mon, Aug 12 on $35 of items shipped by AmazonOr fastest delivery Tomorrow, Aug 8",4.0,,https://m.media-amazon.com/images/I/61K9hYOdiZL._AC_UL320_.jpg,organic,7454898011,shungite,1,3,574.75,0,0
B0C8MCBZSV,12.95,"Grade A++ Crystal Bead Bracelet, Wholesale Genuine Gemstone Stetch Bracelet, Healing Crystal Bracelet Bead Bracelet, Gift for Men & Women",4.4,USD,True,False,12.95,False,,,1,17,False,0,"FREE delivery Mon, Aug 12 on $35 of items shipped by AmazonOr fastest delivery Fri, Aug 9",5.0,,https://m.media-amazon.com/images/I/51RzALe1ORL._AC_UL320_.jpg,organic,7454898011,shungite,1,4,220.14999999999998,0,0
B0BTGLWZJM,36.98,shungite stones raw shungite bracelet (Inner diameter length 2.3Inches),3.6,USD,True,False,36.98,False,,,1,26,False,0,"FREE delivery Mon, Aug 12",6.0,,https://m.media-amazon.com/images/I/51a7khHBhAL._AC_UL320_.jpg,organic,7454898011,shungite,1,5,961.4799999999999,0,0
B07DJJCYK8,20.99,Karelian Heritage Shungite Stone Adjustable Bracelet | Natural Black Macrame Hand-Made Jewelry | Protective Powerful Mineral Shield | Spiritual Healing Crystal Chakra Balance Grounding,3.7,USD,True,False,20.99,False,,,1,45,False,0,"FREE delivery Mon, Aug 12 on $35 of items shipped by AmazonOr fastest delivery Tomorrow, Aug 8",7.0,,https://m.media-amazon.com/images/I/71fwA6V2dxL._AC_UL320_.jpg,organic,7454898011,shungite,1,6,944.55,0,0
B0CQPN8NST,25.99,Shungite Stones & Copper Bracelet | Authetic Shungite Crystal Jewelry | Protective Powerful Defender Stone Bracelet | Spiritual Healing Crystal Chakra Balance,3.0,USD,True,False,25.99,False,,,1,1,False,0,"FREE delivery Mon, Aug 12 on $35 of items shipped by AmazonOr fastest delivery Sun, Aug 11",8.0,,https://m.media-amazon.com/images/I/6173NLEyVCL._AC_UL320_.jpg,organic,7454898011,shungite,1,7,25.99,0,0
B08Q4976KQ,15.99,New Gemstone Healing Chakra Bracelet Anxiety Crystal Natural Stone Men Women Stress Relief Reiki Yoga Diffuser Semi Precious,4.3,USD,True,False,15.99,False,,,1,1486,False,0,"FREE delivery Tue, Aug 13 on $35 of items shipped by Amazon",9.0,,https://m.media-amazon.com/images/I/71Lo059KixL._AC_UL320_.jpg,organic,7454898011,shungite,1,8,23761.14,0,0
B0CQPGYY5K,26.99,"Genuine Shungite Stone Macrame Beaded Bracelet with 8 mm Round Beads, Protection Shungite Jewelry | Natural Semi-Precious Crystal Jewelry | Spiritual Healing Chakra Reiki SB120",2.0,USD,True,False,26.99,False,,,1,2,False,0,"FREE delivery Mon, Aug 12 on $35 of items shipped by AmazonOr fastest delivery Tomorrow, Aug 8",10.0,,https://m.media-amazon.com/images/I/61J7WCGV+bL._AC_UL320_.jpg,organic,7454898011,shungite,1,9,53.98,0,0
B01CGS0LUW,32.99,"Genuine Regular Shungite Tumbled Bracelet, Round Pendant, and Elite Stone | Defender Shield Protection Stone Set | Spiritual Healing Crystal Chakra Balance Reiki Meditation S012",3.8,USD,True,False,32.99,False,,,1,131,False,0,"FREE delivery Mon, Aug 12 on $35 of items shipped by AmazonOr fastest delivery Fri, Aug 9",11.0,,https://m.media-amazon.com/images/I/81iY-DrobtL._AC_UL320_.jpg,organic,7454898011,shungite,1,10,4321.6900000000005,0,0
B0CNW81XWD,27.0,Shungite - 7 Chakras Bracelet - Find balance witting body and mind - Crystal Healing Gem - Each come with Certificate,3.1,USD,True,False,27.0,False,,,1,2,False,0,"FREE delivery Mon, Aug 12 on $35 of items shipped by AmazonOr fastest delivery Tomorrow, Aug 8",12.0,,https://m.media-amazon.com/images/I/514quYee5NL._AC_UL320_.jpg,organic,7454898011,shungite,1,11,54.0,0,0
B0779JRPLT,37.93,Shungite Bracelet - for Grounding - when Worn absorbs the influenses from electronic Gadjet - Real Shungite Stone Type II - Comes wich Certificate,4.4,USD,True,False,37.93,False,,,1,377,False,0,"FREE delivery Mon, Aug 12 Or fastest delivery Tomorrow, Aug 8",13.0,,https://m.media-amazon.com/images/I/71UpEY0dRKL._AC_UL320_.jpg,organic,7454898011,shungite,1,12,14299.61,0,0
B0BL7VLH1T,22.99,"Genuine Shungite Stone Macrame Beaded Bracelet with 10 mm Round Beads, Protection Shungite Jewelry | Natural Semi-Precious Crystal Jewelry | Spiritual Healing Chakra Reiki SB107",3.0,USD,True,False,22.99,False,,,1,1,False,0,"FREE delivery Mon, Aug 12 on $35 of items shipped by AmazonOr fastest delivery Fri, Aug 9",14.0,,https://m.media-amazon.com/images/I/71F5zm1jzaL._AC_UL320_.jpg,organic,7454898011,shungite,1,13,22.99,0,0
B08MT3SX33,12.09,"Shungite,Tiger Eye,Black Tourmaline,Pyrite, Lower Chakras,String Bracelet",4.0,USD,True,False,12.09,False,,,1,62,False,0,"FREE delivery Mon, Aug 12 on $35 of items shipped by AmazonOr fastest delivery Sun, Aug 11",15.0,,https://m.media-amazon.com/images/I/71KknGDiJ2S._AC_UL320_.jpg,organic,7454898011,shungite,1,14,749.58,0,0
B07PVWT363,18.99,CHARGED Natural Russian Shungite Crystal Bead Stretch Bracelets + Baby Selenite Puffy Heart Charger (PROTECT AGAINST NEGATIVITY - PROMOTES POSITIVE GOALS),4.2,USD,False,False,18.99,False,,,1,129,False,0,"FREE delivery Aug 15 - 22 Or fastest delivery Fri, Aug 9",16.0,,https://m.media-amazon.com/images/I/71XqdmXtXuL._AC_UL320_.jpg,organic,7454898011,shungite,1,15,2449.7099999999996,0,0
B07SRDNL1K,25.97,Bracelet Stretch with Natural Shungites and Gemstones Round Beads 10mm,4.1,USD,True,False,25.97,False,,,1,32,False,0,"FREE delivery Mon, Aug 12 on $35 of items shipped by AmazonOr fastest delivery Tomorrow, Aug 8",17.0,,https://m.media-amazon.com/images/I/81kqGfOJqpL._AC_UL320_.jpg,organic,7454898011,shungite,1,16,831.04,0,0
B0BVPBRDQV,9.99,Shungite and Rainbow Fluorite Chakra Reiki string Bracelet Healing Bracelet,0.0,USD,False,False,9.99,False,,,1,0,False,0,FREE delivery on $35 shipped by Amazon.,18.0,,https://m.media-amazon.com/images/I/51CLxOuBLeL._AC_UL320_.jpg,organic,7454898011,shungite,1,17,0.0,0,0
B0D4VC91SX,14.99,"WIKICRYSTAL Shungite Stones Bead Bracelet Handmade Natural Healing Stone Crystal Chakra Bracelets Crystal Spiritual Accessory, Medium, Black",0.0,USD,False,False,14.99,False,,,1,0,False,0,FREE delivery on $35 shipped by Amazon.,19.0,,https://m.media-amazon.com/images/I/61JS1Y5fDJL._AC_UL320_.jpg,organic,7454898011,shungite,1,18,0.0,0,0
B0D7M78R78,12.99,Shungite Stones Sugar Cube Beads Bracelet Chakra Balance - Handcrafted Jewelry - Healing Crystal Protection Bracelet- Crystal Spiritual Accessory,0.0,USD,False,False,12.99,False,,,1,0,False,0,FREE delivery Aug 20 - 29 Or fastest delivery Aug 14 - 19,20.0,,https://m.media-amazon.com/images/I/310ZgTf42QL._AC_UL320_.jpg,organic,7454898011,shungite,1,19,0.0,0,0
B0C8FF6YB2,12.95,"Crystal Bead Bracelet, Wholesale Genuine Stretch Gemstone Bracelet, Healing Crystal Bracelet, Gift for Men & Women",4.3,USD,True,False,12.95,False,,,1,33,False,0,"FREE delivery Mon, Aug 12 on $35 of items shipped by AmazonOr fastest delivery Tomorrow, Aug 8",21.0,,https://m.media-amazon.com/images/I/51RzALe1ORL._AC_UL320_.jpg,organic,7454898011,shungite,1,20,427.34999999999997,0,0
B0CJCFS2Z9,18.99,Shungite Bracelet Shungite Beads Handmade Braided Stones Bracelet for Men Women Crystal Jewellry,0.0,USD,False,False,18.99,False,,,1,0,False,0,$3.99 delivery Aug 16 - 26,22.0,,https://m.media-amazon.com/images/I/616S1ohq8EL._AC_UL320_.jpg,organic,7454898011,shungite,1,21,0.0,0,0
B09DPZYZ81,19.99,Shop LC Beads Pain Relief Meditation Anxiety Karelian Shungite Stretch Beaded Bracelet for Women Jewelry Birthday Gifts for Women,4.0,USD,True,False,19.99,False,,,1,1,False,0,"FREE delivery Mon, Aug 12 on $35 of items shipped by AmazonOr fastest delivery Tomorrow, Aug 8",23.0,,https://m.media-amazon.com/images/I/513vYM2K5HL._AC_UL320_.jpg,organic,7454898011,shungite,1,22,19.99,0,0
B0DBDP5G8M,24.99,Shop LC Healing Pain Relief Black Shungite Terahertz Beaded Bracelet for Women Jewelry Ct 50.02 Birthday Gifts,0.0,USD,False,False,24.99,False,,,1,0,False,0,"FREE delivery Fri, Aug 9",24.0,,https://m.media-amazon.com/images/I/51wPDA2oJ-L._AC_UL320_.jpg,organic,7454898011,shungite,1,23,0.0,0,0
B0CFG48Z1G,35.85,"Grade A ++ Crystal Nugget Bracelet, Wholesale Genuine Tumbled Gemstone Bracelet, Healing Crystal Bracelet, Gift for Men & Women",3.8,USD,True,False,35.85,False,,,1,7,False,0,"FREE delivery Mon, Aug 12 Or fastest delivery Tomorrow, Aug 8",25.0,,https://m.media-amazon.com/images/I/614iO1AcqWL._AC_UL320_.jpg,organic,7454898011,shungite,1,24,250.95000000000002,0,0
B0D3GZKM9X,15.99,WIKICRYSTAL Shungite Stones Bead Bracelet Handmade Natural Healing Stone Crystal Chakra Bracelets Crystal Spiritual Accessory,0.0,USD,False,False,15.99,False,,,1,0,False,0,FREE delivery Aug 20 - 29 Or fastest delivery Aug 14 - 19,26.0,,https://m.media-amazon.com/images/I/413gPls2ZrL._AC_UL320_.jpg,organic,7454898011,shungite,1,25,0.0,0,0
B09HJKYJX2,24.99,"Shop LC Feng Shui Wealth Bracelet for Men Women, Beads Stretchable Good Luck Bracelet Pixiu Gold Plated Dragon Lucky 6.50"" Birthday Gifts for Women",4.1,USD,True,False,24.99,False,,,1,57,False,0,"FREE delivery Mon, Aug 12 on $35 of items shipped by AmazonOr fastest delivery Tomorrow, Aug 8",27.0,,https://m.media-amazon.com/images/I/613fOAYEd-L._AC_UL320_.jpg,organic,7454898011,shungite,1,26,1424.4299999999998,0,0
B0CRPP1MDH,48.0,"Positive Energy Bracelet for Men & Women - Natural Gemstone Women Bracelets - Unique, Beautiful & Stress Relief Gift - Stretchy Cord 4mm Genuine Gemstone Charm Bracelet",1.0,USD,False,False,48.0,False,,,1,1,False,0,"$9.95 delivery Tue, Aug 13",28.0,,https://m.media-amazon.com/images/I/61QCdddwfcL._AC_UL320_.jpg,organic,7454898011,shungite,1,27,48.0,0,0
B0CKBTVGN7,58.99,Natural Dainty Russian Shungite Gemstone ronud 4mm smooth 7inch Beads Stretchble bracelet crystal healing energy stone bracelet for Women & Men Adjustable Size,0.0,USD,False,False,58.99,False,,,1,0,False,0,$4.99 delivery Sep 9 - 20 Or fastest delivery Aug 14 - 19,29.0,,https://m.media-amazon.com/images/I/41F7O5T0ZoL._AC_UL320_.jpg,organic,7454898011,shungite,1,28,0.0,0,0
B0D5YB81X9,28.99,WIKICRYSTAL Shungite Stones Bead Bracelet Handmade Natural Healing Stone Crystal Chakra Bracelets Crystal Spiritual Accessory,0.0,USD,False,False,28.99,False,,,1,0,False,0,FREE delivery Aug 20 - 29 Or fastest delivery Aug 14 - 19,30.0,,https://m.media-amazon.com/images/I/414kylU8hLL._AC_UL320_.jpg,organic,7454898011,shungite,1,29,0.0,0,0
B0CTB14ND6,22.99,Gemstone Stretch Bracelet with 8mm Round Beads,0.0,USD,False,False,22.99,False,,,1,0,False,0,$3.99 delivery Aug 16 - 19 Or fastest delivery Aug 12 - 14,31.0,,https://m.media-amazon.com/images/I/41uRFb35rcL._AC_UL320_.jpg,organic,7454898011,shungite,1,30,0.0,0,0
B0D7H4P9XY,12.99,Shungite Stones Chips Bead Bracelet Chakra Balance - Handcrafted Jewelry - Healing Crystal Protection Bracelet- Crystal Spiritual Accessory,0.0,USD,False,False,12.99,False,,,1,0,False,0,FREE delivery Aug 20 - 29 Or fastest delivery Aug 14 - 19,32.0,,https://m.media-amazon.com/images/I/416kARy9bEL._AC_UL320_.jpg,organic,7454898011,shungite,1,31,0.0,0,0
B0D59V35S4,14.99,WIKICRYSTAL Healing Chakra Shungite Faceted Bracelet - Natural Healing Crystal - Men Women Stress Relief Reiki Yoga Powerful Defender Balance Jewelry,0.0,USD,False,False,14.99,False,,,1,0,False,0,FREE delivery Aug 20 - 29 Or fastest delivery Aug 14 - 19,33.0,,https://m.media-amazon.com/images/I/611hV+S5hkL._AC_UL320_.jpg,organic,7454898011,shungite,1,32,0.0,0,0
B0D9D99HKX,12.04,10mm Natural Shungite Bead Bracelet Adjustable From Karelia Region Russia,0.0,USD,False,False,12.04,False,,,1,0,False,0,FREE delivery Aug 16 - 26,34.0,,https://m.media-amazon.com/images/I/61Yeg2u65ML._AC_UL320_.jpg,organic,7454898011,shungite,1,33,0.0,0,0
B0CGPRGJ6R,0.0,Natural Dainty Russian Shungite Gemstone ronud 4mm smooth 7inch Beads Stretchble bracelet crystal healing energy stone bracelet for Women & Men Adjustable Size,0.0,USD,False,False,0.0,False,,,1,0,False,0,,35.0,,https://m.media-amazon.com/images/I/41F7O5T0ZoL._AC_UL320_.jpg,organic,7454898011,shungite,1,34,0.0,0,0
B0CQXVBX8B,46.97,WWG WWG Shungite Elite Bracelet 8mm rondelle smooth 7inch Natural Gemstones Beaded Bracelets for Men Women Healing Crystal Stretch Beaded Bracelet Unisex,0.0,USD,False,False,46.97,False,,,1,0,False,0,$7.99 delivery Aug 28 - Sep 19 Or fastest delivery Aug 13 - 16,36.0,,https://m.media-amazon.com/images/I/5183fj1FIEL._AC_UL320_.jpg,organic,7454898011,shungite,1,35,0.0,0,0
B0DBQR79D5,113.0,Shop LC Healing Pain Relief Black Shungite 925 Sterling Silver Rhodium Plated Beaded Bracelet for Women Jewelry Ct 49.2 Birthday Gifts,0.0,USD,False,False,113.0,False,,,1,0,False,0,"FREE delivery Tomorrow, Aug 8",37.0,,https://m.media-amazon.com/images/I/61hZAD7GMqL._AC_UL320_.jpg,organic,7454898011,shungite,1,36,0.0,0,0
B0DBR4HVLM,12.04,Natural Shungite Safety Button Carving Peace Buckle For Healing,0.0,USD,False,False,12.04,False,,,1,0,False,0,FREE delivery Aug 16 - 26,38.0,,https://m.media-amazon.com/images/I/51L0gWktfeL._AC_UL320_.jpg,organic,7454898011,shungite,1,37,0.0,0,0
B0CM6275ZH,0.0,Natural Elite Noble Shungite 8mm rondelle smooth 7inch Semi-Precious Gemstones Beaded Bracelets for Men Women Healing Crystal Stretch Beaded Bracelet Unisex,0.0,USD,False,False,0.0,False,,,1,0,False,0,,39.0,,https://m.media-amazon.com/images/I/31CkOcj3PkL._AC_UL320_.jpg,organic,7454898011,shungite,1,38,0.0,0,0
B0BL7FH4K8,119.99,"SHOP LC Healing Pain Relief Black Shungite 925 Sterling Silver Platinum Plated Tennis Bracelet for Women Jewelry Gifts for Women Size 6.5"" Ct 7.26 Engagement Anniversary Wedding Promise",0.0,USD,False,False,119.99,False,,,1,0,False,0,"FREE delivery Tomorrow, Aug 8",40.0,,https://m.media-amazon.com/images/I/51daT6cBI6L._AC_UL320_.jpg,organic,7454898011,shungite,1,39,0.0,0,0
B0D8PX3K37,79.99,"Natural Rough Shungite 2 Stone Adjustable Twister Bangle Bracelet for Women in Sterling Silver, Gemstone Jewelry Gifts for Her Birthday, Anniversary, Graduation (Bezel-Set)",0.0,USD,False,False,79.99,False,,,1,5,False,0,FREE delivery Aug 14 - 15 Or fastest delivery Aug 9 - 13,41.0,,https://m.media-amazon.com/images/I/51b6x+SUSML._AC_UL320_.jpg,organic,7454898011,shungite,1,40,399.95,0,0
B0DB2B5XFT,18.99,"12mm Natural Black Shungite Semi Precious Gemstone Stretch Bracelet - Black Beaded, Unisex, Comfort Fit, Lead & Nickel Compliant, Elegant Accessory (X-Large beads!12mm)",0.0,USD,False,False,18.99,False,,,1,0,False,0,FREE delivery Aug 19 - 22 Or fastest delivery Aug 13 - 15,42.0,,https://m.media-amazon.com/images/I/51SeqAmSebL._AC_UL320_.jpg,organic,7454898011,shungite,1,41,0.0,0,0
B09FXX4R3Q,19.99,"A&M Beautiful Classic Shungite Smooth Tumble Healing Gemstone Beaded Bracelet, Attractive Natural Healing Shungite Bracelet Jewelry for Womens",0.0,USD,False,False,19.99,False,,,1,0,False,0,FREE delivery Aug 28 - Sep 18,43.0,,https://m.media-amazon.com/images/I/71-1W95CC7L._AC_UL320_.jpg,organic,7454898011,shungite,1,42,0.0,0,0
B0DB8DNNWB,39.99,Shop LC Hematite Healing Pain Relief Black Shungite Beaded Stretch Bracelet for Women Jewelry Birthday Gifts for Women,0.0,USD,False,False,39.99,False,,,1,0,False,0,"FREE delivery Fri, Aug 9",44.0,,https://m.media-amazon.com/images/I/51IOi3C3B6L._AC_UL320_.jpg,organic,7454898011,shungite,1,43,0.0,0,0
B0DBDS6BXD,24.99,Shop LC Healing Pain Relief Black Shungite Terahertz Beaded Bracelet for Women Jewelry Ct 106.6 Birthday Gifts,0.0,USD,False,False,24.99,False,,,1,0,False,0,"FREE delivery Fri, Aug 9",45.0,,https://m.media-amazon.com/images/I/514-6UHAVRL._AC_UL320_.jpg,organic,7454898011,shungite,1,44,0.0,0,0
B0DBDQV655,41.99,Shop LC Terahertz Healing Pain Relief Black Shungite Beaded Bracelet for Women Jewelry Ct 74.13 Birthday Gifts,0.0,USD,False,False,41.99,False,,,1,0,False,0,"FREE delivery Fri, Aug 9",46.0,,https://m.media-amazon.com/images/I/51aRc6PIASL._AC_UL320_.jpg,organic,7454898011,shungite,1,45,0.0,0,0
B0CM621WHF,0.0,Natural Shungite 6mm rondelle smooth 7inch Semi-Precious Gemstones Beaded Bracelets for Men Women Healing Crystal Stretch Beaded Bracelet Unisex,0.0,USD,False,False,0.0,False,,,1,0,False,0,,47.0,,https://m.media-amazon.com/images/I/41iGzod000L._AC_UL320_.jpg,organic,7454898011,shungite,1,46,0.0,0,0
B0DB5NRN1G,24.63,Natural shungite elastic cord square stone bracelet bangle charm gift,0.0,USD,False,False,24.63,False,,,1,0,False,0,FREE delivery Aug 16 - 26,48.0,,https://m.media-amazon.com/images/I/4101+cKDkqL._AC_UL320_.jpg,organic,7454898011,shungite,1,47,0.0,0,0
B0BL7TTDKJ,23.99,Genuine Shungite Shambhala Macrame and Arachne Bracelet | Shungite Stone Jewelry for Men Women | Natural Black Stone Macrame Hand-Made Crystal Jewelry,4.2,USD,True,False,23.99,False,,,1,49,True,0,"FREE delivery Mon, Aug 12 on $35 of items shipped by AmazonOr fastest delivery Fri, Aug 9",2.0,,https://m.media-amazon.com/images/I/71TUe4d7hML._AC_UL320_.jpg,amazons_choices,7454898011,shungite,1,1,1175.51,0,0
