asin,price,title,rating,currency,is_prime,best_seller,price_upper,is_sponsored,manufacturer,sales_volume,pricing_count,reviews_count,is_amazons_choice,price_strikethrough,shipping_information,pos,rel_pos,url_image,source,category_id,keyword,page,position,min_revenue,discount,discount_rate
B0D8KH6W8R,48.99,Bracelet for Women 925 Sterling Silver Hexagon Gemstone Link Bracelet Fine Jewelry Anniversary Birthday Christmas Gifts for Women Her,0.0,USD,True,False,48.99,True,,,1,12,False,0.0,"FREE delivery Mon, Aug 12 Or fastest delivery Fri, Aug 9",1,,https://m.media-amazon.com/images/I/51EtDBVkGpL._AC_UL320_.jpg,paid,7454898011,turquoise,1,1,587.88,0.0,0.0
B0BVY9PNZ8,55.99,"Birthstone Bracelets 925 Sterling Silver Moon and Star Bangle Charm Bracelet Fine Jewelry Birthday Anniversary Christmas Day Gift for Her Women, Adjustable Chain 6.7""+1.2"" Extend",4.4,USD,True,False,55.99,True,,,1,53,False,69.99,"FREE delivery Mon, Aug 12 Or fastest delivery Tomorrow, Aug 8",17,,https://m.media-amazon.com/images/I/614DISiRwOL._AC_UL320_.jpg,paid,7454898011,turquoise,1,2,2967.4700000000003,13.999999999999993,0.20002857551078718
B0CFHN5JWR,89.0,by Ross-Simons 3-3.5mm Turquoise Bead Station Bracelet in 14kt Yellow Gold,5.0,USD,True,False,89.0,True,,,1,1,False,0.0,"FREE delivery Tomorrow, Aug 8",18,,https://m.media-amazon.com/images/I/51D8kFbKeLL._AC_UL320_.jpg,paid,7454898011,turquoise,1,3,89.0,0.0,0.0
B0C3HBQLKG,25.99,"Turquoise Bracelet,Blue Gem Stone Bracelet S925 Sterling Silver Round Turquoise Bracelets Jewelry for women",3.9,USD,True,False,25.99,True,,,1,57,False,0.0,"FREE delivery Mon, Aug 12 on $35 of items shipped by AmazonOr fastest delivery Fri, Aug 9",19,,https://m.media-amazon.com/images/I/61aRNKRBKaS._AC_UL320_.jpg,paid,7454898011,turquoise,1,4,1481.4299999999998,0.0,0.0
B09CQBD9KS,15.9,"Turquoise Beaded Bracelet for Women Teens and Girls, Boho Adjustable String Turquoise Pink Silver Beads Bracelets, Bohemian Hippie Indian Style, Handmade Jewelry By Tribes (Turquoise pink)",4.7,USD,True,False,15.9,True,,,1,34,False,0.0,"FREE delivery Mon, Aug 12 on $35 of items shipped by AmazonOr fastest delivery Tomorrow, Aug 8",20,,https://m.media-amazon.com/images/I/41sEdUSnqWS._AC_UL320_.jpg,paid,7454898011,turquoise,1,5,540.6,0.0,0.0
B0CCW6WR2V,23.89,925 Sterling Silver Spoon Ring Adjustable Victorian Vintage Eye of Horus Spoon Thumb Ring Turquoise Cow Skill Aztec Calendar Sign Wolf Head Spoon Ring Spiritual Protection Jewelry Gift for Women,4.2,USD,True,False,23.89,True,,,1,22,False,0.0,"FREE delivery Mon, Aug 12 on $35 of items shipped by AmazonOr fastest delivery Fri, Aug 9",25,,https://m.media-amazon.com/images/I/719ExOf1IZL._AC_UL320_.jpg,paid,7454898011,turquoise,1,6,525.58,0.0,0.0
B0CFHNNVJZ,36.09,Turquoise Earrings for Women 925 Sterling Silver Turquoise Dangle Drop Boho Earrings Western Turquoise Jewelry Birthday Xmas Gifts for Mom Wife,0.0,USD,True,False,36.09,True,,,1,0,False,0.0,"FREE delivery Mon, Aug 12 Or fastest delivery Fri, Aug 9",26,,https://m.media-amazon.com/images/I/613BKukoi7L._AC_UL320_.jpg,paid,7454898011,turquoise,1,7,0.0,0.0,0.0
B09J1SZXSN,149.0,Stauer Sedona Turquoise Genuine Arizona Turquoise Jewelry Earring Set,4.3,USD,True,False,149.0,True,,,1,21,False,0.0,"FREE delivery Mon, Aug 12 Or fastest delivery Fri, Aug 9",27,,https://m.media-amazon.com/images/I/51WD1uR57AL._AC_UL320_.jpg,paid,7454898011,turquoise,1,8,3129.0,0.0,0.0
B0D8PXVWZ7,14.99,"Double Circle Ceramic Bead Bracelet, Gradient Green, Flower Charms, Delicate Bracelet for Women",5.0,USD,True,False,14.99,True,,,1,5,False,0.0,"FREE delivery Tue, Aug 13 on $35 of items shipped by AmazonOr fastest delivery Mon, Aug 12",28,,https://m.media-amazon.com/images/I/71O3YAj9bKL._AC_UL320_.jpg,paid,7454898011,turquoise,1,9,74.95,0.0,0.0
B0D3PTND3G,9.99,2Pcs Heart Bracelet for Women 8mm Crystal Bracelets Gifts Healing Crystal Bracelets Love Charm Bracelet for Women Natural Stone Stretchable Jewelry Birthday Beaded Bracelet Gift for Women,4.7,USD,True,False,9.99,True,,,1,12,False,0.0,"FREE delivery Mon, Aug 12 on $35 of items shipped by AmazonOr fastest delivery Fri, Aug 9",33,,https://m.media-amazon.com/images/I/71JggI1IM0L._AC_UL320_.jpg,paid,7454898011,turquoise,1,10,119.88,0.0,0.0
B08P17RL7N,21.99,"Turquoise Studs Earrings, 925 Sterling Silver Round Shape Tiny Studs, Turquoise Jewelry Mother Day Gift for Women Daughter Girlfriend with Gift Box-4mm 6mm",4.3,USD,True,False,21.99,True,,,1,843,False,0.0,"FREE delivery Mon, Aug 12 on $35 of items shipped by AmazonOr fastest delivery Fri, Aug 9",34,,https://m.media-amazon.com/images/I/61B00xN48CL._AC_UL320_.jpg,paid,7454898011,turquoise,1,11,18537.57,0.0,0.0
B0D3PPBCZD,9.55,2Pcs Butterfly Bracelets for Women Healing Crystals Bracelets for Women Natural Gemstone Stretchable Chip Jewelry 8mm Crystal Beaded Bracelet Gift for Birthday,4.6,USD,True,False,9.55,True,,,1,35,False,0.0,"FREE delivery Mon, Aug 12 on $35 of items shipped by Amazon",35,,https://m.media-amazon.com/images/I/71k-0nri14L._AC_UL320_.jpg,paid,7454898011,turquoise,1,12,334.25,0.0,0.0
B075VC8ZVW,7.99,Natural Gemstone Round Beads Stretch Bracelet Healing Reiki 8mm,4.5,USD,True,False,7.99,False,,100+ bought in past month,1,2150,False,0.0,"FREE delivery Mon, Aug 12 on $35 of items shipped by AmazonOr fastest delivery Tomorrow, Aug 8",3,,https://m.media-amazon.com/images/I/61+F-kll6WL._AC_UL320_.jpg,organic,7454898011,turquoise,1,1,17178.5,0.0,0.0
B07JZBJWBJ,14.99,7 Chakra Bracelets for Women with Real Stones Leather Wrap Healing Bead Bracelet Women Men Boho Friendship Jewelry,4.4,USD,True,False,14.99,False,,100+ bought in past month,1,4367,False,0.0,"FREE delivery Mon, Aug 12 on $35 of items shipped by AmazonOr fastest delivery Tomorrow, Aug 8",4,,https://m.media-amazon.com/images/I/71BzAQwVdcL._AC_UL320_.jpg,organic,7454898011,turquoise,1,2,65461.33,0.0,0.0
B01NBPCWFT,30.12,"Soho Womens Turquoise Stone Cuff Bracelet, Turquoise/Silver",4.1,USD,True,False,30.12,False,,100+ bought in past month,1,339,False,58.0,"FREE delivery Mon, Aug 12 on $35 of items shipped by AmazonOr fastest delivery Tomorrow, Aug 8",5,,https://m.media-amazon.com/images/I/91VTh-XXgUL._AC_UL320_.jpg,organic,7454898011,turquoise,1,3,10210.68,27.88,0.4806896551724138
B07N4HK6WW,14.99,"Gemstone Beaded Stretch Bracelet Fit Various Wrist Sizes, 5 Layers Birthstone Chakra bracelet for Women Teen Girls",4.4,USD,False,False,14.99,False,,50+ bought in past month,1,357,False,0.0,FREE delivery on $35 shipped by Amazon.,6,,https://m.media-amazon.com/images/I/61Eh4wcxwOL._AC_UL320_.jpg,organic,7454898011,turquoise,1,4,5351.43,0.0,0.0
B005G4G4BO,9.99,7.5 Inch Simulated Turquoise Howlite Beads Stretch Bangle Bracelet For Women 20MM,4.6,USD,True,False,9.99,False,,50+ bought in past month,1,289,False,0.0,"FREE delivery Mon, Aug 12 on $35 of items shipped by AmazonOr fastest delivery Fri, Aug 9",7,,https://m.media-amazon.com/images/I/61+kM29otEL._AC_UL320_.jpg,organic,7454898011,turquoise,1,5,2887.11,0.0,0.0
B0C49LKWR5,71.6,"Birthstone Bracelets Sterling Silver Tennis Bracelets Charm Fine Jewelry Birthday Jewelry Gifts for Women Mom 7""",4.3,USD,True,False,71.6,False,,,1,1100,False,92.99,"FREE delivery Mon, Aug 12 Or fastest delivery Tomorrow, Aug 8",8,,https://m.media-amazon.com/images/I/61tEAW6xfPL._AC_UL320_.jpg,organic,7454898011,turquoise,1,6,78760.0,21.39,0.23002473384234867
B09NNQY7LD,7.49,"Handmade Gem Semi Precious Gemstone 6mm Round Beads Stretch Bracelet 7"" Unisex",4.5,USD,True,False,7.49,False,,100+ bought in past month,1,5171,False,7.99,"FREE delivery Mon, Aug 12 on $35 of items shipped by AmazonOr fastest delivery Tomorrow, Aug 8",9,,https://m.media-amazon.com/images/I/41IkjArGsOL._AC_UL320_.jpg,organic,7454898011,turquoise,1,7,38730.79,0.5,0.0625782227784731
B09VD4YD87,9.78,Healing Stone Beaded Bracelets for Women Semi-Precious Gemstones Bracelets Pearl Beaded Bracelet Adjustable Strand Bracelets 6MM,4.5,USD,True,False,9.78,False,,,1,185,False,0.0,"FREE delivery Mon, Aug 12 on $35 of items shipped by AmazonOr fastest delivery Fri, Aug 9",10,,https://m.media-amazon.com/images/I/61myhWjF-9L._AC_UL320_.jpg,organic,7454898011,turquoise,1,8,1809.3,0.0,0.0
B0C8CSTK33,8.99,Healing Bracelet For Women Anxiety Beaded Bracelets Jewelry Healing Stone Crystal Bracelet Stress Relief Yoga Beads Chakra Bracelets Gifts For Women pink,4.6,USD,True,False,8.99,False,,,1,664,False,0.0,"FREE delivery Mon, Aug 12 on $35 of items shipped by AmazonOr fastest delivery Fri, Aug 9",11,,https://m.media-amazon.com/images/I/61z7Z2lM-yL._AC_UL320_.jpg,organic,7454898011,turquoise,1,9,5969.360000000001,0.0,0.0
B0CBB99GSC,10.99,18K Gold Chain Bracelet Tiny Pearl Lucky Evil Eye Turquoise Link Bracelet Sets Minimalist Layering Stacking Jewelry for Women,4.4,USD,True,False,10.99,False,,,1,1911,False,0.0,"FREE delivery Mon, Aug 12 on $35 of items shipped by Amazon",12,,https://m.media-amazon.com/images/I/71Y5wmbgI8L._AC_UL320_.jpg,organic,7454898011,turquoise,1,10,21001.89,0.0,0.0
B0BYRTSPRQ,9.99,Cultured Freshwater Single Pearl Bracelet Handmade Genuine Leather Wrap Bracelet Agate Malachite Tiger Eyes with Charm Jewelry Synthetic Pearl Beaded Gold Bracelet,4.4,USD,True,False,9.99,False,,,1,288,False,0.0,"FREE delivery Mon, Aug 12 on $35 of items shipped by AmazonOr fastest delivery Fri, Aug 9",13,,https://m.media-amazon.com/images/I/71VtRXwNowL._AC_UL320_.jpg,organic,7454898011,turquoise,1,11,2877.12,0.0,0.0
B072BCTC95,15.99,Natural Moonstone Labradorite Pearl Bangle For Women 6X9Mm Pear Shape Gemstone Silver Overlay Handmade Cuff Bangle Jewelry Women's Day Gift For Mom Wife Her,4.3,USD,True,False,15.99,False,,,1,1830,False,0.0,"FREE delivery Mon, Aug 12 on $35 of items shipped by AmazonOr fastest delivery Tomorrow, Aug 8",14,,https://m.media-amazon.com/images/I/61lOTnnFhEL._AC_UL320_.jpg,organic,7454898011,turquoise,1,12,29261.7,0.0,0.0
B0816WJ22J,18.99,"5.80 Cts Oval Shape Natural & Synthetic Gemstones Bohemian Cuff Bangle For Women, Handmade Silver Overlay Birthstone Bangle Jewelry Women's Day Gifts For Mom Wife",4.4,USD,True,False,18.99,False,,,1,267,False,0.0,"FREE delivery Mon, Aug 12 on $35 of items shipped by AmazonOr fastest delivery Fri, Aug 9",15,,https://m.media-amazon.com/images/I/61b5sB5+4CL._AC_UL320_.jpg,organic,7454898011,turquoise,1,13,5070.33,0.0,0.0
B074N3FNZY,17.99,8.80 Cts Natural Moonstone Turquoise Labradorite Malachite Cuff Bangle 12x16mm Oval Shape Gemstone Silver Overlay Handmade Cuff Bangle Jewelry Women's Day Gifts For Mom Wife,4.0,USD,True,False,17.99,False,,,1,535,False,0.0,"FREE delivery Mon, Aug 12 on $35 of items shipped by AmazonOr fastest delivery Fri, Aug 9",16,,https://m.media-amazon.com/images/I/61PUfPyS1aL._AC_UL320_.jpg,organic,7454898011,turquoise,1,14,9624.65,0.0,0.0
B0CMCL7NSZ,9.99,Healing Crystal Bracelet Genuine Stone Bracelet Protection Anxiety Bracelet 7 Chakra Bracelet 6.5 inch Malachite Aquamarine Citrine 8MM Beads Get Well Soon Bracelet,4.5,USD,True,False,9.99,False,,50+ bought in past month,1,108,False,0.0,"FREE delivery Mon, Aug 12 on $35 of items shipped by AmazonOr fastest delivery Fri, Aug 9",21,,https://m.media-amazon.com/images/I/714Nap0zrHL._AC_UL320_.jpg,organic,7454898011,turquoise,1,15,1078.92,0.0,0.0
B0BGQXNZ7R,12.99,"5 Pieces Turquoise Bracelet, Turquoise Cuff Bracelet, Western Turquoise Stackable Bracelet Handmade Gemstone Bangle for Women Christmas Birthday Gift",4.2,USD,True,False,12.99,False,,50+ bought in past month,1,23,False,0.0,"FREE delivery Mon, Aug 12 on $35 of items shipped by AmazonOr fastest delivery Fri, Aug 9",22,,https://m.media-amazon.com/images/I/71Xo2cuxXXL._AC_UL320_.jpg,organic,7454898011,turquoise,1,16,298.77,0.0,0.0
B0BZ42WLPX,4.5,Turquoise Bracelet Classic Luxury Women Summer Unique Design Beaded Imitation Gemstone Butterfly Bracelet Jewelry,3.8,USD,True,False,4.5,False,,,1,13,False,5.5,"FREE delivery Mon, Aug 12 on $35 of items shipped by AmazonOr fastest delivery Fri, Aug 9",23,,https://m.media-amazon.com/images/I/61d0KLLhy5L._AC_UL320_.jpg,organic,7454898011,turquoise,1,17,58.5,1.0,0.18181818181818182
B0CYFWKH6M,9.99,Natural Moonstone Labradorite Pearl Bangle For Women - Pear Shape Gemstone Silver Overlay Cuff Bangle Jewelry,3.6,USD,True,False,9.99,False,,,1,3,False,0.0,"FREE delivery Mon, Aug 12 on $35 of items shipped by AmazonOr fastest delivery Tomorrow, Aug 8",24,,https://m.media-amazon.com/images/I/71NENolNmwL._AC_UL320_.jpg,organic,7454898011,turquoise,1,18,29.97,0.0,0.0
B09LXS1V7S,8.99,Bohemian Vintage Simulated Turquoise Stretch Bracelet Handmade Ethnic Tribal Adjustable Turquoise Bangle Bracelet for Women Birthday Gifts Fashion Party Holiday Jewelry,4.0,USD,False,False,8.99,False,,,1,29,False,0.0,FREE delivery Aug 22 - Sep 4,29,,https://m.media-amazon.com/images/I/51qzAXt9UuL._AC_UL320_.jpg,organic,7454898011,turquoise,1,19,260.71,0.0,0.0
B09QMRGB36,9.99,Western National Style Vintage Turquoise Bracelet Silver Turquoise Bangle Western Jewelry for Women,3.9,USD,True,False,9.99,False,,,1,160,False,0.0,"FREE delivery Mon, Aug 12 on $35 of items shipped by AmazonOr fastest delivery Fri, Aug 9",30,,https://m.media-amazon.com/images/I/71BQ9x5fjKL._AC_UL320_.jpg,organic,7454898011,turquoise,1,20,1598.4,0.0,0.0
B0D1C4YR9Y,9.99,"Vintage Turquoise Bracelet, Stainless Steel Floral Bracelet, Boho Gift for Women",4.5,USD,True,False,9.99,False,,,1,4,False,0.0,"FREE delivery Mon, Aug 12 on $35 of items shipped by AmazonOr fastest delivery Fri, Aug 9",31,,https://m.media-amazon.com/images/I/81WUb306xRL._AC_UL320_.jpg,organic,7454898011,turquoise,1,21,39.96,0.0,0.0
B09NVLFMZ3,11.69,Layered Bohemian Bracelets Natural Stone Beaded Chakra Bangle Bracelet Silver Layered Wrap Bracelet Fashion Jewellery Gifts for Women Ladies Friends,4.4,USD,True,False,11.69,False,,,1,50,False,0.0,"FREE delivery Mon, Aug 12 on $35 of items shipped by AmazonOr fastest delivery Sun, Aug 11",32,,https://m.media-amazon.com/images/I/71WN+xya5JL._AC_UL320_.jpg,organic,7454898011,turquoise,1,22,584.5,0.0,0.0
B07WNDS885,12.99,"8mm Genuine Gemstone Stretch Bracelet for Women Men Unisex, Natural Energy Crystal Stone Beads, Classic Simple Design Cuff Birthday Gift 7.5 Inch",4.5,USD,True,False,12.99,False,,,1,562,False,0.0,"FREE delivery Mon, Aug 12 on $35 of items shipped by AmazonOr fastest delivery Fri, Aug 9",36,,https://m.media-amazon.com/images/I/51-fBEWOL6L._AC_UL320_.jpg,organic,7454898011,turquoise,1,23,7300.38,0.0,0.0
B071JRJ4C7,13.99,5.60 Cts Natural Amethyst Moonstone Turquoise Lapis Cuff Bangle 10x14mm Oval Shape Gemstone Silver Overlay Handmade Cuff Bangle Jewelry Women's Day Gifts For Mom Wife,4.2,USD,True,False,13.99,False,,,1,430,False,0.0,"FREE delivery Mon, Aug 12 on $35 of items shipped by AmazonOr fastest delivery Fri, Aug 9",37,,https://m.media-amazon.com/images/I/712tgJdBorL._AC_UL320_.jpg,organic,7454898011,turquoise,1,24,6015.7,0.0,0.0
B0BHHH61NZ,9.99,"8.85 Cts South Western Native American Style Round Shape Natural & Synthetic Gemstones Bracelet For Women, Handmade Birthstone Bracelet For Women Jewelry Gifts For Her Wife Women Sister Girfriend",4.4,USD,True,False,9.99,False,,,1,1649,False,0.0,"FREE delivery Mon, Aug 12 on $35 of items shipped by AmazonOr fastest delivery Fri, Aug 9",38,,https://m.media-amazon.com/images/I/51ReA5YhCfL._AC_UL320_.jpg,organic,7454898011,turquoise,1,25,16473.510000000002,0.0,0.0
B0D89NGRZY,9.99,"Black Gemstone Beads Stretch Protection Bracelet for Man Woman, Handmade Healing Stone Chakra Beads Elastic Bracelets Accessories Fashion Jewelry Fathers Day Gift",0.0,USD,True,False,9.99,False,,,1,0,False,0.0,"FREE delivery Mon, Aug 12 on $35 of items shipped by AmazonOr fastest delivery Tomorrow, Aug 8",39,,https://m.media-amazon.com/images/I/61Sjh6ycBGL._AC_UL320_.jpg,organic,7454898011,turquoise,1,26,0.0,0.0,0.0
B072KRNSTM,14.99,Natural Moonstone Tiger Eye Lapis Malachite Carnelian Labradorite Bangle 7X9MM Oval Shape 925 Silver Overlay Handmade Cuff Bangle Jewelry,4.5,USD,True,False,14.99,False,,,1,256,False,0.0,"FREE delivery Mon, Aug 12 on $35 of items shipped by AmazonOr fastest delivery Fri, Aug 9",40,,https://m.media-amazon.com/images/I/61iuTXGIaAL._AC_UL320_.jpg,organic,7454898011,turquoise,1,27,3837.44,0.0,0.0
B0CN316C48,15.99,Natural Semi Precious Gemstone beads bracelet for women - Life Tree and Leaf Charm Energy Healing Reiki Crystal Stretch Bracelets,4.5,USD,True,False,15.99,False,,,1,1682,False,0.0,"FREE delivery Mon, Aug 12 on $35 of items shipped by AmazonOr fastest delivery Tomorrow, Aug 8",41,,https://m.media-amazon.com/images/I/71PQ-NoSdEL._AC_UL320_.jpg,organic,7454898011,turquoise,1,28,26895.18,0.0,0.0
B0C49LWLZ3,15.99,"Natural Gemstone Semi Precious Healing Crystals Handmade Stretchy Round Beads Bracelet, Enhance Positive Energy",4.6,USD,True,False,15.99,False,,,1,2222,False,0.0,"FREE delivery Mon, Aug 12 on $35 of items shipped by AmazonOr fastest delivery Tomorrow, Aug 8",42,,https://m.media-amazon.com/images/I/71wlYo0Kd3L._AC_UL320_.jpg,organic,7454898011,turquoise,1,29,35529.78,0.0,0.0
B0CVXCZ3HB,7.99,"Lucky Evil Eye Beads Bracelet for Men Women, Natural Stone Turquoise Tiger Eye Evil Eye Charm, Fashion Healing Energy Jewelry",4.8,USD,True,False,7.99,False,,,1,7,False,9.95,"FREE delivery Mon, Aug 12 on $35 of items shipped by AmazonOr fastest delivery Fri, Aug 9",43,,https://m.media-amazon.com/images/I/71l+aeYc19L._AC_UL320_.jpg,organic,7454898011,turquoise,1,30,55.93,1.959999999999999,0.1969849246231155
B089NZHNGZ,9.99,"Natural Healing Gemstone Bracelet, 8mm Semi Precious Stone Bracelet for Men Women, Stress Relief Crystal Jewelry",4.5,USD,True,False,9.99,False,,,1,1237,False,0.0,"FREE delivery Mon, Aug 12 on $35 of items shipped by AmazonOr fastest delivery Fri, Aug 9",44,,https://m.media-amazon.com/images/I/61qgH3uTUAL._AC_UL320_.jpg,organic,7454898011,turquoise,1,31,12357.630000000001,0.0,0.0
B0CYFWPPD4,9.99,"Natural Stone Wrap Bracelets, Boho Style Beads Bracelet, Jewelry Gift for Women and Men",4.3,USD,True,False,9.99,False,,,1,13,False,0.0,"FREE delivery Mon, Aug 12 on $35 of items shipped by AmazonOr fastest delivery Fri, Aug 9",45,,https://m.media-amazon.com/images/I/71Uq5hd37mL._AC_UL320_.jpg,organic,7454898011,turquoise,1,32,129.87,0.0,0.0
B0BZYFHZR6,14.99,"7 Chakra Stone Bracelets for Women,Handmade Healing Crystal Jasper Beads Bracelet with Tree of Life Button Women Jewelry Gifts",4.5,USD,True,False,14.99,False,,100+ bought in past month,1,257,False,0.0,"FREE delivery Mon, Aug 12 on $35 of items shipped by AmazonOr fastest delivery Fri, Aug 9",46,,https://m.media-amazon.com/images/I/71Yq0uTERjL._AC_UL320_.jpg,organic,7454898011,turquoise,1,33,3852.43,0.0,0.0
B071GYJYPF,13.99,3.44 Cts Natural Moonstone Aquamarine Labradorite Cuff Bangle 9x11mm Oval Shape Gemstone Silver Overlay Handmade Cuff Bangle Jewelry,4.4,USD,True,False,13.99,False,,,1,142,False,0.0,"FREE delivery Mon, Aug 12 on $35 of items shipped by AmazonOr fastest delivery Fri, Aug 9",47,,https://m.media-amazon.com/images/I/71H-nS65ASL._AC_UL320_.jpg,organic,7454898011,turquoise,1,34,1986.58,0.0,0.0
B0D3LJR431,9.99,"Evil Eye Bead Layered Bracelets, Vintage Gothic Leather, Stacked Bracelet Set for Women",4.5,USD,True,False,9.99,False,,,1,5,False,0.0,"FREE delivery Mon, Aug 12 on $35 of items shipped by AmazonOr fastest delivery Tomorrow, Aug 8",48,,https://m.media-amazon.com/images/I/8163PKZqOLL._AC_UL320_.jpg,organic,7454898011,turquoise,1,35,49.95,0.0,0.0
B0D7CBRQY4,14.99,"Leather Wrap Bracelet with Natural Turquoise Pendant, Bohemian Ethnic Gift for Women",3.0,USD,True,False,14.99,False,,,1,1,False,0.0,"FREE delivery Mon, Aug 12 on $35 of items shipped by AmazonOr fastest delivery Fri, Aug 9",49,,https://m.media-amazon.com/images/I/71ROrxO3rVL._AC_UL320_.jpg,organic,7454898011,turquoise,1,36,14.99,0.0,0.0
B004VMOSWE,19.99,Unisex Stackable Set of 3 Gemstone Round Bead 8MM Stretch Bracelet for Women Teen Men Multi Strand Stacking Adjustable,4.4,USD,False,False,19.99,False,,,1,623,False,0.0,"FREE delivery Mon, Aug 19 Or fastest delivery Fri, Aug 9",50,,https://m.media-amazon.com/images/I/71mpO2D9BjL._AC_UL320_.jpg,organic,7454898011,turquoise,1,37,12453.769999999999,0.0,0.0
B07C76P7KR,12.99,Boho Leather Cuff Wrap Bracelet Turtle Turquoise Beads Bracelet Platinum Tree of Life Pendant Woven Wristband Handmade Braided Jewelry for women,4.5,USD,True,False,12.99,False,,,1,347,False,0.0,"FREE delivery Mon, Aug 12 on $35 of items shipped by AmazonOr fastest delivery Fri, Aug 9",51,,https://m.media-amazon.com/images/I/81N2fN2GFOL._AC_UL320_.jpg,organic,7454898011,turquoise,1,38,4507.53,0.0,0.0
B0D78TM2XB,14.99,Bohemian Retro Stainless Steel Turquoise Inlaid Round Plate Design Bangle Bracelet For Women,4.7,USD,True,False,14.99,False,,,1,4,False,0.0,"FREE delivery Tue, Aug 13 on $35 of items shipped by AmazonOr fastest delivery Fri, Aug 9",52,,https://m.media-amazon.com/images/I/61ZOJfrBjnL._AC_UL320_.jpg,organic,7454898011,turquoise,1,39,59.96,0.0,0.0
B0BZXZ119T,18.99,Turquoise Bracelet for Women Adjustable Stainless Steel Chain Bracelet Dainty Simple Malachite Sodalite Turquoise Gemstone Charm Bracelets for Women Teen Girls Jewelry Gift,5.0,USD,False,False,18.99,False,,,1,3,False,0.0,"FREE delivery Thu, Aug 15",53,,https://m.media-amazon.com/images/I/61SBo362GtL._AC_UL320_.jpg,organic,7454898011,turquoise,1,40,56.97,0.0,0.0
B0CW1D9HH5,9.99,"Ceramic Beaded Bracelets for Women, Boho Style Beaded Bracelets with Colorful Heart Ceramic Beads, Adjustable Elastic Bracelets Jewelry for Women Girls",4.5,USD,True,False,9.99,False,,,1,9,False,0.0,"FREE delivery Mon, Aug 12 on $35 of items shipped by AmazonOr fastest delivery Fri, Aug 9",54,,https://m.media-amazon.com/images/I/71ffsi-NPgL._AC_UL320_.jpg,organic,7454898011,turquoise,1,41,89.91,0.0,0.0
B07FDLWFTX,99.0,Turquoise Bracelet Sterling Silver 925 Genuine Turquoise,4.3,USD,True,False,99.0,False,,,1,210,False,0.0,"FREE delivery Mon, Aug 12 Or fastest delivery Fri, Aug 9",55,,https://m.media-amazon.com/images/I/61T1z-7r6XL._AC_UL320_.jpg,organic,7454898011,turquoise,1,42,20790.0,0.0,0.0
B0B6TPRGBP,21.99,Opal/Turquoise Heart Bracelet For Women 925 Sterling Silver Adjustable Bracelets Jewelry Gift for Girls,4.4,USD,True,False,21.99,False,,,1,524,False,0.0,"FREE delivery Mon, Aug 12 on $35 of items shipped by AmazonOr fastest delivery Tomorrow, Aug 8",56,,https://m.media-amazon.com/images/I/51Q8G3OIB1L._AC_UL320_.jpg,organic,7454898011,turquoise,1,43,11522.759999999998,0.0,0.0
B085XTWJVB,12.0,Created Turquoise Beaded Bracelet Handmade Braided Stretch Bracelets Cuff Fashion Jewelry,4.1,USD,True,False,12.0,False,,,1,144,False,0.0,"FREE delivery Mon, Aug 12 on $35 of items shipped by AmazonOr fastest delivery Fri, Aug 9",57,,https://m.media-amazon.com/images/I/61EJyhibJNL._AC_UL320_.jpg,organic,7454898011,turquoise,1,44,1728.0,0.0,0.0
B07TCH21P3,12.4,Turquoise Mother of Pearl Silver Mix Beaded 3 Wrap Bracelet Handmade New Cuff Jewelry,4.7,USD,True,False,12.4,False,,,1,67,False,20.0,"FREE delivery Mon, Aug 12 on $35 of items shipped by AmazonOr fastest delivery Fri, Aug 9",58,,https://m.media-amazon.com/images/I/714E3n-A8dL._AC_UL320_.jpg,organic,7454898011,turquoise,1,45,830.8000000000001,7.6,0.38
B0BKYWZWL3,28.5,Ornate Mosaic Stabilized Turquoise Cuff Bracelet - Slightly Adjustable,5.0,USD,False,False,28.5,False,,,1,5,False,0.0,"$4.50 delivery Thu, Aug 15 Or fastest delivery Fri, Aug 9",59,,https://m.media-amazon.com/images/I/51FX1H-0XdL._AC_UL320_.jpg,organic,7454898011,turquoise,1,46,142.5,0.0,0.0
B0D3G779XL,6.89,Bohemian Turquoise Sea Turtle Bracelets Handmade Charm Blue Turtle Ocean Animal Beaded Wove Knitted Rope Adjustable Bracelets for Women Men Boho Style Summer Hawaiian Beach Holiday Fashion Jewelry Gifts,0.0,USD,True,False,6.89,False,,,1,0,False,0.0,"FREE delivery Mon, Aug 12 on $35 of items shipped by AmazonOr fastest delivery Fri, Aug 9",60,,https://m.media-amazon.com/images/I/61ffq4Ad7TL._AC_UL320_.jpg,organic,7454898011,turquoise,1,47,0.0,0.0,0.0
B0BNN4ZTQ5,5.99,"Turquoise Bracelet for Women,Healing Crystal Stone Stretch Round Bead Bracelets for Women Men Jewelry",4.6,USD,True,False,5.99,False,,100+ bought in past month,1,194,True,0.0,"FREE delivery Mon, Aug 12 on $35 of items shipped by AmazonOr fastest delivery Fri, Aug 9",2,,https://m.media-amazon.com/images/I/518xCdAwaLL._AC_UL320_.jpg,amazons_choices,7454898011,turquoise,1,1,1162.06,0.0,0.0
